Key,Type,Desc,English,Chinese (Simplified),French,German,Italian,Polish,Russian,Spanish,UI_Tester
TFTV_TIP_GEOSCAPE_23,Text,,"If you want to ensure that a lower value Pandoran gets captured, click on the fully paralyzed Pandoran and choose that option in the dropdown menu. Do the same to remove the mark.",,,,,,"Если вы хотите, чтобы в плен попал Пандоран с меньшей стоимостью, щелкните по полностью парализованному Пандорану правой кнопкой мыши и выберите этот вариант в контекстном меню. Сделайте то же самое, чтобы снять метку погрузки.",,
TFTV_TIP_GEOSCAPE_24,Text,,Scyllas are big! You will need a special module to capture them.,,,,,,Сциллы очень большие! Для их перевозки вам понадобится специальный модуль.,,
TFTV_TIP_GEOSCAPE_25,Text,,"If you have a Mutation Lab, captured Pandorans will generate Mutagens every hour. Each Mutation Lab can generate up to 50 Mutagens per day.",,,,,,"Если у вас построена «Лаборатория Мутаций», из захваченных Пандоранов будут добываться мутагены каждый час. Каждая «Лаборатория Мутаций» может добыть до 50 мутагенов в день.",,
TFTV_TIP_GEOSCAPE_26,Text,,"If you have a Food Production facility you can process captured Pandorans, turning them into food. Each of these facilities can process 50 units of Pandoran meat per day.",,,,,,"Если у вас построен «Пищевой Комбинат», вы можете перерабатывать захваченных Пандоранов, превращая их в еду. Каждый из этих комбинатов может перерабатывать до 50 единиц Пандоранского мяса в день.",,
TFTV_TIP_GEOSCAPE_27,Text,,Do you recall the legend of Fort Bacon?,,,,,,"Помните ли вы легенду о Форте «Бекон»? Это небылица, миф о пост-апокалипсисе, распространенный среди наших солдат. В ней рассказывается об убежище, где люди нашли способ безопасно есть Пандоранов... которые, если верить сообщениям, и в самом деле имеют вкус бекона.",,
TFTV_TIP_GEOSCAPE_28,Text,,Containment facilities housing captured Pandoran life forms are perfectly secure. You have absolutely nothing to worry about.,,,,,,"Изоляторы, в которых содержатся захваченные Пандоранские формы жизни, абсолютно надежны. Вам совершенно не о чем беспокоиться!",,
TFTV_TIP_GEOSCAPE_29,Text,,Project Cornucopia is made of fishpeople! It’s made of fishpeople!,,,,,,Проект «Рог изобилия» сделан из рыболюдей! Из рыбо-людей!,,
TFTV_TIP_GEOSCAPE_30,Text,,There are no known health risks associated with consuming nutrients derived from our autonomous Food Production facilities.,,,,,,"Не существует никаких известных рисков для здоровья, связанных с потреблением питательных веществ, полученных на наших автономных «Пищевых Комбинатах».",,
TFTV_TIP_GEOSCAPE_31,Text,,"If your system, or you, are struggling with the Mist from the More Mist Void Omen, you can turn it off in the Mod settings.",,,,,,"Если ваш компьютер или вы сами испытываете трудности с Туманом от Знамения Пустоты «БОЛЬШЕ ТУМАНА», вы можете отключить его в настройках мода.",,
TFTV_TIP_GEOSCAPE_32,Text,,"If the Limited Deployment Void Omen is too much for you, you can turn it off on new game start or in Mod settings.",,,,,,"Если уменьшение отряда на 2 в тактических миссиях при Знамении Пустоты «-2 БОЙЦА В ОТРЯДЕ» вам не очень нравится, вы можете отключить его при новом прохождении игры или в настройках мода.",,
TFTV_TIP_GEOSCAPE_33,Text,,You don't need an aircraft at the Bazaar to buy things! We deliver!,,,,,,"Чтобы купить что-то на Рынке, вам не нужен самолет! Используйте доставку!",,
TFTV_TIP_GEOSCAPE_34,Text,,Mercenaries refuse to be augmented or mutated.,,,,,,Наемники будут отказываться от аугментаций и мутаций.,,
KEY_TACTICAL_LOADING_TIP_4_TFTV,Text,,The Berserker's Dash ability allows a soldier to move up to half its movement range for 1 Action Point.,,,,,,Способность Берсерка «Рывок» позволяет бойцу переместиться на половину своей дальности передвижения за 1 Очко Действий.,,
KEY_DAMAGE_TYPE_ACID_DESC,Text,,"ACID damage sticks to individual body parts - each turn it applies damage to armor first (ignoring temporary armor granted by Electric Reinforcement and similar), then body. Electronic body parts are disabled if their HP are reduced by Acid. Acid Resistance reduces damage from Acid to body parts by 50%. Acid levels reduce by 10 each turn. ",,,,,,"Кислотный урон распространяется на отдельные части тела - каждый ход он наносит урон сначала броне (игнорируя временную броню, получаемую, например, от специальных способностей бойцов), затем телу. Электронные части тела выходят из строя, если их хиты съедены кислотой. Устойчивость к кислоте снижает урон от кислоты для частей тела на 50%. Уровень кислоты уменьшается на 10 каждый ход.",,
KEY_ACID_RESISTANCE_DESCRIPTION,Text,,Reduces damage from Acid to body parts by 50%.,,,,,,Снижает урон от кислоты по частям тела на 50%.,,
KEY_TACTICAL_LOADING_TIP_28,Text,,"Acid damage attached to body parts will damage armor first (ignoring temporary armor granted by Electric Reinforcement and similar), and then body parts. Electronic body parts are disabled if their HP are reduced by Acid. Acid Resistance reduces damage from Acid to body parts by 50%. Remaining acid levels decrease by 10 each turn.",,,,,,"Кислотный урон, нанесенный частям тела, сначала повреждает броню (игнорируя временную броню, получаемую, например, от специальных способностей бойцов), а затем части тела. Электронные части тела выходят из строя, если их хиты съедаются кислотой. Устойчивость к кислоте снижает урон от кислоты для частей тела на 50%. Оставшийся уровень кислоты уменьшается на 10 каждый ход.",,
KEY_TACTICAL_LOADING_TIP_26,Text,,"Poison will inflict damage and reduce WP at the start of the turn, and then the poison value will decrease, and inflict less damage on the next turn, until no poison is left. A poisoned character has a 50% penalty to aim.",,,,,,"Яд наносит урон и снижает Очки Воли в начале хода, а затем сила яда уменьшается и он наносит меньше урона на следующем ходу, и так, пока не пропадает совсем. Отравленный персонаж имеет штраф 50% к точности стрельбы.",,
KEY_GEOSCAPE_LOADING_TIP_9,Text,,"Most of the interesting technology is possessed by the factions - to get access to it, you can 1) ally with them, 2) steal it from them, 3) reverse engineer their items to get access to the underlying technology, or 4) buy it in the Marketplace.",,,,,,"Большинство интересных технологий принадлежит фракциям - чтобы получить к ним доступ, вы можете 
1) заключить с ними союз,
2) украсть их у них,
3) провести реверс-инжиниринг их предметов, чтобы получить доступ к соответствующей технологии,
4) купить их на Рынке.",,
KEY_TACTICAL_LOADING_TIP_1,Text,,"Mindfraggers can take control of your soldiers. A risky way to remove them is to aim at the victim’s head. Handguns work best. If you are playing with Stronger Pandorans option on, removing the Mindfragger by any means other than using the Technician Arms will cause it to explode, dealing a small amount of Acid damage.",,,,,,"Промыватели могут брать под контроль ваших бойцов. Хоть и рискованно, их можно будет убивать, стреляя в голову жертвы. Лучше всего подойдут пистолеты (автомат может первой пулей убить Промывателя, а второй прострелить голову вашему бойцу). Если вы играете с включенной опцией ОПАСНЫЕ ПАНДОРАНЫ, уничтожение Промывателя, кроме как оружием техника, приведет к его взрыву, наносящему небольшой урон кислотой.",,
KEY_TACTICAL_LOADING_TIP_16,Text,,Mist spread during a mission will conceal Pandorans and restore their Will Points. If one of your soldiers is caught inside mist they will be revealed to the enemy and will lose Will Points. Any units (including vehicles) caught in the Mist can be targetted by the Umbra.,,,,,,"Распространяющийся во время миссии Туман скрывает Пандоранов и восстанавливает их Очки Воли. Если один из ваших бойцов окажется в Тумане, он станет виден врагу и потеряет свои Очки Воли. Любые юниты (включая машины), попавшие в Туман, могут стать мишенью для Фиолетовых Тварей.",,
TFTV_TIP_TACTICAL_11,Text,,"If you find the ambush missions too challenging, consider playing with the REVEAL EXIT IN AMBUSH EARLY option enabled. You can select this option either during New Game setup or in the Mod Configuration tab on the main title screen.",,,,,,"Если миссии с засадами кажутся вам слишком сложными, попробуйте поиграть с включенной опцией РАННИЕ ЗОНЫ ЭВАКУАЦИИ ПРИ ЗАСАДАХ. Эту опцию можно выбрать во время настройки новой игры или на вкладке настроек мода в главном меню игры.",,
TFTV_TIP_TACTICAL_12,Text,,"Press ""v"" to toggle displaying for all the revealed enemies the range at which they will detect the selected character. On by default for hidden Infiltrators and Scarabs equipped with the Lazarus Module.",,,,,,"Нажмите «v», чтобы включить\выключить круги дальности обнаружения вашего персонажа всеми видимыми врагами. По умолчанию включено для скрытых Разведчиков и Скарабеев, оснащенных модулем Щит Лазаря.",,
TFTV_TIP_GEOSCAPE_35,Text,,New Jericho Thunderbird aircraft can carry a vehicle using only 2 passenger slots. It can also carry 2 vehicles for 1 passenger slot each if you equip the Ezekiel's Dream module.,,,,,,"Новый самолет Иерихона Гром-птица может перевозить машину на 2-х пассажиро-местах. Если же вы установите модуль «Мечта Иезекииля», самолет сможет перевозить 2 машины, по 1-му пассажиро-месту на каждую.",,
TFTV_TIP_GEOSCAPE_36,Text,,Disciples of Anu Blimp cannot carry any vehicles.,,,,,,"Тиамат Последователей Ану не может перевозить машины, вообще.",,
TFTV_TIP_GEOSCAPE_37,Text,,You can buy Aircraft Modules that can be installed on any Aircraft at the Marketplace.,,,,,,На Рынке вы можете покупать авиационные модули для установки на ваши самолеты.,,
TFTV_TIP_GEOSCAPE_38,Text,,"You can build a Passenger Module for the Manticore, granting 2 extra seats but reducing speed, after researching Capture and Containment.",,,,,,"Вы сможете построить Пассажирский Модуль для Мантикоры, дающий  2 дополнительных пассажиро-места за счет снижения скорости, после исследования Захвата в плен и Изоляторов.",,
TFTV_TIP_GEOSCAPE_39,Text,,"All Aircraft, except the Disciples of Anu Blimp, fly slower when in the Mist. The Blimp, however, flies faster in Mist and gains an even greater boost with the Bioflux Capacitor module.",,,,,,"Все самолеты, за исключением дирижабля Последователей Ану, в Тумане теряют скорость. Дирижабль, однако, в Тумане летает быстрее и получает еще больший разгон, если установлен модуль «Ассимилятор Биопотока».",,
TFTV_TIP_GEOSCAPE_40,Text,,"All Aircraft require periodic maintenance. Flying consumes Maintenance Points, while resting at a base with a functioning Vehicle Bay quickly restores them, provided you have the corresponding Aircraft technology.",,,,,,"Все самолеты нуждаются в периодическом техническом обслуживании. Полеты ухудшают техническое состояние, а стоянка на базе с функционирующим Ангаром быстро восстанавливает его, при условии, что у вас есть соответствующая Авиационная технология.",,
TFTV_TIP_GEOSCAPE_41,Text,,Faction Aircraft can use only their own faction modules and common ones. The Phoenix Manticore can use all faction modules.,,,,,,Самолеты фракций могут использовать только модули своей фракции и универсальные. Мантикора Феникса может использовать любые модули всех фракций.,,
TFTV_TIP_GEOSCAPE_42,Text,,"The Conservatory of Transmutation restores Stamina and heals operatives with Mutations, Mutoids, and Mutogs on board.",,,,,,"Модуль «Обитель Трансмутации» восстанавливает Выносливость и лечит бойцов с Мутациями, Мутоидов и Мутогов на борту.",,
TFTV_TIP_GEOSCAPE_43,Text,,"The Hephaestus Workshop restores Stamina and heals operatives with Bionic Augmentations, as well as Vehicles on board.",,,,,,Модуль «Кузница Гефеста» восстанавливает Выносливость и ремонтирует бойцов с Аугментациями и машины на борту.,,
TFTV_TIP_GEOSCAPE_44,Text,,The Panacea Nexus restores Stamina and heals all operatives on board.,,,,,,"Модуль «Объятия Панацеи» восстанавливает Выносливость и лечит всех бойцов на борту.""",,
TFTV_TIP_GEOSCAPE_45,Text,,Faction Aircraft modules can improve or gain new functions through additional research.,,,,,,Модули самолетов фракций могут быть улучшены или получить новые функции с помощью дополнительных исследований.,,
TFTV_TIP_GEOSCAPE_46,Text,,The Synedrion Helios can carry an Aspida for 1 passenger space after Aspida Technology is researched.,,,,,,Гелиос Синедриона сможет перевозить Аспида на 1-м пассажиро-месте после исследования Технологии Аспида.,,
TFTV_TIP_GEOSCAPE_47,Text,,"When exploring with a Synedrion Helios, the exfiltration zone in Ambush missions is revealed after 2 turns instead of 3.",,,,,,При высадках с Гелиоса Синедриона зона эвакуации в засадных миссиях открывается через 2 хода вместо 3-х.,,
TFTV_TIP_TACTICAL_29,Text,,"Go to Mod Settings to try out a new mechanic — SUPPRESSION: any direct projectiles that hit a character or land nearby accumulate suppression points that can trigger a Suppression Status. There are 3 levels: Light, Moderate, and Severe, reducing the character’s Action Points by 0.5, 1, and 1.5 respectively.",,,,,,"Перейдите в настройки мода, чтобы опробовать новую механику — ПОДАВЛЕНИЕ: любые пули\снаряды, попадающие в персонажа или пролетающие рядом, накапливают очки подавления, которые могут вызвать статус Подавления. Существует 3 уровня: Слабый, Средний и Сильный, которые снижают количество Очков Действий персонажа на 0.5, 1 и 1.5 соответственно.",,
TFTV_TIP_GEOSCAPE_48,Text,,Remember: the Phoenix Project is neither an army nor a police force. It’s not your duty to win wars or protect every haven. You are investigators — focus on uncovering the Pandoran threat and dealing with it.,,,,,,"Помните: Проект Феникс - это не армия и не полиция. В ваши обязанности не входит выигрывать войны или защищать каждое Убежище. Вы — следователи. Ищите причины нашествия Пандоранов, и как его остановить.",,