Key,Type,Desc,English,Chinese (Simplified),French,German,Italian,Polish,Russian,Spanish,UI_Tester
KEY_DLC3_TUT_BEHEMOTH_DESCRIPTION,Text,,"The Behemoth will inexorably attack any haven that has been visited by a Pandoran flyer that has successfully returned to the Festering Skies. Once the Behemoth reaches the haven, it will harvest about half of its population and severely damage all of its facilities. To prevent Behemoth's attacks on havens, destroy all Pandoran flyers.",,"Le Béhémoth attaquera inexorablement tout refuge qui a été visité par un pandorien volant qui a réussi à retourner dans le ciel fétide. Une fois que le Béhémoth aura atteint le refuge, il récoltera environ la moitié de sa population et endommagera gravement toutes ses installations. Pour empêcher les attaques du Béhémoth sur les refuges, détruisez tous les pandoriens volants.",,,,"Бегемот будет неумолимо атаковать любое убежище, которое посетил Пандоранский летун, успешно вернувшийся в ""Гнойное Небо"". Как только Бегемот достигнет убежища, он уничтожит около половины его населения и нанесет серьезный ущерб всем его объектам. Чтобы предотвратить нападения Бегемота на убежища, уничтожайте всех Пандоранских летунов.",,
KEY_TUTORIAL_DLC2_ANCIENT_SITE_DESCRIPTION,Text,,"Send an aircraft to set up an Exploration operation at the site. Once Exploration starts, the presence of aircraft is no longer needed.",,,,,,"Пошлите самолет для исследования этих Руин. Как только исследование начнется, присутствие самолета больше не потребуется.",,
KEY_TUTORIAL_DLC2_EXCAVATION_DONE_NAME,Text,,We've completed our first ancient site Exploration!,,,,,,Мы завершили нашу первую разведку Руин Древних!,,
KEY_TUTORIAL_DLC2_HARVESITNG_DESCRIPTION,Text,,"In TFTV, you immediately gain some amount of an exotic resource when you take control of an ancient site from the Automata. The amount of resources depends on type of resource and difficulty level, or alternatively the manual setting used in the Mod config. ",,,,,,"В TFTV вы сразу же получаете некоторое количество Экзотических Материалов, когда забираете у Роботов контроль над Руинами Древних. Количество ресурсов зависит от типа ресурса и уровня сложности, или, в качестве альтернативы, от соответствующей настройки, используемой в конфигурации мода.",,
KEY_TUTORIAL_DLC2_HARVESITNG_NAME,Text,,ANCIENT SITE,,,,,,РУИНЫ ДРЕВНИХ,,
KEY_TUTORIAL_DLC2_REFINERY_DESCRIPTIOY,Text,,"In TFTV, you immediately gain some amount of an exotic resource when you take control of an ancient site from the Automata. The amount of resources depends on type of resource and difficulty level, or alternatively the manual setting used in the Mod config. ",,,,,,"В TFTV вы сразу же получаете некоторое количество Экзотических Материалов, когда забираете у Роботов контроль над Руинами Древних. Количество ресурсов зависит от типа ресурса и уровня сложности, или, в качестве альтернативы, от соответствующей настройки, используемой в конфигурации мода.",,
KEY_TUTORIAL_DLC2_REFINERY_NAME,Text,,ANCIENT SITE,,,,,,РУИНЫ ДРЕВНИХ,,
KEY_TUTORIAL_DLC2_ARCHEOLOGY_NAME,Text,,We've completed our Archaeology Lab!,,,,,,Мы завершили работу над нашей археологической лабораторией!,,
HINT_HOSTILE_DEFENDERS_TITLE,Text,,Hostile haven defenders,,,,,,Охрана убежища против нас,,
HINT_HOSTILE_DEFENDERS_TEXT,Text,,"<i>""Come to rescue us, have they? They are the ones who brought the damn critters on us in the first place! Fragging nerds…""</i>

While this Void Omen is in effect, haven defenders will be hostile to you and attack your operatives on sight, but <b>killing them is not required to win the mission</b>.

Gain XP by protecting structures or civilians as usual.

You can loot crates with faction weapons, but only the equipment in your operatives or vehicles inventory will be recovered.",,,,,,"<i>""Они пришли, чтобы спасти нас? Как бы не так! Они - это те, кто сначала натравил на нас этих чертовых тварей! Чертовы ублюдки...""</i>

Пока действует это Знамение Пустоты, защитники убежища будут настроены враждебно по отношению к вам и нападут на ваших бойцов, как только увидят их, но для победы в миссии не обязательно их убивать.

Получайте опыт, защищая строения или гражданских лиц, как обычно.

Вы можете разграбить ресурсные ящики с оружием фракции, но унести сможете лишь то, что будет сложено в инвентарь ваших бойцов и машин.",,
HINT_FIRE_QUENCHER_TITLE,Text,,Fire Quencher,,,,,,Живой Огнетушитель,,
HINT_FIRE_QUENCHER_TEXT,Text,,"<i>“There was nothing special about this one… Here comes the bisque, I thought… Boy was I wrong.”</i>

Some Arthrons have evolved the ability to instantly quench the fire they come in contact with, replacing it with Mist. They are apparently doing this by spraying some biochemical compound  from their <b>heads</b>. Disabling their heads should remove both their immunity to fire and their ability to quench it.",,,,,,"<i>""В этой твари не было ничего особенного... Сейчас нафарширую, подумал я тогда. Боже, как же я ошибался...""</i>

Некоторые Артроны развили способность мгновенно гасить огонь, с которым они соприкасаются, заменяя его Туманом. Очевидно, они делают это, распыляя какое-то биохимическое вещество из своих голов. Выбитая голова должна лишить их невосприимчивости к огню и способности гасить его.",,
KEY_GEO_HINT_AUGMENTATION_SCREEN_DESCRIPTION,Text,,"You are about to augment your first soldier. A character can only have UP TO 2 BODY PARTS replaced this way.

Once an augmentation is installed, the soldier will not be able to revert back to their natural limbs. However, augmented body parts CAN BE SWAPPED with different cybernetic parts.

Augmented body parts are IMMUNE TO BLEEDING and RESISTANT TO VIRAL DAMAGE, POISON, AND PARALYSIS. Damaged cybernetics CAN BE REPAIRED after battle at the expense of Tech and Materials. 

In addition, each bionic augmentation reduces the maximum Delirium the character can have by 1/3, and removes up to that amount of Delirium from the character. 

Augmenting a character will reduce their Stamina to zero.",,,,,,"Вы собираетесь аугментировать своего первого бойца. Персонажу можно заменить таким образом не более 2-х частей тела.

После установки аугмента боец не сможет вернуть назад свои естественные конечности. Однако эти части тела можно будет заменить другими кибернетическими частями.

Аугментированные части тела невосприимчивы к кровотечениям и устойчивы к вирусным повреждениям, ядам и параличу. Поврежденные кибернетические части можно будет починить после боя за счет технологий и материалов.

Кроме того, каждая бионическая аугментация уменьшает максимальное количество Сонного Безумия, которое может быть у персонажа, на 1/3 и тут же удаляет с бойца это количество Сонного Безумия.

При аугментации бойца его выносливость тут же снижается до нуля.",,
KEY_GEO_HINT_ACHERON_CAPTURE_DESCRIPTION,Text,need to change,"Despite our best efforts the finding a cure to the new corruption strain ended in failure. Apparently, the virus in all newer specimens has mutated to such a degree that it is useless for our needs. In order to be successful, we need to find one of the original specimens that escaped from the Lab.",,"Malgré tous nos efforts, la recherche d'un remède à la nouvelle souche de corruption s'est soldée par un échec. Apparemment, le virus dans tous les nouveaux spécimens a muté à un tel point qu'il est inutile pour nos besoins. Pour réussir, nous devons trouver l'un des spécimens originaux qui s'est échappé du laboratoire.",,,,"Несмотря на все наши усилия, поиск лекарства от нового штамма вируса закончился неудачей. По-видимому, вирус во всех новых Образцах мутировал до такой степени, что теперь в нем не разобраться. Чтобы добиться результата, нам нужно найти один из первоначальных Образцов, сбежавших из лаборатории.",,
KEY_GEO_HINT_ACHERON_CAPTURE_NAME,Text,need to change,CORRUPTION CURE RESEARCH FAILURE,,ECHEC DE LA RECHERCHE D’UN REMEDE A LA CORRUPTION,,,,ПРОВАЛ ИССЛЕДОВАНИЯ ПО ЛЕЧЕНИЮ ЗАРАЖЕНИЯ,,
KEY_GEO_HINT_ENEMY_SPECIAL_CORRUPTION_DESCRIPTION,Text,,"In this Third Mist the Pandoravirus has mutated yet again. The new strain is slowly driving the survivors insane. 

WP are reduced by the amount of Delirium a character has. This effect is, in turn, reduced when the character is well rested: each 10 points in Stamina reduces the effect of Delirium by 1. The maximum amount of Delirium a character can acquire depends on the Oneiric Delirium Index. 

Delirium is gained by participating in missions where Mist is present (""Delirium Areas"") or suffering attacks from Pandorans with Delirium or Co-Delirium damage.

Different ways of dealing or living with Delirium will become avaliable with Phoenix and faction research.",,"Dans cette troisième brume, le pandoravirus a encore muté. La nouvelle souche rend les survivants lentement fous.

Les Points de Volonté sont réduits par la quantité de Delirium qui affecte le personnage. Cet effet est à son tour réduit lorsque le personnage est bien reposé : chaque tranche de 10 points d'endurance réduit l'effet du délire de 1. La quantité maximale de délire qu'un personnage peut acquérir dépend de l'Indice de Délire Onirique.

Le délire s'acquiert en participant à des missions où la brume est présente (""zones de Délirium"") ou en subissant des attaques de Pandoriens avec des dégâts de Délirium ou de Co-Délirium.

Différentes façons de gérer ou de vivre avec le délire deviendront disponibles avec la recherche de Phoenix Point et des autres factions.",,,,"В третьем Тумане Пандоравирус снова мутировал. Новый штамм медленно сводит выживших с ума.

Сила Воли бойцов уменьшается в зависимости от очков поражения Сонным Безумием. Этот эффект можно отчасти компенсировать, если боец хорошо отдохнул: каждые 10 очков выносливости уменьшают очки Сонного Безумия на 1. Текущий максимум Сонного Безумия бойца определяется текущим ИСБ (Индекс Сонного Безумия), который может меняться в течение игры.

Сонным Безумием можно заразиться в миссиях, где присутствует Туман (""Зоны Сонного Безумия""), или подвергаясь атакам Пандоранов, имеющих свойство наносить урон Сонного Безумия или же Обученных этому свойству (Обучение - свойство некоторых Пандоранов, в результате которого Пандораны, не обладающие свойством наносить урон Сонного Безумия все равно получают его).

С помощью исследований Проекта Феникс и фракций можно найти различные способы борьбы с Сонным Безумием или же способы сосуществовать с ним.",,
KEY_GEO_HINT_ENEMY_SPECIAL_CORRUPTION_NAME,Text,,ONEIRIC DELIRIUM VIRUS STRAIN,,SOUCHE VIRALE DU DÉLIRE ONIRIQUE,,,,ШТАММ ВИРУСА СОННОГО БЕЗУМИЯ,,
KEY_GEO_HINT_ENEMY_SPECIAL_CORRUPTION_OVER_DESCRIPTION,Text,NEED TO CHANGE,"After hours of research we have finally found a vaccine that will eliminate the corruption strain for good. As soldiers are being inoculated against the disease, our planes are spreading it over battlefields ensuring that the dead there pose no further threat.
 
Your soldiers can no longer become corrupted. Those that are currently corrupted still need treatment, though.",,"Après des heures de recherche, nous avons enfin trouvé un vaccin qui éliminera définitivement la souche de corruption. Tandis que les soldats sont inoculés contre la maladie, nos avions le répandent sur les champs de bataille en s'assurant que les morts ne constituent plus une menace.

Vos soldats ne peuvent plus être corrompus. Cependant, ceux qui sont actuellement corrompus ont encore besoin d'un traitement.",,,,"После многочасовых исследований мы, наконец, нашли вакцину, которая навсегда уничтожит штамм вируса. Пока бойцам делают прививки от этой болезни, наши самолеты распыляют ее над полями сражений, гарантируя, что мертвые больше не восстанут.

Ваши бойцы больше не подвержены заражению. Однако те, которые в настоящее время все еще заражены, нуждаются в лечении.",,
KEY_GEO_HINT_ENEMY_SPECIAL_CORRUPTION_OVER_NAME,Text,NEED TO CHANGE,CORRUPTION VACCINE,,VACCIN CONTRE LA CORRUPTION,,,,ВАКЦИНА ОТ СОННОГО БЕЗУМИЯ,,
KEY_GEO_HINT_ENEMY_SPECIAL_CURE_DESCRIPTION,Text,,"Now that you have researched a treatment for the Oneiric Delirium, you can remove this condition from your operatives, though they will acquire it again if they operate in an area covered by mist or are attacked by Pandorans with the Delirium attack. In addition, be aware that the treatment can cause SERIOUS and LONG LASTING side effects: every time you make use of it, there is a 25% chance that the operative will acquire one of the special Delirium perks, which grant a negative and a positive ability. The same operative can acquire any number of these special Delirium perks. They will lose these perks eventually as they complete missions, provided that they do not acquire new Delirium perks.
 
In order to treat a soldier you need to pay 50 MUTAGENS for every 25% of Delirium that has affected the soldier as compared to their Willpower.",,"Maintenant que vous avez recherché un traitement pour le délire onirique, vous pouvez supprimer cette affection de vos agents, bien qu'ils la contractent à nouveau s'ils opèrent dans une zone couverte de brume ou s'ils sont attaqués par des Pandoriens avec l'attaque Délire. De plus, sachez que le traitement peut avoir des effets secondaires GRAVES et PERMANENTS : chaque fois que vous l'utilisez, il y a 25% de chances que l'agent acquière l'un des avantages spéciaux du délire, qui confèrent une capacité négative et une capacité positive. Le même agent peut acquérir n'importe quel nombre de ces effets spéciaux du délire. 

Pour traiter un soldat, vous devez utiliser 50 MUTAGENS pour chaque tranche de 25% de délire qui a affecté le soldat par rapport à sa volonté.",,,,"Теперь, когда вы изучили способ лечения Сонного Безумия, вы можете избавить своих бойцов от этой напасти, хотя... если они опять окажутся в Зоне Тумана, или если Пандораны нанесут им урон Сонного Безумия, то... все по новой. Кроме того, имейте в виду, что это лечение может вызвать серьезные и длительные побочные эффекты: каждый раз, когда вы применяете его, существует 25%-ная вероятность того, что боец получит один из побочных эффектов Сонного Безумия, который может оказаться как негативным, так и полезным. Один и тот же боец может получить любое количество этих побочек от Сонного Безумия. В конце концов, они постепенно будут исчезать по мере выполнения миссий, но если боец опять получит повреждение Сонного Безумия... все по новой.

Чтобы вылечить бойца, вам нужно потратить 50 Мутагенов за каждые 25% очков Сонного Безумия от максимума. Максимум же зависит от Силой Воли.",,
KEY_GEO_HINT_ENEMY_SPECIAL_CURE_NAME,Text,,ONEIRIC DELIRIUM EXPERIMENTAL TREATMENT,,TRAITEMENT EXPERIMENTAL DU DELIRE ONIRIQUE,,,,ЭКСПЕРИМЕНТАЛЬНОЕ ЛЕЧЕНИЕ СОННОГО БЕЗУМИЯ,,
KEY_GEO_HINT_ENEMY_SPECIAL_MUTOID_DESCRIPTION,Text,,"Mutoids are artificially created by aggresively mutating suitable humans using MUTAGENS. Immune to the Delirium they can learn abilities from all researched Soldier Classes, as well as some Pandoran abilities after an autopsy has been performed.

While a Mutoid can learn many abilities, it can only select one Soldier ability and one Pandoran ability per level. For this additional Mutagens are required.

Mutoids can only be healed at a base using MUTAGENS.",,"Les mutoïdes sont créés artificiellement par la mutation forcée d'humains compatibles à l'aide de MUTAGENS. Immunisés au Délire, ils peuvent apprendre les capacités de toutes les classes de soldats connues, ainsi que certaines capacités pandoriennes après une autopsie.

Bien qu'un Mutoïde puisse apprendre de nombreuses capacités, il ne peut choisir qu'une capacité de Soldat et une capacité de Pandorien par niveau. Pour cela, des mutagènes supplémentaires sont nécessaires.

Les mutoïdes ne peuvent être soignés que dans une base utilisant du MUTAGENS.",,,,"Мутоиды создаются искусственно путем агрессивной мутации подходящих людей с использованием Мутагенов. Невосприимчивые к Сонному Безумию, они могут изучать способности всех исследованных классов солдат, а также некоторые способности Пандоранов (после проведения вскрытия).

Хотя Мутоид может изучить множество способностей, он может выбрать только одну способность солдата и одну способность Пандорана на каждом уровне. Для этого придется потратить Мутагены.

Мутоидов можно лечить только на базах с помощью Мутагенов.",,
KEY_GEO_HINT_ENEMY_SPECIAL_MUTOID_NAME,Text,,MUTOID SOLDIERS,,SOLDAT MUTOIDE,,,,Солдат-Мутоид,,
KEY_GEOSCAPE_CLEAN_LAIR_MISSION_OBJECTIVE_TITLE,Text,NEED TO CHANGE,Obtain Corruption Sample from Lair,,Obtenir un échantillon de corruption dans une Tanière,,,,Добыть зараженный Образец в Логове,,
KEY_TAC_HINT_STATUS_CORRUPTED_DESCRIPTION,Text,,"Your soldiers have gained one point of Delirium. At the start of the game, Delirium is capped at one third of the character's willpower. This cap will increase as the game progresses.

Delirium reduces Willpower by an equal amount. The lower a soldier's Willpower becomes, the more susceptible they are to panic or mind control, and the less they can use their skills. <b>Each 10 points in Stamina negate the effects of 1 point of Delirium</b>.

Delirium has other effects as well <b>that are not negated by higher Stamina</b>. ",,"Vos soldats ont gagné un point de Délire. Au début du jeu, le délire est plafonné à un tiers de la volonté du personnage. Ce plafond augmente au fur et à mesure que le jeu progresse.

Le délire réduit la Volonté d'un montant égal. Plus la Volonté d'un soldat est faible, plus il est sensible à la panique ou au contrôle mental, et moins il peut utiliser ses compétences. <b>Chaque tranche de 10 points d'Endurance annule les effets de 1 point de Délire</b>.

Le délire a également d'autres effets <b>qui ne sont pas annulés par une meilleure endurance</b>. ",,,,"Ваши бойцы получили 1 очко Сонного Безумия. В начале игры максимальный уровень Сонного Безумия равен одной трети Силы Воли персонажа. Этот предел будет расти по ходу игры.

Сонное Безумие уменьшает Силу Воли на количество своих очков. Чем слабее Сила Воли бойца, тем более он подвержен панике и контролю разума и тем меньше у него Очков Воли для применения своих навыков. Хорошие новости: <b>Каждые 10 очков выносливости компенсируют 1 очко Сонного Безумия</b>.

У Сонного Безумия есть и другие эффекты, которые никак не компенсируются высокой выносливостью.",,
KEY_TAC_HINT_STATUS_CORRUPTED_NAME,Text,,SUFFERS ONEIRIC DELIRIUM,,SUBIT UN DÉLIRE ONIRIQUE,,,,ЗАРАЖЕН СОННЫМ БЕЗУМИЕМ,,
