Key,Type,Desc,English,Chinese (Simplified),French,German,Italian,Polish,Russian,Spanish,UI_Tester
TFTV_LORE_ALISTAIR_TITLE,Text,,Alistair Ashby,,,,,,Алистер Эшби,,
TFTV_LORE_ALISTAIR_DESCRIPTION,Text,,"Sometimes Alistair thought that the transformative effect of the Pandoravirus on him could not have been greater had he actually been infected with it.

Alistair went from a youthful college-dropout influencer to a bona fide expert, all by taking the first Mist stories seriously, while the rest of the media still considered them fake news. He grasped the significance of what was happening earlier and better than anyone else. He anticipated the Third World War and its consequences, including the rise of the highly polarized and ideologically charged factions, and the demise of race, wealth, nationality and family prestige as relevant sociological factors.

“We are mistaken about the coming Apocalypse. It’s not about extinction or survival. It’s about our place in the new food chain.”

The Pandoravirus also brought Alistair into contact with the child prodigy Olena Kim. They ran into each other more than two decades ago and have been inseparable ever since, to the extent that Alistair now considers himself her oppa (older brother).

The connection - if any - between Alistair and Phoenix Project remains a mystery, but it seems like he knew Randolph Symes III personally.",,,,,,"Иногда Алистеру кажется, что влияние Пандоравируса на него не стало бы сильнее, даже если бы он им заразился.

Алистер прошел путь от молодого дуралея, бросившего колледж, до настоящего гуру, и все потому, что серьезно отнесся к первым сообщениям о Тумане, пока все СМИ все еще считали их фэйками. Он понял значение происходящего раньше и лучше, чем кто-либо другой. Он предвидел Третью мировую войну и ее последствия, включая появление ультра поляризованных и идеологически чуждых друг другу фракций, а также исчезновение рас, богатств, национальностей и семейных ценностей как значимых социологических факторов.

«Мы заблуждаемся относительно грядущего Апокалипсиса. Речь идет не о вымирании или выживании. Речь идет о нашем месте в новой пищевой цепи».

Также из-за Пандоравируса Алистер сошелся с ребенком-вундеркиндом Аленой Ким. Они встретились более двадцати лет назад и с тех пор неразлучны до такой степени, что Алистер считает себя ее старшим братом.

Связь между Алистером и Проектом Феникс остается загадкой, но, похоже, он был лично знаком с Рэндольфом Саймсом 3-м.",,
TFTV_LORE_OLENA_TITLE,Text,,Olena Kim,,,,,,Алена Ким,,
TFTV_LORE_OLENA_DESCRIPTION,Text,,"Olena was born in Odesa to a Korean father and a Ukrainian mother, both renowned scholars in archaeology and anthropology. They traveled around the world with their daughter, exposing her to different cultures and languages. A prodigy, Olena bears the imprint of a program for the gifted: an alien within her own species.

She lost her parents during the First Mist. When Alistair Ashby and his band of refugees found her, she was another shell shocked child. In time, he became her friend and confidant, one of the few people who understood her.

Olena never talks about her past unless asked directly. She prefers to focus on the present and future challenges. She is loyal to Alistair and respects his judgment, particularly as to people. She is curious about the various factions but wary of their intentions or agendas.",,,,,,"Алена родилась в Одессе в семье отца-корейца и матери-украинки, известных ученых в области археологии и антропологии. Они путешествовали с дочерью по всему миру, приобщая ее к разным культурам и языкам. Будучи вундеркиндом, Алена несет на себе отпечаток своего дара: чуждая своему собственному виду.

Она потеряла родителей во время Первого Тумана. Когда Алистер Эшби и его группа беженцев нашли ее, она была еще одним потрясенным ребенком. Со временем он стал ее другом и доверенным лицом, одним из немногих, кто ее понимал.

Алена никогда не говорит о своем прошлом, если ее не спрашивают напрямую. Она предпочитает сосредоточиться на настоящем и будущих проблемах. Она верна Алистеру и уважает его суждения, особенно в отношении людей. Она интересуется различными фракциями, но с опаской относится к их намерениям и планам.",,
TFTV_LORE_HELENA_TITLE,Text,,Helena Lewandowski,,,,,,Хелена Левандовски,,
TFTV_LORE_HELAN_DESCRIPTION,Text,,"Helena Lewandowski was born in Warsaw, Poland, in 1993. She had a passion for history and archaeology since she was a child, and pursued her studies at the University of Warsaw. She became one of the world’s leading experts on prehistoric cultures and civilizations, especially those that existed before the last ice age. 

In 2019, she joined Project Glory, a secretive attempt to study the nature of enigmatic ruins that predated Homo Sapiens. Project Glory was funded by the Phoenix Project and Vanadium Inc., and was led by Dr. Randolph Symes III, the director of the Phoenix Project at that time.

However, Dr. Symes did not share her enthusiasm or vision. Helena left Project Glory and joined Vanadium Inc., where she continued her research under the supervision of Tobias West, the CEO of Vanadium Inc. In 2022, when the Pandora virus began to spread across the globe, Helena uncovered evidence of an ancient civilization that had advanced technology and knowledge beyond anything known to modern humans. She contacted West and told him about her breakthrough.

However, West suddenly shut down Project Glory and ordered Helena to return to New Jericho’s headquarters. She was later transferred to a prison facility, where she remained until rescued by the Phoenix Project. ",,,,,,"Хелена Левандовски родилась в Варшаве, Польша, в 1993 году. Она с детства увлекалась историей и археологией и продолжила обучение в Варшавском университете. Она стала одним из ведущих мировых экспертов по доисторическим культурам и цивилизациям, особенно тем, которые существовали до последнего ледникового периода. 

В 2019 году она присоединилась к проекту «Слава» - тайной попытке изучить природу загадочных руин, существовавших еще до появления человечества. Проект «Слава» под руководством Рэндольфа Саймса 3-его, директора Проекта Феникс на тот момент, финансировался Проектом Феникс и корпорацией Ванадий.

Однако доктор Саймс не разделял ее энтузиазм и идеи. Хелена покинула проект «Слава» и присоединилась к корпорации Ванадий, где продолжила свои исследования под руководством Тобиаса Уэста, генерального директора. В 2022 году, когда Пандоравирус начал распространяться по всему миру, Хелена обнаружила свидетельства существования древней цивилизации, которая обладала технологиями и знаниями, превосходящими все, что известно современным людям. Она связалась с Уэстом и рассказала ему о своем открытии.

Однако Уэст внезапно закрыл проект «Слава» и приказал Хелене вернуться в штаб-квартиру Нового Иерихона. Позже ее перевели в тюрьму, где она оставалась до тех пор, пока ее не спасла команда Проекта Феникс.",,
TFTV_LORE_BENNU_TITLE,Text,,Bennu,,,,,,Бенну,,
TFTV_LORE_BENNU_DESCRIPTION,Text,,"The Phoenix Project relies on a number of Limited Artificial Intelligences: task oriented, non replicating software with limited growth potential devoid of internal personality modulators, aggregated under the namespace Bennu. 

Bennu runs the life support on Phoenix bases, assists with research and manufacturing processes, and provides the Director Interface and other critical information, among many other crucial background tasks. They allow the Director maximum control in both strategic and tactical decisions. 

As a data processing unit, Bennu works to present all relevant information in the most succinct, understandable and engaging manner. Like this text here! Hope you enjoyed it!",,,,,,"Проект Феникс опирается на набор слабых искусственных интеллектов - специализированных, не способных к воспроизводству, программ с ограниченным потенциалом самообучения, лишенных какой-либо личности, объединенных вместе в систему под названием Бенну. 

Бенну обеспечивают жизнедеятельность баз Феникса, помогает в исследованиях и производственных процессах, реализует панель управления Директора и доступ к базе данных Проекта Феникс, а также выполняет множество других важнейших фоновых задач. Он позволяет Директору полностью контролировать принятие стратегических и тактических решений. 

Будучи по сути улучшенной версией ChatGPT, Бенну представляет всю необходимую информацию в наиболее краткой, понятной и увлекательной форме, как, например, данный текст! Надеюсь, вам понравилось?!",,
TFTV_TIP_GEOSCAPE_1,Text,,Accepting a Diplomacy mission from one faction will normally give you a large penalty with the other factions.,,,,,,"Приняв дипломатическое задание от одной фракции, вы обычно получаете большой штраф в отношениях с другими фракциями.",,
TFTV_TIP_GEOSCAPE_2,Text,,"If you choose to postpone a Diplomacy mission, you will suffer a penalty with the offering faction, and be offered the mission again once you reach the required Diplomacy rating.",,,,,,"Если вы решите отложить дипломатическую миссию, вы будите оштрафованы фракцией, предложившей миссию. И вам предложат ее снова не раньше, чем когда вы достигнете требуемого рейтинга дипломатии.",,
TFTV_TIP_GEOSCAPE_3,Text,,Void Omens can be removed by destroying Pandoran Lairs or Citadels (or Nests if you are playing on Rookie).,,,,,,"Знамения Пустоты можно отменить, уничтожая Пандоранские Логова или Цитадели (или Гнезда, если вы играете на уровне сложности Новичок).",,
TFTV_TIP_GEOSCAPE_4,Text,,Pandoran Colonies and Infested Havens speed up Pandoran Evolution.,,,,,,Колонии Пандоранов и зараженные убежища ускоряют эволюцию Пандоранов.,,
TFTV_TIP_GEOSCAPE_5,Text,,Beware of ambushes when exploring!,,,,,,Остерегайтесь засад при разведке неизвестных локаций!,,
TFTV_TIP_GEOSCAPE_6,Text,,You can buy Faction Technologies in the Marketplace.,,,,,,Вы можете купить технологии фракций на Рынке.,,
TFTV_TIP_GEOSCAPE_7,Text,,Reverse Engineering an item will allow the player to research the underlying Faction Technology.,,,,,,"Реверс-инжиниринг предмета позволит игроку изучить технологию фракции, лежащую в его основе.",,
TFTV_TIP_GEOSCAPE_8,Text,,You don't have to follow the Symes questline to win; activate a couple old Phoenix bases to see if there is anything interesting in their archives...,,,,,,"Чтобы победить, необязательно идти по следам Саймса: активируйте пару старых баз Феникса, чтобы узнать, нет ли в их архивах чего-нибудь интересного...",,
TFTV_TIP_GEOSCAPE_9,Text,,The FAR-M module that comes equipped on your starting Manticore adds 4 seats and stamina regeneration to everyone on board.,,,,,,"Модуль РШМ, которым оснащается стартовая Мантикора, добавляет 4 места для бойцов и постепенное восстановление выносливости всех, кто находится на борту.",,
TFTV_TIP_GEOSCAPE_10,Text,,"There are 4 different Passenger Modules for your aircraft, each granting a different bonus in addition to the extra seats. You will unlock them as you acquire Faction Technologies.",,,,,,"Для вашего самолета существует 4 различных пассажирских модуля, каждый из которых дает различные бонусы и дополнительные места для бойцов. Вы откроете их по мере получения технологий фракций.",,
TFTV_TIP_GEOSCAPE_11,Text,,"A Haven under attack will send out an S.O.S., revealing its position.",,,,,,"Убежище, подвергшееся нападению, посылает сигнал SOS, сообщая о своих координатах.",,
TFTV_TIP_GEOSCAPE_12,Text,,Build or repair satellite uplinks at your bases to discover Points of Interest and increase the chance of detecting a Pandoran Colony after successfully defending a haven.,,,,,,"Постройте или отремонтируйте «Спутниковые Комплексы» на своих базах, чтобы находить новые локации на карте Земли и повысить вероятность обнаружения Пандоранских Колоний при успешной защите убежищ.",,
TFTV_TIP_GEOSCAPE_13,Text,,"As long as haven leaders are not hostile to the Phoenix Project, they will continue to offer recruits, though at a higher price if they dislike you.",,,,,,"Пока лидеры убежищ не враждебны Проекту Феникс, они будут продолжать предлагать новобранцев, хотя и по более высокой цене, если вы им не нравитесь.",,
TFTV_TIP_GEOSCAPE_14,Text,,"As the Oneiric Delirium advances, more negative effects will come in play, including Void Omens.",,,,,,"По мере распространения Сонного Безумия в игру будет вступать все больше негативных эффектов, включая Знамения Пустоты (Void Omens).",,
TFTV_TIP_GEOSCAPE_15,Text,,Havens destroyed inside the Mist can become Infested.,,,,,,"Убежища, разрушенные внутри Тумана, могут стать зараженными.",,
TFTV_TIP_GEOSCAPE_16,Text,,"Infested Havens cannot be saved, but unique rewards can be salvaged and some population recovered.",,,,,,"Зараженные убежища нельзя спасти, но при их зачистке можно получить уникальные награды и восстановить часть населения.",,
TFTV_TIP_GEOSCAPE_17,Text,,"If you are looking for a challenge, check the Make Pandorans Stronger option at the start of the game. If you are still finding everything too easy, try the ETERMES difficulty. Report if you survive, would you kindly. ",,,,,,"Если вы хотите больше сложностей, включите опцию ОПАСНЫЕ ПАНДОРАНЫ в начале игры. Если вам все еще кажется, что играть слишком легко, попробуйте сложность ПОЛНОЕ БЕЗУМИЕ. Сообщите, если вы выжили, пожалуйста :)",,
TFTV_TIP_GEOSCAPE_18,Text,,"If you are finding the game too hard, try playing on Story Mode or Rookie. You can also choose a different difficulty setting for the Tactical portion of the game. You can do so either on starting a new game or in the mod config.",,,,,,"Если игра кажется вам слишком тяжелой, попробуйте сыграть на сложности КАК КНИЖКУ ПРОЧИТАТЬ или НОВИЧОК. Вы также можете выбрать отдельно настройку сложности для Тактического (боевого) режима игры. Это можно сделать либо при начале новой игры, либо в конфигурации мода - кликом на название нашего мода в списке модов.",,
TFTV_TIP_GEOSCAPE_19,Text,,"If you run into any Error Messages or other bugs, please report them in our #bug-reporting channel at the Terror from the Void Discord server.",,,,,,"Если вы столкнулись с какими-либо сообщениями об ошибках или другими багами, пожалуйста, сообщите о них в нашем канале #bug-reporting на сервере «Terror from the Void» в Discord.",,
TFTV_TIP_TACTICAL_1,Text,,The total amount of Delirium of all your operatives present on the mission determines the chance that an Arthron or a Triton will be Touched by the Void.,,,,,,"Степень поражения Сонным Безумием ваших бойцов, участвующих в миссии, определяет вероятность того, что Артрон или Тритон получит Благословление Пустоты.",,
TFTV_TIP_TACTICAL_2,Text,,"Umbras can only attack characters that have at least one Delirium point, or are inside the Mist.",,,,,,"Фиолетовая Тварь может атаковать только тех бойцов, которые заражены Сонном Безумием или которые находятся внутри Тумана.",,
TFTV_TIP_TACTICAL_3,Text,,The impact of Delirium on Willpower is weakened if your operative is well rested. Every 10 Stamina will reduce the effect of Delirium on Willpower by 1.,,,,,,"Влияние Сонного Безумия на Силу Воли ослабевает, если ваш боец хорошо отдохнул. Каждые 10 единиц Выносливости уменьшают на 1 влияние Сонного Безумия на Силу Воли.",,
TFTV_TIP_TACTICAL_4,Text,,"If a body part is disabled in battle, the operative's Stamina will drop to 0 after the mission.",,,,,,Если в бою часть тела окажется выбитой (хиты части тела равны 0) то после выполнения миссии Выносливость бойца упадет до 0.,,
TFTV_TIP_TACTICAL_5,Text,,"The bigger Pandorans will ignore smaller critters, drones and turrets, and walk over them, or squash them.",,,,,,"Более крупные Пандораны будут игнорировать мелкую живность, дронов и турели, проходя над ними или давя их.",,
TFTV_TIP_TACTICAL_6,Text,,Decoys and imaginary (or are they?) monsters don't stop bullets.,,,,,,"Приманки и воображаемые (если они воображаемые, конечно) монстры не останавливают пули.",,
TFTV_TIP_TACTICAL_7,Text,,"If you are looking for a challenge, check the Make Pandorans Stronger option at the start of the game. If you are still finding everything too easy, try the ETERMES difficulty. Report if you survive, would you kindly. ",,,,,,"Если вы хотите больше сложностей, включите опцию ОПАСНЫЕ ПАНДОРАНЫ в начале игры. Если вам все еще кажется, что играть слишком легко, попробуйте сложность ПОЛНОЕ БЕЗУМИЕ. Сообщите нам, если вы выжили, пожалуйста :)",,
TFTV_TIP_TACTICAL_8,Text,,"If you are finding the game too hard, try playing on Story Mode or Rookie. You can also choose a different difficulty setting for the Tactical portion of the game. You can do so either on starting a new game or in the mod config.",,,,,,"Если игра кажется вам слишком тяжелой, попробуйте сыграть на сложности КАК КНИЖКУ ПРОЧИТАТЬ или НОВИЧОК. Вы также можете выбрать другую настройку сложности для Тактического (боевого) режима игры. Это можно сделать либо при начале новой игры, либо в конфигурации мода - кликом на название нашего мода в списке модов.",,
TFTV_TIP_TACTICAL_9,Text,,"If you run into any Error Messages or other bugs, please report them in our #bug-reporting channel at the Terror from the Void Discord server.",,,,,,"Если вы столкнулись с какими-либо сообщениями об ошибках или другими багами, пожалуйста, сообщите о них в нашем канале #bug-reporting на сервере «Terror from the Void» в Discord.",,
TFTV_TIP_TACTICAL_10,Text,,Smart adversaries will realize fast that they are attacking a decoy.,,,,,,"Умные противники быстро поймут, что атакуют приманку.",,
TFTV_TIP_GEOSCAPE_20,Text,,The volume of Pandorans that a craft is able to extract is equal to its carrying capacity when equipped with a passenger module.,,,,,,"Объем Пандоранов, который может вместить самолет, равен его грузоподъемности, при условии оснащения пассажирским модулем.",,
TFTV_TIP_GEOSCAPE_21,Text,,Only one aircraft can be used for extracting paralyzed Pandorans for capture. The game will automatically pick the one with the largest capture capacity.,,,,,,Только один самолет может быть использован для перевозки захваченных парализованных Пандоранов. Игра автоматически выберет самолет с наибольшей вместимостью.,,
TFTV_TIP_GEOSCAPE_22,Text,,If you have built a Containment Facility the game will automatically try to extract the most valuable of the paralyzed Pandorans at the end of a successful mission.,,,,,,"Если вы построили Изолятор, то в конце успешной миссии игра автоматически попытается загрузить в самолет самого ценного из парализованных Пандоранов.",,
