"Key","Type","Desc","English","Chinese (Simplified)","French","German","Italian","Polish","Russian","Spanish","UI_Tester"
"HELENA_VIROPHAGE_TEXT","Text","","Director, I believe that with all the information we have gathered, we have a much greater advantage than the Ancients ever had to use the Virophage to defeat the Pandoravirus while minimizing our own losses.

We have a tested solution at our disposal, and once it is done, we will be the ones guiding Humanity forward, recovering the wonders of the Ancients and putting them to the proper use.

You may be tempted to align the Phoenix Project with one of the factions and their vision for the future of our species, but remember that they only want us to help them win. After that, they will disregard us even as they pretend to honor our sacrifices. We will plead with them to listen to us and they will ignore us, as they always have until it is too late.","指挥官，我相信凭借我们收集的所有信息，我们比先行者拥有更大的优势，能够利用病毒吞噬体击败潘多拉病毒，同时将自身损失降到最低。

我们手头有经过测试的方案，一旦完成，我们将引领人类前进，恢复先行者的奇迹并加以合理利用。

你可能会想让凤凰计划与某个派系及其对我们物种未来的愿景结盟，但请记住，他们只是想让我们帮他们赢得胜利。之后，他们会无视我们，即使表面上尊重我们的牺牲。我们会恳求他们倾听，但他们会像往常一样忽视我们，直到为时已晚。","Directeur, je crois qu’avec toutes les informations que nous avons rassemblées, nous disposons d’un avantage bien plus grand que celui que les Anciens ont jamais eu pour utiliser le Virophage afin de vaincre le Pandoravirus tout en minimisant nos propres pertes.

Nous avons une solution éprouvée à notre disposition, et une fois qu’elle sera mise en œuvre, nous serons ceux qui guideront l’Humanité, récupérant les merveilles des Anciens et les mettant à leur juste usage.

Vous pourriez être tenté d’aligner le Projet Phoenix avec l’une des factions et leur vision de l’avenir de notre espèce, mais rappelez-vous qu’ils ne veulent que notre aide pour gagner. Après cela, ils nous ignoreront, même en feignant d’honorer nos sacrifices. Nous les supplierons de nous écouter, et ils nous ignoreront, comme ils l’ont toujours fait, jusqu’à ce qu’il soit trop tard.","Direktor, mit all den Informationen, die wir gesammelt haben, besitzen wir nun einen größeren Vorteil, als ihn die Uralten je hatten. Wir können den Virophagen einsetzen, um das Pandoravirus zu besiegen – und dabei unsere eigenen Verluste zu minimieren.

Wir verfügen über eine erprobte Lösung, und sobald diese abgeschlossen ist, werden wir die Menschheit in die Zukunft führen, die Errungenschaften der Uralten wiederherstellen und sie ihrem Zweck zuführen.

Du könntest versucht sein, das Phoenix-Projekt an eine der Fraktionen zu binden, an ihre Vision von der Zukunft. Doch vergiss nicht: Sie wollen uns nur, solange wir ihnen zum Sieg verhelfen. Danach werden sie uns ignorieren – selbst dann, wenn sie so tun, als ehrten sie unsere Opfer.

Wir werden sie anflehen zuzuhören. Und sie werden uns überhören. Wie immer. Bis es zu spät ist.","","","Директор, я считаю, что со всей информацией, которую мы собрали, у нас есть гораздо большее преимущество, чем когда-либо было у Древних, чтобы использовать вирофаг для борьбы с Пандоравирусом, минимизируя при этом наши собственные потери.

В нашем распоряжении есть проверенное решение, и как только оно будет готово, мы станем теми, кто поведет человечество вперед, возрождая чудеса Древних и находя им правильное применение.

У вас может возникнуть соблазн связать Проект Феникс с одной из фракций и их видением будущего нашего вида, но помните, что они лишь хотят, чтобы мы помогли победить им самим. После этого они будут игнорировать нас, даже если будут делать вид, что уважают наши жертвы. Мы будем умолять их прислушаться к нам, а они будут игнорировать нас, как обычно, пока не станет слишком поздно.","",""
"CAN_BUILD_CYCLOPS_TITLE","Text","","Necroneuromant","死灵神经术士","Nécro‑neuromancien","Necroneuromant","","","Некронейромант","",""
"CAN_BUILD_CYCLOPS_TEXT","Text","","Now that we have analyzed samples of both the Living Crystal and of the Protean Mutane, our scientists and engineers are confident that they can reactivate a Cyclops to access its memories and discover what happened to the Ancients. Olena has warned me that she will need some time to interface with the entity.","现在我们已经分析了活体水晶和变形变异体的样本，科学家和工程师们有信心重新激活一台独眼巨人，访问其记忆，揭示先行者的遭遇。奥莲娜提醒我，她需要一些时间与该实体接口。","Maintenant que nous avons analysé des échantillons du Cristal Vivant et du Mutant Protéen, nos scientifiques et ingénieurs sont confiants de pouvoir réactiver un Cyclops pour accéder à ses mémoires et découvrir ce qui est arrivé aux Anciens. Olena m’a prévenu qu’elle aura besoin de temps pour établir l’interface avec l’entité.","Nachdem wir Proben sowohl des Lebenden Kristalls als auch des proteischen Mutans analysiert haben, sind unsere Wissenschaftler und Ingenieure zuversichtlich, dass sie einen Zyklopen reaktivieren können, um auf seine Erinnerungen zuzugreifen und herauszufinden, was mit den Uralten geschehen ist.
Olena hat mich jedoch gewarnt, dass sie einige Zeit benötigen wird, um mit der Entität eine Schnittstelle herzustellen.","","","Теперь, когда мы проанализировали образцы как Живого Кристалла, так и Белкового Мутагена, наши ученые и инженеры уверены, что смогут реактивировать Циклопа, чтобы получить доступ к его памяти и узнать, что случилось с Древними. Алена предупредила меня, что ей потребуется некоторое время, чтобы установить контакт с Сущностью.","",""
"BUILD_CYCLOPS_OBJECTIVE","Text","","Reactivate a Cyclops at one of the Ancient Sites under your control","在你控制的一个远古遗址重新激活独眼巨人","Réactivez un Cyclops sur l’un des Sites Anciens sous votre contrôle","Reaktiviere einen Zyklopen an einer der Uralten Stätten unter deiner Kontrolle.","","","Активируйте Циклопа в одной из Древних Руин, находящейся под вашим контролем","",""
"BASEDEFENSE_EVENT_TITLE","Text","","A Phoenix Project base is under attack!","凤凰计划基地遭受攻击！","Une base du Projet Phoenix est attaquée  !","Eine Basis des Phoenix-Projekts wird angegriffen!","","","База Проекта Феникс подверглась нападению!","",""
"BASEDEFENSE_EVENT_TEXT","Text","","Director! We are under attack! Our automated defenses and bulwarks will buy us some time, but we need to deploy a squad to secure the base as soon as possible. The longer we take, the more time the enemy will have to achieve its objectives.
","指挥官！我们正遭受攻击！我们的自动防御和壁垒能为我们争取一些时间，但我们需要尽快部署小队保卫基地。拖得越久，敌人完成目标的时间就越多。
","Directeur ! Nous sommes attaqués ! Nos défenses automatisées et nos remparts nous donneront un peu de temps, mais nous devons déployer une escouade pour sécuriser la base dès que possible. Plus nous tardons, plus l’ennemi aura de temps pour atteindre ses objectifs.","<b>Direktor! Wir werden angegriffen!</b>
Unsere automatisierten Verteidigungsanlagen und Befestigungen verschaffen uns etwas Zeit, doch wir müssen so schnell wie möglich ein Einsatzteam entsenden, um die Basis zu sichern.
Je länger wir warten, desto mehr Zeit hat der Feind, seine Ziele zu erreichen.","","","Шеф! На нас напали! Наши турели и бастионы позволят нам выиграть немного времени, но нам нужно как можно скорее направить отряд для защиты базы. Чем дольше мы будем медлить, тем больше шанс, что враг добьется успеха.","",""
"BASEDEFENSE_CONTAINMENTBREACH_TEXT","Text","","Director! Our base is under attack and the containment structure has been breached from within! We are not sure how it happened, but everything that was <i>in</i>, got <i>out</i>. We need to deploy a squad to secure the base before it is completely taken over!","指挥官！我们的基地正遭受攻击，且内部的封锁结构已被突破！我们不确定具体是如何发生的，但所有被关押的都已经逃出。我们需要派遣小队确保基地安全，防止其被完全占领！","Directeur ! Notre base est attaquée et la structure de confinement a été compromise de l’intérieur ! Nous ne savons pas comment cela s’est produit, mais tout ce qui était <i>à l’intérieur</i> est <i>sorti</i>. Nous devons déployer une escouade pour sécuriser la base avant qu’elle ne soit totalement envahie !","<b>Direktor! Unsere Basis wird angegriffen und die Sicherheitsstruktur wurde von innen durchbrochen!</b>
Wir wissen nicht, wie es dazu kommen konnte, aber alles, was <i>drin</i> war, ist jetzt <i>draußen</i>.
Wir müssen unverzüglich ein Einsatzteam entsenden, bevor die Basis vollständig überrannt wird!","","","Шеф! На нашу базу напали, Изолятор был прорван, при чем изнутри! Мы не уверены, как это произошло, но все, что было внутри, выбралось наружу. Нам нужно направить отряд для защиты базы, прежде чем она будет полностью захвачена!","",""
"BASEDEFENSE_CAPTIVE_SIREN_TEXT","Text","","There is something else. We suspect that a Siren held in containment at the base was instrumental in directing the Pandorans to the base! I should have guessed that its telepathic prowess could be a security risk. I recommend that we enforce a perimeter free of Pandoran colonies of at least 2,000 km around our bases with containment facilities if we are going to hold specimens with telepathic abilities. ","还有一件事。我们怀疑基地内被关押的一只塞壬在引导潘多拉体攻击基地中起了关键作用！我早该想到它的心灵感应能力可能构成安全风险。如果我们要关押具有心灵感应能力的标本，建议在拥有封锁设施的基地周围至少设立2000公里的潘多拉殖民地禁区。","Il y a autre chose. Nous soupçonnons qu’une Sirène, retenue en confinement à la base, a joué un rôle clé pour diriger les Pandoriens vers celle-ci ! J’aurais dû me douter que ses capacités télépathiques pouvaient représenter un risque pour la sécurité. Je recommande d’établir un périmètre libre de colonies pandoriennes d’au moins 2 000 km autour de nos bases disposant d’installations de confinement si nous voulons maintenir des spécimens dotés de capacités télépathiques.","Da ist noch etwas. Wir vermuten, dass eine Sirene, die in dieser Basis in Verwahrung gehalten wurde, maßgeblich daran beteiligt war, die Pandoraner hierher zu lenken.
Ich hätte früher erkennen müssen, dass ihre telepathischen Fähigkeiten ein erhebliches Sicherheitsrisiko darstellen. Ich empfehle dringend, um alle Basen mit Eindämmungsanlagen einen pandoranerfreien Radius von mindestens 2.000 Kilometern einzuhalten, sofern wir weiterhin Exemplare mit telepathischen Fähigkeiten festhalten wollen.","","","И еще кое-что. Мы подозреваем, что Сирена, находящаяся в Изоляторе на базе, помогла Пандоранам добраться до базы! Я должен был догадаться, что ее телепатические способности могут представлять угрозу безопасности. Я рекомендую нам обеспечить периметр, свободный от Пандоранских колоний, по крайней мере, на 2000 км вокруг наших баз с Изоляторами, если мы собираемся содержать особей с телепатическими способностями.","",""
"BASEDEFENSE_CAPTIVE_SCYLLA_TEXT","Text","","It was the Scylla! The Scylla that we captured has been acting as a beacon to all the Pandorans within the region. I recommend that we terminate the creature as soon as our researchers are done with it.","是那只斯库拉！我们捕获的斯库拉一直作为该地区所有潘多拉体的信标。我建议研究人员完成工作后立即处决该生物。","C’était la Scylla ! La Scylla que nous avons capturée a servi de balise pour tous les Pandoriens de la région. Je recommande d’éliminer la créature dès que nos chercheurs en auront terminé avec elle.","Es war die Scylla! Die von uns gefangene Scylla diente allen Pandoranern in der Region als Leuchtfeuer. Ich empfehle, die Kreatur umgehend zu eliminieren, sobald unsere Forscher ihre Arbeit abgeschlossen haben.","","","Черт, это была Сцилла! Сцилла, которую мы поймали, служила маяком для всех Пандоранов в регионе. Я рекомендую уничтожить это существо, как только наши исследователи закончат с ним.","",""
"BASEDEFENSE_NJWALLS_TEXT","Text","","Thankfully the New Jericho fortifications will buy us some extra time.","幸好新耶利哥的防御工事为我们争取了一些额外时间。","Heureusement, les fortifications de la Nouvelle-Jéricho nous donneront un peu de temps supplémentaire.","Zum Glück verschaffen uns die Befestigungsanlagen von Neu-Jericho etwas zusätzliche Zeit.","","","К счастью, укрепления Нового Иерихона позволят нам выиграть немного времени.","",""
"BASEDEFENSE_DEFEAT_TITLE","Text","","PHOENIX BASE INFESTED","凤凰点基地被感染","BASE PHOENIX INFESTÉE","PHOENIX-BASIS BEFALLEN","","","БАЗА ФЕНИКСА ЗАРАЖЕНА","",""
"BASEDEFENSE_DEFEAT_TEXT","Text","","Our base has been overrun. We will need to send a team to clear out the infestation if we want to recover it.","我们的基地已被攻占。如果想要夺回基地，我们需要派遣团队清除感染。","Notre base a été envahie. Nous devrons envoyer une équipe pour éliminer l’infestation si nous voulons la récupérer.","Unsere Basis wurde überrannt. Wir müssen ein Team zur Bekämpfung des Befalls entsenden, wenn wir sie zurückerobern wollen.","","","Наша база захвачена. Нам нужно будет отправить отряд для ликвидации заражения, если мы хотим восстановить ее.","",""
"CONTAINMENTBREACH_EVENT_TITLE","Text","","CONTAINMENT BREACH!","封锁突破！","VIOLATION DU CONFINEMENT  !","EINDÄMMUNGSANLAGE DURCHBROCHEN!","","","ПРОРЫВ ИЗОЛЯТОРА!","",""
"CONTAINMENTBREACH_EVENT_TEXT","Text","","We are not sure how it happened, but everything that was <i>in</i>, got <i>out</i>.

Director, this base is already almost taken over by the Pandorans!","我们不确定具体是如何发生的，但所有被关押的都已经逃出。

指挥官，这个基地几乎已被潘多拉体占领！","Nous ne savons pas comment cela s’est produit, mais tout ce qui était <i>à l’intérieur</i> est <i>sorti</i>.

Directeur, cette base est déjà presque entièrement envahie par les Pandoriens !","Wir wissen nicht genau, wie es passiert ist, aber alles, was <i>drin</i> war, ist <i>draußen</i>.

Direktor, diese Basis steht kurz davor, vollständig von den Pandoranern übernommen zu werden!“","","","Мы не совсем уверены, как это произошло, но все, что было внутри, вышло наружу.

Директор, эта база почти полностью захвачена Пандоранами!","",""
"BASEDEFENSE_PURGE_TITLE","Text","","Purge containment?","清除封锁？","Purge ?","Sicherungsverwahrung säubern?","","","Сжечь Изолятор?","",""
"BASEDEFENSE_PURGE_TEXT","Text","","Director, what shall do we with the captured Pandorans held at the base? They might break free during the attack! Do you authorize the purge? Here is the manifest:","指挥官，我们该如何处理基地内被关押的潘多拉体？它们可能会在攻击中逃脱！您是否授权进行清除？以下是清单：","Directeur, que devons-nous faire des Pandoriens capturés détenus à la base ? Ils pourraient s’échapper pendant l’attaque ! Autorisez‑vous la purge ? Voici le manifeste :","Direktor, was sollen wir mit den gefangenen Pandoranern der Basis tun? Während des Angriffs könnten sie ausbrechen! Genehmigung für Säuberung? Hier ist die Liste:","","","Директор, что нам делать с захваченными Пандоранами, удерживаемыми на базе? Они могут вырваться на свободу во время атаки! Вы разрешаете зачистку? Отдайте приказ!","",""
"BASEDEFENSE_PURGE_CHOICE_O","Text","","Purge them!","清除他们！","Éliminez‑les tous !","Entfernt sie!","","","Сжечь их всех!","",""
"BASEDEFENSE_PURGE_CHOICE_1","Text","","No, they are too valuable. We will risk it.","不，他们太宝贵了。我们愿意冒这个险。","Négatif. Ils sont trop précieux. Nous prenons le risque.","Nein, sie sind zu wertvoll. Wir gehen das Risiko ein.","","","Нет, они слишком ценны. Мы рискнем.","",""
"LOOSE_SCYLLA_EVENT_TITLE","Text","","SCYLLA ON THE LOOSE!","斯库拉失控！","SCYLLA EN LIBERTÉ !","SCYLLA IST AUF DER FLUCHT!","","","СЦИЛЛА НА СВОБОДЕ!","",""
"LOOSE_SCYLLA_EVENT_TEXT","Text","","Director, the Scylla escaped! It is taking over our base! If we don't act fast, it might turn it into a Pandoran colony.","指挥官，斯库拉逃脱了！它正在接管我们的基地！如果我们不迅速行动，它可能会将基地变成潘多拉殖民地。","Directeur, la Scylla s’est échappée ! Elle est en train de prendre le contrôle de notre base ! Si nous n’agissons pas vite, elle pourrait la transformer en colonie pandorienne.","Direktor, die Scylla ist entkommen! Sie beginnt, unsere Basis zu übernehmen!
Wenn wir nicht sofort handeln, könnte sie den Standort in eine pandoranische Kolonie verwandeln.","","","Шеф, Сцилла сбежала! Она крушит все вокруг! Если мы не поторопимся, она превратит нашу замечательную базу в мерзкую колонию Пандоранов!","",""
"PROG_FS9_CHOICE_0_TEXT","Text","","OK.","好的。","OK.","OK.","","","Ок","",""
"PROG_FS9_OUTCOME","Text","","Anu havens join in a ritual to welcome the prophesized Trials and Tribulations, their incomprehensible chant reverberating across the airwaves.

Synedrion, trapped in the complex web of its inner politics, fails to agree on a course of action, but one of their havens decides to send a mission to investigate the impact zone.

New Jericho mobilizes its armed forces. ""Caught between the foolish and the mad, we must act!"", proclaims West.","阿努门徒的避难所共同举行仪式，迎接预言中的考验与磨难，他们那难以理解的咏唱声在无线电波中回荡。

平衡议会被其内部政治的复杂网络所困，未能就行动方案达成一致，但其中一个避难所决定派遣任务调查影响区。

新耶利哥动员武装力量。韦斯特宣称：“夹在愚者与疯子之间，我们必须行动！”","Les refuges d’Anu se joignent à un rituel pour accueillir les épreuves et les malheurs prophétisés, leur chant incompréhensible résonnant sur les ondes.

Synedrion, piégé dans le réseau complexe de sa politique intérieure, ne parvient pas à s’entendre sur une ligne de conduite, mais l’un de ses refuge décide d’envoyer une mission pour enquêter sur la zone d’impact.

La Nouvelle-Jéricho mobilise ses forces armées. ""Pris entre le ridicule et la folie, nous devons agir!"" , proclame West.","Die Zufluchten von Anu vereinen sich in einem Ritual, um die prophezeiten Prüfungen und Leiden zu begrüßen. Ihr unverständlicher Singsang hallt durch die Funknetze und legt sich wie ein Echo über die Welt.

Synedrion, gefangen im komplexen Netz seiner internen Politik, kann sich nicht auf ein gemeinsames Vorgehen einigen, doch einer ihrer Zufluchten beschließt, eine Mission zur Untersuchung des Einschlaggebiets zu entsenden.

Neu-Jericho mobilisiert seine Streitkräfte. „Zwischen Torheit und Wahnsinn müssen wir handeln!“, verkündet West.","","","Жители Убежища Ану присоединяются к ритуалу, приветствуя предсказанные Испытания и Напасти, их непонятное пение эхом разносится по радиоэфиру.

Синедрионцы, запутавшиеся в сложной паутине своей внутренней политики, не могут договориться о дальнейших действиях, но одно из их убежищ решает отправить миссию для расследования зоны падения.

Новый Иерихон мобилизует свои вооруженные силы. ""Оказавшись между глупцами и безумцами, мы должны действовать!"" - провозглашает Уэст.","",""
