Key,Type,Desc,English,Chinese (Simplified),French,German,Italian,Polish,Russian,Spanish,UI_Tester
KEY_GEO_HINT_MUTATION_SCREEN_DESCRIPTION,Text,,"You are about to mutate your first soldier. A character can only have UP TO 2 BODY PARTS altered this way.

Each mutated body part increases damage dealt by character by 2% per each Delirium point that the character has.

Once a mutation is applied, the operative won't be able to revert back to their natural limbs. However, mutated body parts CAN BE SWAPPED with different mutation variants.

The :PRIEST: PRIEST soldier class has access to UNIQUE HEAD MUTATIONS greatly enhancing their powers.",,"Vous êtes sur le point de muter votre premiere unité. Un personnage ne peut avoir que JUSQU'À 2 PARTIES DU CORPS modifiées de cette manière.

Chaque partie du corps mutée augmente les dégâts infligés par le personnage de 2 % pour chaque point de Delirium qu'il possède.

Une fois une mutation appliquée, l'agent ne pourra plus retrouver ses membres naturels. Cependant, les parties du corps mutées PEUVENT ÊTRE ÉCHANGÉES contre différentes variantes de mutation.

La classe PRÊTRE a accès à des MUTATIONS DE TÊTE UNIQUES améliorant considérablement ses pouvoirs.","Du bist im Begriff, deine erste Einheit zu mutieren. Eine Einheit kann maximal 2 Körperteile auf diese Weise verändert bekommen.

Jedes mutierte Körperteil erhöht den Schaden von Nahkampf, Waffenstoß, Geistbruch und Verwüsten um 2% pro Delirium-Punkt.

Sobald eine Mutation angewendet wurde, kann die Einheit nicht mehr zu seinen natürlichen Gliedmaßen zurückkehren. Mutierte Körperteile KÖNNEN jedoch GEGEN ANDERE Mutationsvarianten AUSGETAUSCHT werden.

Die Klasse :PRIEST: Priester hat Zugriff auf EINZIGARTIGE KOPFMUTATIONEN, die ihre Kräfte erheblich verstärken.",,,"Вы собираетесь мутировать своего первого солдата. У персонажа может быть изменено не более 2 частей тела таким образом.

Каждая мутировавшая часть тела увеличивает наносимый персонажем урон на 2% за каждое имеющееся у него очко Сонного Безумия.

Как только мутация будет применена, боец не сможет вернуться к своим естественным конечностям. Однако, измененные части тела могут быть заменены другими вариантами мутаций.

Класс солдат-жрецов :PRIEST: имеет доступ к уникальным мутациям головы, значительно повышающим их способности.",,
KEY_GEO_HINT_MUTATION_SCREEN_NAME,Text,,MUTATING A SOLDIER,,MUTATION D'UN SOLDAT,MUTATION EINER EINHEIT,,,МУТИРОВАТЬ БОЙЦА,,
KEY_TUTORIAL_RESOURCES_DESCRIPTION,Text,,"On completing a mission, all gathered items and resources are added to your overall SUPPLIES. These can be accessed instantly anywhere on the GEOSCAPE, regardless of location.

Soldiers get fatigued during battle, LOSING 1 STAMINA POINT PER TURN (max 10 per battle).They also lose ALL STAMINA if one of their bodyparts is disabled during the mission.

If an operative starts a mission with 10 STAMINA OR LESS, they will only have 3 Action Points, instead of 4. If the operative has 0 STAMINA, they will only have 2 Action Points.

Your soldiers will slowly recover STAMINA in the aircraft if it has a FAR-M passenger module, and much faster at base, as long as it has a functioning Living Quarters. They can also recover HITPOINTS at the base if it has a functioning Medical Facility.

RETURN TO YOUR BASE SO YOUR SOLDIERS CAN RECOVER",,"À la fin d'une mission, tous les objets et ressources collectés sont ajoutés à vos FOURNITURES globales. Celles-ci sont accessibles instantanément n'importe où sur le GÉOSCAPE, quel que soit l'endroit.

Les agents se fatiguent pendant le combat, PERDANT 1 POINT D'ENDURANCE PAR TOUR (max 10 par bataille). Ils perdent également TOUTE LEUR ENDURANCE si l'une des parties de leur corps est neutralisée durant la mission.

Si un agent commence une mission avec 10 D'ENDURANCE OU MOINS, il n'aura que 3 points d'action au lieu de 4. Si l'agent a 0 D'ENDURANCE, il n'aura que 2 points d'action.

Vos agents récupèrent lentement leur ENDURANCE dans l'appareil s'il possède un module passager FAR-M, et beaucoup plus rapidement à la base, à condition qu'elle dispose de quartiers d'habitation fonctionnels. Ils peuvent également récupérer des POINTS DE VIE à la base si elle dispose d'un centre médical opérationnel.

RETOURNEZ À VOTRE BASE POUR QUE VOS SOLDATS PUISSENT RÉCUPÉRER","Nach Abschluss einer Mission werden alle gesammelten Gegenstände und Ressourcen deinem gesamten VORRAT hinzugefügt. Dieser ist sofort überall auf der GEOSCAPE verfügbar – unabhängig vom Aufenthaltsort.

Einheiten ermüden im Gefecht und verlieren 1 AUSDAUERPUNKT PRO RUNDE (maximal 10 pro Einsatz). Wird während der Mission ein Körperteil außer Gefecht gesetzt, fällt die Ausdauer der Einheit sofort auf 0.

Beginnt eine Einheit eine Mission mit 10 AUSDAUER ODER WENIGER, stehen ihm nur 3 Aktionspunkte statt 4 zur Verfügung. Hat die Einheit 0 AUSDAUER, bleiben ihr nur 2 Aktionspunkte.

Erholung: Im Fluggerät mit FAR-Truppmodul regenerieren Einheiten langsam Ausdauer langsam. In einer Basis geht es deutlich schneller, wenn funktionierende Unterkünfte vorhanden sind. Trefferpunkte regenerieren in der Basis, sofern eine funktionsfähige Krankenstation existiert.

KEHRE ZUR BASIS ZURÜCK, DAMIT DEINE EINHEITEN SICH ERHOLEN.",,,"По завершении миссии все собранные предметы и ресурсы добавляются на ваши склады. К ним можно получить мгновенный доступ в любой точке земного шара, независимо от местоположения.

Бойцы устают во время боя, теряя 1 очко выносливости в ход (максимум 10 за все сражение). Они также теряют ВСЮ ВЫНОСЛИВОСТЬ, если одна из частей их тела будет выбита во время миссии (0 хитов).

Если боец начинает миссию с запасом выносливости 10 или меньше, у него останется только 3 Очка Действий вместо 4-х. Если у бойца 0 очков выносливости, у него останется только 2 Очка Действий.

Ваши бойцы будут медленно восстанавливать силы в самолете, если у него есть модуль РШМ, и намного быстрее на базе, если на ней есть действующие ""Жилые Помещения"". Они также могут восстанавливать хиты на базе, если там есть действующий ""Медпункт"".

ВОЗВРАЩАЙТЕСЬ НА СВОЮ БАЗУ, ЧТОБЫ ВАШИ БОЙЦЫ МОГЛИ ОТЛЕЧИТЬСЯ И ВОССТАНОВИТЬ ВЫНОСЛИВОСТЬ!",,
KEY_DLC3_TUT_INFESTATION_DESCRIPTION,Text,,"Scum, villany, unbeatable prices!

The Marketplace offers:

-Cheap soldiers of fortune with mediocre equipment that <b>cannot receive mutations or bionics </b>. 
-Hand-crafted weapons, known as Kaos Guns, with good performance but small magazines and expensive ammo that can only be bought in the Bazaar.
-Junker, the post-Collapse ground vehicle of choice, and modules for it and other vehicles.
-Access to faction technologies.

The stock rotates approximately every 3 days and more options will become gradually available.   
You can access and make purchases in the Bazaar remotely, without a vehicle at the site.
",,"Racaille, scélératesse et prix imbattables !

Le Marché propose :

- Des soldats de fortune bon marché avec un équipement médiocre qui <b>ne peuvent pas recevoir de mutations ou de modules cybernétiques.</b>. 
- Des armes artisanales, appelées Armes Kaos, offrant de bonnes performances mais dotées de petits chargeurs et de munitions coûteuses qui ne peuvent être achetées qu'au Bazar.
- Le Junker, le véhicule terrestre de prédilection de l'après-Effondrement, ainsi que des modules pour celui-ci et pour d'autres véhicules.
- Un accès aux technologies des factions.

Le stock change environ tous les 3 jours et de plus en plus d'options deviendront progressivement disponibles.   
Vous pouvez accéder au Bazar et effectuer des achats à distance, sans avoir besoin d'un véhicule sur place.","<color=#ecba62><b><i>„Abschaum, Schurken – und unschlagbare Preise!“</i></b></color>

Der Basar bietet:
 • Günstige Kämpfer mit mäßiger Ausrüstung, die jedoch keine Mutationen oder Bionik erhalten können.
 • Kaos-Waffen: Gute Leistung, aber kleine Magazine und teure Spezialmunition (nur hier erhältlich).
 • Bodenfahrzeug Junker, der Standard nach dem Kollaps, und einzigartige Fahrzeugmodule.
 • Zugang zu Fraktionstechnologien.
 • Fluggerätemodule.

Das Angebot wechselt ungefähr alle 3 Tage, mehr Auswahl wird nach und nach verfügbar.
Du kannst den <i>Basar auch aus der Ferne</i> nutzen und Einkäufe tätigen, <i>ohne dass ein Fahrzeug vor Ort sein muss</i>.",,,"Железо, бойцы, лучшие цены!

Рынок предлагает:

- Недорогие солдаты удачи с подходящим снаряжением.<b> Но они точно не захотят аугментироваться или мутировать</b>;
- Самодельное оружие бренда ""Kаос"": хорошие ТТХ, но небольшие магазины и дорогие боеприпасы, которые можно купить только у нас;
- ""НИ-1"", наш любимый постапокалиптический бронетрактор, названный в честь широко известного в узких кругах советского танка ""На Испуг"" эпохи Второй мировой войны, а также модули для него и других машин;
- Доступ к технологиям фракций.

Ассортимент обновляется примерно каждые 3 дня, и постепенно будет становиться разнообразнее.
Вы можете совершать покупки на Рынке удаленно, прилетать не обязательно, работает доставка!",,
KEY_DLC3_TUT_INFESTATION_NAME,Text,,BAZAAR - MARKETPLACE,,BAZAR - MARCHÉ,BASAR,,,Рынок - Супермаркет,,
KEY_HINT_BEHEMOTH_MISSION_TITLE,Text,,Attack the Behemoth,,Attaquer le Béhémoth,Greife den Behemoth an,,,Атаковать Бегемота,,
KEY_HINT_BEHEMOTH_MISSION_DESCRIPTION,Text,,"You can now land a squad on the Behemoth to destroy it once and for all! Load a team on the Masked Manticore and click on this icon when the Behemoth emerges to trigger the mission.
",,Vous pouvez désormais faire atterrir une escouade sur le Béhémoth pour le détruire une bonne fois pour toutes ! Chargez une équipe à bord du Manticore Masqué et cliquez sur cette icône lorsque le Béhémoth surgit pour déclencher la mission.,"Du kannst nun ein Einsatzteam auf dem Behemoth landen, um ihn ein für alle Mal zu vernichten.
Lade ein Einsatzteam in den maskierten Manticore und klicke auf dieses Symbol, sobald der Behemoth auftaucht, um die Mission zu starten.",,,"Теперь вы можете высадить отряд прямо на Бегемота, чтобы уничтожить его раз и навсегда! Когда Бегемот появится, загрузите отряд в Замаскированную Мантикору и нажмите сюда, чтобы начать миссию.",,
KEY_HINT_BEHEMOTH_DEPLOY_TITLE,Text,,Deploying on the Behemoth,,Déploiement sur le Béhémoth,Einsatz auf dem Behemoth,,,Высадка на Бегемота,,
KEY_HINT_BEHEMOTH_DEPLOY_DESCRIPTION,Text,,"Your squad will have to separate into 2 teams to complete the objective. Because of the high winds it will be very difficult, if not impossible for the 2 teams to rendezvous, so you should assume that each will have to act fully independently. Assign your operatives to A and B teams accordingly.",,"Votre escouade devra se séparer en 2 équipes pour remplir l'objectif. En raison des vents violents, il sera très difficile, voire impossible, pour les 2 équipes de se rejoindre ; vous devez donc partir du principe que chacune devra agir de manière totalement indépendante. Répartissez vos agents dans les équipes A et B en conséquence.","Dein Einsatzteam muss sich in zwei Teams aufteilen, um das Ziel zu erreichen. Aufgrund der extremen Winde wird es sehr schwierig – wenn nicht unmöglich – sein, dass sich beide Teams wieder zusammentreffen. Gehe davon aus, dass jedes Team vollständig eigenständig handeln muss.
Teile deine Einheiten entsprechend den Teams A und B zu.",,,"Для выполнения миссии вашему отряду придется разделиться на 2 группы. Из-за шторма встретиться двум командам будет очень сложно, если не невозможно, поэтому вам следует исходить из того, что каждой из них придется действовать полностью независимо. Распределите своих бойцов в группы А и В соответственно.",,
KEY_HINT_BASE_MISSION_TITLE,Text,,Base defense deployment,,Déploiement en défense de base,Einsatz - Basisverteidigung,,,Организация защиты базы,,
KEY_HINT_BASE_MISSION_DESCRIPTION,Text,,"You have some options when deploying for the base defense, depending on the stage of the attack and whether you have an operational Access Lift.

During the initial state (more than 12 hours left on the timer) you can deploy at the Hangar or at a choke point in the Entrance to the base.

If the Pandorans have already penetrated the first line of defense (less than 12 hours left on the timer), you will have to deploy at the Entrance to the base.  

If the base has an operational Access Lift you can also deploy your operatives there.",,"Vous disposez de plusieurs options lors du déploiement pour la défense de la base, selon le stade de l'attaque et selon que vous possédez ou non un ascenseur d'accès opérationnel.

Pendant la phase initiale (plus de 12 heures restantes sur le compte à rebours), vous pouvez vous déployer au Hangar ou à un point de passage stratégique à l'Entrée de la base.

Si les Pandoriens ont déjà pénétré la première ligne de défense (moins de 12 heures restantes sur le compte à rebours), vous devrez vous déployer à l'Entrée de la base.

Si la base possède un Ascenseur d'accès opérationnel, vous pouvez également y déployer vos agents.","Beim Einsatz zur Basisverteidigung stehen dir mehrere Optionen zur Verfügung, abhängig vom Stadium des Angriffs und davon, ob ein funktionsfähiger Zugangslift vorhanden ist.

Im Anfangsphase (mehr als 12 Stunden Restzeit) kannst du Einheiten entweder im Hangar oder an einem Engpass am Basiseingang einsetzen.

Sollten die Pandoraner die erste Verteidigungslinie bereits durchbrochen haben (weniger als 12 Stunden Restzeit), musst du deine Bodenkräfte am Basiseingang positionieren.

Verfügt die Basis über einen einsatzbereiten Zugangslift, kannst du deine Einheiten auch dort einsetzen.",,,"При подготовке к защите базы у вас есть несколько вариантов, в зависимости от стадии атаки и наличия у вас лифта доступа.

В начале (по таймеру осталось более 12 часов) вы можете высадить бойцов в ангаре или в узком месте на входе на базу.

Если Пандораны уже прорвали первую линию обороны (по таймеру осталось менее 12 часов), вам придется высадиться у входа на базу.

Если на базе есть лифт доступа, вы также можете разместить своих бойцов в нем.",,