"Key","Type","Desc","English","Chinese (Simplified)","French","German","Italian","Polish","Russian","Spanish","UI_Tester"
"PX_MUTOID_RESEARCHDEF_COMPLETE","Text","","***Classified. Access restricted*** —- *** QKD verification in progress…*** — ***Granted***

Just as speculated, it has proven possible to create ""super-soldiers"" using mutagens and the RDNA techniques developed by Barnabas in his research into the Oneiric Delirium treatment. We call them “Mutoids”. The newly created Mutoid soldiers are immune to the effects of the Oneiric Delirium and are capable of learning all human skills, and many of the Pandorans' as well (provided DNA samples are available). We have purposefully “advertised” that Mutoids are created entirely from Mutagens, but unfortunately the process does require a humanoid specimen with certain (though not uncommon) genetic markers. 

////

I am surprised. Of course I saw the possibilities myself but I thought this avenue of research crossed boundaries that should not be crossed. Perhaps I was wrong and it is time I addressed the biases that come with being a member of my species. Thanks to you I am beginning to appreciate that the pursuit of greater good sometimes requires sacrificing personal morals.  

-B

PS: Please accept my apologies for the liberties taken with your security protocols.","***机密。访问受限*** —- *** QKD 验证中…*** — ***已授权***

正如推测的那样，利用变异素和巴纳巴斯在梦魇谵妄治疗研究中开发的RDNA技术，成功创造了“超级士兵”。我们称他们为“变异体”。新造的变异体士兵对梦魇谵妄的影响免疫，能够学习所有人类技能，以及许多潘多拉体的技能（前提是有DNA样本）。我们故意“宣传”变异体完全由变异素构成，但实际上该过程确实需要具备某些（虽不罕见）遗传标记的人形样本。

////

我感到惊讶。当然我自己也看到了可能性，但我认为这条研究路径触及了不应逾越的界限。也许我错了，是时候正视作为我们物种成员所带来的偏见。多亏了你，我开始理解追求更大善意有时需要牺牲个人道德。

-B

附言：请接受我对擅自修改你们安全协议的歉意。","***Classified. Accès restreint. - Vérification QKD en cours... - Accordé.

Comme prévu, il s'est avéré possible de créer des ""super-agents"" en utilisant des mutagènes et les techniques RDNA développées par Barnabas dans ses recherches sur le traitement du Delirium. On les appelle les ""mutoïdes"". Les agents mutoïdes nouvellement créés sont immunisés contre les effets du Delirium et sont capables d'apprendre toutes les compétences humaines, ainsi que de nombreuses compétences des Pandoriens (à condition que des échantillons d'ADN soient disponibles). Nous avons volontairement ""annoncé"" que les mutoïdes sont créés entièrement à partir de mutagènes, mais malheureusement le processus nécessite un spécimen humanoïde avec certains marqueurs génétiques (bien que assez commun). La procédure efface complètement tous les souvenirs et les traits de personnalité. Nous pouvons facilement nous procurer des sujets appropriés en nombre suffisant dans des refuges amis.

////

Je suis surpris. Bien sûr, j'ai vu les possibilités moi-même, mais je pensais que cette voie de recherche franchissait des limites qui ne devraient pas être franchies. J'avais peut-être tort et il est temps que je m'attaque aux préjugés qui accompagnent le fait d'être membre de mon espèce. Grâce à vous, je commence à comprendre que la poursuite du bien commun exige parfois de sacrifier sa morale personnelle.

-B

PD : Veuillez accepter mes excuses pour les libertés prises avec vos protocoles de sécurité.","*** GEHEIM. ZUGRIFF BESCHRÄNKT ***
<i>** Quanten-Schlüsselprüfung läuft **</i>
* Freigabe erteilt *

Wie vermutet, ist es tatsächlich möglich, mithilfe von Mutagenen und den von Barnabas im Rahmen seiner Forschung zur Behandlung des Oneirischen Deliriums entwickelten RDNA-Techniken „Supersoldaten“ zu erschaffen. Wir nennen sie „Mutoiden“. Die neu erschaffenen Mutoiden-Soldaten sind immun gegen die Auswirkungen des Oneirischen Deliriums und können alle menschlichen Fähigkeiten sowie viele der Pandoraner erlernen (vorausgesetzt, DNA-Proben sind verfügbar). Wir haben bewusst „bekannt gemacht“, dass Mutoiden ausschließlich aus Mutagenen erschaffen werden, doch leider benötigt der Prozess ein humanoides Exemplar mit bestimmten (wenn auch nicht seltenen) genetischen Markern.

///

Ich bin überrascht. Natürlich habe ich die Möglichkeiten selbst erkannt, aber ich dachte, dieser Forschungsansatz überschreite Grenzen, die nicht überschritten werden sollten. Vielleicht habe ich mich geirrt, und es ist an der Zeit, die Vorurteile zu hinterfragen, die mit meiner Spezies einhergehen. Dank Ihnen beginne ich zu verstehen, dass das Streben nach dem Gemeinwohl manchmal das Opfer persönlicher Moralvorstellungen erfordert.

– B

<i>PS: Bitte entschuldigen Sie die Abweichungen von Ihren Sicherheitsvorkehrungen.</i>","","","***Секретно. Доступ ограничен*** - ***Выполняется проверка кода доступа*** - ***Принято***

Как и предполагалось, оказалось возможным создать «суперсолдат», используя мутагены и методы рДНК, разработанные Барнабасом в ходе его исследований лечения Сонного Безумия. Мы называем их Мутоидами. Созданные солдаты-мутанты невосприимчивы к воздействию Сонного Безумия и способны обучаться всем человеческим навыкам, а также многим Пандоранским (при условии наличия образцов ДНК). Мы специально «рекламировали», будто Мутоиды создаются исключительно из мутагенов, но, к сожалению, для этого процесса требуется гуманоидная особь с определенными (хотя и нередкими) генетическими маркерами. 

<i>«Я удивлен. Конечно, я и сам видел возможности, но думал, что это направление исследований пересекает границы, которые не следует переступать. Возможно, я ошибался, и мне пора разобраться с предубеждениями, которые возникают в связи с принадлежностью к моему виду. Благодаря вам я начинаю понимать, что стремление к высшему благу иногда требует жертвовать личной моралью»</i>, - Барнабас

P.S. <i>«Примите мои извинения за вольности, допущенные с вашими протоколами безопасности.»</i>","",""
"PX_MUTOID_RESEARCHDEF_NAME","Text","","Mutoid Genetics","变异体基因学","Génétique Mutoïde","Mutoidgenetik","","","Генетика Мутоидов","",""
"PX_MUTOID_RESEARCHDEF_UNLOCK","Text","","Data found in the old Firebird Initiative lab points to an interesting application of the research pursued by Barnabas into the use of RDNA viruses and mutagens. We believe that it should be relatively easy to use these techniques to radically alter a human to turn it into a ""super-soldier"". It should be mentioned that not all of us are comfortable with pursuing this research.","在旧火鸟计划实验室发现的数据指向巴纳巴斯关于RDNA病毒和变异素应用研究的一个有趣方向。我们相信利用这些技术将人类彻底改造为“超级士兵”相对容易。需要说明的是，并非所有人都认同开展这项研究。","Les données trouvées dans l'ancien laboratoire de l'Initiative Phoenix indiquent une application intéressante des recherches poursuivies par Barnabas sur l'utilisation des virus RDNA et des mutagènes. Nous pensons qu'il devrait être relativement facile d'utiliser ces techniques pour modifier radicalement un humain et le transformer en ""super-agent"". Il convient de mentionner que nous ne sommes pas tous à l'aise avec la poursuite de ces recherches.","Daten aus dem ehemaligen Firebird-Initiative-Labor deuten auf eine interessante Anwendung der von Barnabas betriebenen Forschung zur Verwendung von RDNA-Viren und Mutagenen hin. Wir glauben, dass es relativ einfach sein sollte, diese Techniken einzusetzen, um einen Menschen radikal zu verändern und ihn in einen „Supersoldaten“ zu verwandeln. Es sei jedoch darauf hingewiesen, dass nicht alle von uns mit dieser Forschung einverstanden sind.","","","Данные, найденные в старой лаборатории Проекта Жар-птица, указывают на интересное применение исследований Барнабаса по использованию вирусов рДНК и мутагенов. Мы считаем, что с помощью этих методов можно будет относительно легко, но радикально, изменить человека, превратив его в «суперсолдата». Следует отметить, что не все из нас согласны с проведением этих исследований.","",""
"PX_ORIGINAL_ACHERON_RESEARCHDEF_BENEFITS","Text","","Corruption Sample Mission available","腐化样本任务可用","Mission Echantillon de Corruption disponible","Mission zur Entnahme einer Verderbnisprobe verfügbar","","","Миссия по поиску зараженного Образца доступна","",""
"PX_ORIGINAL_ACHERON_RESEARCHDEF_COMPLETE","Text","","By applying different stimulations to Specimen 2, we have “taught” it to release zeta-blockers in aerosol or cloud form which, when a human is exposed to it, dim the excitations of the amygdala associated with Oneiric Delirium incidents. However, the procedure is largely impractical (requiring the afflicted to be unarmored and in close proximity to the Acheron) and not entirely effective. Fortunately, the study of the chemical process taking place in the Acheron has allowed us to synthesize an easily administrable and highly effective biochemical compound.     

While all medical facilities have been equipped with the necessary equipment, the treatment is highly individual and requires a fresh supply of mutagens. 

In addition, our experiments have revealed that the Specimen 2, under the right stimulation, is capable of producing other biochemical compounds that may be of use in the battlefield. We recommend allocating additional resources to this research.","通过对样本2施加不同刺激，我们“教会”它释放ζ阻断剂，以气溶胶或云雾形式存在，当人类暴露于此时，可抑制与梦魇谵妄相关的杏仁核兴奋。然而，该程序在实践中不太可行（要求患者无护甲且靠近Acheron），且效果不完全理想。幸运的是，对Acheron内化学过程的研究使我们合成出一种易于使用且高效的生化化合物。

虽然所有医疗设施均配备了必要设备，但治疗高度个体化，且需要持续供应变异素。

此外，我们的实验表明，在适当刺激下，样本2能够产生其他可能在战场上有用的生化化合物。建议为该研究分配更多资源。","En appliquant différentes stimulations au spécimen 2, nous lui avons ""appris"" à libérer des zêta-bloquants sous forme d'aérosol ou de nuage qui, lorsqu'un humain y est exposé, atténuent les excitations de l'amygdale associées aux incidents de Delirium. Cependant, la procédure est très peu pratique (elle exige que la personne touchée ne soit pas armée et se trouve à proximité de l'Achéron) et n'est pas entièrement efficace. Heureusement, l'étude du processus chimique qui se déroule dans l'Achéron nous a permis de synthétiser un composé biochimique facilement administrable et très efficace.

Bien que toutes les installations médicales aient été équipées du matériel nécessaire, le traitement est très individuel et nécessite un approvisionnement  en mutagènes frais.

De plus, nos expériences ont révélé que le spécimen 2, sous une stimulation appropriée, est capable de produire d'autres composés biochimiques qui pourraient être utiles sur le champ de bataille. Nous recommandons d'allouer des ressources supplémentaires à cette recherche.","Durch die Anwendung verschiedener Stimulationen auf Testsubjekt II haben wir es dazu gebracht, Zeta-Blocker in Aerosol- oder Wolkenform freizusetzen. Diese dämpfen bei Exposition eines Menschen die mit Oneirischen Delirium-Episoden verbundenen Amygdala-Erregungen. Das Verfahren ist jedoch weitgehend unpraktisch (da die betroffene Person ungeschützt sein und sich in unmittelbarer Nähe des Acheron befinden muss) und nicht vollständig wirksam. Glücklicherweise ermöglichte uns die Untersuchung der im Acheron ablaufenden chemischen Prozesse die Synthese einer leicht zu verabreichenden und hochwirksamen biochemischen Verbindung.

Obwohl alle medizinischen Einrichtungen mit der notwendigen Ausrüstung ausgestattet sind, ist die Behandlung sehr individuell und erfordert eine ständige Nachlieferung von Mutagenen.

Darüber hinaus haben unsere Experimente gezeigt, dass Testsubjekt II unter der richtigen Stimulation weitere biochemische Verbindungen produzieren kann, die auf dem Schlachtfeld von Nutzen sein könnten. Wir empfehlen, dieser Forschung zusätzliche Ressourcen zuzuweisen.","","","Применяя различные стимулы к Образцу №2, мы «научили» его выделять зета-блокаторы в виде аэрозоля или газа, которые при воздействии на человека уменьшают возбуждение части мозга, зараженной Сонным Безумием. Однако эта процедура в значительной степени непрактична (она требует, чтобы пострадавший был без брони и находился в непосредственной близости от Ахерона) и не совсем эффективна. К счастью, изучение химических процессов, происходящих в Ахероне, позволило нам синтезировать легко вводимое и высокоэффективное биохимическое соединение. Хотя все медицинские учреждения оснащены необходимым оборудованием, лечение очень индивидуально и требует свежих поставок мутагенов. Кроме того, наши эксперименты показали, что Образец №2 при правильной стимуляции способен производить другие биохимические соединения, которые могут пригодиться на поле боя. Мы рекомендуем выделить дополнительные ресурсы на эти исследования.","",""
"PX_ORIGINAL_ACHERON_RESEARCHDEF_NAME","Text","","Specimen 2","样本2","Specimen 2","Testsubjekt II","","","Образец №2","",""
"PX_ORIGINAL_ACHERON_RESEARCHDEF_UNLOCK","Text","","We have captured Specimen 2, the Acheron infected with the RDNA virus that holds the key to creating a treatment for the Oneiric Delirium.","我们已捕获样本2，即感染了RDNA病毒的Acheron，该病毒是制造梦魇谵妄治疗方案的关键。","Nous avons capturé le spécimen 2, l'Achéron infecté par le virus RDNA qui détient la clé pour créer un traitement contre le Delirium.","Wir haben Testsubjekt II gefangen, den Acheron, der mit dem RDNA-Virus infiziert ist, das den Schlüssel zur Entwicklung einer Behandlung für das Oneirische Delirium birgt.","","","Мы захватили Образец №2, Ахерона, зараженного вирусом рДНК, который является ключом к созданию лекарства от Сонного Безумия.","",""
"PX_MUTAGENHARVESTING_RESEARCHDEF_COMPLETE_TFTV","Text","","We discovered that certain tissue samples retain the ability to mutate. The discovery was made when a test subject accidentally had a mutated sample injected into them. The error was discovered too late, but scientists observed the results and found that Pandorans have a set of cells, derived from the original Pandoravirus infection, that have unique properties. We call these mutagens. They were the same cells the Disciples of Anu use in rituals to “evolve closer to the Exalted.” Since the discovery, the process has been refined, allowing a creature’s mutagens to be continually harvested, as long as it remains alive.","我们发现某些组织样本保留了变异能力。这一发现源于一名测试对象意外注射了变异样本。错误发现得太晚，但科学家观察了结果，发现潘多拉体拥有一组细胞，源自最初的潘多拉病毒感染，具有独特特性。我们称这些为变异素。这些细胞正是阿努门徒在仪式中用来“进化得更接近尊者”的细胞。自发现以来，该过程已被改进，只要生物体存活，其变异素就能持续被采集。","Nous avons découvert que certains échantillons de tissus conservent la capacité de muter. Cette découverte a eu lieu lorsqu’un sujet d’expérience a accidentellement reçu l’injection d’un échantillon muté. L’erreur a été détectée trop tard, mais les scientifiques ont pu observer les résultats et constater que les Pandoriens possèdent un ensemble de cellules, issues de l’infection initiale par le Pandoravirus, présentant des propriétés uniques. Nous les appelons mutagènes. Ce sont les mêmes cellules que les Disciples d’Anu utilisent lors de rituels pour « évoluer vers les Exaltés ». Depuis cette découverte, le processus a été perfectionné, permettant de récolter en continu les mutagènes d’une créature, tant qu’elle reste vivante.","Wir entdeckten, dass bestimmte Gewebeproben die Fähigkeit zur Mutation behalten. Diese Entdeckung gelang, als einem Testsubjekt versehentlich eine mutierte Probe injiziert wurde. Der Fehler wurde zu spät bemerkt, doch Wissenschaftler beobachteten die Ergebnisse und stellten fest, dass Pandoraner über eine Reihe von Zellen verfügen, die von der ursprünglichen Pandoravirus-Infektion abstammen und einzigartige Eigenschaften besitzen. Wir nennen diese Zellen Mutagene. Es handelt sich um dieselben Zellen, die die Jünger Anus in Ritualen verwenden, um sich „den Erhabenen anzunähern“. Seit dieser Entdeckung wurde das Verfahren verfeinert, sodass die Mutagene eines Lebewesens kontinuierlich gewonnen werden können, solange es lebt.","","","Мы обнаружили, что некоторые образцы тканей сохраняют способность мутировать. Это открытие было сделано, когда подопытному случайно ввели мутировавший образец. Ошибка была обнаружена слишком поздно, но ученые наблюдали за результатами и обнаружили, что у Пандоранов есть набор клеток, полученных от первоначальной Пандоравирусной инфекции, которые обладают уникальными свойствами. Мы называем их мутагенами. Это были те самые клетки, которые Последователи Ану используют в ритуалах, чтобы «становиться ближе к Возвышенной». С момента открытия процесс был усовершенствован, и теперь мутагены можно собирать постоянно, пока существо остается живым.","",""
"PX_MUTAGENHARVESTING_RESEARCHDEF_UNLOCK_TFTV","Text","","<i>""Now I understand why they were keeping those worms around...""</i> - Alistair Ashby

A method for extracting mutagens from captured Pandorans is being devised. The process is still in its infancy, but should it be successful it would provide us with a virtually endless source of mutagens.","<i>“现在我明白他们为何留着那些虫子了……”</i> - 阿利斯泰尔·阿什比

正在制定一种从被捕获的潘多拉体中提取变异素的方法。该过程仍处于初期阶段，但若成功，将为我们提供几乎无尽的变异素来源。","<i> « Maintenant, je comprends pourquoi ils gardaient ces vers... »</i> - Alistair Ashby

Une méthode d’extraction des mutagènes à partir de Pandoriens capturés est en cours de mise au point. Le processus en est encore à ses débuts, mais s’il s’avère efficace, il pourrait nous fournir une source pratiquement infinie de mutagènes.","<i>„Jetzt verstehe ich, warum sie diese Würmer behalten haben...“</i> – Alistair Ashby

Es wird eine Methode zur Gewinnung von Mutagenen aus gefangenen Pandoranern entwickelt. Das Verfahren steckt noch in den Kinderschuhen, aber sollte es erfolgreich sein, würde es uns eine nahezu unerschöpfliche Quelle an Mutagenen liefern.","","","<i>""Теперь я понимаю, почему они держали этих червей рядом...""</i> - Алистер Эшби. 
В настоящее время разрабатывается метод извлечения мутагенов из пленных Пандоранов. Процесс пока находится в зачаточном состоянии, но если он окажется успешным, мы получим практически бесконечный источник мутагенов.","",""
"PX_FOODHAVRESTING_RESEARCHDEF_BENEFITS_TFTV","Text","","Captured Pandorans can now be rendered for food processing at our Food Production facilities.","被捕获的潘多拉体现在可以在我们的食物生产设施中进行食物加工。","Les Pandoriens capturés peuvent désormais être transformés en nourriture dans nos installations de production alimentaire.","Gefangene Pandoraner können ab sofort in unseren Nahrungsproduktionen zu Nahrung aufbereitet werden.","","","Захваченные Пандораны теперь могут перерабатываться в еду на наших Пищевых Комбинатах.","",""
