"Key","Type","Desc","English","Chinese (Simplified)","French","German","Italian","Polish","Russian","Spanish","UI_Tester"
"KEY_ALISTAIRONWEST_DESCRIPTION","Text","","I will give West that he founded New Jericho, not just seized it as some two-bit military dictator of yore. But ultimately the only human will he cares about is his own. A lot depends on his future plans; consider he might take the crazy cyborg route to preserve his legacy. But then we have already dealt - DEALT - with one of those before…","我得承认韦斯特确实创立了新耶利哥，而不是像某些过气的军阀那样夺取它。但归根结底，他唯一关心的人类意志只有他自己。很多事情取决于他的未来计划；考虑到他可能会走疯狂的义体改造路线以保留他的遗产。但我们之前已经处理过——处理过——一个这样的家伙……","Je reconnais à West qu'il a construit la Nouvelle-Jéricho, et ne s'en est pas contenté comme un dictateur militaire à deux balles d'antan. Mais finalement, la seule volonté humaine dont il se soucie est la sienne. Beaucoup de choses dépendent de ses plans de retraite ; gardez à l'esprit qu'il pourrait prendre la route de la folie cybernétique pour défendre son héritage. Mais nous avons déjà eu affaire à l'un d'entre eux auparavant...","Ich will West zugestehen, dass er Neu-Jericho gegründet hat – nicht einfach an sich gerissen wie irgendein zweitklassiger Militärdiktator aus alten Zeiten.
Aber letztlich ist der einzige menschliche Wille, der ihn interessiert, sein eigener. Viel hängt von seinen zukünftigen Plänen ab. Ziehen Sie in Betracht, dass er den wahnsinnigen Kyborg-Weg einschlagen könnte, um sein Vermächtnis zu bewahren.
Aber... mit so jemandem haben wir bereits einmal zu tun gehabt – zu tun gehabt.","","","Я готов отдать Уэсту должное за то, что он основал Новый Иерихон, а не просто захватил его, как какой-нибудь никчемный военный диктатор прошлого. Но, в конечном счете, единственная человеческая воля, о которой он заботится - это его собственная. Многое зависит от его планов - подумайте о том, что он может пойти по пути безумного киборга, чтобы сохранить свое наследие. Но с другой стороны, мы уже сталкивались с подобным раньше...","",""
"KEY_ALISTAIRONWEST_CHOICE","Text","","What do you make of New Jericho?","你怎么看新耶利哥？","Que pensez-vous de la Nouvelle-Jéricho ?","Was hälst du von Neu-Jericho?","","","Что вы думаете о Новом Иерихоне?","",""
"KEY_ALISTAIRONSYNEDRION_DESCRIPTION","Text","","Synedrion are not the naive fool everyone assumes they are - and that they pretend to be. They have mastered the art of ruling while appearing not to rule: pulled a colegial Octavian, so to speak. Their compact with the AIs allows them to do that, using them for all bureaucratic functions and imposing a soft censorship by manipulating public feed algorithms. Besides, remember those Pre-Collapse cautionary tales about AIs enslaving humanity? So do I.","平衡议会并非所有人以为的天真傻瓜——他们也假装不是。他们掌握了统治的艺术，同时看似不统治：可以说是拉了个合议制的屋大维。他们与人工智能的契约让他们得以如此，利用人工智能处理所有官僚职能，并通过操控公共信息流算法实施软性审查。此外，记得那些崩溃前关于人工智能奴役人类的警示故事吗？我记得。","Synedrion, ils ne sont pas les idiots naïfs que tout le monde pense qu'ils sont - et qu'ils prétendent être. Ils ont maîtrisé l'art de gouverner tout en ayant l'air de ne pas gouverner : ils ont créé un Octave collégial, pour ainsi dire. C'est le pacte avec les IA qui leur a permis de faire cela, en se reposant sur elles pour toutes les fonctions bureaucratiques et en maintenant une censure douce via une manipulation adroite de l'algorithme des flux publics... Quoi qu'il en soit, vous vous souvenez de ces mises en garde d'avant l'effondrement sur les IA asservissant l'humanité ? Oui, moi aussi.","Synedrion ist nicht der naive Idealistenhaufen, für den man sie hält – und für den sie sich selbst ausgeben.
Sie haben die Kunst perfektioniert, zu herrschen, ohne zu herrschen: ein kollegialer Octavian, wenn man so will.

Ihr Pakt mit den KIs erlaubt ihnen genau das: Sie überlassen ihnen sämtliche Bürokratie und üben eine sanfte Zensur, indem sie die Algorithmen der öffentlichen Informationsströme manipulieren.
Und erinnern Sie sich an die warnenden Geschichten aus der Zeit vor dem Zusammenbruch – über KIs, die die Menschheit versklaven?
Ich erinnere mich.","","","Синедрион не такие наивные дурачки, какими их все считают - и какими они притворяются. Они овладели искусством править, делая вид, что не правят: так сказать, сыграли роль коллегиального Октавиана. Их соглашение с ИИ позволяет им это делать, используя его для выполнения всех бюрократических функций и устанавливая мягкую цензуру, манипулируя алгоритмами публичной подачи информации. Кроме того, помните те поучительные истории об ИИ, порабощавших человечество до апокалипсиса? Вот, вот...","",""
"KEY_ALISTAIRONSYNEDRION_CHOICE","Text","","What about Synedrion?","那平衡议会呢？","Que pensez-vous du Synedrion ?","Und was ist mit Synedrion?","","","А как насчет Синедриона?","",""
"KEY_ALISTAIRONANU_DESCRIPTION","Text","","The Disciples of Anu… They are the wild card. They have masked as religious dogma human transformation through an alien rDNA virus. Well, maybe not alien, since we are apparently partly its product. But, do we really want to take that road? Could there not be plans within plans within plans to tempt us into an ascendancy that becomes the slavery we fought so hard to avoid?","阿努门徒……他们是个变数。他们将通过外星rDNA病毒实现的人类转化伪装成宗教教义。嗯，也许不算外星，因为我们显然部分是它的产物。但，我们真的想走那条路吗？难道不会有层层计划诱使我们走向一种成为我们曾极力避免的奴役的崇高地位吗？","Les Disciples d'Anu... Ils sont le joker. Ils ont déguisé en dogme religieux l'ascension humaine grâce à un virus ARN extraterrestre. Enfin, pas exactement extraterrestre, puisque apparemment nous sommes en partie son successeur. Mais voulons-nous vraiment prendre cette voie ? Ne pourrait-il pas y avoir des plans dans les plans dans les plans pour nous attirer vers une ascendance qui s'avère être l'esclavage que nous avons combattu si durement pour l'éviter ?","Die Jünger des Anu...
Sie sind die Unbekannte in dieser Gleichung. Sie haben die Transformation des Menschen durch ein fremdes rDNA-Virus hinter religiösem Dogma verborgen. Nun ja – vielleicht nicht völlig fremd, wenn wir offenbar selbst zum Teil sein Produkt sind.

Aber wollen wir diesen Weg wirklich einschlagen?
Könnte es nicht Pläne in Plänen in Plänen geben – eine Versuchung zur Erhebung, die sich am Ende als genau jene Knechtschaft entpuppt, der wir so verbissen entkommen wollten?","","","Последователи Ану... непредсказуемые... Они замаскировали под религиозную догму трансформацию человека с помощью инопланетного рДНК-вируса. Ну, может, и не инопланетного, поскольку мы, по-видимому, частично являемся его продуктом. Но действительно ли мы хотим пойти по этому пути? Нет ли там каких-то планов внутри планов внутри планов, чтобы привести нас к господству, которое в итоге окажется порабощением, против которого мы так упорно боролись?","",""
"KEY_ALISTAIRONANU_CHOICE","Text","","What do you think of the Exalted?","你怎么看待尊贵者？","Que pensez-vous de l’Exalté ?","Was hältst du von den Erhabenen?","","","Что вы думаете о Возвышенной?","",""
"KEY_ALISTAIRONHELENA_DESCRIPTION","Text","","Dr. Helena has spent her life working towards restoring the legacy of the Ancients, and what better way to honor our ancestors than using their WMDs. But as the saying goes, insanity is doing the same thing over and over again expecting a different result. Some of us will survive, I’m sure: survival is our strength. But what if the Ancients were extinguished by the political chaos after the war, rather than by the biological weapon itself? What if minimizing the casualties will not make a difference? Can the Phoenix Project handle the task of rebuilding a human civilization without the factions?","海伦娜博士毕生致力于恢复远古遗产，还有什么比使用他们的大规模杀伤性武器更能纪念我们的祖先呢。但俗话说，疯狂就是一遍又一遍地做同样的事，却期待不同的结果。我相信我们中会有人幸存：生存是我们的力量。但如果远古人是被战争后的政治混乱而非生物武器本身所灭绝呢？如果减少伤亡无济于事呢？凤凰计划能否承担起在没有派系的情况下重建人类文明的任务？","Le Dr. Helena a passé sa vie à travailler pour faire revivre l'héritage des Anciens, et quelle meilleure façon d'honorer nos ancêtres que d'utiliser leurs armes de destruction massive. Mais quel était ce dicton à propos de faire la même chose encore et encore en espérant un résultat différent ? Beaucoup d'entre nous survivront, j'en suis sûr : ceux d'entre nous qui restent maintenant sont bons pour survivre. Mais si les Anciens étaient éteints par le chaos politique d'après-guerre, plutôt que par l'arme biologique elle-même ? Et si réduire le nombre de victimes ne faisait pas de différence ? Le Projet Phoenix est-il à la hauteur de la tâche consistant à reconstruire une civilisation humaine sans les factions en présence ?","Dr. Helena hat ihr Leben dem Ziel gewidmet, das Erbe der Uralten wiederherzustellen. Und was könnte unsere Vorfahren besser ehren, als ihre Massenvernichtungswaffen zu nutzen?

Doch wie das Sprichwort sagt: <i>Wahnsinn ist, immer wieder dasselbe zu tun und ein anderes Ergebnis zu erwarten.</i>
Einige von uns werden überleben, da bin ich sicher – <b>Überleben ist unsere Stärke</b>. Aber was, wenn die Uralten nicht durch die biologische Waffe ausgelöscht wurden, sondern durch das politische Chaos nach dem Krieg?
Was, wenn es keinen Unterschied macht, die Verluste zu minimieren?

Kann das Phoenix-Projekt die Aufgabe bewältigen, eine menschliche Zivilisation ohne die Fraktionen neu aufzubauen?","","","Доктор Хелена всю свою жизнь работала над восстановлением наследия Древних, и нет лучшего способа почтить память наших предков, чем использовать их оружие массового уничтожения. Но, как говорится, безумие - это делать одно и то же снова и снова, ожидая другого результата. Я уверен, что некоторые из нас выживут: выживание - это наша сила. Но что, если Древние были уничтожены политическим хаосом после войны, а не самим биологическим оружием? Что, если минимизация потерь ничего не изменит? Сможет ли Проект Феникс справиться с задачей восстановления человеческой цивилизации без участия фракций?","",""
"KEY_ALISTAIRONHELENA_CHOICE","Text","","Do you trust that Dr. Helena's plan will work?","你相信海伦娜博士的计划会成功吗？","Croyez-vous que le plan du Dr. Helena va fonctionner ?","Traust du Dr. Helenas Plan?","","","Вы верите, что план доктора Хелены сработает?","",""
"KEY_ALISTAIRONVIROPHAGE_DESCRIPTION","Text","","The second worst outcome beats the hell out of the worst outcome.","第二糟糕的结果总比最糟糕的结果好。","Le deuxième pire résultat bat le pire résultat.","Das zweitschlechteste Ergebnis ist verdammt noch mal besser als das schlechteste.","","","Второй худший исход походу намного хуже самого худшего из исходов.","",""
"KEY_ALISTAIRONVIROPHAGE_CHOICE","Text","","Should we build the Virophage Injector?","我们应该制造病毒吞噬体注射器吗？","Devrions-nous construire l'injecteur de Virophage ?","Sollen wir den Virophage-Injektor bauen?","","","Стоит ли нам создавать инъектор вирофагов?","",""
"KEY_ALISTAIR_ROADS_DESCRIPTION","Text","","The history of our species is one of mistakes and accidents, some more fortunate than others. Now we come to yet another crossroads, where, to continue onwards, we need to choose a new mistake to make. ","我们物种的历史充满了错误和意外，有些比其他更幸运。现在我们又来到一个十字路口，要继续前进，我们需要选择一个新的错误去犯。","L'histoire de notre espèce est faite d'erreurs et d'accidents, certains plus heureux que d'autres. Nous arrivons maintenant à un nouveau carrefour où, pour continuer à avancer, nous devons choisir une nouvelle erreur à commettre.","Die Geschichte unserer Spezies ist geprägt von Fehlern und Zufällen, manche glücklicher als andere. Nun stehen wir an einem weiteren Scheideweg, an dem wir, um weiterzukommen, einen neuen Fehler wählen müssen.","","","История нашего вида - это история ошибок и случайностей, только одним из нас повезло больше, чем другим. Теперь мы подходим к очередному перекрестку, где, чтобы двигаться дальше, нам нужно выбрать новую ошибку, которую мы опять совершим.","",""
"KEY_ALISTAIR_ROADS_TITLE","Text","","Roads","道路","La croisée des chemins","Straßen","","","Развилка","",""
"KEY_ALISTAIR_ROADS_ALLDONE","Text","","That will be all. Thank you, Alistair","就这些了。谢谢你，阿利斯泰尔","Ce sera tout. Merci, Alistair","Das wäre alles. Danke, Alistair.","","","На этом все. Спасибо, Алистер!","",""
"KEY_ALISTAIR_ROADS_DESCRIPTION_2","Text","","Will that be all, Director?","就这些吗，指挥官？","Ce sera tout, directeur ?","War das alles, Direktor?","","","Это все, Директор?","",""
"KEY_OLENA_HELENA_DESCRIPTION","Text","","This... Can't be... Olena? You are alive. Your parents... We used to work together... We were friends. You probably don't remember me, you were so little... ","这……不可能……奥琳娜？你还活着。你的父母……我们曾经一起工作……我们是朋友。你可能不记得我了，你那时还很小……","C'est... Ne peut pas être... Olena ? Vous êtes vivante. Tes parents... Nous avions l'habitude de travailler ensemble... Nous étions amis. Tu ne te souviens probablement pas de moi, tu étais si petite...","Das... das kann nicht sein... Olena? Du lebst? Deine Eltern... wir haben zusammengearbeitet... wir waren Freunde. Du erinnerst dich vermutlich nicht an mich, du warst noch so klein...","","","Это... Не может быть... Алена? Ты жива. Твои родители... Мы работали вместе... Мы были друзьями. Ты, наверное, не помнишь меня, ты была такой маленькой...","",""
"KEY_OLENAONWEST_DESCRIPTION","Text","","You know, that Vanadium neural link West has, it doesn't really make him any smarter. It gives him some limited augmented reality functionality and  easy access to external data, but that's about it. Interesting… if anything, at New Jericho they have the tech for much deeper neurological enhancement. I wouldn't be surprised if they could merge West's brain with a slaved AI. ","你知道，那个范德姆神经链接西部拥有的东西，并没有让他变得更聪明。它给了他一些有限的增强现实功能和轻松访问外部数据的能力，仅此而已。有趣的是……如果说有什么不同的话，新耶利哥拥有更深层次神经增强的技术。我一点也不惊讶他们能把西部的大脑和一个被奴役的人工智能融合起来。","Vous savez, ce lien neuronal de Vanadium que possède West, ne le rend pas vraiment plus intelligent. Ca lui donne quelques fonctionnalités limitées de réalité augmentée et un accès facile aux données externes, mais c'est à peu près tout. Intéressant... si la Nouvelle-Jéricho a la technologie pour une amélioration neurologique beaucoup plus profonde, je ne serais pas surpris qu'ils puissent fusionner le cerveau de West avec une IA asservie.","Du weißt, diese Vanadium-Neuronalschnittstelle, die West trägt – sie macht ihn nicht klüger. Sie liefert ihm etwas erweiterte Realität, schnellen Zugriff auf externe Daten, mehr nicht. Interessant ist etwas anderes: In Neu-Jericho verfügen sie längst über Technologien für deutlich tiefere neurologische Eingriffe. Es würde mich nicht überraschen, wenn sie Wests Gehirn eines Tages mit einer kontrollierten KI verschmelzen könnten.","","","Знаете, нейронный чип корпорации Ванадий, который имплантирован Уэсту, на самом деле не делает его умнее. Он дает ему некоторые ограниченные возможности дополненной реальности и быстрый доступ к внешним данным, но и только. Интересно... во всяком случае, в Новом Иерихоне есть технологии для гораздо более глубокого неврологического улучшения. Я не удивлюсь, если им удастся объединить мозг Уэста с управляемым искусственным интеллектом.","",""
"KEY_OLENAONSYNOD_DESCRIPTION","Text","","Why would anyone create the Synod? And how did its... constituent parts feel about it? Perhaps the Exalted wanted to show everyone that the Disciples are concerned neither by ethics nor aesthetics when it comes to human gene manipulation.","为什么有人会创造平衡议会？它的……组成部分对此有什么感受？也许尊者们想向所有人展示，阿努门徒在操控人类基因时，既不关心伦理，也不在意美学。","Pourquoi quelqu'un aurait-il créé le Synode ? Et qu'en pensent ses... parties constituantes ? Peut-être que l'Exalté voulait montrer à tous que les Disciples ne sont concernés ni par l'éthique ni par l'esthétique lorsqu'il s'agit de manipulations génétiques humaines.","Warum sollte irgendjemand die Synode erschaffen? Und wie standen ihre... Bestandteile dazu? Vielleicht wollte der Erhabene allen zeigen, dass die Jünger sich weder um Ethik noch um Ästhetik scheren, wenn es um die Manipulation menschlicher Gene geht.","","","Зачем кому-то понадобилось создавать Синод? И как отнеслись к этому его... составные части? Возможно, Возвышенная хотела показать всем, что Последователей не волнуют ни этика, ни эстетика, когда дело доходит до манипулирования человеческими генами.","",""
"KEY_OLENAONANCIENTS_DESCRIPTION","Text","","I always knew about the ""Ancients"". As a child, I have these memories of my parents talking about them... They weren't just real, they were more real to them than everything else.","我一直知道“先行者”。小时候，我记得父母谈论过他们……他们不仅是真实的，对他们来说比其他一切都更真实。","J'ai toujours connu les ""Anciens"". Enfant, j'ai ces souvenirs de mes parents parlant d'eux... Ils n'étaient pas seulement réels, ils étaient plus réels pour eux que tout le reste.","Ich wusste schon immer von den <b>Uralten</b>. Als Kind erinnere ich mich daran, wie meine Eltern über sie sprachen...
Sie waren nicht nur real – sie waren für sie realer als alles andere.","","","Я всегда знала о Древних. В детстве у меня сохранились воспоминания о том, как мои родители говорили о них... Они были не просто реальны, они были для них более реальны, чем все остальное.","",""
"KEY_OLENAONANCIENTS_TITLE","Text","","Parents and Forefathers","父母与祖先","Parents et aïeux","Eltern und Vorfahren","","","Родители и Праотцы","",""
"KEY_OLENAONBEHEMOTH_DESCRIPTION","Text","","It didn't come from an egg. It was created by the Pandoravirus. We are likely seeing the result of super-charged genetic amalgamation of the flora and fauna inhabiting the Hammerfall impact zone; instead of being vaporized it turned into something else. ","它不是从蛋里孵化出来的。它是由潘多拉病毒创造的。我们很可能看到的是锤击陨石撞击区内动植物基因超级融合的结果；它没有被蒸发，而是变成了别的东西。","Il ne vient pas d'un oeuf. Il a été créé par le Pandoravirus. Nous voyons probablement le résultat d'un amalgame génétique hyperactif de la flore et de la faune de la zone d'impact du Hammerfall ; au lieu d'être vaporisée, elle s'est transformée en autre chose. ","Es stammte nicht aus einem Ei. Es wurde vom Pandoravirus erschaffen. Wahrscheinlich sehen wir das Ergebnis einer extremen genetischen Verschmelzung der Flora und Fauna aus der Einschlagszone von Hammerfall; anstatt verdampft zu werden, ist etwas anderes entstanden.","","","Он появился не из яйца. Он был создан Пандоравирусом. Вероятно, мы наблюдаем результат ускоренного генетического слияния флоры и фауны, населяющей зону падения ""Удара Молота"". Вместо того, чтобы испариться, он превратился во что-то другое.","",""
"KEY_OLENAONALISTAIR_DESCRIPTION","Text","","Oppa Alistair... He knows he's not very imaginative. And as he knows he can't be imagining things, he trusts what he sees. That's the best way I can put it, I guess.","阿利斯泰尔哥哥……他知道自己想象力不丰富。既然他知道自己不会胡思乱想，他就相信自己所见。这大概是我能说的最好的解释了。","Oppa Alistair... Il sait qu'il n'est pas très imaginatif. Et comme il sait qu'il ne peut pas s'imaginer des choses, il fait confiance à ce qu'il voit. C'est la meilleure façon de le dire, je suppose.","Oppa Alistair... Er weiß, dass er nicht besonders fantasievoll ist. Und gerade weil er weiß, dass er sich Dinge nicht einfach einbildet, vertraut er dem, was er sieht. So kann ich es wohl am besten ausdrücken.","","","Братец Алистер... Он знает, что у него не очень богатое воображение. И поскольку он знает, что не умеет выдумывать, он верит тому, что видит. Думаю, это лучшие слова, которыми я могу это все описать.","",""
