"Key","Type","Desc","English","Chinese (Simplified)","French","German","Italian","Polish","Russian","Spanish","UI_Tester"
"PX_REVENANT_LIVE_RESEARCH_COMPLETE","Text","","There is no room for doubt: this creature is, or used to be one of our operatives. What has been done to our friend and how... I would rather not try to imagine it. I wanted to hope that there was no shred of consciousness of the former self left in that monstrosity, but... I could swear it recognized me.

There is nothing we can do for our comrade now, and I'm afraid that killing it won't provide any release. We might encounter it again and again: the Pandorans splice and clone their victims ad infinitum.

We have to defeat the Pandoravirus once and for all. It's the only way to be sure.","毫无疑问：这生物是，或者曾经是我们的干员。对我们的朋友做了什么……我宁愿不去想象。我本想相信那怪物里已无昔日意识残留，但……我敢发誓它认出了我。

我们现在无能为力，恐怕杀死它也无法解脱。我们可能会一次又一次遇到它：潘多拉体无限拼接和克隆他们的受害者。

我们必须彻底击败潘多拉病毒。这是唯一的保证。","Il n'y a pas de place pour le doute : cette créature est, ou était, un de nos agents. Ce qui a été fait à notre ami et comment... Je préfère ne pas essayer de l'imaginer. Je voulais espérer qu'il ne restait aucune trace de conscience de l'ancienne personne dans cette monstruosité, mais... Je pourrais jurer qu'elle m'a reconnu.

Il n'y a rien que nous puissions faire pour notre camarade maintenant, et j'ai peur que le tuer ne nous libère en rien. Nous pourrions le rencontrer encore et encore : les Pandoriens dédoublent et clonent leurs victimes à l'infini.

Nous devons vaincre le Pandoravirus une fois pour toutes. C'est la seule façon d'être sûrs.","Es besteht kein Zweifel: Dieses Wesen ist oder war einer unserer Einheiten. Was mit unserem Freund geschehen ist und wie... ich will es mir lieber nicht vorstellen. Ich hatte gehofft, dass in diesem Monstrum kein Funken Bewusstsein seines früheren Selbst mehr schlummert, aber... ich hätte schwören können, es hat mich erkannt.

Wir können jetzt nichts mehr für unseren Kameraden tun, und ich fürchte, es zu töten, wird uns nicht erlösen. Wir könnten ihm immer wieder begegnen: Die Pandoraner vervielfältigen und klonen ihre Opfer endlos.

Wir müssen das Pandoravirus ein für alle Mal besiegen. Nur so können wir Gewissheit erlangen.","","","Сомнений быть не может: эта тварь является, точнее когда-то была одним из наших бойцов. Что произошло с нашим другом и почему... Лучше даже не пытаться это представить. Я бы хотел надеяться, что в этом чудовище не осталось ни крупицы сознания прежнего человека, но... могу поклясться, что оно узнало меня. Сейчас мы ничего не можем сделать для нашего товарища, и, думаю, его убийство не принесет пользы. Мы можем столкнуться с ним снова и снова: Пандораны бесконечно скрещивают и клонируют свои жертвы. Мы должны победить Пандоравирус раз и навсегда. Это единственный способ покончить с этим.
","",""
"PX_REVENANT_LIVE_RESEARCH_BENEFITS","Text","","Killing or capturing Revenants may grant access to additional research","击杀或俘获幽灵可能解锁额外研究","Tuer ou capturer des Revenants peut permettre d’accéder à des recherches supplémentaires.","Das Töten oder Fangen von Revenanten [Rückkehrern] kann den Zugang zu zusätzlicher Forschung gewähren.","","","Убийство или захват Возвращенцев может дать доступ к дополнительным исследованиям
","",""
"PX_PROJECT_OSIRIS_TITLE","Text","","Project Osiris","奥西里斯计划","Projet Osiris","Projekt Osiris","","","ПРОЕКТ ОСИРИС
","",""
"PX_PROJECT_OSIRIS_REVEAL","Text","","Defeating Revenants in the field has brought us closer to understanding how they are created. We may yet harness this knowledge in the war for the future of our species.","在战场上击败幽灵让我们更接近理解它们的创造方式。我们或许能利用这知识，为人类的未来战争带来转机。","Vaincre les Revenants sur le terrain nous a permis de mieux comprendre comment ils sont créés. Nous pouvons encore exploiter ces connaissances dans la guerre pour l'avenir de notre espèce.","Die Niederlage der Revenanten [Rückkehrer] im Feld hat uns dem Verständnis ihrer Entstehung nähergebracht. Dieses Wissen könnten wir im Kampf um das Überleben unserer Spezies noch nutzen.","","","Победа над Возвращенцами в бою приблизила нас к пониманию того, откуда они берутся. Возможно, мы еще воспользуемся этими знаниями в войне за будущее нашего вида.
","",""
"PX_PROJECT_OSIRIS_COMPLETE","Text","","The Pandorans use the Oneiric Delirium to tap into our consciousness and partially replicate it. 

At first we assumed that they could only access information stored in our genes. However, subsequent encounters with Revenants demonstrated that they retained memories of their former lives. Furthermore, we have evidence that the act of remembering triggers an emotional response in them. 

All this leads us to conclude that the Oneiric Delirium taps into a variety of data streams or information centers of the infected. It's a process that we cannot even begin to understand, even as it puts into question our basic notions of consciousness. 

Nevertheless, we have managed to extract some practical applications from our research into Revenants. We believe we are  now capable of sometimes saving critically wounded operatives by giving them new, artificial bodies.","潘多拉体利用梦魇谵妄侵入我们的意识并部分复制它。

起初我们以为他们只能访问储存在我们基因中的信息。然而，随后与复仇者的遭遇表明他们保留了前世的记忆。此外，我们有证据显示，回忆的行为会在他们体内触发情感反应。

所有这些都让我们得出结论：梦魇谵妄侵入了感染者的多种数据流或信息中心。这是一个我们甚至无法开始理解的过程，同时它也质疑了我们对意识的基本认知。

尽管如此，我们还是从对复仇者的研究中提取了一些实用应用。我们相信现在有能力通过赋予凤凰点干员新的人工身体，有时能挽救危重伤员。","Les Pandoriens utilisent le Delirium pour puiser dans notre conscience et la répliquer partiellement.

Au début, nous avons supposé qu'ils ne pouvaient accéder qu'aux informations stockées dans nos gènes. Cependant, des rencontres ultérieures avec des Revenants ont démontré qu'ils conservaient des souvenirs de leurs vies antérieures. De plus, nous avons la preuve que l'acte de se souvenir déclenche une réponse émotionnelle chez eux.

Tout cela nous amène à conclure que le Delirium puise dans une variété de flux de données ou de centres d'information des infectés. C'est un processus que nous ne pouvons même pas commencer à comprendre, même s'il remet en question nos notions de base de la conscience.

Néanmoins, nous avons réussi à extraire quelques applications pratiques de nos recherches sur les Revenants. Nous pensons que nous sommes maintenant capables de sauver parfois des agents gravement blessés en leur donnant de nouveaux corps artificiels.","Die Pandoraner nutzen das Oneirische Delirium, um in unser Bewusstsein einzudringen und es teilweise zu replizieren.

Zuerst nahmen wir an, sie könnten nur auf in unseren Genen gespeicherte Informationen zugreifen. Begegnungen mit Revenanten [Rückkehrern] zeigten jedoch, dass diese Erinnerungen an ihre früheren Leben bewahrten. Darüber hinaus gibt es Hinweise darauf, dass das Erinnern eine emotionale Reaktion in ihnen auslöst.

All dies lässt uns schlussfolgern, dass das Oneirische Delirium auf verschiedene Datenströme oder Informationszentren der Infizierten zugreift. Es ist ein Prozess, den wir noch nicht einmal ansatzweise verstehen können und der unsere grundlegenden Vorstellungen von Bewusstsein infrage stellt.

Dennoch ist es uns gelungen, aus unserer Forschung an den Revenanten [Rückkehrern] einige praktische Anwendungen zu gewinnen. Wir glauben, dass wir nun in der Lage sind, schwer verletzte Einheiten mitunter zu retten, indem wir ihnen neue, künstliche Körper geben.","","","Пандораны используют Сонное Безумие, чтобы проникнуть в наше сознание и частично заместить его. Сначала мы предположили, что они могут получить доступ только к информации, хранящейся в наших генах. Однако последующие встречи с Возвращенцами показали, что они сохраняют воспоминания о своих прежних жизнях. Более того, у нас есть доказательства того, что попытки вспомнить вызывают у них эмоции. Все это позволяет сделать вывод, что Сонное Безумие распространяется вместе с различными потоками данных через информационные системы зараженных. Это процесс, который мы даже не можем понять, так как он ставит под сомнение наши основные представления о сознании. Тем не менее нам удалось извлечь некоторые практические выгоды из наших исследований Возвращенцев. Мы считаем, что теперь можем иногда спасать тяжелораненых бойцов, давая им новые, искусственные тела.
","",""
"PX_PROJECT_OSIRIS_BENEFITS","Text","","With a mutation and/or a bionic lab, a Phoenix KIA operative may be given a new lease on life. Limited to one deceased operative per mission. Chances are highest for the more experienced operatives.","通过变异和/或义体实验室，凤凰点阵亡干员可能获得新生。每次任务限一名阵亡干员。经验丰富的干员成功率更高。","Grâce à un laboratoire de mutations et/ou cybernétique, un agent Phoenix mort au combat peut se voir offrir une seconde chance. Limité à une unité décédée par mission. Les chances sont plus élevées pour les unités les plus expérimentées.","Durch eine Mutation und/oder ein Bioniklabor kann eine im Einsatz gefallene Phoenix-Einheit wiederbelebt werden. Pro Mission kann nur eine gefallene Einheit wiederbelebt werden. Die Chancen stehen für erfahrenere Einheiten am besten.","","","С помощью лаборатории мутаций и/или бионической лаборатории боец Феникса может получить новую жизнь. Ограничение: один погибший боец за миссию. Наибольшие шансы - у более опытных бойцов.
","",""
"PX_ANTEDILUVIANARCHAEOLOGY_RESEARCHDEF_COMPLETE","Text","","<i>""Our planet is over 4.5 billion years old. Pre-collapse, no more than 3% of Earth's surface was urbanized. Dinosaurs lived on Earth for about 165 million years, going extinct some 65 million years ago. In a little over two centuries we found around 11,000 Dinosaur bones, which comes to one bone for every 15,000 years they spent on our planet. 

Do the math, Tobias... A million years from now someone might be proposing 'crackpot theories' suggesting that something like our civilization might have existed.""</i>

- Dr Helena Lewandowski

Over the past decades, the melting permafrost and the ecological changes wrought by the Pandoravirus have brought to the surface sites long hidden by sediment and water. With the help of Dr. Helena we have devised a scanner probe which can be produced in the Archaeology Facility. When launched from one of our aircraft, it can detect anomalies pointing to promising archaeological sites. Then, the hazardous process of exploration can begin.
","<i>“我们的星球已有超过45亿年历史。崩溃前，地球表面城市化面积不超过3%。恐龙在地球上生活了约1.65亿年，约6500万年前灭绝。在短短两个多世纪内，我们发现了约11000块恐龙骨骼，相当于它们在地球上每15000年留下的一块骨头。

算算吧，托比亚斯……一百万年后，可能有人会提出‘怪诞理论’，声称类似我们文明的东西曾经存在过。”</i>

- 海伦娜·莱万多夫斯基博士

过去几十年，融化的永久冻土和潘多拉病毒引发的生态变化使长期被沉积物和水覆盖的遗址浮出水面。在海伦娜博士的帮助下，我们设计了一种可在考古设施生产的扫描探针。它可由我们的飞行器发射，探测指向有潜力的考古遗址的异常信号。随后，危险的探索过程便可开始。
","<i> « Notre planète a plus de 4,5 milliards d’années. Avant l’effondrement, pas plus de 3 % de la surface de la Terre était urbanisée. Les dinosaures ont vécu sur Terre pendant environ 165 millions d’années, avant de disparaître il y a quelque 65 millions d’années. En un peu plus de deux siècles, nous avons trouvé environ 11 000 os de dinosaures, ce qui fait un os pour 15 000 années passées sur notre planète.

Fais le calcul, Tobias... Dans un million d’années, quelqu’un pourrait proposer des ‘théories farfelues’ suggérant qu’une civilisation comme la nôtre a pu exister. »</i>

- Dr Helena Lewandowski

Au cours des dernières décennies, le dégel du pergélisol et les changements écologiques provoqués par le Pandoravirus ont mis au jour des sites longtemps enfouis sous les sédiments et l’eau. Avec l’aide du Dr Helena, nous avons mis au point une sonde de détection pouvant être produite dans l’Installation d’Archéologie. Lancée depuis l’un de nos appareils, elle peut repérer des anomalies indiquant des sites archéologiques prometteurs. Vient ensuite le processus dangereux d’exploration.","<i>„Unser Planet ist über 4,5 Milliarden Jahre alt. Vor dem Zusammenbruch der Zivilisation waren nicht mehr als 3% der Erdoberfläche besiedelt. Dinosaurier lebten etwa 165 Millionen Jahre lang auf der Erde und starben vor rund 65 Millionen Jahren aus. In etwas mehr als zwei Jahrhunderten fanden wir etwa 11.000 Dinosaurierknochen – das entspricht einem Knochen pro 15.000 Jahre, die sie auf unserem Planeten verbrachten.</i>

Rechne es dir aus, Tobias... In einer Million Jahren wird vielleicht jemand mit abwegigen Theorien aufwarten, die die Existenz einer Zivilisation wie unserer nahelegen.“

– Dr. Helena Lewandowski

In den letzten Jahrzehnten haben das Auftauen des Permafrosts und die durch das Pandoravirus verursachten ökologischen Veränderungen Stätten freigelegt, die lange unter Sedimenten und Wasser verborgen waren. Mithilfe von Dr. Helena Lewandowski haben wir eine Scannersonde entwickelt, die in der Archäologischen Einrichtung hergestellt werden kann. Vom Boden aus gestartet, kann sie Anomalien erkennen, die auf vielversprechende archäologische Stätten hinweisen. Dann kann der risikoreiche Erkundungsprozess beginnen.","","","<i>""Нашей планете более 4,5 миллиардов лет. До апокалипсиса на Земле было застроено не более 3 % поверхности. Динозавры жили на Земле около 165 миллионов лет, вымерли примерно 65 миллионов лет назад. За два с небольшим столетия мы нашли около 11 000 костей динозавров, то есть по одной кости на каждые 15 000 лет, проведенных ими на нашей планете. Посчитайте, Тобиас... Через миллион лет кто-то будет выдвигать «безумные теории» о том, что нечто подобное нашей цивилизации могло существовать». </i> - Доктор Хелена Левандовски.

За последние десятилетия из-за таяния вечной мерзлоты и экологических изменений, вызванные Пандоравирусом, появились места, долгое время скрытые осадочными породами и водой. С помощью доктора Хелены мы разработали зонд-сканер, который можно изготовить в Археологическом Центре. Запущенный с одного из наших самолетов, он может обнаруживать аномалии, указывающие на перспективные места археологических раскопок. Это будет опасно, но мы проведем эти раскопки! 
","",""
"PX_ANTEDILUVIANARCHAEOLOGY_RESEARCHDEF_UNLOCK","Text","","Pre-Collapse there had been many attempts to find evidence of advanced precursor civilizations on Earth. Could those out-of-place artifacts have been real? What was behind the myths of Atlantis and of the Great Flood? If we want to learn the truth, we must pursue a more scientific approach.","崩溃前，曾有多次尝试寻找地球上先进先行者文明的证据。那些不合时宜的遗物可能是真实的吗？亚特兰蒂斯和大洪水的神话背后隐藏着什么？若想揭开真相，我们必须采取更科学的方法。","Avant l’Effondrement, de nombreuses tentatives avaient été faites pour trouver des preuves de civilisations précurseures avancées sur Terre. Ces artefacts hors de leur contexte étaient-ils réels ? Que se cachait-il derrière les mythes de l’Atlantide et du Déluge ? Si nous voulons connaître la vérité, nous devons adopter une approche plus scientifique.","Vor dem Zusammenbruch gab es zahlreiche Versuche, Beweise für hochentwickelte Vorläuferzivilisationen auf der Erde zu finden. Könnten diese Artefakte, die dort nicht hingehören, echt gewesen sein? Was verbarg sich hinter den Mythen von Atlantis und der Sintflut? Wenn wir die Wahrheit erfahren wollen, müssen wir einen wissenschaftlicheren Ansatz verfolgen.","","","До апокалипсиса было множество попыток найти доказательства существования на Земле развитых цивилизаций-предшественников. Могли ли эти необычные артефакты быть реальными? Что скрывалось за мифами об Атлантиде и Великом потопе? Если мы хотим узнать правду, мы должны использовать более научный подход.
","",""
"AUTOMATA_RESEARCH_TITLE","Text","","Ancient Automata","远古自动机","Automates Anciens","Uralte Automaten","","","РОБОТ ДРЕВНИХ
","",""
"AUTOMATA_RESEARCH_REVEAL","Text","","We have retrieved the remains of the automata that we encountered at the site. We should analyze them immediately.","我们已回收在遗址发现的自动机残骸，应立即进行分析。","Nous avons récupéré les restes de l’automate que nous avons rencontré sur le site. Nous devrions les analyser immédiatement.","Wir haben die Überreste der Automaten, die wir an der Fundstelle entdeckt haben, geborgen. Wir sollten sie unverzüglich analysieren.","","","Мы извлекли остатки Робота, с которым столкнулись в этом месте. Мы должны немедленно их проанализировать.
","",""
