Key,Type,Desc,English,Chinese (Simplified),French,German,Italian,Polish,Russian,Spanish,UI_Tester
KEY_DLC3_TUT_RECON_DESCRIPTION,Text,,"A Pandoran flyer has separated itself from the Festering Skies. It may come upon a haven and attack it. If the haven is not yet revealed, it will send an SOS disclosing its postion. 

Should the stray Pandoran flyer return to the swarm, the haven will be targeted by the Behemoth. Once a haven is targeted for attack, nothing can be done to prevent it: once the Behemoth reaches the haven, it will damage all its facilities and harvest about half of its population. 

Destroy Pandoran flyers to protect the havens, to colllect rewards from factions and to force the Behemoth to submerge.",,"Un chasseur pandorien s'est séparé de l'essaim. Il peut tomber sur un refuge et l'attaquer. Si le refuge n'a pas encore été révélé, il enverra un SOS indiquant sa position.

Si l'appareil pandorien errant retourne dans l'essaim, le refuge sera pris pour cible par le Béhémoth. Une fois qu'un refuge est visé par une attaque, rien ne peut être fait pour l'empêcher : une fois que le Béhémoth aura atteint le refuge, il endommagera toutes ses installations et récoltera environ la moitié de sa population.

Détruisez les pandoriens volants pour protéger les refuges, pour collecter les récompenses des factions et pour forcer le Béhémoth à s'immerger.","Ein pandoranisches Flugwesen hat sich von den Fauligen Himmeln gelöst. Es kann auf eine Zuflucht stoßen und sie angreifen. Ist die Zuflucht noch nicht entdeckt, sendet sie ein Notsignal aus, das ihre Position preisgibt.

Kehrt das umherirrende pandoranische Flugwesen zum Schwarm zurück, wird die Zuflucht vom Behemoth ins Visier genommen. Sobald eine Zuflucht als Angriffsziel markiert ist, kann nichts mehr unternommen werden, um dies zu verhindern: Erreicht der Behemoth die Zuflucht, beschädigt er alle Einrichtungen und erntet etwa die Hälfte der Bevölkerung.

<b>Zerstöre pandoranische Flugwesen, um Zufluchten zu schützen, Belohnungen von den Fraktionen zu erhalten und den Behemoth zum Abtauchen zu zwingen.</b>",,,"Пандоранский летун отделился от ""Гнойного Неба"". Он может наткнуться на убежище и атаковать его. Если убежище еще не обнаружено, оно отправит сигнал SOS со своими координатами.

Если заблудившийся летун Пандоранов вернется обратно в рой, к убежищу направится Бегемот. Предотвратить его нападение невозможно: как только Бегемот доберется до убежища, он повредит все его объекты и уничтожит около половины его населения.

Уничтожайте летунов Пандоранов, чтобы защищать убежища, получать награды от фракций и заставить Бегемота уйти под воду пораньше.",,
KEY_DLC3_TUT_RECON_NAME,Text,,PANDORAN FLYER,,PANDORIEN VOLANT,PANDORANISCHES FLUGWESEN,,,ПАНДОРАНСКИЙ ЛЕТУН,,
KEY_DLC3_TUT_BEHEMOTH_DISRUPTION_DESCRIPTION,Text,,"The Behemoth harvests all the biomass it encounters on its path, showing particular predilection for human havens. Any haven visited by a Pandoran flyer that successfully returns to the Festering Skies will be targeted for harvesting by the Behemoth. Once the Behemoth has collected enough biomass, it will submerge in the ocean. It will emerge again at a different point, sometimes fielding stronger flyers. 

The Behemoth will submerge sooner if it is able to harvest havens or if its harvesting operations are disrupted. The Behemoth will gain Disruption Points (DP) when:
- a haven is harvested (1 DP)
- a Pandoran flyer is destroyed (1 DP if Charun, 2 DP if Berith, and 4 DP if Abaddon)
- a Node is destroyed (5 DP)

Once the Disruption Threshold is reached, the Behemoth will go back to the ocean.",,"Le Béhémoth récolte toute la biomasse qu'il rencontre sur son chemin, montrant une prédilection particulière pour les refuges humains. Tout refuge visité par un appareil pandorien qui réussit à retourner dans l'essaim sera ciblé pour être récolté par le Béhémoth. Une fois que le Béhémoth aura collecté suffisamment de biomasse, il s'immergera dans l'océan. Il en ressortira à un autre endroit, avec parfois des appareils plus puissants.

Le Béhémoth s'immergera plus tôt s'il est capable de récolter des refuges ou si ses opérations de récolte sont perturbées. Le Béhémoth gagne des points de perturbation (PD) lorsque :
- un refuge est récolté (1 PD)
- un pandorien volant est détruit (Charun : 1 PD, Berith : 2 PD, et Abaddon : 4 PD)
- un nœud de corruption est détruit (5 PD)

Une fois le seuil de perturbation atteint, le Béhémoth retourne dans l'océan.","Der Behemoth erntet jede Biomasse, der er auf seinem Weg begegnet, mit besonderer Vorliebe für menschliche Zufluchten. Jede Zuflucht, die von einem pandoranischen Flugwesen besucht wurde, das anschließend erfolgreich zu den Fauligen Himmeln zurückkehrt, wird vom Behemoth zur Ernte markiert. Sobald der Behemoth genügend Biomasse gesammelt hat, taucht er im Ozean ab. Später wird er an einem anderen Ort erneut auftauchen – mitunter mit stärkeren Flugwesen.

Der Behemoth taucht früher ab, wenn es ihm gelingt, Zufluchten zu ernten, oder wenn seine Ernteoperationen gestört werden. Der Behemoth erhält <b>Störungspunkte (SP)</b>, wenn:
- eine Zuflucht geerntet wird (<b>1 SP</b>)
- ein pandoranisches Flugwesen zerstört wird (<b>1 SP</b> bei Charun, <b>2 SP</b> bei Berith, <b>4 SP</b> bei Abaddon)
- ein pandoranischer Knoten zerstört wird (<b>5 SP</b>)

Sobald die <b>Störungsschwelle</b> erreicht ist, zieht sich der Behemoth in den Ozean zurück.",,,"Бегемот собирает всю биомассу, которую встречает на своем пути, проявляя особую любовь к убежищам людей. Любое убежище, посещенное Пандоранским летуном, который успешно вернется в ""Гнойное Небо"", подвергнется нападению Бегемота. Как только Бегемот соберет достаточное количество биомассы, он погрузится в океан. Потом он снова всплывет в другом месте, иногда в окружении более сильных летунов.

Бегемот уйдет под воду раньше, если ему удастся собрать урожай биомассы в убежищах или если ему помешают. Бегемот получит Очки Разрушения (ОР), когда:
- атаковано убежище (1 ОР)
- уничтожен Пандоранский летун (1 ОР для Харуна, 2 ОР для Берита и 4 ОР для Абаддона)
- уничтожен Узел Порчи (5 ОР)

Как только будет достигнут предел Очков Разрушения, Бегемот вернется в океан.",,
KEY_DLC3_TUT_BEHEMOTH_DISRUPTION_NAME,Text,,BEHEMOTH BEHAVIOR,,COMPORTEMENT DU BEHEMOTH,VERHALTEN DES BEHEMOTH,,,ПОВЕДЕНИЕ БЕГЕМОТА,,
KEY_DLC3_TUT_BEHEMOTH_DESCRIPTION,Text,,"The Behemoth will inexorably attack any haven that has been visited by a Pandoran flyer that has successfully returned to the Festering Skies. Once the Behemoth reaches the haven, it will harvest about half of its population and severely damage all of its facilities. To prevent Behemoth's attacks on havens, destroy all Pandoran flyers.",,"Le Béhémoth attaquera inexorablement tout refuge qui a été visité par un pandorien volant qui a réussi à retourner dans l'essaim. Une fois que le Béhémoth aura atteint le refuge, il récoltera environ la moitié de sa population et endommagera gravement toutes ses installations. Pour empêcher les attaques du Béhémoth sur les refuges, détruisez tous les pandoriens volants.","Der Behemoth greift unausweichlich jede Zuflucht an, die von einem pandoranischen Flugwesen besucht wurde, das erfolgreich zu den Fauligen Himmeln zurückgekehrt ist. Sobald der Behemoth die Zuflucht erreicht, erntet er etwa die Hälfte ihrer Bevölkerung und beschädigt alle Einrichtungen schwer.
<b>Zerstöre alle pandoranischen Flugwesen, um Angriffe des Behemoths auf Zufluchten zu verhindern.</b>",,,"Бегемот будет неумолимо атаковать любое убежище, которое посетил Пандоранский летун, успешно вернувшийся в ""Гнойное Небо"". Как только Бегемот достигнет убежища, он уничтожит около половины его населения и нанесет серьезный ущерб всем его объектам. Чтобы предотвратить нападения Бегемота на убежища, уничтожайте всех Пандоранских летунов.",,
KEY_TUTORIAL_DLC2_ANCIENT_SITE_DESCRIPTION,Text,,"Send an aircraft to set up an Exploration operation at the site. Once Exploration starts, the presence of aircraft is no longer needed.",,"Envoyez un appareil pour établir une opération d'exploration sur le site. Une fois que l'exploration a commencé, la présence de l'appareil n'est plus nécessaire.","Entsende ein Fluggerät, um vor Ort eine Erkundungsmission zu starten. Sobald das Team mit der Erkundung begonnen hat, wird das Fluggerät nicht mehr benötigt.",,,"Пошлите самолет для исследования этих Руин. Как только исследование начнется, присутствие самолета больше не потребуется.",,
KEY_TUTORIAL_DLC2_EXCAVATION_DONE_NAME,Text,,We've completed our first ancient site Exploration!,,Nous avons terminé notre première exploration de site ancien !,Wir haben unsere erste Erkundung einer Uralten Stätte abgeschlossen!,,,Мы завершили нашу первую разведку Руин Древних!,,
KEY_TUTORIAL_DLC2_HARVESITNG_DESCRIPTION,Text,,"In TFTV, you immediately gain some amount of an exotic resource when you take control of an ancient site from the Automata. The amount of resources depends on type of resource and difficulty level, or alternatively the manual setting used in the Mod config. ",,"Dans TFTV, vous obtenez immédiatement une certaine quantité d'une ressource exotique lorsque vous prenez le contrôle d'un site ancien aux mains des Automates. Le montant des ressources dépend du type de ressource et du niveau de difficulté, ou alternativement, du réglage manuel utilisé dans la configuration du Mod.","In TFTV erhält man sofort eine bestimmte Menge einer exotischen Ressource, sobald man eine Uralte Stätte von den Automaten erobert. Die Menge der Ressource hängt von der Art der Ressource und dem Schwierigkeitsgrad ab, alternativ auch von den manuellen Einstellungen in der Mod-Konfiguration.",,,"В TFTV вы сразу же получаете некоторое количество Экзотических Материалов, когда забираете у Роботов контроль над Руинами Древних. Количество ресурсов зависит от типа ресурса и уровня сложности, или, в качестве альтернативы, от соответствующей настройки, используемой в конфигурации мода.",,
KEY_TUTORIAL_DLC2_HARVESITNG_NAME,Text,,ANCIENT SITE,,SITE ANCIEN,URALTE STÄTTE,,,РУИНЫ ДРЕВНИХ,,
KEY_TUTORIAL_DLC2_REFINERY_DESCRIPTIOY,Text,,"In TFTV, you immediately gain some amount of an exotic resource when you take control of an ancient site from the Automata. The amount of resources depends on type of resource and difficulty level, or alternatively the manual setting used in the Mod config. ",,"Dans TFTV, vous obtenez immédiatement une certaine quantité d'une ressource exotique lorsque vous prenez le contrôle d'un site ancien aux mains des Automates. Le montant des ressources dépend du type de ressource et du niveau de difficulté, ou alternativement, du réglage manuel utilisé dans la configuration du Mod.","In TFTV erhältst du sofort eine bestimmte Menge einer exotischen Ressource, sobald du eine Uralte Stätte von den Automaten übernimmst. Die Menge hängt von der Art der Ressource und dem Schwierigkeitsgrad ab oder alternativ von den manuellen Einstellungen in der Mod-Konfiguration.",,,"В TFTV вы сразу же получаете некоторое количество Экзотических Материалов, когда забираете у Роботов контроль над Руинами Древних. Количество ресурсов зависит от типа ресурса и уровня сложности, или, в качестве альтернативы, от соответствующей настройки, используемой в конфигурации мода.",,
KEY_TUTORIAL_DLC2_REFINERY_NAME,Text,,ANCIENT SITE,,SITE ANCIEN,URALTE STÄTTE,,,РУИНЫ ДРЕВНИХ,,
KEY_TUTORIAL_DLC2_ARCHEOLOGY_NAME,Text,,We've completed our Archaeology Lab!,,Nous avons terminé notre laboratoire d'archéologie !,Unser Archäologielabor ist fertiggestellt!,,,Мы завершили работу над нашей археологической лабораторией!,,
HINT_HOSTILE_DEFENDERS_TITLE,Text,,Hostile haven defenders,,Défenseurs de refuge hostiles,Feindliche Zufluchtverteidiger,,,Охрана убежища против нас,,
HINT_HOSTILE_DEFENDERS_TEXT,Text,,"<i>""Come to rescue us, have they? They are the ones who brought the damn critters on us in the first place! Fragging nerds…""</i>

While this Void Omen is in effect, haven defenders will be hostile to you and attack your operatives on sight, but <b>killing them is not required to win the mission</b>.

Gain XP by protecting structures or civilians as usual.

You can loot crates with faction weapons, but only the equipment in your operatives or vehicles inventory will be recovered.",,"<i>« Ils viennent nous sauver, c'est ça ? Ce sont eux qui nous ont attiré ces maudites bestioles dès le départ ! Sacrés intellos... »</i>

Tant que cette « Influence du Néant » est active, les défenseurs du refuge vous seront hostiles et attaqueront vos unités à vue, mais <b>les tuer n'est pas requis pour remporter la mission</b>.

Gagnez de l'EXP en protégeant les structures ou les civils comme d'habitude.

Vous pouvez piller des caisses contenant des armes de faction, mais seul l'équipement se trouvant dans l'inventaire de vos unités ou de vos véhicules sera récupéré.","<i>„Sollen die uns etwa retten? Dabei haben sie uns diese verdammten Viecher doch erst eingebrockt! Verdammte Nerds...“</i>

Solange dieses Omen der Leere aktiv ist, sind die Verteidiger der Zuflucht dir gegenüber feindselig und greifen deine Einheiten sofort an – aber <b>du musst sie nicht töten, um die Mission zu gewinnen</b>.

Erfahrungspunkte (XP) erhältst du wie gewohnt, indem du Gebäude oder Zivilisten schützt.

Kisten mit Fraktionswaffen können geplündert werden, doch nur die Ausrüstung im Inventar deiner Einheiten oder Fahrzeuge wird geborgen.",,,"<i>""Они пришли, чтобы спасти нас? Как бы не так! Они - это те, кто сначала натравил на нас этих чертовых тварей! Чертовы ублюдки...""</i>

Пока действует это Знамение Пустоты, защитники убежища будут настроены враждебно по отношению к вам и нападут на ваших бойцов, как только увидят их, но для победы в миссии не обязательно их убивать.

Получайте опыт, защищая строения или гражданских лиц, как обычно.

Вы можете разграбить ресурсные ящики с оружием фракции, но унести сможете лишь то, что будет сложено в инвентарь ваших бойцов и машин.",,
HINT_FIRE_QUENCHER_TITLE,Text,,Fire Quencher,,Extincteur,FLAMMENLÖSCHER,,,Живой Огнетушитель,,
HINT_FIRE_QUENCHER_TEXT,Text,,"<i>“There was nothing special about this one… Here comes the bisque, I thought… Boy was I wrong.”</i>

Some Arthrons have evolved the ability to instantly quench the fire they come in contact with, replacing it with Mist. They are apparently doing this by spraying some biochemical compound  from their <b>heads</b>. Disabling their heads should remove both their immunity to fire and their ability to quench it.",,"<i>« Il n'avait rien de spécial, celui-là... Et voilà la bisque, que je me suis dit... Eh bien, je me trompais lourdement. »</i>

Certains Arthrons ont développé la capacité d'éteindre instantanément les flammes avec lesquelles ils entrent en contact, les remplaçant par de la Brume. Ils y parviennent apparemment en pulvérisant un composé biochimique depuis leur <b>tête</b>. Neutraliser leur tête devrait supprimer à la fois leur immunité au feu et leur capacité à l'éteindre.","<i>„An diesem hier war nichts Besonderes...
‚Jetzt gibt’s Krabbensuppe‘, dachte ich...
Junge, lag ich daneben.“</i>

Einige Arthrons haben die Fähigkeit entwickelt, Feuer, mit dem sie in Kontakt kommen, augenblicklich zu löschen und durch Nebel zu ersetzen. Offenbar erreichen sie dies, indem sie eine biochemische Substanz aus ihren <b>Köpfen</b> versprühen. Wird der Kopf deaktiviert, verlieren sie sowohl ihre Feuerimmunität als auch ihre Fähigkeit, Flammen zu ersticken.",,,"<i>""В этой твари не было ничего особенного... Сейчас нафарширую, подумал я тогда. Боже, как же я ошибался...""</i>

Некоторые Артроны развили способность мгновенно гасить огонь, с которым они соприкасаются, заменяя его Туманом. Очевидно, они делают это, распыляя какое-то биохимическое вещество из своих голов. Выбитая голова должна лишить их невосприимчивости к огню и способности гасить его.",,
KEY_GEO_HINT_AUGMENTATION_SCREEN_DESCRIPTION,Text,,"You are about to augment your first soldier. A character can only have UP TO 2 BODY PARTS replaced this way.

Once an augmentation is installed, the soldier will not be able to revert back to their natural limbs. However, augmented body parts CAN BE SWAPPED with different cybernetic parts.

Augmented body parts are IMMUNE TO BLEEDING and RESISTANT TO VIRAL DAMAGE, POISON, AND PARALYSIS. Damaged cybernetics CAN BE REPAIRED after battle at the expense of Tech and Materials. 

In addition, each bionic augmentation reduces the maximum Delirium the character can have by 1/3, and removes up to that amount of Delirium from the character. 

Augmenting a character will reduce their Stamina to zero.",,"Vous êtes sur le point d'augmenter votre premiere unité. Un personnage ne peut avoir que JUSQU'À 2 PARTIES DU CORPS remplacées de cette manière. Cette action réduira son Endurance à zéro.

Une fois une augmentation installée, l'unité ne pourra plus retrouver ses membres naturels. Cependant, les parties du corps augmentées PEUVENT ÊTRE ÉCHANGÉES par d'autres modules cybernétiques.

Les parties du corps augmentées sont IMMUNISÉES CONTRE LES SAIGNEMENTS et RÉSISTANTES AUX DÉGÂTS VIRAUX, AU POISON ET À LA PARALYSIE. Un module cybernétique endommagé PEUT ÊTRE RÉPARÉ après la bataille au prix de Technologie et de Matériaux.

De plus, chaque augmentation cybernétique réduit le Delirium maximum du personnage de 1/3, et retire ce montant de Delirium du personnage.","Du bist dabei, deine erste Einheit zu augmentieren. Eine Einheit kann auf diese Weise HÖCHSTENS 2 KÖRPERTEILE ersetzen lassen.

Sobald eine Augmentation installiert ist, kann die Einheit nicht mehr zu seinen natürlichen Gliedmaßen zurückkehren. Allerdings können augmentierte Körperteile gegen andere kybernetische Teile ausgetauscht werden.

Augmentierte Körperteile sind IMMUN GEGEN BLUTEND und RESISTENT GEGEN VIRUSSCHADEN, GIFT UND LÄHMUNG. Beschädigte Kybernetik kann nach dem Einsatz repariert werden, allerdings auf Kosten von Technik und Materialien.

Zusätzlich reduziert jede bionische Augmentation das maximale Delirium, das eine Einheit haben kann, um ein Drittel, und entfernt bis zu dieser Menge bestehendes Delirium von der Einheit.

Das Augmentieren einer Einheit setzt ihre Ausdauer auf null.",,,"Вы собираетесь аугментировать своего первого бойца. Персонажу можно заменить таким образом не более 2-х частей тела.

После установки аугмента боец не сможет вернуть назад свои естественные конечности. Однако эти части тела можно будет заменить другими кибернетическими частями.

Аугментированные части тела невосприимчивы к кровотечениям и устойчивы к вирусным повреждениям, ядам и параличу. Поврежденные кибернетические части можно будет починить после боя за счет технологий и материалов.

Кроме того, каждая бионическая аугментация уменьшает максимальное количество Сонного Безумия, которое может быть у персонажа, на 1/3 и тут же удаляет с бойца это количество Сонного Безумия.

При аугментации бойца его выносливость тут же снижается до нуля.",,
KEY_GEO_HINT_ACHERON_CAPTURE_DESCRIPTION,Text,need to change,"Despite our best efforts the finding a cure to the new corruption strain ended in failure. Apparently, the virus in all newer specimens has mutated to such a degree that it is useless for our needs. In order to be successful, we need to find one of the original specimens that escaped from the Lab.",,"Malgré tous nos efforts, la recherche d'un remède à la nouvelle souche de corruption s'est soldée par un échec. Apparemment, le virus dans tous les nouveaux spécimens a muté à un tel point qu'il est inutile pour nos besoins. Pour réussir, nous devons trouver l'un des spécimens originaux qui s'est échappé du laboratoire.","Trotz aller Bemühungen ist die Suche nach einem Heilmittel gegen den neuen Verderbnisstamm gescheitert. Offenbar ist das Virus in allen neueren Proben so weit mutiert, dass sie für unsere Zwecke unbrauchbar sind.
Um Erfolg zu haben, müssen wir eines der ursprünglichen Exemplare finden, das aus dem Labor entkommen ist.",,,"Несмотря на все наши усилия, поиск лекарства от нового штамма вируса закончился неудачей. По-видимому, вирус во всех новых Образцах мутировал до такой степени, что теперь в нем не разобраться. Чтобы добиться результата, нам нужно найти один из первоначальных Образцов, сбежавших из лаборатории.",,
KEY_GEO_HINT_ACHERON_CAPTURE_NAME,Text,need to change,CORRUPTION CURE RESEARCH FAILURE,,ECHEC DE LA RECHERCHE D’UN REMEDE A LA CORRUPTION,SCHEITERN DER VERDERBNISHEILUNG,,,ПРОВАЛ ИССЛЕДОВАНИЯ ПО ЛЕЧЕНИЮ ЗАРАЖЕНИЯ,,
