Key,Type,Desc,English,Chinese (Simplified),French,German,Italian,Polish,Russian,Spanish,UI_Tester
PX_MUTAGENHARVESTING_RESEARCHDEF_UNLOCK_TFTV,Text,,"<i>""Now I understand why they were keeping those worms around...""</i> - Alistair Ashby

A method for extracting mutagens from captured Pandorans is being devised. The process is still in its infancy, but should it be successful it would provide us with a virtually endless source of mutagens.",,"<i> « Maintenant, je comprends pourquoi ils gardaient ces vers... »</i> - Alistair Ashby

Une méthode d’extraction des mutagènes à partir de Pandoriens capturés est en cours de mise au point. Le processus en est encore à ses débuts, mais s’il s’avère efficace, il pourrait nous fournir une source pratiquement infinie de mutagènes.","<i>„Jetzt verstehe ich, warum sie diese Würmer behalten haben...“</i> – Alistair Ashby

Es wird eine Methode zur Gewinnung von Mutagenen aus gefangenen Pandoranern entwickelt. Das Verfahren steckt noch in den Kinderschuhen, aber sollte es erfolgreich sein, würde es uns eine nahezu unerschöpfliche Quelle an Mutagenen liefern.",,,"<i>""Теперь я понимаю, почему они держали этих червей рядом...""</i> - Алистер Эшби. 
В настоящее время разрабатывается метод извлечения мутагенов из пленных Пандоранов. Процесс пока находится в зачаточном состоянии, но если он окажется успешным, мы получим практически бесконечный источник мутагенов.",,
PX_FOODHAVRESTING_RESEARCHDEF_BENEFITS_TFTV,Text,,Captured Pandorans can now be rendered for food processing at our Food Production facilities.,,Les Pandoriens capturés peuvent désormais être transformés en nourriture dans nos installations de production alimentaire.,Gefangene Pandoraner können ab sofort in unseren Nahrungsproduktionen zu Nahrung aufbereitet werden.,,,Захваченные Пандораны теперь могут перерабатываться в еду на наших Пищевых Комбинатах.,,
TFTV_MUTATIONTECH_RESEARCHDEF_COMPLETE_W_HARVESTING,Text,,"<i>“Those that partake of the Waters of Life say that, as their dreams become more vivid, their waking life becomes more dreamlike, until they know not when they are asleep and when they are awake. And always they feel more capable of incredible feats of arms, and of vanquishing their enemies. I’m exhilarated by their confidence, yet I also fear their brutality.”</i>

- Neophyte Ryodik, Disciples of Anu 

<i>""Now I understand why they were keeping those worms around...""</i> 

- Alistair Ashby

The Disciples of Anu use genetic material derived from Pandorans in their rituals to “evolve closer to the Exalted”; in essence, a process of controlled mutation. We have learned both how to extract mutagens from Pandorans and to replicate some of their mutation techniques, naturally without all the superfluous elements of liturgy. We can synthesize a limited amount of mutagens in each of our mutation labs, but to scale the production we need live Pandoran subjects in captivity.",,"<i> « Ceux qui s’abreuvent aux Eaux de Vie disent que, à mesure que leurs rêves deviennent plus vifs, leur vie éveillée devient plus onirique, jusqu’à ce qu’ils ne sachent plus quand ils dorment et quand ils sont éveillés. Et ils se sentent toujours plus capables d’exploits militaires incroyables et de vaincre leurs ennemis. Je suis enthousiasmé par leur confiance, mais je crains aussi leur brutalité. »</i>

- Néophyte Ryodik, Disciples d’Anu

<i>« Maintenant, je comprends pourquoi ils gardaient ces vers... »</i>

- Alistair Ashby

Les Disciples d’Anu utilisent du matériel génétique dérivé des Pandoriens dans leurs rituels pour « évoluer vers les Exaltés » ; en essence, un processus de mutation contrôlée. Nous avons appris à la fois comment extraire les mutagènes des Pandoriens et à reproduire certaines de leurs techniques de mutation, naturellement sans tous les éléments superflus de la liturgie. Nous pouvons synthétiser une quantité limitée de mutagènes dans chacun de nos laboratoires de mutation, mais pour augmenter la production, nous avons besoin de sujets Pandoriens vivants en captivité.
","<i>„Diejenigen, die vom Wasser des Lebens trinken, berichten, dass ihre Träume immer lebhafter werden und ihr Wachleben immer traumhafter, bis sie nicht mehr zwischen Schlaf und Wachen unterscheiden können. Ständig fühlen sie sich zu unglaublichen Waffentaten und zur Vernichtung ihrer Feinde fähig. Ihr Selbstvertrauen beflügelt mich, doch ihre Brutalität fürchte ich zugleich.“</i>

– Neophyt Ryodik, Jünger des Anu

„Jetzt verstehe ich, warum sie diese Würmer behalten haben...“

– Alistair Ashby

Die Jünger des Anu verwenden in ihren Ritualen genetisches Material von Pandoranern, um sich „den Erhabenen anzunähern“. Im Wesentlichen ein Prozess kontrollierter Mutation. Wir haben gelernt, Mutagene aus Pandoranern zu gewinnen und einige ihrer Mutationstechniken nachzuahmen, natürlich ohne die überflüssigen Elemente der Liturgie. In jedem unserer Mutationslabore können wir eine begrenzte Menge an Mutagenen synthetisieren, aber um die Produktion auszuweiten, benötigen wir lebende Pandoraner in Gefangenschaft.",,,"<i>""Те, кто пьет Живую Воду, говорят, что сначала их сны становятся нереально яркими, а реальность становится все более похожей на сон, а потом наступает момент, когда уже не различить, где сон, где явь. Но они всегда чувствуют себя способными на великие подвиги и жаждут побед над своими врагами. Меня восхищает их уверенность, и в тоже время страшит их жестокость..""</i>  - Неофит Риодик, Последователи Ану.

<i>""Теперь я понимаю, почему они держали этих червей рядом...""</i> - Алистер Эшби.  

Последователи Ану используют генетический материал, полученный от Пандоранов, в своих ритуалах, чтобы «становиться ближе к Возвышенной». По сути, это процесс контролируемой мутации. Мы научились извлекать мутагены из Пандоранов и воспроизводить некоторые из их типов мутаций, естественно, выкинув все лишнее. Мы можем синтезировать ограниченное количество мутагенов в каждой из наших мутационных лабораторий, но для расширения производства нам нужны живые Пандораны в клетках.",,
KEY_FS_ALN_CORRUPTION_NODE_RESEARCHDEF_NAME,Text,,NODE,,NOEUD,NODE,,,УЗЕЛ ПОРЧИ,,
KEY_FS_ALN_CORRUPTION_NODE_RESEARCHDEF_UNLOCK,Text,,A monstrous entity whose anatomy doesn't resemble any Pandoravirus mutation in our database able to take over machines and entire settlements by telepathic attacks.,,Une entité monstrueuse dont l’anatomie ne ressemble à aucune mutation du Pandoravirus dans notre base de données. Elle est capable de prendre le contrôle de machines et de colonies entières par des attaques télépathiques.,"Ein monströses Wesen, dessen Anatomie keiner Pandoravirus-Mutation in unserer Datenbank ähnelt. Es ist in der Lage, Maschinen und ganze Siedlungen durch telepathische Angriffe zu übernehmen.",,,"Чудовищное существо, анатомия которого не похожа ни на одну мутацию Пандоравируса из нашей базы данных, способное захватывать машины и целые поселения с помощью телепатических атак.",,
KEY_FS_ALN_CORRUPTION_NODE_RESEARCHDEF_COMPLETE,Text,,"Species classification CN-Alpha
A highly evolved form of the Pandoravirus has been reported to attack human settlements by attaching itself to structures and machinery to form a powerful symbiotic connection. Affected havens are completely overtaken by the creature and all of their citizens are kept in a mindless state serving the Pandorans.
Recent reports indicate Nodes are able to establish a similar telepathic connection with AI-operated aircraft and use it to attack other humans. Despite the evidence of high intelligence, no attempt at peaceful contact with the creature has been successful yet.",,"Classification des espèces CN-Alpha
Une forme très évoluée du pandoravirus aurait attaqué les établissements humains en s’attachant aux structures et aux machines pour former une puissante connexion symbiotique. Les refuges affectés sont complètement dépassés par la créature et tous leurs citoyens sont maintenus dans un état aveugle au service des Pandoriens.
Des rapports récents indiquent que les noeuds sont capables d’établir une connexion télépathique similaire avec des appareils exploités par l’IA et de l’utiliser pour attaquer d’autres humains. Malgré les preuves d’une grande intelligence, aucune tentative de contact pacifique avec la créature n’a encore réussi.","Speziesklassifizierung CN-Alpha
Eine hochentwickelte Form des Pandoravirus greift Berichten zufolge menschliche Siedlungen an, indem sie sich an Gebäude und Maschinen anheftet und eine starke symbiotische Verbindung eingeht. Betroffene Zufluchten werden vollständig von der Kreatur eingenommen, und ihre Bewohner verfallen in einen willenlosen Zustand und dienen den Pandoranern. Jüngste Berichte deuten darauf hin, dass „Node“ eine ähnliche telepathische Verbindung zu KI-gesteuerten Fluggeräten herstellen und diese nutzen können, um andere Menschen anzugreifen. Trotz der Hinweise auf hohe Intelligenz ist bisher kein Versuch eines friedlichen Kontakts mit der Kreatur erfolgreich gewesen.",,,"Видовая классификация: УП-Альфа. 
Сообщалось, что высокоразвитая форма Пандоравируса поражает населенные пункты, прикрепляясь к конструкциям и механизмам, образуя мощную симбиотическую связь. Пострадавшие Убежища полностью захвачены этим существом, и все их жители находятся в состоянии невменяемости, под контролем Пандоранов. Последние сообщения указывают на то, что УЗЕЛ ПОРЧИ способен устанавливать аналогичную телепатическую связь с самолетами, управляемыми искусственным интеллектом, и использовать ее для нападения на других людей. Несмотря на свидетельства высокого интеллекта, ни одна попытка мирного контакта с этим существом пока не увенчалась успехом.",,
KEY_FS_PX_ALIEN_CORRUPTION_NODE_RESEARCHDEF_COMPLETE,Text,,"Summary: What we have uncovered is deeply troubling. It is certain that the Node is not created through genetic aggregation and manipulation, either via cloning or aggressively mutating a live subject, as are all the other Pandoran species that we have encountered so far. Biologically, it is nothing but a random collection of cells: we are at a loss as to how it is even able to maintain a coherent shape. What we have autopsied is little more than a broken vessel that was previously inhabited by something that left no trace of itself upon leaving it.

We are only left with the esoteric as a plausible explanation: the Node must be a physical manifestation of the Oneiric Delirium; it is quite literally the product of nightmares. We hypothesize that a Pandoran creature with telepathic ability provoked a massive OD event at the haven and that brought the Node into being. We can further hypothesize that this required a substantial amount of biomass and a period of time. Once the Node appeared, it took over the haven and everything and everyone in it at the time: the unfortunate inhabitants were somehow used to invoke the intelligence that subdued them.

Genetic origins: none

Function: unknown

Offensive capabilities: Takes over and controls entire human settlements and technology, including aircraft. We speculate that the creature is somehow harnessing the Oneiric Delirium phenomenon. Should this speculation prove correct, the fact that the creature's control extends to inanimate objects such as terrestrial and aerial vehicles would have tremendous implications for our understanding of this phenomenon.

Defensive capabilities: Spreads viral agents around its body to fend off attackers.

Mobility: Once attached, the body remains completely immobile.

Weakness: It seems to have a one-sided telepathic connection with its victims. Once the body is dead, all mind-control connection with all entities is broken.",,"Résumé : Ce que nous avons découvert est profondément troublant. Il est certain que le Node n'est pas créé par agrégation et manipulation génétique, soit par clonage, soit par mutation agressive d'un sujet vivant, comme le sont toutes les autres espèces pandorannes que nous avons rencontrées jusqu'à présent. Biologiquement, il n'est rien d'autre qu'une collection aléatoire de cellules : nous ne savons pas comment il est capable de maintenir une forme cohérente. Ce que nous avons autopsié n'est guère plus qu'un vaisseau brisé qui était auparavant habité par quelque chose qui n'a laissé aucune trace de lui en le quittant.

Il ne nous reste que l’ésotérique comme explication plausible : le Nœud doit être une manifestation physique du Delirium ; il est littéralement le produit des cauchemars. Nous supposons qu’une créature pandorane avec une capacité télépathique a provoqué un événement de Delirium massif au refuge et qui a amené l’existence du Noeud. Nous pouvons également émettre l’hypothèse que cela a nécessité une quantité substantielle de biomasse et du temps. Une fois le Nœud apparu, il a pris le contrôle du refuge et tout ce qui s'y trouvait à l’époque : les malheureux habitants ont été en quelque sorte utilisés pour invoquer l’intelligence qui les a soumis.

Origine génétique : aucune

Fonction : inconnue

Capacités offensives : Prend en charge et contrôle l’ensemble des humains et de la technologie, y compris les appareils. Nous supposons que la créature exploite le phénomène du Delirium. Si cette spéculation s’avérait correcte, le fait que le contrôle de la créature s’étende aux objets inanimés tels que les véhicules terrestres et aériens aurait d’énormes implications pour notre compréhension de ce phénomène.

Capacités défensives : Propage des agents viraux autour de son corps pour repousser les attaquants.

Mobilité : Une fois attaché, le corps reste complètement immobile.

Faiblesse : Il semble avoir un lien télépathique unilatéral avec ses victimes. Une fois le corps mort, toute connexion de contrôle mental avec les victimes est brisée.","Zusammenfassung: Unsere Entdeckung ist zutiefst beunruhigend. Es steht fest, dass der „Node“ nicht durch genetische Aggregation und Manipulation entstanden ist, weder durch Klonen noch durch aggressive Mutation eines lebenden Organismus, wie es bei allen anderen uns bisher bekannten pandoranischen Spezies der Fall ist. Biologisch gesehen ist er nichts weiter als eine zufällige Ansammlung von Zellen: Wir sind ratlos, wie er überhaupt eine zusammenhängende Form bewahren kann. Was wir obduziert haben, ist kaum mehr als ein zerbrochenes Rezeptakel, das zuvor von etwas bewohnt war, das beim Verlassen keine Spuren hinterließ.

Uns bleibt nur die esoterische Erklärung als plausible Möglichkeit: Der Node muss eine physische Manifestation des Oneirischen Deliriums sein. Er ist buchstäblich das Produkt jenseitiger Albträumen. Wir vermuten, dass ein pandoranisches Wesen mit telepathischen Fähigkeiten ein massives OD-Ereignis in der Zuflucht auslöste, wodurch der Node entstand. Wir können weiterhin annehmen, dass dies eine beträchtliche Menge an Biomasse und einen gewissen Zeitraum erforderte. Sobald der Node erschien, übernahm er die Kontrolle über die Zuflucht und alles, was sich darin befand: Die unglücklichen Bewohner wurden auf irgendeine Weise benutzt, um die Intelligenz zu beschwören, die sie unterworfen hatte.

Genetische Ursprünge: keine

Funktion: unbekannt

Offensive Fähigkeiten: Übernimmt und kontrolliert ganze menschliche Siedlungen und Technologien, einschließlich Fluggeräte. Wir vermuten, dass die Kreatur das Phänomen des Oneirischen Deliriums nutzt. Sollte sich diese Vermutung als richtig erweisen, hätte die Tatsache, dass die Kontrolle der Kreatur sich auch auf unbelebte Objekte wie Land- und Luftfahrzeuge erstreckt, enorme Auswirkungen auf unser Verständnis dieses Phänomens.

Defensive Fähigkeiten: Verbreitet Viren um seinen Körper, um Angreifer abzuwehren.

Mobilität: Nach der Anheftung bleibt der Körper völlig unbeweglich.

Schwäche: Es scheint eine einseitige telepathische Verbindung zu seinen Opfern zu haben. Sobald der Körper tot ist, bricht die Verbindung zu allen kontrollierten Entitäten ab.",,,"Резюме
То, что мы обнаружили, вызывает глубокую тревогу. Несомненно, что УЗЕЛ ПОРЧИ создан не путем генетической агрегации и манипуляций, не путем клонирования или агрессивной мутации живого существа, как это происходит со всеми другими Пандоранскими видами, с которыми мы сталкивались до сих пор. Биологически это не что иное, как случайный набор клеток: мы в недоумении, как он вообще способен сохранять целостную форму. 

То, что мы обнаружили при вскрытии, представляет собой нечто большее, чем разбитый сосуд, в котором ранее обитало нечто, не оставившее после себя никаких следов. В качестве правдоподобного объяснения нам остается только эзотерика: УЗЕЛ ПОРЧИ, должно быть, является физическим проявлением Сонного Безумия. Это в буквальном смысле воплощение ночных кошмаров. Мы предполагаем, что Пандоранское существо, обладающее телепатическими способностями, спровоцировало массовый психоз в убежище, что привело к появлению УЗЛА ПОРЧИ. Мы также можем предположить, что для этого потребовалось значительное количество биомассы и определенный период времени. Как только УЗЕЛ появился, он захватил власть над убежищем и всем, что находилось в нем на тот момент: несчастных обитателей каким-то образом использовали, чтобы создать разум, который подчинил их себе.

Генетическое происхождение: отсутствует.

Назначение: неизвестно. 

Атакующие способности: захватывает и контролирует целые человеческие поселения и технологии, включая самолеты. Мы предполагаем, что это существо каким-то образом использует феномен Сонного Безумия. Если это предположение подтвердится, то тот факт, что под контролем существа находятся неодушевленные предметы, такие, как наземные и воздушные машины, будет иметь огромное значение для нашего понимания этого феномена. 

Защитные способности: распространяет вирусные агенты по всему телу, чтобы отражать атаки. 

Подвижность: будучи вросшим в окружающие объекты, тело остается полностью неподвижным. 

Слабости: кажется, что у него односторонняя телепатическая связь со своими жертвами. Как только тело погибает, все связи с существами, разум которых оно контролирует, исчезают.",,
KEY_FS_PX_ALIEN_CORRUPTION_NODE_RESEARCHDEF_NAME,Text,,Node Autopsy,,Autopsie du Noeud,Node-Autopsie,,,Вскрытие Узла Порчи,,
KEY_FS_PX_ALIEN_CORRUPTION_NODE_RESEARCHDEF_UNLOCK,Text,,"Specimen: NODE
A species that looks utterly alien, even compared to other highly mutated Pandorans. We must commence study as soon as possible to understand how the infestation occurred.",,"Spécimen : NOEUD
Une espèce qui semble totalement étrangère, même comparée à d’autres Pandoriens hautement mutés. Nous devons commencer l’étude le plus tôt possible pour comprendre comment l’infestation s’est produite.","Exemplar: NODE
Eine Spezies, die selbst im Vergleich zu anderen hochmutierten Pandoranern völlig fremdartig wirkt. Wir müssen so schnell wie möglich mit den Untersuchungen beginnen, um zu verstehen, wie es zu diesem Befall kam.",,,"Образец: Узел Порчи, который выглядит совершенно чужеродным, даже по сравнению с другими сильно мутировавшими Пандоранами. Мы должны начать исследование как можно скорее, чтобы понять, как произошло заражение.",,
MASKED_MANTICORE_RESEARCHDEF_TFTV,Text,,"""See, I think the Manti was designed in different times, when aircraft needed to be certified for flight and such… Long story short, it has many in-built redundancies to satisfy safety inspectors who have long turned to crab. We can get rid of <i>that</i> stuff and then we will have space to put in <i>other</i> stuff, know what I'm saying? Beats me why you want to cover it in slime, but you're the boss… or the Director… or whatever"".

Ralph ""Wrench"" Mulligan, Phoenix Project
",,"""Voyez-vous, je pense que le Manticore a été conçu à différentes époques, alors que les appareils devaient être certifiés pour le vol, etc. Bref, il y a de nombreuses redondances pour satisfaire les inspecteurs de la sécurité qui se sont depuis longtemps transformé en crabe. On peut se débarrasser de <i>ça</i> et on aura de la place pour mettre d’<i>autres</i> trucs, tu vois ce que je veux dire ? Ça m’étonne que tu veuilles le couvrir de bave, mais tu es le patron... ou le directeur... ou peu importe.""

Ralph Wrench Mulligan, Projet Phoenix
","„Sehen Sie, ich glaube, die Manti wurde in einer anderen Zeit entworfen, als Flugzeuge noch für den Flugbetrieb zugelassen werden mussten und so weiter... Kurz gesagt, sie hat viele eingebaute Redundanzen, um die Sicherheitsinspektoren zufriedenzustellen, die sich längst in Krabben verwandelt haben. Wir können <i>diesen</i> Kram entfernen und dann haben wir Platz für <i>anderen</i> Kram, verstehen Sie? Mir ist schleierhaft, warum Sie sie mit Schleim bedecken wollen, aber Sie sind der Chef... oder der Direktor... oder was auch immer.“

Ralph „Wrench“ Mulligan, Phoenix-Projekt",,,"""Видите ли, я думаю, что Мантикора разрабатывалась в то время, когда самолеты нуждались в сертификации для полетов и тому подобном... Короче говоря, в ней есть много встроенных резервов, чтобы удовлетворить требования инспекторов по безопасности полетов, которые давно канули в лету. Мы можем избавиться от этого, и тогда у нас будет место для других вещей, понимаете, о чем я? Я не знаю, почему вы хотите на это забить, но вы же босс... или директор... или кто вы там..."", - Ральф «Тех» Маллиган, Проект Феникс",,
