"Key","Type","Desc","English","Chinese (Simplified)","French","German","Italian","Polish","Russian","Spanish","UI_Tester"
"PROG_LE1_WIN_CHOICE_2_OUTCOME_GENERAL","Text","","MESSAGE 
From:Colonel Jack Harlson (New Jericho) 
To: Phoenix Point

The Pandorans grow ever more cunning and deliberate in their attacks. We need more and better weapons. West is right: whatever the wishful thinkers may be dreaming, any feasible solution to this menace requires force and the willingness to use it.","消息 
发件人：杰克·哈尔森上校（新耶利哥） 
收件人：凤凰点

潘多拉体的攻击变得愈发狡猾且有预谋。我们需要更多更好的武器。韦斯特说得对：无论那些幻想者如何梦想，任何切实可行的解决方案都需要武力以及使用武力的决心。","MESSAGE
EXPÉDITEUR : Colonel Jack Harlson (Nouvelle-Jéricho)
DESTINATAIRE : Phoenix

Les pandoriens deviennent de plus en plus rusés et réfléchis dans leurs attaques. Nous avons besoin de plus d’armes et de meilleures qualités. West a raison : peu importe ce que rêvent les penseurs, toute solution réaliste à cette menace nécessite la force et la volonté de l’utiliser.","NACHRICHT
Von: Oberst Jack Harlson (Neu-Jericho)
An: Phoenix Point

Die Pandoraner werden mit jedem Angriff berechnender und zielgerichteter. Wir brauchen mehr und bessere Waffen. West hat recht: Was auch immer die Träumer wünschen mögen, jede realistische Lösung für diese Bedrohung erfordert Gewalt und die Bereitschaft, sie anzuwenden.","","","ВХОДЯЩЕЕ СООБЩЕНИЕ 
ОТ: Полковник Джек Харлсон (Новый Иерихон) 
КОМУ: Проект Феникс

Пандораны становятся все более хитрыми и жесткими в своих атаках. Нам нужно больше самого лучшего оружия. Уэст прав: о чем бы ни мечтали фантазеры, любое реальное решение этой угрозы требует силы и готовности ее применить.","",""
"PROG_LE1_WIN_CHOICE_2_TEXT","Text","","The Pandorans did it, all of it!","潘多拉体干的，全部都是！","Les Pandoriens l’ont fait !","DIE PANDORANER WAREN ES – ALLESAMT!","","","Это сделали Пандораны, все это!","",""
"PROG_LE1_WIN_CHOICE_1_OUTCOME_GENERAL","Text","","MESSAGE 
From: Colonel Jack Harlson (New Jericho) 
To: Phoenix Point

I wanted to thank you personally for delivering this information. It is crucial that all of us understand the peril we are facing. Over the years we have gathered a lot of evidence showing how the Anu cultists are collaborating with the enemy. In due time, they will pay for their crimes against humanity.","消息 
发件人：杰克·哈尔森上校（新耶利哥） 
收件人：凤凰点

我想亲自感谢你们提供这条情报。我们所有人都必须清楚所面临的危险。多年来，我们收集了大量证据，显示阿努教派与敌人勾结。到时候，他们将为对人类犯下的罪行付出代价。","MESSAGE
EXPÉDITEUR : Colonel Jack Harlson (Nouvelle-Jéricho)
DESTINATAIRE : Phoenix

Je tiens à vous remercier personnellement d’avoir fourni cette information. Il est crucial que nous comprenions tous les dangers auxquels nous faisons face. Au fil des ans, nous avons rassemblé beaucoup de preuves montrant comment les disciples d’Anu collaborent avec l’ennemi. En temps voulu, ils paieront pour leurs crimes contre l’humanité.","NACHRICHT
Von: Oberst Jack Harlson (Neu-Jericho)
An: Phoenix Point

Ich möchte Ihnen persönlich dafür danken, dass Sie diese Informationen übermittelt haben. Es ist von entscheidender Bedeutung, dass wir alle das Ausmaß der Gefahr begreifen, der wir gegenüberstehen.
Im Laufe der Jahre haben wir umfangreiche Aufklärungsergebnisse konsolidiert, die belegen, dass die Anu-Kultisten mit dem Feind kollaborieren. Zu gegebener Zeit werden sie für ihre Verbrechen gegen die Menschheit zur Rechenschaft gezogen.","","","ВХОДЯЩЕЕ СООБЩЕНИЕ 
ОТ:  Полковник Джек Харлсон (Новый Иерихон) 
КОМУ:  Проект Феникс

Я хотел бы лично поблагодарить вас за эту информацию. Очень важно, чтобы все мы понимали, какая опасность нам грозит. За прошедшие годы мы собрали множество доказательств того, что культисты Ану сотрудничают с врагом. В свое время они заплатят за свои преступления против человечества.","",""
"PROG_LE1_WIN_CHOICE_1_TEXT","Text","","Provide New Jericho with intelligence <i>proving</i> that Anu instigated the Pandoran attack","向新耶利哥提供<i>证明</i>阿努煽动潘多拉体攻击的情报","Fournir à la Nouvelle-Jéricho des renseignements <i>prouvant</i> que les Disciples d’Anu ont provoqués l’attaque des Pandoriens","Stelle Neu-Jericho Informationen zur Verfügung, die <i>beweisen</i>, dass Anu den pandoranischen Angriff angezettelt hat.","","","Предоставить Новому Иерихону сведения, <i>доказывающие</i>, что Последователи Ану спровоцировали нападение Пандоранов","",""
"PROG_LE1_WIN_CHOICE_0_OUTCOME_GENERAL","Text","","MESSAGE 
From: Colonel Jack Harlson (New Jericho) 
To: Phoenix Point 

It has been reported that your organization is in the possession of an armored vehicle stolen from a New Jericho facility that came under heavy attack by Pandorans and unknown human or pseudo-human assailants. 

I'll be looking into this matter personally. 

West is showing great leniency to your organization in the expectation of the role it will play in the delivery of our species. For my part, sometimes I'm not so sure that we need you at all.","消息 
发件人：杰克·哈尔森上校（新耶利哥） 
收件人：凤凰点 

据报道，你们组织拥有一辆从新耶利哥设施偷来的装甲车，该设施遭到潘多拉体和未知人类或类人袭击者的猛烈攻击。

我将亲自调查此事。

韦斯特对你们组织表现出极大宽容，期待你们在拯救我们物种的过程中发挥作用。就我而言，有时我并不确定我们是否真的需要你们。","MESSAGE
EXPÉDITEUR : Colonel Jack Harlson (Nouvelle-Jéricho)
DESTINATAIRE : Phoenix

Il a été rapporté que votre organisation est en possession d’un véhicule blindé volé dans une installation de la Nouvelle-Jéricho qui a été attaquée par des Pandoriens et des assaillants humains ou pseudo-humains inconnus.

Je vais me renseigner personnellement.

West fait preuve d’une grande indulgence à l’égard de votre organisation dans l’attente du rôle qu’elle jouera dans la libération de notre espèce. Pour ma part, parfois je ne suis pas sûr qu’on ait besoin de vous.","NACHRICHT
Von: Oberst Jack Harlson (Neu-Jericho)
An: Phoenix Point

Uns wurde gemeldet, dass sich Ihre Organisation im Besitz eines gepanzerten Fahrzeugs befindet, das aus einer Einrichtung von Neu-Jericho stammt, die unter schwerem Angriff durch Pandoraner sowie unbekannte menschliche oder pseudo-menschliche Angreifer geraten ist.

Ich werde diese Angelegenheit persönlich prüfen. 

West zeigt Ihrer Organisation große Nachsicht in der Erwartung, dass sie eine wichtige Rolle bei der Befreiung unserer Spezies spielen wird. Ich persönlich bin mir manchmal nicht sicher, ob wir Sie überhaupt brauchen.","","","ВХОДЯЩЕЕ СООБЩЕНИЕ 
ОТ:  Полковник Джек Харлсон (Новый Иерихон) 
КОМУ:  Проект Феникс 

Поступило сообщение, что в распоряжении вашей организации находится броневик, угнанный с объекта на Новом Иерихоне, который подвергся мощной атаке Пандоранов и неизвестных человеческих или псевдочеловеческих нападавших. 

Я лично займусь этим вопросом. 

Уэст проявляет большую снисходительность к вашей организации, рассчитывая на то, что она сыграет свою роль в спасении нашего вида. Однако, иногда я не уверен, что вы вообще нам нужны.","",""
"PROG_LE1_WIN_CHOICE_0_TEXT","Text","","Keep the Armadillo","保留犰狳装甲车","Gardez l’Armadillo","Behalte den Armadillo","","","Оставить броневик себе","",""
"PROG_LE1_WIN_TEXT_GENERAL_0","Text","","We succeeded in our mission despite the unexpected appearance of Pandorans on the scene. Now we have to decide on our response to New Jericho.","尽管现场意外出现了潘多拉体，我们还是完成了任务。现在我们必须决定如何回应新耶利哥。","Nous avons réussi notre mission malgré l’apparition inattendue de Pandoriens sur la zone. Maintenant, nous devons décider de notre réponse à la Nouvelle-Jéricho.","Trotz des unerwarteten Auftauchens der Pandoraner haben wir unsere Mission erfolgreich abgeschlossen. Nun müssen wir entscheiden, wie wir auf Neu-Jericho reagieren.","","","Мы успешно справились с заданием, несмотря на неожиданное появление Пандоранов на сцене. Теперь нам предстоит решить, что делать с Новым Иерихоном.","",""
"PROG_LE1_WIN_TITLE","Text","","Playing the Blame Game","推卸责任游戏","Le jeu de la culpabilité","Das Schuldzuschiebespiel","","","Игра в обвинения","",""
"PROG_LE1_MISS_CHOICE_0_TEXT","Text","","START MISSION","开始任务","COMMENCER LA MISSION","MISSION STARTEN","","","НАЧАТЬ МИССИЮ","",""
"PROG_LE1_MISS_CHOICE_1_TEXT","Text","","CANCEL","取消","ANNULER","ABBRECHEN","","","ОТМЕНА МИССИИ","",""
"PROG_LE1_MISS_TEXT_GENERAL_0","Text","","MISSION BRIEFING

We have come up with a simple plan to obtain the NG+ Weapon Systems research without prejudicing our relations with New Jericho or drawing their attention to the value of the data in their possession. 

Your team will be inserted outside the operational perimeter and proceed to the objective on foot. After obtaining a copy of the data, they will steal an armored vehicle from the garrison and make their getaway in it. They will subsequently abandon and destroy the vehicle. We will present the facts to New Jericho as a raid by an unknown third party. As long as we can maintain plausible deniability, our relations with NJ should not be affected.","任务简报

我们制定了一个简单的计划，以在不影响我们与新耶利哥关系且不引起他们对所持数据价值注意的情况下，获取 NG+ 武器系统的研究资料。

你的团队将被投放在作战外围之外，徒步前往目标地点。获取数据副本后，他们将从驻军处偷取一辆装甲车并驾车逃离。随后他们将弃车并摧毁该车辆。我们将向新耶利哥呈现此事为未知第三方的袭击。只要我们能保持合理的否认，我们与新耶利哥的关系不应受到影响。","BRIEFING DE MISSION

Nous avons élaboré un plan simple pour obtenir la recherche sur les systèmes d’armes NG+ sans nuire à nos relations avec la Nouvelle-Jéricho, ni attirer leur attention sur la valeur des données en leur possession.

Votre équipe sera insérée hors du périmètre opérationnel et se dirigera vers l’objectif à pied. Après avoir obtenu une copie des données, ils vont voler un véhicule blindé de la garnison et s'enfuir avec. Ils vont ensuite abandonner et détruire le véhicule. Nous allons présenter les faits à la Nouvelle-Jéricho comme un raid par un tiers inconnu. Tant que nous pouvons maintenir un déni plausible, nos relations avec la Nouvelle-Jéricho ne devraient pas être affectées.","MISSIONSBESCHREIBUNG

Wir haben einen einfachen Plan ausgearbeitet, um an die Forschung der NG+-Waffensysteme zu gelangen, ohne unsere Beziehungen zu Neu-Jericho zu gefährden oder ihre Aufmerksamkeit auf den Wert der Daten zu lenken.

Dein Team wird außerhalb des Einsatzgebiets abgesetzt und rückt zu Fuß zum Ziel vor. Nach dem Sichern einer Kopie der Daten wird es ein gepanzertes Fahrzeug aus der Garnison entwenden und damit fliehen. Anschließend wird das Fahrzeug aufgegeben und zerstört.

Gegenüber Neu-Jericho werden wir den Vorfall als Überfall einer unbekannten dritten Partei darstellen. Solange wir eine plausible Abstreitbarkeit wahren können, sollten unsere Beziehungen zu NJ unbeeinträchtigt bleiben.","","","ЦЕЛИ МИССИИ

Мы разработали простой план по получению исследований компании ""Оружейные системы нового поколения"", не нанося ущерба нашим отношениям с Новым Иерихоном и не обозначая наш интерес к ценности данных, которыми они владеют. 

Ваша группа будет высажена за пределами объекта и отправится к цели пешком. Получив копию данных, они угонят броневик и скроются на нем. Потом они уничтожат машину, чтобы замести следы, а мы представим эти факты Новому Иерихону как налет неизвестной третьей стороны. Если нам удастся не засветиться, наши отношения с Иерихоном не пострадают.","",""
"PROG_LE1_MISS_TITLE","Text","","Grand Theft Auto","大盗行动","Grand Theft Auto","Grand Theft Auto","","","Угон машины","",""
"PROG_LE1_TEXT_GENERAL_0","Text","","Vanadium Co had an R & D division, Next Generation+ Weapon Systems, focused on designing armaments that required as of yet undiscovered technologies, energy sources or materials with impossible tensile strengths or conductivity. 

Though at the time it was deemed little more than a publicity stunt and part of Vanadium's talent retention strategy, we speculate that these weapons could be indeed developed using the materials harnessed by the Ancients.

We have located a New Jericho archive facility harboring the NG+ Weapon Systems research.
","钒公司曾设有一个研发部门，名为下一代+武器系统，专注于设计需要尚未发现的技术、能源或具有不可能的抗拉强度或导电性的材料的武器。

尽管当时这被视为不过是一个公关噱头和钒公司的人才留存策略的一部分，我们推测这些武器确实可能利用先行者所掌握的材料开发。

我们已定位到一个新耶利哥档案设施，藏有 NG+ 武器系统的研究资料。
","Vanadium Co avait une division de R & D, Next Generation+ Weapon Systems, axée sur la conception d’armements qui nécessitaient des technologies, des sources d’énergie ou des matériaux non encore découverts avec des résistances ou une conductivité impossibles.

Bien qu’à l’époque on ait considéré qu’il ne s’agissait que d’un coup de publicité et qu’il faisait partie de la stratégie de rétention des talents de Vanadium, nous supposons que ces armes pourraient être développées en utilisant les matériaux utilisés par les Anciens.

Nous avons localisé une installation d’archives de la Nouvelle-Jéricho abritant la recherche sur les systèmes d’armes NG+.","Vanadium Co. unterhielt eine Forschungs- und Entwicklungsabteilung namens <b>Next Generation+ Waffensysteme</b>, die sich auf die Konstruktion von Waffen konzentrierte, welche bislang unbekannte Technologien, Energiequellen oder Materialien mit unmöglicher Zugfestigkeit oder Leitfähigkeit erforderten.

Zum damaligen Zeitpunkt galt das Projekt kaum mehr als ein PR-Manöver und Teil von Vanadiums Strategie zur Bindung hochqualifizierter Talente. Wir vermuten jedoch, dass diese Waffen mithilfe der Materialien der Uralten tatsächlich realisierbar sein könnten.

Wir haben eine Archiveinrichtung von Neu-Jericho lokalisiert, in der sich die Forschung zu den NG+-Waffensystemen befindet.
","","","У корпорации «Ванадий» был научно-исследовательский филиал «Оружейные системы нового поколения», занимавшийся разработкой вооружений, для которых требовались еще не открытые технологии, источники энергии или материалы с невозможной прочностью на разрыв или проводимостью. 

Хотя в то время это считалось не более чем рекламным трюком и частью стратегии удержания талантов в корпорации «Ванадий», мы предполагаем, что такое оружие действительно могло быть разработано с использованием материалов Древних.

Мы обнаружили архив на территории Нового Иерихона, где хранятся материалы этих исследований.","",""
"OLENA_PUZZLE_OUTCOME","Text","","Yes, apparently Vanadium Co had an R & D division, Next Generation+ Weapon Systems, focused on designing armaments that required as of yet undiscovered technologies, energy sources or materials with impossible tensile strengths or conductivity. 

According to Helena, at the time it was deemed little more than a publicity stunt, but I have a hunch that maybe these weapons could be indeed developed using the exotic materials...

We have located a New Jericho archive facility harboring the NG+ Weapon Systems research, if you deem it worth our efforts, Director.","是的，显然钒公司曾设有一个研发部门，名为下一代+武器系统，专注于设计需要尚未发现的技术、能源或具有不可能的抗拉强度或导电性的材料的武器。

据海伦娜说，当时这被视为不过是一个公关噱头，但我有预感这些武器或许确实可以利用那些奇异材料开发……

我们已定位到一个新耶利哥档案设施，藏有 NG+ 武器系统的研究资料，如果你认为值得我们付出努力，主任。","Oui, apparemment, Vanadium Co possédait une division R&D, Next Generation+ Weapon Systems, spécialisée dans la conception d’armements nécessitant des technologies, des sources d’énergie ou des matériaux encore inconnus, aux résistances mécaniques ou conductivités impossibles.

Selon Helena, à l’époque, cela n’était considéré guère plus qu’un coup de publicité, mais j’ai l’intuition que ces armes pourraient effectivement être développées en utilisant des matériaux exotiques...

Nous avons localisé une installation d’archives de la Nouvelle-Jéricho abritant les recherches sur les NG+ Weapon Systems, si vous jugez que nos efforts en valent la peine, Directeur.","Ja, offenbar unterhielt Vanadium Co. tatsächlich eine Forschungs- und Entwicklungsabteilung namens <b>Next Generation+ Waffensysteme</b>, die sich auf die Konstruktion von Waffen konzentrierte, welche bislang unbekannte Technologien, Energiequellen oder Materialien mit unmöglicher Zugfestigkeit oder Leitfähigkeit erforderten.

Laut Helena galt das Projekt damals kaum mehr als ein PR-Gag. Doch mich beschleicht die unheilvolle Ahnung, dass diese Waffen mithilfe der exotischen Materialien tatsächlich realisierbar sein könnten...

Wir haben eine Archiveinrichtung von Neu-Jericho lokalisiert, in der sich die Forschung zu den NG+-Waffensystemen befindet – wenn du der Meinung bist, dass sie den Aufwand wert ist, Direktor.","","","Да, конечно, у корпорации «Ванадий» был научно-исследовательский филиал, «Оружейные Системы Нового Поколения», который занимался разработкой вооружений требующих еще не открытых технологий источников энергии или материалов с невозможной прочностью на разрыв или проводимостью. 

По словам Хелены, в то время это считалось не более чем рекламным трюком, но у меня есть предположение, что, возможно, такое оружие действительно было разработано с применением Экзотических Материалов.

Если вы сочтете что это стоит наших усилий, Директор, то мы нашли архив на территории Нового Иерихона, где хранятся исследования ОСНП.","",""
"PROG_LE1_TITLE","Text","","Impossible Weapons","不可能的武器","Mystérieuses Armes","Unmögliche Waffen","","","Супер-оружие","",""
"OLENA_PUZZLE_CHOICE","Text","","Weapons? That sounds interesting.","武器？听起来很有趣。","Des armes ? Ça a l’air intéressant.","Waffen? Das klingt interessant.","","","Оружие? Звучит заманчиво...","",""
"OLENA_PUZZLE_TEXT","Text","","Strange… there is nothing like a CPU, nothing like a memory module. I suppose we should have expected that they would be very different from what we could have designed. There must be something here we are not seeing. We should secure and analyze samples of the Living Crystal and of the Protean Mutane as soon as possible.

One more thing: I have been talking to Helena about her time at Vanadium, and she recalls another ""moonshot"" division, charged with designing a new generation of weapon systems.","奇怪……没有类似中央处理器的东西，也没有类似内存模块的东西。我想我们本应预料到它们会与我们设计的完全不同。这里一定有我们未曾察觉的东西。我们应尽快获取并分析活体晶体和变形变异体的样本。

还有一件事：我一直在和海伦娜谈论她在钒公司的经历，她记得另一个“登月计划”部门，负责设计新一代武器系统。","Étrange... il n’y a rien qui ressemble à un CPU, rien qui ressemble à un module mémoire. Je suppose que nous aurions dû nous attendre à ce qu’ils soient très différents de ce que nous aurions pu concevoir. Il doit y avoir quelque chose ici que nous ne voyons pas. Nous devrions sécuriser et analyser des échantillons du Cristal Vivant et du Mutant Protéen dès que possible.

Une autre chose : j’ai parlé avec Helena de son temps chez Vanadium, et elle se souvient d’une autre division “moonshot”, chargée de concevoir une nouvelle génération de systèmes d’armes.","Merkwürdig... nichts, was einer CPU ähnelt, nichts, was man als Speichermodul bezeichnen könnte. Eigentlich hätten wir erwarten müssen, dass diese Systeme völlig anders aufgebaut sind als alles, was wir selbst entwerfen würden.
Hier muss es etwas geben, das wir noch nicht erkennen.

Wir sollten so schnell wie möglich Proben des Lebenden Kristalls und des proteischen Mutans sichern und analysieren.

Noch etwas: Ich habe mit Helena über ihre Zeit bei Vanadium gesprochen. Sie erinnert sich an eine weitere sogenannte „Moonshot“-Abteilung, die mit der Entwicklung einer neuen Generation von Waffensystemen betraut war.","","","Странно... Здесь нет ничего похожего на процессор, ничего похожего на модуль памяти. Полагаю, нам следовало ожидать, что они будут сильно отличаться от наших компьютеров. Должно быть, здесь есть что-то, чего мы не видим. Мы должны как можно скорее получить и проанализировать образцы Живого Кристалла и Белкового Мутагена.

И еще одно: я разговаривала с Хеленой о ее работе в корпорации ""Ванадий"", и она вспомнила, что у там было еще один ""лунный"" филиал, которому было поручено разработка нового поколения систем вооружения.","",""
"PROG_LE0_MISS_CHOICE_2_TEXT","Text","","Ask West to release Dr. Helena","请求韦斯特释放海伦娜博士","Demandez à West de libérer le Dr. Helena","Fordere West auf, Dr. Helena Lewandowski freizulassen","","","Попросить Уэста освободить доктора Хелену","",""
