"Key","Type","Desc","English","Chinese (Simplified)","French","German","Italian","Polish","Russian","Spanish","UI_Tester"
"TFTV_ALL_OPTIONS_TITLE","Text","","SHOW ALL OPTIONS","显示所有选项","AFFICHER TOUTES LES OPTIONS","ALLE EINSTELLUNGEN","","","ПОКАЗАТЬ ВСЕ НАСТРОЙКИ","",""
"TFTV_ALL_OPTIONS_DESCRIPTION","Text","","Show all the options.","显示所有选项。","Afficher toutes les options.","Zeige alle Einstellungen.","","","Показывает все настройки мода","",""
"TFTV_SCAVENGING_OPTIONS_TITLE","Text","","SHOW SCAVENGING SITES OPTIONS (ON NEW GAME ONLY)","显示搜刮地点选项（仅限新游戏）","AFFICHER LES OPTIONS DES SITES DE RÉCUPÉRATION","BEUTEZÜGE ANPASSEN (NEUE SPIELE)","","","ПОКАЗАТЬ НАСТРОЙКИ РУИН (ДЛЯ НОВОЙ ИГРЫ)","",""
"TFTV_SCAVENGING_OPTIONS_DESCRIPTION","Text","","Show additional options for number and type of scavenging sites in game world.","显示游戏世界中搜刮地点数量和类型的附加选项。","(NOUVELLE PARTIE UNIQUEMENT) Affiche des options supplémentaires concernant le nombre et le type de sites de récupération.","Einstellungen für Anzahl und Art der Beutestätten im Spiel.","","","Показывает дополнительные настройки количества и типов руин (сбор ресурсов, спасение людей, поиск машин) в игровом мире","",""
"TFTV_TACTICAL_OPTIONS_TITLE","Text","","SHOW OPTIONS FOR TACTICAL","显示战术选项","AFFICHER LES OPTIONS TACTIQUES","TAKTISCHE EINSTELLUNGEN","","","ПОКАЗАТЬ НАСТРОЙКИ ТАКТИЧЕСКОГО РЕЖИМА","",""
"TFTV_TACTICAL_OPTIONS_DESCRIPTION","Text","","Show additional options for the turn based Tactical part of the game.","显示回合制战术部分的附加选项。","Affiche des options supplémentaires pour la partie tactique au tour par tour.","Zusätzliche Einstellungen für den rundenbasierten Taktikteil des Spiels.","","","Показывает дополнительные настройки для тактического (боевого) режима игры","",""
"TFTV_GEOSCAPE_OPTIONS_TITLE","Text","","SHOW OPTIONS FOR GEOSCAPE","显示世界地图选项","AFFICHER LES OPTIONS DU GEOSCAPE","GEOSCAPE-EINSTELLUNGEN","","","ПОКАЗАТЬ НАСТРОЙКИ ПЛАНЕТАРНОГО РЕЖИМА","",""
"TFTV_GEOSCAPE_OPTIONS_DESCRIPTION","Text","","Show additional options for the strategic (or Geoscape) part of the game.","显示战略（或世界地图）部分的附加选项。","Affiche des options supplémentaires pour la partie stratégique (Géoscape).","Zusätzliche Einstellungen für den strategischen (oder Geoscape) Teil des Spiels.","","","Показывает дополнительные настройки для стратегического (планетарного) режима игры","",""
"TFTV_MISC_OPTIONS_TITLE","Text","","SHOW OTHER OPTIONS","显示其他选项","AFFICHER LES AUTRES OPTIONS","WEITERE EINSTELLUNGEN","","","ПОКАЗАТЬ ПРОЧИЕ НАСТРОЙКИ","",""
"TFTV_MISC_OPTIONS_DESCRIPTION","Text","","Show minor options and adjustments.","显示次要选项和调整。","Affiche les options et réglages mineurs.","Kleinere Einstellungen und Anpassungen.","","","Показывает мелкие настройки и регулировки","",""
"TFTV_ADDITIONAL_START_OPTIONS_TITLE","Text","","SHOW ADDITIONAL START OPTIONS","显示额外的开始选项","AFFICHER LES OPTIONS DE DÉPART SUPPLÉMENTAIRES","STARTEINSTELLUNGEN <color=#a020f0>(AUTOMATISCH)</color>","","","ПОКАЗАТЬ НАСТРОЙКИ ПРИ НАЧАЛЕ НОВОЙ ИГРЫ","",""
"TFTV_ADDITIONAL_START_DESCRIPTION","Text","","Show more options that can only be changed on starting a new game.","显示只能在新游戏开始时更改的更多选项。","Affiche davantage d’options qui ne peuvent être modifiées qu’en début de partie.","Einstellungen, die nur beim Start eines neuen Spiels geändert werden können.","","","Показывает настройки, доступные только при старте новой игры","",""
"TFTV_ANYTIME_OPTIONS_TITLE","Text","","SHOW OPTIONS THAT CAN BE CHANGED ANYTIME","显示可随时更改的选项","AFFICHER LES OPTIONS MODIFIABLES À TOUT MOMENT","JEDERZEIT ÄNDERBARE EINSTELLUNGEN","","","ПОКАЗАТЬ ИЗМЕНЯЕМЫЕ В ЛЮБОЕ ВРЕМЯ НАСТРОЙКИ","",""
"TFTV_ANYTIME_OPTIONS_DESCRIPTION","Text","","Show options that can also be changed any time in the Mod config tab.","显示也可以在 Mod 配置标签中随时更改的选项。","Affiche les options modifiables à tout moment dans l’onglet Config Mods.","Einstellungen anzeigen, die jederzeit im Mod-Konfigurations-Tab geändert werden können.","","","Показывает настройки, которые можно менять в любое время игры в меню мода","",""
"TFTV_DIFFICULTY_ROOKIE_TITLE","Text","","STORY MODE","剧情模式","MODE HISTOIRE","ERZÄHLUNG","","","КАК КНИЖКУ ПРОЧИТАТЬ","",""
"TFTV_DIFFICULTY_ROOKIE_DESCRIPTION","Text","","Life is hard enough already; games don't have to be.","生活已经够艰难了；游戏不必如此。","La vie est assez dure comme ça ; les jeux ne devraient pas l’être.","Das Leben ist schon schwer genug, Spiele müssen es nicht auch noch sein.","","","Жизнь и так - штука тяжелая, почему бы просто не поиграть в свое удовольствие (самый простой режим игры)","",""
"TFTV_DIFFICULTY_ETERMES_TITLE","Text","","ELDRITCH","古神模式","ELDRITCH","ELDRITCH","","","ПОЛНОЕ БЕЗУМИЕ","",""
"TFTV_DIFFICULTY_ETERMES_DESCRIPTION","Text","","<color=#c41f23>WARNING: FOR THE LOVE OF CTHULHU, STAY AWAY!</color> 
UNFAIR difficulty. Don't complain about BALANCE, there is NONE. 
We only accept complaints if you are not SUFFERING enough.","<color=#c41f23>警告：为了克苏鲁之名，敬而远之！</color> 
极端难度。不要抱怨平衡性，因为根本没有平衡。 
只有当你觉得不够痛苦时，我们才接受抱怨。","<color=#c41f23>ATTENTION : PAR L'AMOUR DE CTHULHU, FUYEZ !</color>
Difficulté INJUSTE. Ne vous plaignez pas de l'ÉQUILIBRAGE, il n'y en a AUCUN.
Nous n'acceptons les réclamations que si vous ne SOUFFREZ pas assez.","Der Schmerz! Der Horror! Lasst die Schleusen der Verzweiflung brechen!

<color=#c41f23>UNFAIRER Schwierigkeitsgrad. Beschwere dich nicht über die BALANCE, es gibt KEINE. Beschwerden werden nur akzeptiert, wenn du noch nicht genug LEIDEST.</color>","","","Боль! Ужас! Страдания!

НЕВЕРОЯТНАЯ сложность. Не жалуйтесь на БАЛАНС, его НЕ СУЩЕСТВУЕТ. Мы принимаем жалобы только в том случае, если вам все еще МАЛО!","",""
"TFTV_PROMO_SKINS","Text","","Adds a bunch of differently-skinned free armors and guns at the start of the game, making it considerably easier.","游戏开始时添加一批不同皮肤的免费护甲和武器，大大降低游戏难度。","Ajoute un ensemble d’armures et d’armes gratuites avec différents skins au début du jeu, rendant la partie nettement plus facile.","Kostenlose Rüstungen und Waffen mit unterschiedlichen Skins beim Spielstart, die das Spiel deutlich erleichtern.","","","Добавляет в начале игры кучу разных бесплатных бронежилетов и единиц оружия с уникальными скинами, что значительно облегчает игру","",""
"Opening Screen/KEY_DLC_ACTIVATE","Text","","ADDITIONAL OPTIONS ON NEW GAME START","新游戏开始时的额外选项","OPTIONS SUPPLÉMENTAIRES DU DÉBUT DE PARTIE","ZUSÄTZLICHE EINSTELLUNGEN","","","НАСТРОЙКИ ПРИ НАЧАЛЕ НОВОЙ ИГРЫ","",""
"UNBUFFED","Text","","UNBUFFED","未强化","SANS BONUS","<color=#a020f0>NORMAL</color>","","","ОБЫЧНЫЙ","",""
"BUFFED","Text","","BUFFED","已强化","AVEC BONUS","VERSTÄRKT","","","УСИЛЕННЫЙ","",""
"RANDOM","Text","","RANDOM","随机","ALÉATOIRE","ZUFÄLLIG","","","СЛУЧАЙНЫЙ","",""
"KEY_StartingSquad","Text","","STARTING SQUAD","初始小队","ESCOUADE DE DÉPART","STARTEINSATZTEAM","","","СТАРТОВЫЙ ОТРЯД","",""
"KEY_StartingSquad_DESCRIPTION ","Text","","You can choose to get a squad with random identities (as in Vanilla without doing the tutorial), the Vanilla tutorial starting squad (with higher stats), or a squad that will include Sophia Brown and Jacob with unbuffed stats (default on TFTV). Note that Jacob is a sniper, as in the title screen :)","你可以选择获得一个随机身份的小队（如原版未做教程时），原版教程初始小队（属性更高），或者包含索菲亚·布朗和雅各布且属性未强化的小队（TFTV默认）。注意雅各布是狙击手，就像标题画面中一样 :)","Vous pouvez choisir d'obtenir une escouade aux identités aléatoires (comme dans le jeu de base sans le tutoriel), l'escouade de départ du tutoriel original (avec des statistiques améliorées), ou une escouade incluant Sophia Brown et Jacob avec des statistiques non buffées (option par défaut sur TFTV). Notez que Jacob est un tireur d'élite, comme sur l'écran titre :)","Du kannst ein Einsatzteam mit zufälligen Identitäten (wie im Basisspiel ohne Tutorial), das Einsatzteam aus dem Tutorial (mit besseren Werten) oder ein Einsatzteam mit <color=#a020f0>Sophia Brown & Jacob</color> mit Standardwerten wählen (die empfohlene TFTV-Erfahrung). Beachte, dass Jacob ein Scharfschütze ist, wie im Titelbildschirm :)","","","Вы можете выбрать СЛУЧАЙНЫЙ отряд (ванильный, без прохождения обучения), УСИЛЕННЫЙ отряд из ванильного обучения (с более высокими характеристиками) или команду, в которую войдут София Браун и Джейкоб с ОБЫЧНЫМИ характеристиками (по умолчанию в TFTV). Обратите внимание, что Джейкоб - снайпер, как и нарисовано на заставке :)","",""
"Vanilla_Random","Text","","Vanilla Random","原版随机","Aléatoire Vanilla","Zufällig (Basisspiel)","","","Случайно (как в ванили)","",""
"Random","Text","","Random (ALL bases included)","随机（包含所有基地）","Aléatoire (toutes les bases incluses)","Zufällig (ALLE Basen)","","","Случайно (из всех баз)","",""
"Antarctica","Text","","Antarctica","南极洲","Antarctique","Antarktis","","","Антарктика","",""
"Asia","Text","","Asia (China)","亚洲（中国）","Asie (Chine)","Asien (China)","","","Азия (Китай)","",""
"Australia","Text","","Australia","澳大利亚","Australie","Australien","","","Австралия","",""
"Central_America","Text","","Central America (Honduras)","中美洲（洪都拉斯）","Amérique centrale (Honduras)","Mittelamerika (Honduras)","","","Центральная Америка (Гондурас)","",""
"East_Africa","Text","","East Africa (Ethiopia)","东非（埃塞俄比亚）","Afrique de l’Est (Éthiopie)","Ostafrika (Äthiopien)","","","Восточная Африка (Эфиопия)","",""
"Eastern_Europe","Text","","Eastern Europe (Ukraine)","东欧（乌克兰）","Europe de l’Est (Ukraine)","Osteuropa (Ukraine)","","","Восточная Европа (Украина)","",""
"Greenland","Text","","Greenland","格陵兰","Groenland","Grönland","","","Гренландия","",""
"Middle_East","Text","","Middle East (Afghanistan)","中东（阿富汗）","Moyen-Orient (Afghanistan)","Naher Osten (Afghanistan)","","","Ближний Восток (Афганистан)","",""
"North_Africa","Text","","North Africa (Algeria)","北非（阿尔及利亚）","Afrique du Nord (Algérie)","Nordafrika (Algerien)","","","Северная Африка (Алжир)","",""
"Alaska","Text","","North America (Alaska)","北美（阿拉斯加）","Amérique du Nord (Alaska)","Nordamerika (Alaska)","","","Северная Америка (Аляска)","",""
"Mexico","Text","","North America (Mexico)","北美（墨西哥）","Amérique du Nord (Méxique)","Nordamerika (Mexiko)","","","Северная Америка (Мехико)","",""
"Quebec","Text","","North America (Quebec)","北美（魁北克）","Amérique du Nord (Québec)","Nordamerika (Quebec)","","","Северная Америка (Квебек)","",""
"Siberia","Text","","Northern Asia (Siberia)","北亚（西伯利亚）","Asie du Nord (Sibérie)","Nordasien (Sibirien)","","","Северная Азия (Сибирь)","",""
"South_Africa","Text","","South Africa (Zimbabwe)","南非（津巴布韦）","Afrique australe (Zimbabwe)","Südafrika (Simbabwe)","","","Южная Африка (Зимбабве)","",""
"Bolivia","Text","","South America (Bolivia)","南美洲（玻利维亚）","Amérique du Sud (Bolivie)","Südamerika (Bolivien)","","","Южная Америка (Боливия)","",""
"Tierra_de_Fuego","Text","","South America (Tierra de Fuego)","南美洲（火地岛）","Amérique du Sud (Tierra del Fuego)","Südamerika (Feuerland)","","","Южная Америка (Огненная Земля)","",""
"Southeast_Asia","Text","","Southeast Asia (Cambodia)","东南亚（柬埔寨）","Asie du Sud-Est (Cambodge)","Südostasien (Kambodscha)","","","Юго-Восточная Азия (Камбоджа)","",""
"West_Africa","Text","","West Africa (Ghana)","西非（加纳）","Afrique de l’Ouest (Ghana)","Westafrika (Ghana)","","","Западная Африка (Гана)","",""
"KEY_StartingBase","Text","","STARTING BASE LOCATION","起始基地位置","EMPLACEMENT DE DÉPART","STANDORT STARTBASIS","","","МЕСТО СТАРТОВОЙ БАЗЫ","",""
"KEY_StartingBase_DESCRIPTION","Text","","Select your starting base. You can choose a specific location to start from. Please note that some locations are harder to start from than others!","选择你的起始基地。你可以选择一个特定的位置开始。请注意，有些位置比其他位置更难起步！","Sélectionnez votre base de départ. Vous pouvez choisir un emplacement précis pour commencer. Notez que certains emplacements sont plus difficiles que d’autres pour débuter !","Startort wählen, um einen bestimmten Ort als Ausgangspunkt zu wählen. Bitte beachten, dass manche Orte schwieriger zu erreichen sind als andere!","","","Выберите стартовую базу. Вы можете выбрать конкретное место для начала игры. Пожалуйста, обратите внимание, что с некоторых мест стартовать сложнее, чем с других!","",""
"KEY_StartingFaction","Text","","FACTION BACKGROUND","派系背景","HISTORIQUE DE LA FACTION","HINTERGRUND","","","ФРАКЦИЯ","",""
"KEY_StartingFaction_DESCRIPTION","Text","","You can choose a different faction background. If you do, one of your Assaults and your starting Heavy on Legend and Hero, Assault on Veteran, or Sniper on Rookie will be replaced by an operative of the elite class of the Faction of your choice. You will also get the corresponding faction technology once the faction researches it.","你可以选择不同的派系背景。如果选择，传奇和英雄难度下你的一个突击兵和起始重装兵，老兵难度下的突击兵，或新手难度下的狙击手将被你选择的派系精英干员替代。一旦该派系研究了对应科技，你也将获得该派系的相应科技。","Vous pouvez choisir une origine de faction différente. Si vous le faites, l'une de vos Unités d'assaut ainsi que votre Mastodonte de départ en difficulté Légende et Héros, votre unité d'assaut en Vétéran, ou votre Tireur d'élite en Recrue sera remplacé par un agent de la classe d'élite de la faction choisie. Vous obtiendrez également la technologie de faction correspondante une fois que celle-ci aura été recherchée par la faction.","Startfraktion nun wählbar.

Eliteklassen der gewählten Fraktion ersetzen einzelne Starteinheiten:
Grünschnabel (Scharfschütze), Veteran (Sturm), Held/Legende (Sturm + Schwer).

Fraktionstechnologien nach Erforschung verfügbar.","","","Вы можете выбрать другую фракцию. Если вы это сделаете, то один из ваших Штурмовиков и ваш стартовый Тяжелый штурмовик (на сложности ""Легенда"" и ""Герой""), Штурмовик (на сложности ""Ветеран""), Снайпер (на сложности ""Новичок"") будут заменены на элитных бойцов вашей фракции. Вы также получите соответствующую технологию фракции, как только фракция ее исследует","",""
"KEY_ScavSites_DESCRIPTION","Text","","Total number of scavenging sites generated on game start, not counting overgrown sites. (Vanilla: 16, TFTV default 8, because Ambushes generate additional resources).","游戏开始时生成的拾荒地点总数，不包括被植物覆盖的地点。（原版：16，TFTV 默认8，因为伏击会生成额外资源）。","Nombre total de sites de récupération générés au début de la partie, sans compter les sites envahis. (Vanilla : 16, par défaut dans TFTV : 8, car les embuscades génèrent des ressources supplémentaires).","Gesamtzahl der zu Spielbeginn generierten Beutestätten, ohne überwucherte Orte mitzuzählen. (Basisspiel: 16, TFTV-Standard 8 - da Hinterhalte zusätzliche Ressourcen generieren).","","","Общее количество руин, созданных в начале игры, не считая ""заросших"" (появляются в игре позже). В ванильной игре: 16, в TFTV по умолчанию: 8, так как здесь больше засад, а где засады - там дополнительные ресурсы","",""
"YES","Text","","ON","开启","Activé","<color=#13c233>AN</color>","","","ДА","",""
"NO","Text","","OFF","关闭","Désactivé","AUS","","","НЕТ","",""
"KEY_LimitedCapture_DESCRIPTION","Text","","Play with game mechanics that set a limit to how many Pandorans you can capture per mission.","游戏机制限制每次任务中可捕获的潘多拉体数量。","Jouez avec des mécaniques de jeu qui imposent une limite au nombre de Pandoriens que vous pouvez capturer par mission.","Experimentiere mit Spielmechaniken, die die Anzahl der Pandoraner begrenzt, die pro Mission gefangengenommen werden können.","","","Установить ограничение на количество Пандоранов, которое вы можете захватить за миссию","",""
"KEY_LimitedHarvesting_DESCRIPTION","Text","","Play with game mechanics that make obtaining food or mutagens from captured Pandorans harder.","游戏机制使从捕获的潘多拉体中获取食物或变异素更加困难。","Jouez avec des mécaniques de jeu qui rendent plus difficile l’obtention de nourriture ou de mutagènes à partir des Pandoriens capturés.","Experimentiere mit Spielmechaniken, die es erschweren, Nahrung oder Mutagene von gefangenen Pandoranern zu erhalten.","","","Усложнить добычу еды и мутагенов из захваченных Пандоранов","",""
"KEY_LimitedHarvesting","Text","","LIMITED HARVESTING","限制采集","RÉCOLTE LIMITÉE","<color=#a020f0>BEGRENZTES ERNTEN</color>","","","ОГРАНИЧЕННАЯ ДОБЫЧА","",""
"KEY_LimitedCapture","Text","","LIMITED CAPTURING","限制捕获","CAPTURE LIMITÉE","<color=#a020f0>BEGRENZTE EINDÄMMUNG</color>","","","ОГРАНИЧЕННЫЙ ЗАХВАТ В ПЛЕН","",""
"KEY_ScavSites","Text","","SCAVENGING SITES #","拾荒地点 #","SITES DE RÉCUPÉRATION #","ANZAHL DER BEUTESTÄTTEN","","","РУИНЫ","",""
"HIGH","Text","","HIGH","高","ÉLEVÉ","HOCH","","","ВЫСОКИЙ","",""
"MEDIUM","Text","","MEDIUM","中","MODÉRÉ","MITTEL","","","СРЕДНИЙ","",""
"LOW","Text","","LOW","低","FAIBLE","NIEDRIG","","","НИЗКИЙ","",""
"NONE","Text","","NONE","无","AUCUN","KEINE","","","НЕТ","",""
"KEY_ResCratePriority_DESCRIPTION","Text","","In Vanilla and default TFTV, resource crate scavenging sites are much more likely to spawn than either vehicle or personnel rescues. You can modify the relative chances of each type of scavenging site being generated. Choose none to have 0 scavenging sites of this type (for reference, high/medium/low ratio is 6/4/1).","在原版和默认的来自虚空的恐惧（TFTV）中，资源箱搜刮地点比车辆或人员救援地点更容易生成。你可以修改每种搜刮地点生成的相对概率。选择无则该类型搜刮地点数量为0（参考高/中/低比例为6/4/1）。","Dans le jeu vanilla comme dans la configuration par défaut de TFTV, les sites de récupération de caisses ont bien plus de chances d’apparaître que les missions de récupération de véhicules ou de sauvetage.","Im Basisspiel und der Standardversion von TFTV erscheinen Rohstoffkisten bei Beutezügen deutlich häufiger als Fahrzeug- oder Personenrettungen. Die Wahrscheinlichkeit für jeden Typ von Beutestätte ist anpassbar. Die Auswahl „Keine“ erzeugt 0 Beutestätten dieses Typs (zur Information: Das Verhältnis hoch/mittel/niedrig ist 6/4/1).","","","В ванильной игре и стандартном TFTV, руины с ресурсными ящиками генерируются гораздо чаще, чем руины с миссиями по спасению бойцов и поиску машин. Можно изменить шанс генерации каждого типа руин: «высокий/средний/низкий/нет» означает 6/4/1/0 руин","",""
"KEY_RecruitsPriority_DESCRIPTION","Text","","In Vanilla and default TFTV, resource crate scavenging sites are much more likely to spawn than either vehicle or personnel rescues. You can modify the relative chances of each type of scavenging site being generated. Choose none to have 0 scavenging sites of this type (for reference, high/medium/low ratio is 6/4/1).","在原版和默认的来自虚空的恐惧（TFTV）中，资源箱搜刮地点比车辆或人员救援地点更容易生成。你可以修改每种搜刮地点生成的相对概率。选择无则该类型搜刮地点数量为0（参考高/中/低比例为6/4/1）。","Dans le jeu vanilla comme dans la configuration par défaut de TFTV, les sites de récupération de caisses ont bien plus de chances d’apparaître que les missions de récupération de véhicules ou de sauvetage.","Im Basisspiel und der Standardversion von TFTV erscheinen Rohstoffkisten bei Beutezügen deutlich häufiger als Fahrzeug- oder Personenrettungen. Die Wahrscheinlichkeit für jeden Typ von Beutestätte ist anpassbar. Die Auswahl „Keine“ erzeugt 0 Beutestätten dieses Typs (zur Information: Das Verhältnis hoch/mittel/niedrig ist 6/4/1).","","","В ванильной игре и стандартном TFTV, руины с ресурсными ящиками генерируются гораздо чаще, чем руины с миссиями по спасению бойцов и поиску машин. Можно изменить шанс генерации каждого типа руин: «высокий/средний/низкий/нет» означает 6/4/1/0 руин","",""
"KEY_VehiclePriority_DESCRIPTION","Text","","In Vanilla and default TFTV, resource crate scavenging sites are much more likely to spawn than either vehicle or personnel rescues. You can modify the relative chances of each type of scavenging site being generated. Choose none to have 0 scavenging sites of this type (for reference, high/medium/low ratio is 6/4/1).","在原版和默认的来自虚空的恐惧（TFTV）中，资源箱搜刮地点比车辆或人员救援地点更容易生成。你可以修改每种搜刮地点生成的相对概率。选择无则该类型搜刮地点数量为0（参考高/中/低比例为6/4/1）。","Dans le jeu vanilla comme dans la configuration par défaut de TFTV, les sites de récupération de caisses ont bien plus de chances d’apparaître que les missions de récupération de véhicules ou de sauvetage.","Im Basisspiel und der Standardversion von TFTV erscheinen Rohstoffkisten bei Beutezügen deutlich häufiger als Fahrzeug- oder Personenrettungen. Die Wahrscheinlichkeit für jeden Typ von Beutestätte ist anpassbar. Die Auswahl „Keine“ erzeugt 0 Beutestätten dieses Typs (zur Information: Das Verhältnis hoch/mittel/niedrig ist 6/4/1).","","","В ванильной игре и стандартном TFTV, руины с ресурсными ящиками генерируются гораздо чаще, чем руины с миссиями по спасению бойцов и поиску машин. Можно изменить шанс генерации каждого типа руин: «высокий/средний/низкий/нет» означает 6/4/1/0 руин","",""
"KEY_VehiclePriority","Text","","VEHICLE PRIORITY","车辆优先","PRIORITÉ VÉHICULE","PRIORITÄT FAHRZEUGE","","","ПОИСК МАШИН","",""
"KEY_RecruitsPriority","Text","","RECRUITS PRIORITY","招募优先","PRIORITÉ RECRUES","PRIORITÄT REKRUTEN","","","СПАСЕНИЕ БОЙЦОВ","",""
