"Key","Type","Desc","English","Chinese (Simplified)","French","German","Italian","Polish","Russian","Spanish","UI_Tester"
"KEY_SY_SHINOBI_BIO_LEGS_DESCRIPTION","Text","","Synedrion Anti-detection Legs Augmentation","平衡议会反侦测腿部义体","Module jambes Synedrion : anti-détection","Anti-Detektions-Beinaugmentation (Synedrion)","","","Аугментация «Ноги-ниндзя» Синедриона","",""
"KEY_SY_SHINOBI_BIO_LEGS_LONG_DESCRIPTION","Text","","Designed for silent running, the Mirage legs allow soldiers to run through observed areas unnoticed without worrying about enemy Overwatch.","为静音奔跑设计，幻影腿允许士兵在被观察区域内悄无声息地奔跑，无需担心敌方警戒。","Conçues pour la course silencieuse, les jambes Mirage permettent aux agents de traverser des zones surveillées sans être détectés, sans craindre la surveillance ennemie.","Für lautlose Bewegung konzipiert, ermöglichen die Mirage-Beine Einheiten, überwachte Bereiche unbemerkt zu durchqueren, ohne feindliche Überwachung auszulösen.","","","Созданные для бесшумного бега, «Ноги-ниндзя» позволяют бойцам незаметно пробегать под носом у врагов, находящихся в режиме наблюдения, не опасаясь перехвата.","",""
"KEY_SY_SHINOBI_BIO_LEGS_NAME2","Text","","Mirage Legs","幻影腿","Jambes Mirage","Mirage-Beine","","","Ноги-ниндзя","",""
"KEY_SY_SHINOBI_BIO_TORSO_DESCRIPTION","Text","","Synedrion Melee Proficient Torso Augmentation","平衡议会近战精通躯干义体","Module torse Synedrion : combat rapproché","Nahkampf-Rumpfaugmentation (Synedrion)","","","Аугментация «Корпус-ниндзя» Синедриона","",""
"KEY_SY_SHINOBI_BIO_TORSO_LONG_DESCRIPTION","Text","","The Vengeance torso augmentation focuses on close combat efficiency, combining reflex enhancers and vital spot targeting assistance. This also allows soldiers to wield melee weapons effectively without prior training.","复仇躯干义体专注于近战效率，结合了反射增强器和关键部位瞄准辅助。这也使士兵能够在无先前训练的情况下有效使用近战武器。","L’augmentation du torse Vengeance est axée sur l’efficacité au combat rapproché, combinant des amplificateurs de réflexes et une assistance au ciblage des points vitaux. Elle permet également aux agents de manier efficacement les armes de mêlée sans formation préalable.","Die Vengeance-Rumpfaugmentation ist auf Effizienz im Nahkampf ausgelegt und kombiniert Reflexverstärker mit Zielhilfen zur Erkennung vitaler Trefferzonen. Dadurch können Einheiten Nahkampfwaffen auch ohne vorherige Ausbildung effektiv einsetzen.","","","«Корпус-ниндзя» сочетает в себе усилители рефлексов и автонаведение в уязвимые точки, что позволяет бойцам эффективно владеть оружием ближнего боя без предварительной подготовки.","",""
"KEY_SY_SHINOBI_BIO_TORSO_NAME2","Text","","Vengeance Torso","复仇躯干","Torse Vengeance","Vengeance-Rumpf","","","Корпус-ниндзя","",""
"KEY_MUTATION_PART_HEAD_ARMORED_LONG_DESCRIPTION","Text","","Developed through Arthron DNA modification, the mutation grants 30 head armor and full daze immunity. Additional +1 to Strength","通过Arthron（Arthron）DNA改造开发，该变异赋予30点头部护甲和完全的眩晕免疫。额外+1力量。","Développée par modification de l’ADN d’Arthron, cette mutation confère 30 d’armure crânienne et une immunité totale à l’étourdissement. +1 supplémentaire en Puissance.","Durch Modifikation von Arthron-DNA entwickelt, verleiht diese Mutation 30 Kopfrüstung sowie vollständige Immunität gegen Benommenheit. Zusätzlich +1 auf Stärke.","","","Мутация, полученная в результате модификации ДНК Артрона, дает 30 единиц брони голове и полную невосприимчивость к оглушения. Увеличивает силу на 1","",""
"KEY_MUTATION_PART_HEAD_PERCEPTOR_LONG_DESCRIPTION","Text","","Based on Scylla DNA samples, the mutation enhances the senses, increasing Perception by 8 and Accuracy by 10%.","基于斯库拉（Scylla）DNA样本，该变异增强感官，提升8点感知和10%精准。","Basée sur des échantillons d’ADN de Scylla, cette mutation améliore les sens, augmentant la Perception de 8 et la Précision de 10 %.","Basierend auf Scylla-DNA-Proben verstärkt diese Mutation die Sinne und erhöht Wahrnehmung um 8 sowie Genauigkeit um 10%.","","","Мутация основана на образцах ДНК Сциллы. Обостряет чувства, увеличивая восприятие на 8 и точность на 10%","",""
"KEY_MUTATION_PART_HEAD_RESISTOR_LONG_DESCRIPTION","Text","","Engineered through Siren gene modification, the mutation offers Poison and Virus resistance, while also increasing Willpower by +2.","通过塞壬（Siren）基因改造设计，该变异提供毒素和病毒抗性，同时增加+2意志力。","Obtenue par modification génétique du gène Siren, cette mutation confère une résistance au Poison et aux Virus, tout en augmentant la Volonté de +2.","Durch Modifikation von Sirenen-Genen entwickelt, verleiht diese Mutation Resistenz gegen Gift und Virus und erhöht die Willenskraft um +2.","","","Мутация, созданная путем модификации генов Сирены, обеспечивает устойчивость к ядам и вирусам, а также увеличивает Силу Воли на 2","",""
"KEY_MUTATION_PART_LEG_AGILE_LONG_DESCRIPTION","Text","","Modified based on Arthron DNA, the mutation grants superior Speed as well as goo immunity and the ability to jump up one storey.","基于Arthron（Arthron）DNA改造，该变异赋予卓越速度、黏液免疫以及跳跃一层楼的能力。","Modifiée à partir de l’ADN d’Arthron, cette mutation confère une vitesse supérieure, une immunité au slime et la capacité de sauter d’un étage.","Auf Arthron-DNA basierend verleiht diese Mutation überlegene Geschwindigkeit, Immunität gegen Schleim sowie die Fähigkeit, eine Etage hoch zu springen.","","","Мутация на основе ДНК Артрона, дает превосходную скорость, а также невосприимчивость к слизи и способность прыгать на один этаж вверх","",""
"KEY_MUTATION_PART_LEG_SNEAKER_LONG_DESCRIPTION","Text","","Combining Triton and aquatic DNA, the mutation grants superior stealth and the ability to perform kicks (Sonic Attack will daze target with WP < 15) as well as approach Sentinels without being detected.","结合特里同（Triton）和水生DNA，该变异赋予卓越潜行能力和踢击技能（声波攻击会使意志力低于15的目标眩晕），并能接近哨兵而不被发现。","Combinant l’ADN Triton et aquatique, cette mutation confère une discrétion supérieure et la capacité d’effectuer des coups de pied (l’attaque Sonique étourdit les cibles avec Volonté < 15), tout en permettant d’approcher les Sentinelles sans être détecté.","Durch Kombination von Triton- und aquatischer DNA verleiht diese Mutation überlegene Tarnung sowie die Fähigkeit, Tritte auszuführen (Schallangriff betäubt Ziele mit Willenskraft < 15), und ermöglicht es, sich Wächtern unentdeckt zu nähern.","","","Мутация на основе ДНК Тритона, дает превосходную скрытность, позволяя незаметно приближаться к Стражам, и способность выполнять «Электроудар» (оглушает врагов с Очками Воли менее 15).","",""
"KEY_MUTATION_PART_LEG_STOMPER_LONG_DESCRIPTION","Text","","Created from Chiron DNA, the mutation grants Stomping Attack (Shock Attack affecting a 5-tile radius, dazing targets if shock value > target Hit Points and removes Mist and Fire from the tiles within range). Additional +1 to Strength.","由凯隆（Chiron）DNA创造，该变异赋予践踏攻击（冲击攻击，影响5格半径，若冲击值大于目标生命值则使其眩晕，并移除范围内的迷雾和火焰）。额外+1力量。","Créée à partir de l’ADN de Chiron, cette mutation confère l’attaque Écrasante (attaque électrique affectant un rayon de 5 cases, étourdit les cibles si la valeur électrique est supérieure aux points de vie de la cible et supprime le Brouillard et le Feu des cases dans la zone). +1 supplémentaire en Puissance.","Aus Chiron-DNA erschaffen, verleiht diese Mutation den Stampfangriff (Schockangriff mit 5-Felder-Radius, der Ziele betäubt, wenn der Schockwert die Trefferpunkte des Ziels übersteigt, und Nebel sowie Feuer aus dem Wirkungsbereich entfernt). Zusätzlich +1 auf Stärke.","","","Мутация, созданная из ДНК Хирона, дает способность ""Атака топотом"" (шоковая атака в радиусе 5 клеток, оглушающая цель, если значение шока превышает количество хитов цели). Увеличивает силу на 1","",""
"KEY_MUTATION_PART_PRIEST1_LONG_DESCRIPTION","Text","","Based on DNA from the Synod of Yearning, the mutation restores 2 Will Points to all friendly living entities within 7 tiles at the start of each turn. Additional +4 to Willpower.","基于渴望议会（Synod of Yearning）DNA，该变异在每回合开始时为7格范围内所有友方活体单位恢复2点意志力。额外+4意志力。","Basée sur l’ADN du Synode du Désir, cette mutation restaure 2 points de Volonté à toutes les entités vivantes alliées dans un rayon de 7 cases au début de chaque tour. +4 supplémentaire en Volonté.","Basierend auf DNA des Synods der Sehnsucht stellt diese Mutation zu Beginn jedes Zuges allen verbündeten lebenden Einheiten im Umkreis von 7 Feldern 2 Willenspunkte wieder her. Zusätzlich +4 auf Willenskraft.","","","Мутация на основе ДНК «Синода Возжелания», восстанавливает 2 Очка Воли у всех союзников в радиусе 7 клеток в начале каждого хода. Увеличивает Силу Воли на 4.","",""
"KEY_MUTATION_PART_PRIEST2_LONG_DESCRIPTION","Text","","Created from DNA of from the Blind Legate, the mutation allows a priest to perform Instil Frenzy (increase Speed by 33% and make them immune to panic) on allied characters. Additional +4 to Willpower.","由盲使者（Blind Legate）DNA创造，该变异允许牧师对友方角色施放激励狂暴（提升33%速度并使其免疫恐慌）。额外+4意志力。","Créée à partir de l’ADN du Légat Aveugle, cette mutation permet à un prêtre d’utiliser Instiller la Frénésie (augmente la Vitesse de 33 % et rend immunisé à la panique) sur les alliés. +4 supplémentaire en Volonté.","Aus der DNA des Blinden Legaten erschaffen, ermöglicht diese Mutation einem Priester die Fähigkeit Raserei einflößen (erhöht die Geschwindigkeit um 33% und macht Ziele immun gegen Panik) auf verbündeten Einheiten zu wirken. Zusätzlich +4 auf Willenskraft.","","","Мутация на основе ДНК «Слепого Легата», позволяет жрецу вызывать Иссупление у союзников (скорость +33% и невосприимчивость к панике). Увеличивает Силу Воли на 4.","",""
"KEY_MUTATION_PART_PRIEST3_LONG_DESCRIPTION","Text","","Engineered from the Keeper of the Threshhold’s DNA, the mutation grants Mind Control Immunity and the ability to perform a Psychic Scream (reduces the Will Points of all enemy units in an 8 tile radius by 10). Additional +8 to Willpower.","由门槛守护者的DNA工程改造而成，该变异赋予精神控制免疫能力和施放精神尖啸的能力（在8格半径内减少所有敌方单位10点意志力）。额外增加8点意志力。","Conçue à partir de l’ADN du Gardien du Seuil, cette mutation confère une immunité au contrôle mental et la capacité de lancer un Cri Psychique (réduit de 10 les points de Volonté de toutes les unités ennemies dans un rayon de 8 cases). +8 supplémentaire en Volonté.","Aus der DNA des Hüters der Schwelle entwickelt, verleiht diese Mutation Immunität gegen Gedankenkontrolle sowie die Fähigkeit Psychischer Schrei (reduziert die Willenspunkte aller feindlichen Einheiten im Umkreis von 8 Feldern um 10). Zusätzlich +8 auf Willenskraft.","","","Мутация на основе ДНК «Хранителя Врат», дает иммунитет к контролю над разумом и способность издавать «Психический Вопль» (уменьшает количество Очков Воли на 10 у всех врагов в радиусе 8 клеток). Увеличивает Силу Воли на 8.","",""
"KEY_MUTATION_PART_TORSO_REGEN_LONG_DESCRIPTION","Text","","Based on Arthron DNA, the mutation has regeneration capabilities (restore 10 Hit Points to arms and torso at the end of each turn) and fire resistance. Additional +1 to Strength.","基于ArthronDNA，该变异具备再生能力（每回合结束时恢复手臂和躯干10点生命值）和火焰抗性。额外增加1点力量。","Basée sur l’ADN d’Arthron, cette mutation confère des capacités de régénération (restaure 10 points de vie aux bras et au torse à la fin de chaque tour) et une résistance au feu. +1 supplémentaire en Puissance.","Basierend auf Arthron-DNA verleiht diese Mutation Regenerationsfähigkeiten (stellt am Ende jedes Zuges 10 Trefferpunkte an Armen und Rumpf wieder her) sowie Feuerresistenz. Zusätzlich +1 auf Stärke.","","","Мутация, основанная на ДНК Артрона, дает способность к регенерации (восстанавливает 10 хитов на руках и туловище в конце каждого хода) и огнестойкость. Увеличивает Силу на 1","",""
"KEY_MUTATION_PART_TORSO_SHOOT_LONG_DESCRIPTION","Text","","Created through combination of aquatic DNA, the mutation makes it possible to shoot poisonous darts at short distances. The mutation prevents the use of two-handed weapons.","通过水生DNA组合创造，该变异使得能够在短距离射出毒镖。该变异禁止使用双手武器。","Obtenue par combinaison d’ADN aquatique, cette mutation permet de tirer des fléchettes empoisonnées à courte portée. Elle empêche l’utilisation d’armes à deux mains.","Durch die Kombination aquatischer DNA erschaffen, ermöglicht diese Mutation das Abfeuern giftiger Pfeile auf kurze Distanz. Die Mutation verhindert die Nutzung zweihändiger Waffen.","","","Мутация, созданная путем сочетания ДНК различных водных организмов, позволяет стрелять ядовитыми дротиками на короткие расстояния. Использование двуручного оружия невозможно","",""
"KEY_MUTATION_PART_TORSO_TENTACLE_LONG_DESCRIPTION","Text","","Two pairs of tentacles that retaliate to any proximity attack. Based on electric eel DNA, the tentacles are capable of performing melee attacks that deal Paralyze damage.","两对触手会对任何近身攻击进行反击。基于电鳗DNA，这些触手能够进行造成麻痹伤害的近战攻击。","Deux paires de tentacules qui ripostent à toute attaque de proximité. Basées sur l’ADN d’anguille électrique, elles peuvent effectuer des attaques de mêlée infligeant des dégâts de Paralysie.","Zwei Tentakelpaare, die auf Angriffe aus nächster Nähe reagieren. Basierend auf der DNA des Zitteraals sind die Tentakel in der Lage, Nahkampfangriffe auszuführen, die Lähmungsschaden verursachen.","","","Две пары щупалец, которые отвечают на любую атаку с близкого расстояния и способны выполнять атаки ближнего боя с нанесением парализующего урона. Разработка на основе ДНК электрического угря.","",""
"TFTV_KEY_AC_MACE_NAME","Text","","Reaper","收割者","Reaper","Schnitter","","","ЖНЕЦ","",""
"TFTV_KEY_AC_HEAVY_NAME","Text","","Rebuke","斥责者","Rebuke","Rebuke","","","ДЕЗИНТЕГРАТОР","",""
"TFTV_KEY_AC_SNIPER_NAME","Text","","Scorpion","蝎子","Scorpion","Skorpion","","","СКОРПИОН","",""
"TFTV_KEY_AC_SCYTHE_NAME","Text","","Scyther","镰刀手","Scyther","Sense","","","КОСИЛКА","",""
"TFTV_KEY_AC_SHOTGUN_NAME","Text","","Shard Gun","碎片枪","Shard Gun","Splitter-Schrotflinte","","","ОСКОЛОЧНОЕ РУЖЬЕ","",""
"KEY_KAOSGUNS_AMMO_KS_Obliterator_WeaponDef","Text","","Obliterator Ammo","毁灭者弹药","Munitions Obliterator","Obliterator-AR-Magazin","","","Патроны к Уничтожителю","",""
"KEY_KAOSGUNS_AMMO_DESCRIPTION_KS_Obliterator_WeaponDef","Text","","Obliterator Assault Rifle Magazine","歼灭者突击步枪弹匣","Chargeur Obliterator","AR-Magazin für das Obliterator-Sturmgewehr","","","Магазин к автомату Уничтожитель","",""
"KEY_KAOSGUNS_AMMO_KS_Subjector_WeaponDef","Text","","Subjector Ammo","支配者弹药","Munitions Subjector","Subjector-Munition","","","Патроны к Покорителю","",""
"KEY_KAOSGUNS_AMMO_DESCRIPTION_KS_Subjector_WeaponDef","Text","","Subjector Sniper Rifle Magazine","支配者狙击步枪弹匣","Chargeur Subjector","Subjector-Scharfschützengewehrmagazin","","","Снаряженная обойма к снайперской винтовке Покоритель","",""
"KEY_KAOSGUNS_AMMO_KS_Redemptor_WeaponDef","Text","","Redemptor Ammo","救赎者弹药","Munitions Redemptor","Redeemer-Munition","","","Патроны к Спасителю","",""
"KEY_KAOSGUNS_AMMO_DESCRIPTION_KS_Redemptor_WeaponDef","Text","","Redemptor Shotgun Shells","救赎者霰弹枪弹壳","Cartouches Redemptor","Redemptor-Schrotflintenmunition","","","Боеприпасы к дробовику Спаситель","",""
"KEY_KAOSGUNS_AMMO_KS_Devastator_WeaponDef","Text","","Devastator Ammo","毁灭者弹药","Munitions Devastator","Devastator-Munition","","","Снаряды к Опустошителю","",""
"KEY_KAOSGUNS_AMMO_DESCRIPTION_KS_Devastator_WeaponDef","Text","","Devastator Cannon Shells","毁灭者加农炮弹壳","Obus Devastator","Devastator-Kanonenmunition","","","Боеприпасы к автопушке Опустошитель","",""
"KEY_KAOSGUNS_AMMO_KS_Tormentor_WeaponDef","Text","","Tormentor Ammo","折磨者弹药","Munitions Tormentor","Tormentor-Munition","","","Патроны к Мучителю","",""
"KEY_KAOSGUNS_AMMO_DESCRIPTION_KS_Tormentor_WeaponDef","Text","","Tormentor Handgun Magazine","折磨者手枪弹匣","Chargeur Tormentor","Tormentor-Pistolenmagazin","","","Магазин к пистолету Мучитель","",""
"KEY_EXPENDABLE_ARCHETYPE_FORMER_PX_NAME","Text","","SECURITY","安保","SECURITÉ","SICHERHEIT","","","Бывший охранник","",""
"KEY_EXPENDABLE_ARCHETYPE_FORMER_PX_DESCRIPTION","Text","","This mercenary was employed in the Phoenix Point security detail before the cataclysm, and still proudly carries an older pattern of our gear, now a little worse-for-wear after several years without proper maintenance. When you speak with them they tell you that they had no idea that the project had survived. They are dismissive of suggestions that they join back up with the cause, but mention casually that you would be very welcome to take them on at their standard rates. Plus hazard pay of course.","这名雇佣兵在灾难发生前曾受雇于凤凰点的安保部门，至今仍自豪地穿着我们较旧款式的装备，经过多年缺乏适当维护后，装备已略显破旧。当你与他们交谈时，他们告诉你根本不知道凤凰计划还存活着。他们对加入凤凰计划的建议不屑一顾，但随口提到如果你愿意按标准价格雇佣他们，他们会非常欢迎你。当然，还会有危险津贴。","Ce mercenaire travaillait dans la sécurité du projet Phoenix avant le cataclysme, et porte encore fièrement un ancien modèle de notre équipement, désormais un peu usé après plusieurs années sans entretien approprié. Lorsque vous lui parlez, il vous dit qu’il n’avait aucune idée que le projet avait survécu. Il écarte les suggestions de rejoindre à nouveau la cause, mais mentionne avec décontraction que vous seriez le bienvenu pour l’engager à ses tarifs habituels. Avec, bien sûr, une prime de risque.","Dieser Söldner war vor der Katastrophe im Sicherheitsdienst von Phoenix Point angestellt und trägt noch immer stolz eine ältere Version unserer Ausrüstung, die nach jahrelanger mangelnder Pflege etwas abgenutzt ist. Im Gespräch mit ihm beteuert er, keine Ahnung gehabt zu haben, dass das Projekt überlebt hat. Vorschläge, sich wieder dem Projekt anzuschließen, lehnt er ab, erwähnt aber beiläufig, dass man ihn gerne zu seinem üblichen Tarif einstellen könne. Gefahrenzulage natürlich.","","","Этот наемник работал в службе безопасности Феникс-Пойнт до катаклизма и до сих пор с гордостью носит нашу экипировку старого образца, слегка потрепанную после стольких лет отсутствия надлежащего ухода. Завидев вас, он удивляется, что Проект Феникс еще жив. Он не хочет снова присоединяться Проекту, но вскользь упоминает, что был бы рад поработать с нами за обычный гонорар. Плюс, конечно, надбавки за работу в опасных условиях.","",""
"KEY_EXPENDABLE_ARCHETYPE_FORMER_PX_QUOTE","Text","","<i>“We already tried to save the world once, and everyone I worked with died. It’s naive to think that everything can be overcome with grit and best intentions. Sometimes you just have to escape, survive, and reassess your priorities.”</i>","<i>“我们已经尝试过一次拯救世界，我共事的所有人都死了。认为凭借毅力和良好意愿就能克服一切是天真的。有时候你只能逃离、生存，然后重新评估你的优先事项。”</i>","<i>« Nous avons déjà essayé de sauver le monde une fois, et tous ceux avec qui je travaillais sont morts. C’est naïf de penser que tout peut être surmonté avec du courage et de bonnes intentions. Parfois, il faut juste fuir, survivre et réévaluer ses priorités. »</i>","<i>„Wir haben schon einmal versucht, die Welt zu retten, und alle, mit denen ich zusammengearbeitet habe, sind gestorben. Es ist naiv zu glauben, dass man mit Entschlossenheit und den besten Absichten alles überwinden kann. Manchmal muss man einfach nur fliehen, überleben und seine Prioritäten neu überdenken.“</i>","","","«Однажды мы уже пытались спасти мир, и все, с кем я работал, погибли. Наивно думать, что все можно преодолеть с помощью мужества и хороших намерений. Иногда нужно просто сбежать, выжить и пересмотреть свои приоритеты».","",""
"KEY_EXPENDABLE_ARCHETYPE_SECTARIAN_NAME","Text","","Sectarian (Berserker)","教派狂战士（狂战士）","Fanatique (Berserker)","Sektierer (Berserker)","","","Сектант (Берсерк)","",""
