Key,Type,Desc,English,Chinese (Simplified),French,German,Italian,Polish,Russian,Spanish,UI_Tester
VOID_OMEN_DESCRIPTION_TEXT_13,Text,,"Overhead imagery and field observations confirm our previous suspicions that the Pandorans are using predominantly lower evolution tier creatures to build their colonies, the basic Arthron claw being the main digging utensil. Startlingly, these digging operations have experienced a dramatic increase in number and intensity.",俯視圖像和實地觀察證實了我們先前的懷疑，即潘朵拉人主要使用較低進化層的生物來建立他們的殖民地，基本的阿爾索龍爪是主要的挖掘工具。令人驚訝的是，這些挖掘作業的數量和強度都急劇增加。,"<i>""Ecoutez, les Colonies Pandoriennes ne se créent pas par hasard... Elles suivent un certain modèle ; je ne peux pas vous dire lequel car nous ne le comprenons pas... pour le moment. Mais je peux vous dire que quelque chose a changé.""</i>",,,,"Скорость строительства Пандоранских Колоний снизилась. Они опять копают норы в своем обычном темпе, что дает нам небольшую передышку с учетом текущей интенсивности и количества создаваемых новых колоний.",,
VOID_OMEN_DESCRIPTION_TEXT_14,Text,,"According to recent field reports we have begun experiencing unexplainable shortcomings in our situational awareness during combat operations. Further analysis and experimentation at our research facilities has led us to an unexpected conclusion: this is a species-wide perception reducing effect tied to an unknown neurological condition.  

<i>Have you noticed how things look less substantial these days? Like they were covered in fog, or made of cotton candy. Maybe it's just me.</i>","根據最近的實地報告，我們在戰鬥行動中的態勢感知方面開始遇到無法解釋的缺陷。在我們的研究機構進行的進一步分析和實驗使我們得出了一個意想不到的結論：這是與未知的神經系統疾病相關的全物種感知降低效應。 
 
 <i>你有沒有註意到現在的事情看起來不那麼重要了？就像它們被霧氣覆蓋，或是由棉花糖製成的。也許只有我這樣。",<i>Avez-vous remarqué que les choses ont l'air moins importantes de nos jours ? Comme si elles étaient couvertes de brouillard ou faites de barbe à papa. Peut-être que c'est juste moi.</i>,,,,"Необъяснимые недостатки в ориентировании во время боевых действий, связанные с эффектом снижения восприятия в масштабах всего вида, больше не отмечаются. Наше понимание неизвестного неврологического состояния остается ограниченным, но восприятие бойцов восстанавливается до прежнего стандартного уровня.",,
VOID_OMEN_DESCRIPTION_TEXT_15,Text,,"The number of reports of encounters with psycho-paranormal phenomena is currently peaking. Since we cannot objectively verify the occurrence of these events, we are increasing the frequency of psyche evaluations of all operatives.

<i>Our people are seeing <b>more</b> oil monsters in the field. Not surprisingly the strict adherents of the scientific method among us are explaining this away as our operatives are going <b>more</b> crazy.""</i>","目前，遭遇心理超自然現象的報告數量已達到高峰。由於我們無法客觀地驗證這些事件的發生，因此我們正在增加對所有操作人員進行心理評估的頻率。
 
 <i>我們的人民在油田看到<b>更多</b>個石油怪物。毫不奇怪，我們當中科學方法的嚴格追隨者正在解釋這一點，因為我們的操作人員變得<b>更加</b>瘋狂。","<i>""Nos hommes voient de <b>plus en plus</b> de monstres pétroliers sur le terrain. J'ai hâte que les adeptes de la méthode scientifique expliquent cela par le fait que nos agents deviennent de <b>plus en plus</b> fous.""</i>",,,,"Количество сообщений о встречах с психо-паранормальными явлениями в настоящее время достигло своего пика. Поскольку мы не можем объективно подтвердить факт существования этих событий, мы увеличиваем частоту психиатрических обследований всех сотрудников.

""<i>Наши люди видят все <b>больше</b> нефтяных фиолетовых монстров в боях. Строгие приверженцы научного метода среди нас объясняют это тем, что наши бойцы все больше сходят с ума.</i>""",,
VOID_OMEN_DESCRIPTION_TEXT_16,Text,,We are receiving reports of psycho-paranormal phenomena occurring in areas where no Mist is present. A likely explanation is that it is another manifestation of the mass psychogenic illness or mass hysteria somehow connected to the Oneiric Delirium.,我們收到有關在沒有迷霧的地區發生心理超自然現象的報告。一種可能的解釋是，這是大規模心因性疾病或大規模歇斯底里症的另一種表現，與夢魘譫妄有某種關聯。,<i>Ce n'est pas juste ! Les démons sont censés suivre des règles aussi !</i>,,,,"Мы получаем сообщения о психо-паранормальных явлениях, происходящих в районах, где нет Тумана. Вероятным объяснением является то, что это еще одно проявление массового психогенного заболевания или массовой истерии, каким-то образом связанных с Сонным Безумием.",,
VOID_OMEN_DESCRIPTION_TEXT_17,Text,,"Exploration of havens destroyed by Pandorans typically conform to a scenario of complete destruction of the haven facilities and the physical extermination or kidnapping of all its inhabitants. However, we are receiving reports that havens in areas covered by Mist are suffering a different fate.",對潘朵拉人摧毀的避難所的探索通常符合避難所設施被徹底摧毀以及所有居民被消滅或綁架的場景。然而，我們收到的報告稱，迷霧覆蓋地區的避難所正在遭受不同的命運。,<i>Et si c'était leur but ultime ? Faire de nous tous les marionnettes d'une intelligence extraterrestre ?</i>,,,,"Исследование убежищ, разрушенных Пандоранами, обычно соответствует сценарию полного уничтожения объектов убежища и физического истребления или похищения всех его обитателей. Однако мы получаем сообщения о том, что убежища в районах, покрытых Туманом, постигает иная участь.",,
VOID_OMEN_DESCRIPTION_TEXT_18,Text,,"Our intelligence sources within the factions report that they are mobilizing additional personnel to enhance the havens defense capabilities and reduce their dependence on outside help, most notably the Phoenix Project. We have to look for other sources of resource procurement for the time being.

<i>""To keep the Synedrion dream alive, we must keep our people alive. Join the volunteer militia today! Service guarantees basic alimentary allocation."" </i> - Notice on a public Synedrion feed","我們各派系內部的情報來源報告稱，他們正在動員更多人員來增強避難所的防禦能力，並減少對外部幫助的依賴，尤其是鳳凰計劃。我們暫時還得找其他的資源採購來源。
 
 <i>“為了讓 Synedrion 夢想永存，我們必須讓我們的人民活下去。今天就加入志願民兵吧！服務保證基本的食物分配。” </i> - 關於公共 Synedrion 提要的通知","<i>"" To keep the Synedrion dream alive, we must keep our people alive. Join the volunteer militia today ! Service guarantees basic alimentary allocation."" </i>

- Public notice on a Synedrion feed",,,,"Рост оборонительных возможностей убежищ, чему способствовала усиленная мобилизация фракций, замедлился. Одновременно отмечается снижение зависимости от внешней помощи, в частности, от Проекта Феникс.",,
VOID_OMEN_DESCRIPTION_TEXT_19,Text,,"We have arrived at a troubling conclusion based on recent operational debriefings: the Pandorans seem to possess intelligence regarding our tactics and war doctrine and are physiologically adapting to it on the fly. Our friends at the Bazaar have confirmed that this is a generalized phenomenon and have expressed willingness to assist us in any way they can.

<i>They *know* us. Is it really all that surprsing? We are seeing their nightmares, they learn our tactics.</i>","根據最近的作戰匯報，我們得出了一個令人不安的結論：潘朵拉人似乎擁有有關我們的戰術和戰爭學說的情報，並且在生理上正在快速適應它。我們在義賣市場的朋友已經證實這是一個普遍現象，並表示願意盡其所能地幫助我們。
 
 <i>他們「了解」我們。事情真的有那麼令人驚訝嗎？我們看到了他們的惡夢，他們學習了我們的戰術。","<i>Ils nous ""connaissent"". Est-ce vraiment si surprenant ? Nous voyons leurs cauchemars, ils apprennent nos tactiques.""</i>",,,,"Тревожный феномен усиления адаптивной стойкости Пандоранов к нашей тактике и оружию больше не отмечается. Судя по недавним донесениям, кажется, что адапционный потенциал Пандоранов исчерпан. И кстати, наши партнеры на Рынке вернули цены на товары и услуги к обычному уровню.",,
VOID_OMEN_DESCRIPTION_TEXT_20,Text,,<i>They are always coming up with something new.</i>,<i>他們總是想出一些新東西。,<i>Ils sont toujours en train d'inventer quelque chose de nouveau.</i>,,,,<i> Они вечно придумывают что-то новое.</i>,,
VOID_OMEN_REMOVAL_TEXT_1,Text,,"In the aftermath of heightened hostilities and intensified resource acquisition, the operational landscape gradually reverts to established parameters. The aberrant frequency of ambushes diminishes, returning to standard levels.",在敵對行動加劇和資源取得加劇之後，作戰格局逐漸恢復到既定參數。伏擊的異常頻率減少，恢復到標準水準。,,,,,"После ряда жестких боев за ресурсы оперативная обстановка постепенно возвращается к обычным параметрам. Аномальная частота засад уменьшается, возвращаясь к стандартному уровню.",,
VOID_OMEN_REMOVAL_TEXT_2,Text,,"Following a period characterized by a reduction in political engagement, the populace's interest and involvement in factional dynamics show signs of normalization. Diplomatic challenges resume their standard equilibrium. The ebb and flow of diplomatic interactions return to baseline parameters.",在經歷了政治參與減少的時期之後，民眾對派系動態的興趣和參與顯示出正常化的跡象。外交挑戰恢復了標準平衡。外交互動的潮起潮落回歸到基線參數。,,,,,"После периода, характеризующегося снижением политической активности, интерес населения и его вовлеченность в фракционную динамику демонстрируют признаки нормализации. Дипломатические проблемы возвращаются к своему стандартному равновесию. Взлеты и падения дипломатических взаимодействий возвращаются к исходным параметрам.",,
VOID_OMEN_REMOVAL_TEXT_3,Text,,"The reported increase in feelings of persistent tiredness and increased difficulty in executing strenuous mental or physical tasks has subsided, marking a return to standard operational parameters. We attribute with high confidence the recovery to customary levels of operational efficiency to adjustment in pharmacological and direct-stimulatory therapy. ",據報道，持續疲勞感的增加以及執行繁重的腦力或體力任務的難度增加已經消退，這標誌著恢復到標準操作參數。我們充滿信心地將恢復到正常運作效率水準歸因於藥理學和直接刺激療法的調整。,,,,,"Отмечаемые негативные эффекты (чувство постоянной усталости и неспособность выполнять напряженные умственные или физические задачи) уменьшилось, что свидетельствует о возвращении к стандартным рабочим параметрам. Мы с высокой степенью уверенности связываем восстановление работоспособности до обычного уровня с корректировкой фармакологической и стимулирующей терапии.",,
VOID_OMEN_REMOVAL_TEXT_4,Text,,"The disconcerting trend observed in operative behavior, marked by increased irritability and self-reliance, has abated. Operational cohesion is restored as operatives regain trust in their teammates. The organization returns to its customary level of teamwork and collaborative task execution",在手術行為中觀察到的令人不安的趨勢（以煩躁和自力更生增加為特徵）已經減弱。當操作人員重新獲得對隊友的信任時，操作凝聚力就會恢復。組織恢復到團隊合作和協作任務執​​行的慣常水平,,,,,"Тревожная тенденция в поведении бойцов, характеризующаяся повышенной раздражительностью и уверенностью в себе, уменьшилась. Командная сплоченность восстанавливается по мере того, как бойцы вновь обретают доверие к своим товарищам по оружию. Организация возвращается к привычному уровню командной работы и отрядного выполнения миссий.",,
VOID_OMEN_REMOVAL_TEXT_5,Text,,"The peculiar shift in attitude among Haven defenders, rendering them perpetually hostile, has concluded. Normalcy is restored, and the defenders resume their customary disposition.",避難所捍衛者態度的奇特轉變已經結束，這使得他們永遠充滿敵意。一切恢復正常，守軍也恢復了慣常的部署。,,,,,"Своеобразный сдвиг в поведении защитников убежищ, который делал их постоянно враждебными, прошел сам собой. Нормальная обстановка восстановлена, и защитники возвращаются к своему обычному поведению.",,
VOID_OMEN_REMOVAL_TEXT_6,Text,,"The accelerated evolution observed in Pandoran entities, a response to losses sustained in missions and colonies, has ceased. Concurrently, the augmented research output from the Phoenix Project has returned to standard levels. The intricate dance of adaptation and advancement reaches an equilibrium.",在潘朵拉實體中觀察到的加速進化（這是對任務和殖民地遭受損失的反應）已經停止。同時，鳳凰計畫的增強研究成果已恢復到標準水準。適應和進步的複雜舞蹈達到了平衡。,,,,,"Ускоренная эволюция, наблюдаемая у Пандоранских существ в ответ на потери, понесенные в миссиях и колониях, прекратилась. Одновременно с этим процессы исследований в рамках Проекта Феникс вернулись к стандартному уровню. Сложный процесс адаптации и корреляции достиг равновесия.",,
VOID_OMEN_REMOVAL_TEXT_7,Text,,"The heightened concentrations of Mist observed in covered areas, prompting the augmentation in operative deployment, have abated. The standard Mist levels return, and the organization resumes deploying the customary number of operatives on standard missions. Operational situational awareness is maintained at expected levels.",在覆蓋區域觀察到的霧氣濃度升高，促使行動部署加強，但已經減弱。標準迷霧等級回歸，組織恢復在標準任務中部署常規數量的特工。作戰態勢感知維持在預期水準。,,,,,"Повышенная плотность Тумана, наблюдаемая в некоторых районах и приведшая к усиленному реагированию, уменьшилась. Туман возвращается к обычному уровню, и Феникс возобновляет высадку обычных отрядов в стандартных миссиях. Ситуация продолжает контролироваться в штатном режиме.",,
VOID_OMEN_REMOVAL_TEXT_8,Text,,"The heightened diplomatic tensions among factions have dissipated. Intelligence gathered from New Jericho, Disciples of Anu, and Synedrion indicates the conclusion of enhanced security protocols and increased scrutiny of outside contacts. The factions return to standard diplomatic postures, while the temporary doubling of research efforts by factions has concluded.",各派系之間加劇的外交緊張局勢已經消散。從新傑里科、阿努門徒和 Synedrion 收集的情報表明，加強了安全協議並加強了對外部接觸的審查。各派系恢復了標準的外交姿態，而各派系暫時加倍的研究工作也已經結束。,,,,,"Обострившаяся дипломатическая напряженность между фракциями рассеялась. Разведданные, собранные в Новом Иерихоне, Ану и Синедрионе, указывают на принятие усиленных протоколов безопасности и усиление контроля за внешними контактами. Фракции возвращаются к стандартным дипломатическим отношениям, в то время как временное ускорение исследовательских усилий фракций завершилось.",,
VOID_OMEN_REMOVAL_TEXT_9,Text,,"The heightened frequency of Pandoran concentrations near havens, leading to increased attacks, has subsided. The organization returns to a phase of relative respite from the escalated aggression witnessed against the remaining centers of population. Vigilance, however, remains paramount.",潘朵拉人在避難所附近集中的頻率增加導致攻擊事件增加，但這種情況已經有所緩解。該組織從對其餘人口中心的不斷升級的侵略中恢復到相對喘息的階段。然而，保持警惕仍然至關重要。,,,,,"Скопления Пандоранов вблизи убежищ рассеялись, массированные нападения прекратились. Организация возвращается к фазе относительной передышки после эскалации агрессии, направленной против оставшихся поселений. Однако бдительность терять нельзя..",,
VOID_OMEN_REMOVAL_TEXT_10,Text,,"The period marked by stronger than expected effects of Mist exposure has concluded. Our operatives, who previously exhibited symptoms resembling myalgic encephalitis or chronic fatigue syndrome, have undergone a transition. ",霧氣暴露影響強於預期的時期已經結束。我們的操作人員以前表現出類似肌痛性腦炎或慢性疲勞症候群的症狀，現在已經經歷了轉變。,,,,,"Период, ознаменовавшийся более сильными, чем ожидалось, последствиями воздействия Тумана, подошел к концу. Наши бойцы, у которых ранее наблюдались симптомы энцефалита и синдрома хронической усталости, пришли в себя.",,
VOID_OMEN_REMOVAL_TEXT_11,Text,,"The departure from established behavioral patterns exhibited by Behemoth entities concludes, restoring conventional expectations of their sub-surface duration. The previously elevated disruption threshold, indicative of prolonged above-surface activity, reverts to its customary parameters.",巨獸實體所表現出的與既定行為模式的背離最終恢復了對其地下持續時間的傳統預期。先前升高的破壞閾值表示長期的地表以上活動，並恢復到其慣用參數。,,,,,"Отход от устоявшейся модели поведения, демонстрируемый гигантским существом относительно продолжительности его пребывания под поверхностью воды, завершился. Повышенная ранее продолжительность активности в ""Небе"" возвращается к своим обычным параметрам.",,
VOID_OMEN_REMOVAL_TEXT_12,Text,,"The surge in Pandoran forces involved in attacks against havens concludes, marking a return to standard levels of engagement. The speculated strategy of overwhelming haven defenses through brute force diminishes, and the havens resume facing challenges within customary parameters.",參與針對避難所的襲擊的潘多拉部隊激增結束，標誌著回到標準交戰水平。透過暴力壓倒避難所防禦的推測策略減弱，避難所重新面臨慣常範圍內的挑戰。,,,,,"Увеличение численности Пандоранских отрядов при нападениях на убежища завершился. Происходит возвращение к стандартному уровню боевых действий. Предполагаемая стратегия прорыва обороны убежищ грубой силой ослабевает, и убежища снова сталкиваются со стандартными набегами.",,
VOID_OMEN_REMOVAL_TEXT_13,Text,,"The accelerated pace of Pandoran colony construction has abated. The construction operations return to their customary tempo, offering a brief reprieve in the intensity and number of new colonies established.",潘朵拉殖民地建設的加速步伐已經放緩。建設工作恢復到慣常的節奏，為建立新殖民地的強度和數量提供了短暫的喘息。,,,,,"Ускоренные темпы строительства Пандоранских Колоний снизились. Копание нор возвращается к своему обычному темпу, что дает небольшую передышку в интенсивности и количестве создаваемых новых колоний.",,
VOID_OMEN_REMOVAL_TEXT_14,Text,,"The unexplainable shortcomings in situational awareness during combat operations, linked to a species-wide perception-reducing effect, have dissipated. Our understanding of the unknown neurological condition remains limited, but operational perception is restored to previous baseline level.",戰鬥行動期間態勢感知中無法解釋的缺陷（與全物種感知降低效應有關）已經消失。我們對未知神經系統狀況的理解仍然有限，但操作感知已恢復到先前的基線水平。,,,,,"Необъяснимые недостатки в ориентировании во время боевых действий, связанные с эффектом снижения восприятия в масштабах всего вида, устранены. Наше понимание неизвестного неврологического состояния остается ограниченным, но оперативное восприятие восстанавливается до прежнего базового уровня.",,
