Key,Type,Desc,English,Chinese (Simplified),French,German,Italian,Polish,Russian,Spanish,UI_Tester
KEY_GEO_HINT_AUGMENTATION_SCREEN_DESCRIPTION,Text,,"You are about to augment your first soldier. A character can only have UP TO 2 BODY PARTS replaced this way.

Once an augmentation is installed, the soldier will not be able to revert back to their natural limbs. However, augmented body parts CAN BE SWAPPED with different cybernetic parts.

Augmented body parts are IMMUNE TO BLEEDING and RESISTANT TO VIRAL DAMAGE, POISON, AND PARALYSIS. Damaged cybernetics CAN BE REPAIRED after battle at the expense of Tech and Materials. 

In addition, each bionic augmentation reduces the maximum Delirium the character can have by 1/3, and removes up to that amount of Delirium from the character. 

Augmenting a character will reduce their Stamina to zero.",,,,,,"Вы собираетесь аугментировать своего первого бойца. Персонажу можно заменить таким образом не более 2-х частей тела.

После установки аугмента боец не сможет вернуть назад свои естественные конечности. Однако эти части тела можно будет заменить другими кибернетическими частями.

Аугментированные части тела невосприимчивы к кровотечениям и устойчивы к вирусным повреждениям, ядам и параличу. Поврежденные кибернетические части можно будет починить после боя за счет технологий и материалов.

Кроме того, каждая бионическая аугментация уменьшает максимальное количество Сонного Безумия, которое может быть у персонажа, на 1/3, и тут же удаляет с бойца это количество Сонного Безумия.

При аугментации бойца его выносливость снижается до нуля.",,
KEY_GEO_HINT_AUGMENTATION_SCREEN_NAME,Text,,AUGMENTING A SOLDIER,,,,,,АУГМЕНТАЦИЯ БОЙЦА,,
KEY_GEO_HINT_CYBERNETICS_LAB_BUILT_DESCRIPTION,Text,,"The construction of your Cybernetics Lab is complete. You will now be able to AUGMENT SOLDIERS, replacing their natural limbs with powerful cybernetics.

Each augmentation reduces the maximum Delirium a character may have by 1/3 and also immediately removes that much Delirium from the character.  

To Augment a soldier, navigate to the PERSONNEL tab, select EDIT UNIT and then select AUGMENT.",,,,,,"Строительство вашей кибернетической лаборатории завершено. Теперь вы сможете аугментировать бойцов, заменяя их естественные конечности на мощные кибернетические.

Каждая аугментация уменьшает максимальное количество очков Сонного Безумия, которое может быть у бойца, на 1/3, а также немедленно вылечивает столько же текущих очков Сонного Безумия.

Чтобы аугментировать бойца, перейдите на вкладку ""Состав"" в главном меню Геоскопа, выберите иконку ""Характеристики и снаряжение"", а затем иконку ""Аугмент"".",,
KEY_GEO_HINT_CYBERNETICS_LAB_BUILT_NAME,Text,,AUGMENTATION NOW AVAILABLE,,,,,,ДОСТУПНЫ АУГМЕНТАЦИИ,,
KEY_GEO_HINT_MUTATION_LAB_BUILT_DESCRIPTION,Text,,"The construction of your Mutation Lab is complete. You will now be able to MUTATE SOLDIERS, replacing their natural limbs with ones enhanced by Pandoravirus mutation.

To Mutate a soldier, navigate to the PERSONNEL tab, select EDIT UNIT and then select MUTATE.

In addition, if you have completed the Mutagen harvesting technology, your mutation lab will automatically extract mutagens from any Pandorans held in your Containment facilities. ",,,,,,"Строительство вашей лаборатории мутаций завершено. Теперь вы сможете мутировать бойцов, заменяя их естественные конечности на конечности, улучшенные в результате мутаций Пандоравируса.

Чтобы мутировать бойца, перейдите на вкладку ""Состав"" в главном меню Геоскопа, выберите иконку ""Характеристики и снаряжение"", а затем иконку ""Мутировать"".

Кроме того, если вы освоите технологию сбора Мутагенов, ваша Лаборатория Мутаций автоматически будет извлекать Мутагены из любых Пандоранов, содержащихся в ваших Изоляторах.",,
KEY_GEO_HINT_MUTATION_LAB_BUILT_NAME,Text,,MUTATION NOW AVAILABLE,,,,,,ДОСТУПНЫ МУТАЦИИ,,
KEY_GEO_HINT_MUTATION_SCREEN_DESCRIPTION,Text,,"You are about to mutate your first soldier. A character can only have UP TO 2 BODY PARTS altered this way.

Each mutated body part increases damage dealt by character by 2% per each Delirium point that the character has.

Once a mutation is applied, the operative won't be able to revert back to their natural limbs. However, mutated body parts CAN BE SWAPPED with different mutation variants.

The :PRIEST: PRIEST soldier class has access to UNIQUE HEAD MUTATIONS greatly enhancing their powers.",,,,,,"Вы собираетесь мутировать своего первого солдата. У персонажа может быть изменено не более 2 частей тела таким образом.

Каждая мутировавшая часть тела увеличивает наносимый персонажем урон на 2% за каждое имеющееся у него очко Сонного Безумия.

Как только мутация будет применена, боец не сможет вернуться к своим естественным конечностям. Однако, измененные части тела могут быть заменены другими вариантами мутаций.

Класс солдат-жрецов :PRIEST: имеет доступ к уникальным мутациям головы, значительно повышающим их способности.",,
KEY_GEO_HINT_MUTATION_SCREEN_NAME,Text,,MUTATING A SOLDIER,,,,,,МУТИРОВАТЬ БОЙЦА,,
KEY_TUTORIAL_RESOURCES_DESCRIPTION,Text,,"On completing a mission, all gathered items and resources are added to your overall SUPPLIES. These can be accessed instantly anywhere on the GEOSCAPE, regardless of location.

Soldiers get fatigued during battle, LOSING 1 STAMINA POINT PER TURN (max 10 per battle).They also lose ALL STAMINA if one of their bodyparts is disabled during the mission.

If an operative starts a mission with 10 STAMINA OR LESS, they will only have 3 Action Points, instead of 4. If the operative has 0 STAMINA, they will only have 2 Action Points.

Your soldiers will slowly recover STAMINA in the aircraft if it has a FAR-M passenger module, and much faster at base, as long as it has a functioning Living Quarters. They can also recover HITPOINTS at the base if it has a functioning Medical Facility.

RETURN TO YOUR BASE SO YOUR SOLDIERS CAN RECOVER",,,,,,"По завершении миссии все собранные предметы и ресурсы добавляются на ваши склады. К ним можно получить мгновенный доступ в любой точке земного шара, независимо от местоположения.

Бойцы устают во время боя, теряя 1 очко выносливости в ход (максимум 10 за все сражение). Они также теряют ВСЮ ВЫНОСЛИВОСТЬ, если одна из частей их тела будет выбита во время миссии (0 хитов).

Если боец начинает миссию с запасом выносливости 10 или меньше, у него останется только 3 Очка Действий вместо 4-х. Если у бойца 0 очков выносливости, у него останется только 2 Очка Действий.

Ваши бойцы будут медленно восстанавливать силы в самолете, если у него есть модуль РШМ, и намного быстрее на базе, если на ней есть действующие ""Жилые Помещения"". Они также могут восстанавливать хиты на базе, если там есть действующий ""Медпункт"".

ВОЗВРАЩАЙТЕСЬ НА СВОЮ БАЗУ, ЧТОБЫ ВАШИ БОЙЦЫ МОГЛИ ОТЛЕЧИТЬСЯ И ВОССТАНОВИТЬ ВЫНОСЛИВОСТЬ!",,
KEY_DLC3_TUT_INFESTATION_DESCRIPTION,Text,,"Scum, villany, unbeatable prices!

The Marketplace offers:

-Cheap soldiers of fortune with mediocre equipment that <b>cannot receive mutations or bionics </b>. 
-Hand-crafted weapons, known as Kaos Guns, with good performance but small magazines and expensive ammo that can only be bought in the Bazaar.
-Junker, the post-Collapse ground vehicle of choice, and modules for it and other vehicles.
-Access to faction technologies.

The stock rotates approximately every 3 days and more options will become gradually available.   
You can access and make purchases in the Bazaar remotely, without a vehicle at the site.
",,,,,,"Железо, бойцы, лучшие цены!

Рынок предлагает:

- Недорогие солдаты удачи с подходящим снаряжением.<b> Но они точно не захотят аугментироваться или мутировать</b>;
- Самодельное оружие бренда ""Kаос"": хорошие ТТХ, но небольшие магазины и дорогие боеприпасы, которые можно купить только у нас;
- ""НИ-1"", наш любимый постапокалиптический бронетрактор, названный в честь широко известного в узких кругах советского танка ""На Испуг"" эпохи Второй мировой войны, а также модули для него и других машин;
- Доступ к технологиям фракций.

Ассортимент обновляется примерно каждые 3 дня, и постепенно будет становиться разнообразнее.
Вы можете совершать покупки на Рынке удаленно, прилетать не обязательно, работает доставка!",,
KEY_DLC3_TUT_INFESTATION_NAME,Text,,BAZAAR - MARKETPLACE,,,,,,Базар - Супермаркет,,
KEY_HINT_BEHEMOTH_MISSION_TITLE,Text,,Attack the Behemoth,,,,,,Атаковать Бегемота,,
KEY_HINT_BEHEMOTH_MISSION_DESCRIPTION,Text,,"You can now land a squad on the Behemoth to destroy it once and for all! Load a team on the Masked Manticore and click on this icon when the Behemoth emerges to trigger the mission.
",,,,,,"Теперь вы можете высадить отряд прямо на Бегемота, чтобы уничтожить его раз и навсегда! Когда Бегемот появится, загрузите отряд в Замаскированную Мантикору и нажмите сюда, чтобы начать миссию.",,
KEY_HINT_BEHEMOTH_DEPLOY_TITLE,Text,,Deploying on the Behemoth,,,,,,Высадка на Бегемота,,
KEY_HINT_BEHEMOTH_DEPLOY_DESCRIPTION,Text,,"Your squad will have to separate into 2 teams to complete the objective. Because of the high winds it will be very difficult, if not impossible for the 2 teams to rendezvous, so you should assume that each will have to act fully independently. Assign your operatives to A and B teams accordingly.",,,,,,"Для выполнения миссии вашему отряду придется разделиться на 2 группы. Из-за шторма встретиться двум командам будет очень сложно, если не невозможно, поэтому вам следует исходить из того, что каждой из них придется действовать полностью независимо. Распределите своих бойцов в группы А и В соответственно.",,
KEY_HINT_BASE_MISSION_TITLE,Text,,Base defense deployment,,,,,,Организация защиты базы,,
KEY_HINT_BASE_MISSION_DESCRIPTION,Text,,"You have some options when deploying for the base defense, depending on the stage of the attack and whether you have an operational Access Lift.

During the initial state (more than 12 hours left on the timer) you can deploy at the Hangar or at a choke point in the Entrance to the base.

If the Pandorans have already penetrated the first line of defense (less than 12 hours left on the timer), you will have to deploy at the Entrance to the base.  

If the base has an operational Access Lift you can also deploy your operatives there.",,,,,,"При подготовке к защите базы у вас есть несколько вариантов, в зависимости от стадии атаки и наличия у вас лифта доступа.

В начале (по таймеру осталось более 12 часов) вы можете высадить бойцов в ангаре или в узком месте на входе на базу.

Если Пандораны уже прорвали первую линию обороны (по таймеру осталось менее 12 часов), вам придется высадиться у входа на базу.

Если на базе есть лифт доступа, вы также можете разместить своих бойцов в нем.",,