"Key","Type","Desc","English","Chinese (Simplified)","French","German","Italian","Polish","Russian","Spanish","UI_Tester"
"PROTEAN_MUTANE_RESEARCH_COMPLETE","Text","","<i> ""Make no mistake: for the ancients, our ancestors were little more than curious animals. Perhaps they had laws to ensure our protection along with that of the other primates. Maybe they came from somewhere else and brought their own primordial soup with them… These are gods we are talking about, only they cleaned their roadside picnic pretty well when they left. Fortunately for us, we were able to grow without the burden of familiarity with our precursors' magic. Can you imagine how long it would have taken us to invent the lever had we been cursed with the power of ""protean mutane"" in our infancy?""</i> - Alistair Ashby

Protean Mutane possesses the extraordinary ability to manipulate gravitational forces, providing a powerful motor-like effect.

The material is composed of a complex array of molecular structures, including a high concentration of exotic particles known as gravitons. These particles are believed to be responsible for mediating the gravitational force and have only been theorized to exist by physicists.

Protean Mutane appears to harness the energy of these gravitons in a way that has yet to be fully understood. The material's structure also appears to be in a state of constant flux, hence its name is strikingly appropriate; ""Protean"" meaning able to change shape easily and ""Mutane"" meaning mutation.","<i>“别搞错了：对于远古人来说，我们的祖先不过是好奇的动物。也许他们有法律来保护我们和其他灵长类动物。也许他们来自别处，带来了他们自己的原始汤……我们说的是神明，只是他们离开时把路边的野餐收拾得很干净。幸运的是，我们能够在没有熟悉前辈魔法负担的情况下成长。你能想象如果我们在婴儿期就被“变形变异体”的力量诅咒，我们发明杠杆要花多长时间吗？”</i> - 阿利斯泰尔·阿什比

变形变异体拥有操控引力的非凡能力，提供强大的马达般效果。

该材料由复杂的分子结构组成，包括高浓度的奇异粒子——引力子。这些粒子被认为是引力的媒介，物理学家们仅理论上推测其存在。

变形变异体似乎以尚未完全理解的方式利用这些引力子的能量。材料结构也处于不断变化的状态，因此其名称非常贴切；“Protean”意为易变形，“Mutane”意为变异。","<i> « Ne vous méprenez pas : pour les Anciens, nos ancêtres n’étaient guère plus que de simples animaux curieux. Peut-être avaient-ils des lois pour protéger notre espèce ainsi que les autres primates. Peut-être venaient-ils d’ailleurs et ont-ils apporté leur propre soupe primordiale... Nous parlons de dieux, seulement ils ont assez bien nettoyé leurs pique-niques au bord des routes avant de partir. Heureusement pour nous, nous avons pu nous développer sans le fardeau de la familiarité avec la magie de nos précurseurs. Pouvez-vous imaginer combien de temps il nous aurait fallu pour inventer le levier si nous avions été maudits dès notre enfance avec le pouvoir du « Mutane Protéen » ? »</i> - Alistair Ashby

Le Mutane Protéen possède l’extraordinaire capacité de manipuler les forces gravitationnelles, produisant un effet puissant analogue à un moteur.

Le matériau est composé d’un réseau complexe de structures moléculaires, incluant une forte concentration de particules exotiques appelées gravitons. On pense que ces particules sont responsables de la médiation de la force gravitationnelle et n’ont été que théorisées par les physiciens.

Le Mutane Protéen semble exploiter l’énergie de ces gravitons d’une manière qui reste encore à comprendre pleinement. La structure du matériau paraît également en état de flux constant, d’où son nom particulièrement approprié : “Protéen” signifiant capable de changer de forme facilement, et “Mutane” signifiant mutation.","<i>„Täuscht euch nicht: Für die Uralten waren unsere Vorfahren kaum mehr als neugierige Tiere. Vielleicht hatten sie Gesetze, die uns und die anderen Primaten schützen sollten. Vielleicht kamen sie von woanders her und brachten ihre eigene Ursuppe mit... Wir sprechen hier von Göttern, die ihren Picknickplatz am Wegesrand gründlich säuberten, als sie gingen. Zum Glück für uns konnten wir ohne die Last der Vertrautheit mit der Magie unserer Vorfahren aufwachsen. Könnt ihr euch vorstellen, wie lange wir für die Erfindung des Hebels gebraucht hätten, wären wir in unserer Kindheit mit der Macht des „proteischen Mutans“ verflucht worden?“</i> – Alistair Ashby

Proteisches Mutan besitzt die außergewöhnliche Fähigkeit, Gravitationskräfte zu manipulieren und erzeugt so einen starken motorähnlichen Effekt.

Das Material besteht aus einer komplexen Anordnung von Molekülstrukturen, darunter eine hohe Konzentration exotischer Teilchen, bekannt als Gravitonen. Man geht davon aus, dass diese Teilchen für die Vermittlung der Gravitationskraft verantwortlich sind und ihre Existenz bisher nur theoretisch von Physikern postuliert wurde.

Proteisches Mutan scheint die Energie dieser Gravitonen auf eine noch nicht vollständig verstandene Weise zu nutzen. Die Struktur des Materials ist offenbar in einem ständigen Wandel, daher ist sein Name bemerkenswert treffend: „proteisch“ bedeutet wandelbar/unzuverlässig und „Mutan“ kommt von Mutation.","","","<i> ""Не заблуждайтесь: для Древних наши предки были не более чем диковинными животными. Возможно, у них были законы, обеспечивающие нашу защиту наряду с защитой других приматов. Может быть, они пришли откуда-то еще и принесли с собой свой первородный бульон... Мы говорим о богах, только что они хорошо прибрались на своем «пикнике на обочине», когда уходили. К счастью для нас, мы смогли развиться без бремени знакомства с магией наших предшественников. Представляете, сколько времени ушло бы на изобретение рычага, если бы в младенчестве мы были прокляты владением Белковым Мутагеном?""</i> - Алистер Эшби. 

Белковый Мутаген обладает экстраординарной способностью манипулировать гравитационными силами, обеспечивая мощный двигательный эффект. Материал состоит из сложного набора молекулярных структур, включая высокую концентрацию экзотических частиц, известных как гравитоны. Считается, что эти частицы отвечают за перенос гравитации, и физики лишь теоретически предполагают их существование. Белковый Мутаген, по-видимому, использует энергию этих гравитонов способом, который еще не до конца понятен. Структура материала также находится в состоянии постоянного движения, поэтому его название удивительно подходит: «Белковый» подразумевает способность легко менять форму, а «Мутаген» означает мутацию.","",""
"PROTEAN_MUTANE_RESEARCH_BENEFITS","Text","","We can now manufacture weapons that require Protean Mutane, and probably reactivate one of the defeated Cyclops, if needed","我们现在可以制造需要变形变异体的武器，并且如果需要，可能重新激活一只被击败的独眼巨人。","Nous pouvons désormais fabriquer des armes nécessitant du Mutane Protéen et, si nécessaire, probablement réactiver l’un des Cyclopes vaincus.","Wir können nun Waffen herstellen, die proteisches Mutan benötigen, und gegebenenfalls einen der besiegten Zyklopen reaktivieren.","","","Теперь мы можем производить оружие, для которого нужен Белковый Мутаген, и, возможно, реактивировать одного из поверженных Циклопов, если понадобится.","",""
"ALN_ELITERANGER_RESEARCHDEF_NAME","Text","","ARTHRON SKIRMISHER CHAMPION","节肢战士突击冠军","ARTHRON ÉCLAIREUR CHAMPION","ARTHRON PLÄNKLER CHAMPION","","","АРТРОН-СТРЕЛОК (ЧЕМПИОН)","",""
"ALN_ELITERANGER2_RESEARCHDEF_NAME","Text","","ARTHRON SKIRMISHER CHAMPION","节肢战士突击冠军","ARTHRON ÉCLAIREUR CHAMPION","ARTHRON PLÄNKLER CHAMPION","","","АРТРОН-СТРЕЛОК (ЧЕМПИОН)","",""
"ALN_ELITERANGER3_RESEARCHDEF_NAME","Text","","ARTHRON SKIRMISHER CHAMPION","节肢战士突击冠军","ARTHRON ÉCLAIREUR CHAMPION","ARTHRON PLÄNKLER CHAMPION","","","АРТРОН-СТРЕЛОК (ЧЕМПИОН)","",""
"ALN_ULTRARANGER_RESEARCHDEF_NAME","Text","","ARTHRON SKIRMISHER  PRIME","节肢战士突击精英","ARTHRON ÉCLAIREUR PRIME","ARTHRON PLÄNKLER PRIME","","","АРТРОН-СТРЕЛОК (ВОЖАК)","",""
"PX_BLASTRESISTANCEVEST_RESEARCHDEF_NAME","Text","","Acid Resistance Technology","酸性抗性技术","Technologie de résistance à l’acide","Säurebeständigkeitstechnologie","","","Технология кислотостойкости","",""
"PX_BLASTRESISTANCEVEST_RESEARCHDEF_UNLOCK","Text","","The natural resistance to Pandoran acid possessed by this creature has promising applications for our own research into a device that would reduce the damage caused by the acid to our operarives.","这种生物对潘多拉酸的天然抗性为我们研发减少酸对干员伤害的装置提供了有希望的应用。","La résistance naturelle à l’acide pandorien possédée par cette créature offre des applications prometteuses pour nos recherches sur un dispositif capable de réduire les dégâts causés par l’acide à nos agents.","Die natürliche Resistenz dieses Lebewesens gegenüber pandoranischer Säure bietet vielversprechende Anwendungsmöglichkeiten für unsere eigene Forschung an einem Gerät, das die durch die Säure verursachten Schäden an unseren Operateuren verringern könnte.","","","Природная устойчивость к Пандоранской кислоте, которой обладает это существо, имеет многообещающее применение в наших собственных исследованиях покрытия, которое уменьшило бы ущерб, наносимый кислотой нашим бойцам.","",""
"PX_BLASTRESISTANCEVEST_RESEARCHDEF_COMPLETE","Text","","The new acid resistance vest can be fitted under all torso armor sections. It reduces the damage to body parts from Acid by roughly half, providing valuable protection against this new Pandoran threat.","新的酸性抗性背心可装配于所有躯干护甲下方。它能将酸对身体部位的伤害减少约一半，为抵御这一新潘多拉威胁提供宝贵保护。","Le nouveau gilet de résistance à l’acide peut être porté sous toutes les sections d’armure du torse. Il réduit d’environ moitié les dégâts infligés par l’acide aux différentes parties du corps, offrant une protection précieuse contre cette nouvelle menace pandorienne.","Die neue Säureschutzweste kann unter allen Torso-Panzerungsteilen getragen werden. Sie reduziert die Säureschäden an Körperteilen um etwa die Hälfte und bietet so wertvollen Schutz vor dieser neuen Bedrohung aus Pandora.","","","Новый костюм химзащиты можно одевать на все слоты брони на теле. Он уменьшает повреждения частей тела от кислоты примерно наполовину, обеспечивая хорошую защиту от этой новой угрозы со стороны Пандоранов.","",""
"PX_BLASTRESISTANCEVEST_RESEARCHDEF_BENEFITS","Text","","Acid-Res Vest is available for production","酸性抗性背心现已可生产","Le gilet de résistance à l’acide est désormais disponible à la production.","Die säurebeständige Weste ist ab sofort erhältlich.","","","Доступен для производства ""Костюм химзащиты"".","",""
"PX_ALIEN_ACIDWORM_RESEARCHDEF_BENEFITS","Text","","Can now research acid resistance technology!","现在可以研究酸性抗性技术！","La technologie de résistance à l’acide peut désormais être recherchée !","Jetzt kann ich die Säureresistenztechnologie erforschen!","","","Теперь вы можете исследовать технологию кислотостойкости!","",""
"NJ_FIRERESISTANCETECH_RESEARCHDEF_COMPLETE","Text","","New heat and blast resistant undersuits have been developed for use on the battlefield. The module is light to wear and can be incorporated into virtually any armor, increasing tolerance to flame and heat by 62%, and reducing the impact of explosive munitions by roughly half.","已开发出新型耐热和耐爆炸内衣，适用于战场。该模块轻便，可集成于几乎任何护甲中，提升62%的火焰和热量耐受度，并将爆炸弹药的影响减少约一半。","De nouvelles combinaisons résistantes à la chaleur et aux explosions ont été développées pour le champ de bataille. Le module est léger à porter et peut être intégré à presque toutes les armures, augmentant la résistance au feu et à la chaleur de 62 % et réduisant l’impact des munitions explosives d’environ moitié.","Für den Einsatz auf dem Schlachtfeld wurden neue, hitze- und explosionsbeständige Unteranzüge entwickelt. Das Modul ist leicht zu tragen und lässt sich in nahezu jede Schutzweste integrieren. Es erhöht die Feuer- und Hitzebeständigkeit um 62% und reduziert die Wirkung von Sprengmunition um etwa die Hälfte.","","","Для использования в бою были разработаны новые термо- и взрывозащищенные пластины. Модули легкие, могут быть встроены практически в любую броню, повышая устойчивость к огню и перегреву на 62% и снижая воздействие взрывов примерно наполовину.","",""
"NJ_FIRERESISTANCETECH_RESEARCHDEF_NAME","Text","","Blast and Fire Resistant Technology","耐爆炸与耐火技术","Résistance Feu et Explosion","Explosions- und feuerbeständige Technologie","","","Технология защиты от взрывов и огня","",""
"NJ_FIRERESISTANCETECH_RESEARCHDEF_UNLOCK","Text","","With the emergence of creatures such as the Fireworms, it is becoming increasingly necessary to invest in better blast and fire resistance technology.","随着火虫等生物的出现，投资更好的耐爆炸和耐火技术变得日益必要。","Avec l’apparition de créatures comme les Vers de Feu, il devient de plus en plus nécessaire d’investir dans une technologie offrant une meilleure résistance aux explosions et au feu.","Angesichts des Auftretens von Kreaturen wie den Feuerwürmern wird es immer notwendiger, in bessere Technologien zur Explosions- und Feuerbeständigkeit zu investieren.","","","С появлением таких созданий, как Огненные Черви, необходимо срочно разработать более совершенные технологии взрывозащиты и огнестойкости.","",""
"NJ_PURIFICATIONTECH_RESEARCHDEF_COMPLETE","Text","","A new type of bio-fuel has been created to use with modern flame throwers, and compact incendiary grenades have been developed from solid fuel technology. The new weapons will assist with clearance, especially inside alien structures.

In addition, new heat and blast resistant undersuits have been developed for use on the battlefield. The module is light to wear and can be incorporated into virtually any armor, increasing tolerance to flame and heat by 62%, and reducing the impact of explosive munitions by roughly half.","已研发出新型生物燃料，适用于现代火焰喷射器，并基于固体燃料技术开发出紧凑型燃烧手榴弹。新武器将有助于清理，尤其是在外星结构内部。

此外，还开发了新型耐热和耐爆炸内衣，适用于战场。该模块轻便，可集成于几乎任何护甲中，提升62%的火焰和热量耐受度，并将爆炸弹药的影响减少约一半。","Un nouveau type de biocarburant a été créé pour être utilisé avec les lance‑flammes modernes, et des grenades incendiaires compactes ont été développées à partir de la technologie des carburants solides. Ces nouvelles armes faciliteront le déblaiement, notamment à l’intérieur des structures extraterrestres.

De plus, de nouvelles combinaisons résistantes à la chaleur et aux explosions ont été développées pour le champ de bataille. Le module est léger à porter et peut être intégré à presque toutes les armures, augmentant la résistance au feu et à la chaleur de 62 % et réduisant l’impact des munitions explosives d’environ moitié.","Für moderne Flammenwerfer wurde ein neuartiger Biokraftstoff entwickelt, und auf Basis von Festbrennstofftechnologie wurden kompakte Brandgranaten konstruiert. Die neuen Waffen erleichtern die Räumung, insbesondere in außerirdischen Strukturen.

Darüber hinaus wurden neue hitze- und explosionsbeständige Unteranzüge für den Einsatz auf dem Schlachtfeld entwickelt. Das Modul ist leicht zu tragen und in nahezu jede Rüstung integrierbar. Es erhöht die Feuer- und Hitzebeständigkeit um 62% und reduziert die Wirkung von Sprengmunition um etwa die Hälfte.","","","Был разработан новый тип биотоплива для использования в современных огнеметах, а на основе технологии твердого топлива были разработаны компактные зажигательные гранаты. Новое оружие поможет при зачистке, особенно внутри инопланетных тоннелей.  Кроме того, для использования в бою были разработаны новые огне- и взрывоустойчивые пластины. Модули легкие, могут быть встроены практически в любую броню, повышая устойчивость к пламени и перегреву на 62% и снижая воздействие взрывов примерно вдвое.","",""
"PX_LIGHTSNIPERRIFLE_RESEARCHDEF_UNLOCK","Text","","The appearance of Myrmidons has inspired our designers to consider developing a more agile sniper rifle that can deal quickly with small targets at range.","蚁狮的出现激发了设计师开发更灵活的狙击步枪，以快速远程处理小型目标。","L’apparition des Myrmidons a incité nos concepteurs à envisager le développement d’un fusil de précision plus agile, capable de neutraliser rapidement de petites cibles à longue distance.","Das Erscheinen der Myrmidonen hat unsere Designer dazu inspiriert, die Entwicklung eines wendigeren Scharfschützengewehrs in Erwägung zu ziehen, das kleine Ziele auf Distanz schnell ausschalten kann.","","","Появление Мирмидонов вдохновило наших конструкторов на разработку легкой снайперской винтовки, способной быстро расправляться с небольшими целями на расстоянии.","",""
"PX_CAPTURETECH_RESEARCHDEF_COMPLETE_TFTV","Text","","Specialized Pandoran Containment facilities have been designed and successfully tested, allowing us to safely keep Pandorans in a state of constant paralysis. 

In addition, we have equipped all our aircraft with the Skyhook Retrieval and Transportation System (SRTS), which allows us to retrieve fully paralyzed Pandorans from the battlefield after a successful mission.

The SRTS uses micro drones to attach tethers to the immobilized Pandoran organism. Total volume of transportable matter is determined by aircraft carrying capacity. For reference, we estimate that our Manticores should be able to carry up to 3 Arthrons or Tritons.

This represents a step forward in our struggle to understand their biology.","已设计并成功测试专用潘多拉体收容设施，使我们能够安全地将潘多拉体保持在持续瘫痪状态。

此外，我们为所有飞行器配备了天钩回收与运输系统（SRTS），可在任务成功后从战场回收完全瘫痪的潘多拉体。

SRTS使用微型无人机将系绳连接到被固定的潘多拉体。可运输物体总量由飞行器载重决定。参考估计，螳螂飞行器最多可携带3只甲壳虫或三鳍鱼。

这标志着我们在理解其生物学方面迈出了一大步。","Des installations spécialisées de confinement pandorien ont été conçues et testées avec succès, nous permettant de maintenir les Pandoriens dans un état de paralysie constante en toute sécurité.

De plus, nous avons équipé tous nos appareils du Système de Récupération et de Transport Skyhook (SRTS), qui nous permet de récupérer les Pandoriens entièrement paralysés après une mission réussie.

Le SRTS utilise des micro‑drones pour fixer des cordages à l’organisme pandorien immobilisé. Le volume total transportable dépend de la capacité de charge de l’appareil. À titre indicatif, nous estimons que nos Manticores devraient pouvoir transporter jusqu’à 3 Arthrons ou Tritons.

Cela représente un progrès important dans notre lutte pour comprendre leur biologie.","Spezielle Einrichtungen zur Eindämmung von Pandoranern wurden entwickelt und erfolgreich getestet. Sie ermöglichen es uns, Pandoraner sicher in einem Zustand dauerhafter Lähmung zu halten.

Zusätzlich haben wir alle unsere Fluggeräte mit dem Skyhook-Bergungs- und Transportsystem (SRTS) ausgestattet. Dieses System erlaubt es uns, vollständig benommene Pandoraner nach einer erfolgreichen Mission vom Schlachtfeld zu bergen.

Das SRTS verwendet Mikrodrohnen, um die immobilisierten Pandoraner mit Seilen zu fixieren. Das Gesamtvolumen des transportierbaren Materials hängt von der Tragfähigkeit des Fluggerätes ab. Wir schätzen, dass unser Manticore bis zu drei Arthrons oder Tritons transportieren kann.

Dies stellt einen Fortschritt in unserem Bestreben dar, ihre Biologie zu verstehen.","","","Были разработаны и успешно испытаны специализированные установки для удержания Пандоранов, позволяющие безопасно держать их в состоянии постоянного паралича. 

Кроме того, мы оснастили все наши самолеты грузоподъемной системой «Небесный Крюк», которая позволяет нам загружать полностью парализованных Пандоранов с поля боя в самолет после успешной миссии. Система использует микродроны, чтобы прикрепить тросы к обездвиженному Пандорану. Общий объем транспортируемой биомассы определяется грузоподъемностью самолета. Для сравнения, по нашим расчетам, наши Мантикоры смогут перевозить до 3-х Артронов или Тритонов. Это шаг вперед в нашей борьбе за понимание их биологии.","",""
