Key,Type,Desc,English
TFTV_INCIDENT_43_OUTCOME_0_SUCCESS,Text,Reward: additional personnel,"New training and access protocols are drafted to familiarize the refugees with the haven’s automated infrastructure.

Instruction helps reduce accidental damage, but it does little to address the deeper issue.

The question is not how systems function, but how people do.

Can a population accustomed to ritual obedience embrace freedom—or even tolerate it in others?"
TFTV_INCIDENT_43_OUTCOME_1_SUCCESS,Text,Reward: additional personnel,"Time spent among the refugees reveals a complex picture.

They are far from uniform; many were never fervent adherents of Anu doctrine.

Yet surrounded by strangers and stripped of familiar structures, they gravitate toward the most eloquent and charismatic religious speakers.

These figures gain influence quickly—and show little interest in relinquishing it."
TFTV_INCIDENT_43_OUTCOME_0_FAIL,Text,,"The proposed protocols prove too rigid and impersonal.

Refugees struggle to adapt to automated systems that offer no guidance beyond abstract instructions.

Frustration grows on both sides, reinforcing the belief that the newcomers are incompatible with Synedrion society.

Several systems are taken offline after repeated misuse, worsening the atmosphere further."
TFTV_INCIDENT_43_OUTCOME_1_FAIL,Text,,"The refugees are wary and defensive.

Phoenix operatives are seen as representatives of Synedrion authority rather than neutral observers.

Conversations collapse into rehearsed slogans and quiet suspicion.

Whatever grievances exist remain unspoken, hardening into resentment."
TFTV_INCIDENT_44_TITLE_SY,Text,,The Quiet Specimen
TFTV_INCIDENT_44_DESC,Text,,"Synedrion representatives report the capture of a Pandoran creature that has displayed no aggressive behavior since containment.

Speakers of the Polyphonic Tendency have seized upon the incident as evidence that coexistence with Pandorans may be possible.

Terraformers remain skeptical, warning against drawing conclusions from an isolated case.

Both factions have requested Phoenix Project involvement to examine the creature and assess the circumstances of its capture."
TFTV_INCIDENT_44_CHOICE_0_B_O,Text,,"Conduct a thorough biological examination of the specimen.
(Biotech / Occult approach)"
TFTV_INCIDENT_44_CHOICE_1_C,Text,,"Review all data related to the capture and containment.
(Compute)"
TFTV_INCIDENT_44_CHOICE_2,Text,,"We don't know where this sample came from nor how it was collected. This is Propaganda, not Science. [END]"
TFTV_INCIDENT_44_OUTCOME_0_SUCCESS,Text,"Reward: +4 Syn, +8 haven leader, + 500 Research","The specimen is identified as an Arthron, though markedly atypical in appearance.

Its facial structure is disturbingly humanoid, and its physiology shows extensive signs of age—at least twenty-five years by Phoenix estimates.

The carapace bears long-set stains of crude oil, embedded deep into the chitin.

Whatever this creature once was, it has survived far longer than most of its kind.

It is a fascinating specimen, but a poor foundation for broad conclusions about Pandoran behavior."
TFTV_INCIDENT_44_OUTCOME_1_SUCCESS,Text,"Reward: +4 Syn, +8 haven leader, + 500 Research","Records show the creature was discovered alone, disoriented, and wandering without apparent purpose.

It offered no resistance and did not react to nearby humans.

Capture involved repeated use of paralyzing weaponry, followed by continuous heavy sedation.

Containment logs indicate minimal response to external stimuli.

There is little evidence the specimen possesses awareness of who—or what—it is, or of its surroundings."
TFTV_INCIDENT_44_OUTCOME_0_FAIL,Text,,"The examination proves inconclusive.

Prolonged sedation and neural degradation have obscured meaningful biological markers.

The specimen’s condition appears less like adaptation and more like collapse.

Any attempt to classify its behavior risks mistaking decay for intent."
TFTV_INCIDENT_44_OUTCOME_1_FAIL,Text,,"The capture records are fragmented and selectively preserved.

Gaps in the logs coincide with changes in sedation protocols and containment procedures.

Whether this reflects incompetence or careful curation is impossible to determine.

What remains is insufficient to reconstruct the specimen’s original behavior."