Key,Type,Desc,English,Chinese (Simplified),French,German,Italian,Polish,Russian,Spanish,UI_Tester
TFTV_BIONICS_RESEARCHDEF_COMPLETE,Text,,"<i>""Which brings us back to Project Purity... This PV strain is even worse than the previous ones. In the Second Mist, we knew the human from the abomination. But now... We all have those nightmares. The chems may dull them, but they never go away. Even West has them, I'm sure. We don't fully understand how or why it happens, but the correlation is undeniable: the users of substantial bionic prosthetics are outperforming their non-augmented peers in psycho-evaluations by 30 to 60 percent. It's the opposite of what we expected! Want another interesting data point? They dream less.""</i>

- Dr. Abongameli Smith, New Jericho

Vastly improved from the first New Jericho attempts, the technology no longer leaves the subjects dead or crippled. A new set of bio-implants have successfully been developed thanks to advancements in neural co-processors and light metal alloy development. The new implants allow personnel to withstand heavy amounts of damage, land safely from great heights, and even run through walls if needed.",,"<i>""Ce qui nous ramène au Projet Pureté... Cette souche de Pandoravirus est encore pire que les précédentes. Dans la seconde brume, nous savions distinguer l'humain de l'abomination. Mais maintenant, nous avons tous ces cauchemars. Les médicaments peuvent les atténuer, mais ils ne disparaissent jamais.  Même West en a, j'en suis sûr. Nous ne comprenons pas entièrement comment ou pourquoi cela se produit, mais la corrélation est indéniable : les utilisateurs de prothèses cybernétiques majeures ont des performances supérieures de 30 à 60 % à celles de leurs pairs non équipés dans les évaluations psychologiques. C'est le contraire de ce a quoi nous nous attendions ! Vous voulez un autre point de données intéressant ? Ils rêvent moins.""</i>

- Dr. Abongameli Smith, Nouvelle-Jéricho

Largement améliorée par rapport aux premières tentatives de la Nouvelle-Jéricho, la technologie cybernétique ne laisse plus les sujets morts ou estropiés. Une nouvelle série de bio-implants a été développée avec succès grâce à des avancées dans les coprocesseurs neuronaux et le développement d'alliages de métaux légers. Ces nouveaux implants permettent au personnel de résister à des dommages importants, d'atterrir en toute sécurité depuis de grandes hauteurs et même de traverser les murs si nécessaire.","<i>„Was uns zurück zu Projekt Reinheit führt... Diese Pandoravirus-Variante ist noch schlimmer als die vorherigen. Im zweiten Nebel konnten wir den Menschen vom Ungeheuer unterscheiden. Aber jetzt... Wir alle haben diese Albträume. Die Drogen mögen sie betäuben, aber sie verschwinden nie ganz. Selbst West hat sie, da bin ich mir sicher. Wir verstehen noch nicht genau, wie oder warum das passiert, aber der Zusammenhang ist unbestreitbar: Die Nutzer umfangreicher bionischer Prothesen übertreffen ihre nicht-augmentierten Altersgenossen in psychologischen Tests um 30 bis 60 Prozent. Das ist genau das Gegenteil von dem, was wir erwartet haben! Noch ein interessanter Befund? Sie träumen weniger.“</i>

– Dr. Abongameli Smith, Neu-Jericho

Die Technologie hat sich im Vergleich zu den ersten Versuchen in Neu-Jericho enorm verbessert und führt nicht mehr zu Tod oder Verkrüppelung der Probanden. Dank Fortschritten bei neuronalen Koprozessoren und der Entwicklung von Leichtmetalllegierungen konnte eine neue Generation von Bioimplantaten erfolgreich entwickelt werden. Die neuen Implantate ermöglichen es dem Personal, starkem Schaden standzuhalten, aus großer Höhe sicher zu landen und notfalls sogar durch Wände zu rennen.",,,"<i>""Что возвращает нас к проекту ""Непорочные""... Этот штамм Пандоравируса еще хуже предыдущих. Во втором Тумане мы отличали человека от нечести. Но теперь... У всех нас бывают эти кошмары. Таблетки могут притупить их, но они никогда не проходят. Я уверен, что даже у Уэста они есть. Мы не до конца понимаем, как и почему это происходит, но связь неоспорима: люди с бионическими протезами превосходят обычных людей по психологическим показателям на 30-60 процентов. Это прямо противоположно всем прогнозам! Хотите еще один интересный факт? Они меньше спят.""</i> - Доктор Абонгамели Смит, Новый Иерихон. 

Значительно усовершенствованная по сравнению с первыми попытками в Новом Иерихоне, технология больше не оставляет испытуемых мертвыми или калеками. Новый набор биоимплантов был успешно разработан благодаря достижениям в области нейронных сопроцессоров и разработке сплавов легких металлов. Новые имплантаты позволяют бойцам выдерживать сильный урон, безопасно приземляться с большой высоты и даже бегать по стенам, если надо.
",,
TFTV_MUTATIONTECH_RESEARCHDEF_COMPLETE,Text,,"<i>""Those that partake of the Waters of Life say that, as their dreams become more vivid, their waking life becomes more dreamlike, till they know not when they are asleep and when they are awake. And always they feel most capable of incredible feats of arms and of vanquishing their enemies. I'm exhilarated by their confidence, yet I also fear their brutality.""</i>

- Neophyte Ryodik, Disciples of Anu 

This technology represents a first step towards mastering the mutation mechanics of the Pandoravirus. Test subjects have been injected with modified strains of the infection under carefully-controlled conditions, and with the additional of a chemical cocktail intended to keep the virus from asserting control over the subject. 

The process is still experimental and there may be some side effects, but the potential benefits to our soldiers are worth the risk.",,"<i>""Ceux qui prennent part aux Eaux de la Vie disent que, à mesure que leurs rêves deviennent plus vifs, leur vie éveillée devient plus onirique, jusqu'à ce qu'ils ne sachent plus quand ils dorment et quand ils sont éveillés. Et ils se sentent capables d'incroyables faits d'armes et de vaincre leurs ennemis. Je suis exalté par leur confiance, mais je crains aussi leur brutalité.""</i>

- Neophyte Ryodik, Disciples of Anu

Cette technologie représente un premier pas vers la maîtrise des mécanismes de mutation du pandoravirus. Des sujets d'essai ont été injectés avec des souches modifiées de l'infection dans des conditions soigneusement contrôlées, et avec l'ajout d'un cocktail chimique destiné à empêcher le virus de prendre le contrôle du sujet.

Le processus est encore expérimental et il peut y avoir des effets secondaires, mais les avantages potentiels pour nos agents en valent la peine.","<i>„Diejenigen, die vom Wasser des Lebens trinken, berichten, dass ihre Träume immer lebhafter werden und ihr Wachleben immer traumhafter, bis sie nicht mehr zwischen Schlaf und Wachen unterscheiden können. Stets fühlen sie sich zu unglaublichen Waffentaten und zur Vernichtung ihrer Feinde fähig. Ihr Selbstvertrauen beflügelt mich, doch ihre Brutalität fürchte ich zugleich.“</i>

– Neophyt Ryodik, Die Jünger des Anu

Diese Technologie stellt einen ersten Schritt zur Beherrschung der Mutationsmechanismen des Pandoravirus dar. Testpersonen wurden unter streng kontrollierten Bedingungen mit modifizierten Virusstämmen infiziert, zusätzlich wurde ihnen ein chemischer Cocktail verabreicht, der verhindern soll, dass das Virus die Kontrolle über den Organismus erlangt.

Das Verfahren ist noch experimentell und es können Nebenwirkungen auftreten, doch der potenzielle Nutzen für unsere Soldaten ist das Risiko wert.",,,"<i>""Те, кто пьет Живую Воду, говорят, что сначала их сны становятся нереально яркими, а реальность становится все более похожей на сон, а потом наступает момент, когда уже не различить, где сон, где явь. Но они всегда чувствуют себя способными на великие подвиги и жаждут победы над своими врагами. Меня восхищает их уверенность, и в тоже время страшит их жестокость..""</i>  - Неофит Риодик, Последователи Ану. 

Эта технология представляет собой первый шаг к овладению механикой мутаций Пандоравируса. В тщательно контролируемых условиях испытуемым вводились модифицированные штаммы инфекции с добавлением химического коктейля, призванного удержать вирус от захвата организма испытуемого. Процесс все еще является экспериментальным, и возможны некоторые побочные эффекты, но потенциальная польза для наших бойцов стоит риска.
",,
PX_REVENANT_LIVE_RESEARCH_TITLE,Text,,Captured Revenant,,Revenant capturé,Gefangener Revenant,,,"ПЛЕННЫЙ ВОЗВРАЩЕНЕЦ
",,
PX_REVENANT_LIVE_RESEARCH_REVEAL,Text,,"The operatives who captured this creature claim that it is a former comrade, returned as a Pandoran monstrosity. We should examine it as soon as possible.",,"Les agents qui ont capturé cette créature prétendent que c'est un ancien camarade, revenu sous la forme d'une monstruosité pandorienne. Nous devrions l'examiner dès que possible.","Die Einheiten, die dieses Wesen gefangen genommen haben, behaupten, es sei ein ehemaliger Kamerad, der als pandoranisches Monstrum zurückgekehrt sei. Wir sollten es so schnell wie möglich untersuchen.",,,"Бойцы,  захватившие эту тварь, утверждают, что это бывший товарищ, вернувшийся в виде Пандоранского чудовища. Мы должны исследовать его как можно скорее.
",,
PX_REVENANT_LIVE_RESEARCH_COMPLETE,Text,,"There is no room for doubt: this creature is, or used to be one of our operatives. What has been done to our friend and how... I would rather not try to imagine it. I wanted to hope that there was no shred of consciousness of the former self left in that monstrosity, but... I could swear it recognized me.

There is nothing we can do for our comrade now, and I'm afraid that killing it won't provide any release. We might encounter it again and again: the Pandorans splice and clone their victims ad infinitum.

We have to defeat the Pandoravirus once and for all. It's the only way to be sure.",,"Il n'y a pas de place pour le doute : cette créature est, ou était, un de nos agents. Ce qui a été fait à notre ami et comment... Je préfère ne pas essayer de l'imaginer. Je voulais espérer qu'il ne restait aucune trace de conscience de l'ancienne personne dans cette monstruosité, mais... Je pourrais jurer qu'elle m'a reconnu.

Il n'y a rien que nous puissions faire pour notre camarade maintenant, et j'ai peur que le tuer ne nous libère en rien. Nous pourrions le rencontrer encore et encore : les Pandoriens dédoublent et clonent leurs victimes à l'infini.

Nous devons vaincre le Pandoravirus une fois pour toutes. C'est la seule façon d'être sûrs.","Es besteht kein Zweifel: Dieses Wesen ist oder war einer unserer Einheiten. Was mit unserem Freund geschehen ist und wie... ich will es mir lieber nicht vorstellen. Ich hatte gehofft, dass in diesem Monstrum kein Funken Bewusstsein seines früheren Selbst mehr schlummert, aber... ich hätte schwören können, es hat mich erkannt.

Wir können jetzt nichts mehr für unseren Kameraden tun, und ich fürchte, es zu töten, wird uns nicht erlösen. Wir könnten ihm immer wieder begegnen: Die Pandoraner vervielfältigen und klonen ihre Opfer endlos.

Wir müssen das Pandoravirus ein für alle Mal besiegen. Nur so können wir Gewissheit erlangen.",,,"Сомнений быть не может: эта тварь является, точнее когда-то была одним из наших бойцов. Что произошло с нашим другом и почему... Лучше даже не пытаться это представить. Я бы хотел надеяться, что в этом чудовище не осталось ни крупицы сознания прежнего человека, но... могу поклясться, что оно узнало меня. Сейчас мы ничего не можем сделать для нашего товарища, и, думаю, его убийство не принесет пользы. Мы можем столкнуться с ним снова и снова: Пандораны бесконечно скрещивают и клонируют свои жертвы. Мы должны победить Пандоравирус раз и навсегда. Это единственный способ покончить с этим.
",,
PX_REVENANT_LIVE_RESEARCH_BENEFITS,Text,,Killing or capturing Revenants may grant access to additional research,,Tuer ou capturer des Revenants peut permettre d’accéder à des recherches supplémentaires.,Das Töten oder Fangen von Revenanten [Rückkehrern] kann den Zugang zu zusätzlicher Forschung gewähren.,,,"Убийство или захват Возвращенцев может дать доступ к дополнительным исследованиям
",,
PX_PROJECT_OSIRIS_TITLE,Text,,Project Osiris,,Projet Osiris,Projekt Osiris,,,"ПРОЕКТ ОСИРИС
",,
PX_PROJECT_OSIRIS_REVEAL,Text,,Defeating Revenants in the field has brought us closer to understanding how they are created. We may yet harness this knowledge in the war for the future of our species.,,Vaincre les Revenants sur le terrain nous a permis de mieux comprendre comment ils sont créés. Nous pouvons encore exploiter ces connaissances dans la guerre pour l'avenir de notre espèce.,Die Niederlage der Revenanten [Rückkehrer] im Feld hat uns dem Verständnis ihrer Entstehung nähergebracht. Dieses Wissen könnten wir im Kampf um das Überleben unserer Spezies noch nutzen.,,,"Победа над Возвращенцами в бою приблизила нас к пониманию того, откуда они берутся. Возможно, мы еще воспользуемся этими знаниями в войне за будущее нашего вида.
",,
PX_PROJECT_OSIRIS_COMPLETE,Text,,"The Pandorans use the Oneiric Delirium to tap into our consciousness and partially replicate it. 

At first we assumed that they could only access information stored in our genes. However, subsequent encounters with Revenants demonstrated that they retained memories of their former lives. Furthermore, we have evidence that the act of remembering triggers an emotional response in them. 

All this leads us to conclude that the Oneiric Delirium taps into a variety of data streams or information centers of the infected. It's a process that we cannot even begin to understand, even as it puts into question our basic notions of consciousness. 

Nevertheless, we have managed to extract some practical applications from our research into Revenants. We believe we are  now capable of sometimes saving critically wounded operatives by giving them new, artificial bodies.",,"Les Pandoriens utilisent le Delirium pour puiser dans notre conscience et la répliquer partiellement.

Au début, nous avons supposé qu'ils ne pouvaient accéder qu'aux informations stockées dans nos gènes. Cependant, des rencontres ultérieures avec des Revenants ont démontré qu'ils conservaient des souvenirs de leurs vies antérieures. De plus, nous avons la preuve que l'acte de se souvenir déclenche une réponse émotionnelle chez eux.

Tout cela nous amène à conclure que le Delirium puise dans une variété de flux de données ou de centres d'information des infectés. C'est un processus que nous ne pouvons même pas commencer à comprendre, même s'il remet en question nos notions de base de la conscience.

Néanmoins, nous avons réussi à extraire quelques applications pratiques de nos recherches sur les Revenants. Nous pensons que nous sommes maintenant capables de sauver parfois des agents gravement blessés en leur donnant de nouveaux corps artificiels.","Die Pandoraner nutzen das Oneirische Delirium, um in unser Bewusstsein einzudringen und es teilweise zu replizieren.

Zuerst nahmen wir an, sie könnten nur auf in unseren Genen gespeicherte Informationen zugreifen. Begegnungen mit Revenanten [Rückkehrern] zeigten jedoch, dass diese Erinnerungen an ihre früheren Leben bewahrten. Darüber hinaus gibt es Hinweise darauf, dass das Erinnern eine emotionale Reaktion in ihnen auslöst.

All dies lässt uns schlussfolgern, dass das Oneirische Delirium auf verschiedene Datenströme oder Informationszentren der Infizierten zugreift. Es ist ein Prozess, den wir noch nicht einmal ansatzweise verstehen können und der unsere grundlegenden Vorstellungen von Bewusstsein infrage stellt.

Dennoch ist es uns gelungen, aus unserer Forschung an den Revenanten [Rückkehrern] einige praktische Anwendungen zu gewinnen. Wir glauben, dass wir nun in der Lage sind, schwer verletzte Einheiten mitunter zu retten, indem wir ihnen neue, künstliche Körper geben.",,,"Пандораны используют Сонное Безумие, чтобы проникнуть в наше сознание и частично заместить его. Сначала мы предположили, что они могут получить доступ только к информации, хранящейся в наших генах. Однако последующие встречи с Возвращенцами показали, что они сохраняют воспоминания о своих прежних жизнях. Более того, у нас есть доказательства того, что попытки вспомнить вызывают у них эмоции. Все это позволяет сделать вывод, что Сонное Безумие распространяется вместе с различными потоками данных через информационные системы зараженных. Это процесс, который мы даже не можем понять, так как он ставит под сомнение наши основные представления о сознании. Тем не менее нам удалось извлечь некоторые практические выгоды из наших исследований Возвращенцев. Мы считаем, что теперь можем иногда спасать тяжелораненых бойцов, давая им новые, искусственные тела.
",,
PX_PROJECT_OSIRIS_BENEFITS,Text,,"With a mutation and/or a bionic lab, a Phoenix KIA operative may be given a new lease on life. Limited to one deceased operative per mission. Chances are highest for the more experienced operatives.",,"Grâce à un laboratoire de mutations et/ou cybernétique, un agent Phoenix mort au combat peut se voir offrir une seconde chance. Limité à une unité décédée par mission. Les chances sont plus élevées pour les unités les plus expérimentées.",Durch eine Mutation und/oder ein Bioniklabor kann eine im Einsatz gefallene Phoenix-Einheit wiederbelebt werden. Pro Mission kann nur eine gefallene Einheit wiederbelebt werden. Die Chancen stehen für erfahrenere Einheiten am besten.,,,"С помощью лаборатории мутаций и/или бионической лаборатории боец Феникса может получить новую жизнь. Ограничение: один погибший боец за миссию. Наибольшие шансы - у более опытных бойцов.
",,
