"Key","Type","Desc","English","Chinese (Simplified)","French","German","Italian","Polish","Russian","Spanish","UI_Tester"
"KEY_ResCratePriority","Text","","RESOURCE CRATE PRIORITY","资源箱优先","PRIORITÉ CAISSES","PRIORITÄT ROHSTOFFKISTEN","","","СБОР РЕСУРСОВ","",""
"NO_CHANGE","Text","","NO CHANGE","无变化","AUCUN CHANGEMENT","KEINE ÄNDERUNG","","","НЕ МЕНЯТЬ","",""
"KEY_TacticalDifficulty_DESCRIPTION","Text","","You can choose a different difficulty setting for the tactical portion of the game at any time.","你可以随时选择战术部分的不同难度设置。","Vous pouvez changer à tout moment le niveau de difficulté de la partie tactique du jeu.","Jederzeit kann ein anderer Schwierigkeitsgrad für den Taktikteil des Spiels gewählt werden.","","","В любой момент в процессе игры вы можете выбрать другой режим сложности для тактического (боевого) режима","",""
"KEY_TacticalDifficulty","Text","","DIFFICULTY ON TACTICAL","战术难度","DIFFICULTÉ TACTIQUE","SCHWIERIGKEITSGRAD TAKTISCH","","","СЛОЖНОСТЬ БОЕВКИ","",""
"KEY_LearnFirstSkill_DESCRIPTION","Text","","If enabled, the first personal skill (level 1) is set right after a character is created (starting soldiers, new recruits in havens, rewards, etc).","如果启用，角色创建后（起始士兵、避难所新兵、奖励等）将直接获得第一个个人技能（1级）。","Si activé, attribue automatiquement la première compétence personnelle (niveau 1) immédiatement après la création d’un personnage (soldats de départ, recrues, récompenses...).","Wenn diese Einstellung aktiviert ist, wird die erste persönliche Fertigkeit (Stufe 1) direkt nach der Einheitenerstellung festgelegt (Starteinheiten, neue Rekruten in Zufluchten, Belohnungen usw.).","","","Если эта функция включена, то первый персональный навык (уровень 1) создается сразу при генерации бойца (стартовые солдаты, новобранцы в убежищах, наградные бойцы и т.д.)","",""
"KEY_LearnFirstSkill","Text","","LEARN FIRST BACKGROUND PERK","学习第一个背景特质","PREMIÈRE COMPÉTENCE AUTOMATIQUE","ZUERST DEN HINTERGRUNDVORTEIL LERNEN","","","ИЗУЧИТЬ ПЕРВЫЙ НАВЫК СРАЗУ","",""
"KEY_HavenSOS_DESCRIPTION","Text","","Havens under attack will send an SOS, revealing their location to the player.","受到攻击的避难所将发送求救信号，向玩家揭示其位置。","Les refuges attaqués envoient un SOS, révélant leur position au joueur.","Angegriffene Zufluchten senden ein SOS und geben so ihre Position auf der Karte preis.","","","Убежища, подвергшиеся нападению, посылают сигнал SOS передавая свои координаты","",""
"KEY_HavenSOS","Text","","HAVENS SEND SOS","避难所发送求救信号","SOS DES REFUGES","ZUFLUCHTEN SENDEN SOS","","","УБЕЖИЩА ПОСЫЛАЮТ SOS ПРИ НАПАДЕНИИ","",""
"KEY_DisableTacSaves_DESCRIPTION","Text","","You can still restart the mission though.","你仍然可以重新开始任务。","Il est toujours possible de relancer la mission.","Du kannst die Mission aber trotzdem neu starten.","","","В тактическом режиме вы не сможете сохраняться (рекомендовано, так как такие сохранения порождают различные баги). При этом все равно можно будет перезапустить миссию","",""
"KEY_DisableTacSaves","Text","","DISABLE SAVING ON TACTICAL","禁用战术战斗存档","DÉSACTIVER LA SAUVEGARDE EN TACTIQUE","SPEICHERN IM TAKTIKMODUS DEAKTIVIEREN","","","НЕ СОХРАНЯТЬСЯ В ТАКТИЧЕСКОМ РЕЖИМЕ","",""
"KEY_StaminaRecuperation_DESCRIPTION","Text","","The starting type of passenger module, FAR-M, will slowly recuperate the stamina of the operatives on board. Switch off if you prefer to have to return to base more often.","起始乘员模块 FAR-M 会缓慢恢复机组干员的耐力。若你希望更频繁返回基地，可关闭此功能。","Le type de module passager de départ, FAR-M, régénère lentement l’endurance des agents à bord. Désactivez-le si vous préférez devoir retourner à la base plus souvent.","Das standardmäßige Fluggerätetransportmodul „Erstangriff-Aufklärungs-Modul (FAR)“ regeneriert langsam die Ausdauer der Besatzung. Deaktiviert muss öfter eine Basis angeflogen werden.","","","Стартовый тип пассажирского модуля самолета РШМ (разведывательно-штурмовой модуль) будет медленно восстанавливать выносливость бойцов на борту. Отключите эту опцию, если предпочитаете чаще возвращаться на базу","",""
"KEY_StaminaRecuperation","Text","","STAMINA RECUPERATION FAR-M","耐力恢复 FAR-M","RÉGÉNÉRATION D’ENDURANCE DU FAR-M","AUSDAUERREGENERATION FAR","","","САМОЛЕТ ВОССТАНАВЛИВАЕТ ВЫНОСЛИВОСТЬ","",""
"KEY_ShowAmbushExfil_DESCRIPTION","Text","","Reveal exfiltration location on the second turn of the mission, making it considerably easier.","在伏击任务的第二回合显示撤离位置，大大简化任务难度。","Révélez la position d’exfiltration au deuxième tour de la mission, ce qui la rend considérablement plus facile.","Der Evakuierungsort wird in der zweiten Runde der Mission enthüllt, was die Sache erheblich erleichtert.","","","Показывает зоны эвакуации на втором ходу миссии с засадой, что значительно облегчает ее выполнение","",""
"KEY_ShowAmbushExfil","Text","","REVEAL EXIT IN AMBUSH EARLY","提前显示伏击撤离点","EMBUSCADES : RÉVÉLER L'EXTRACTION PLUS TÔT","AUSGANG IM HINTERHALT FRÜH ENTHÜLLEN","","","РАННИЕ ЗОНЫ ЭВАКУАЦИИ ПРИ ЗАСАДАХ","",""
"KEY_EtermesVulnerabilityResistance_DESCRIPTION","Text","","Phoenix Units suffer 25% extra damage AND all enemies have 25% damage resistance.","凤凰单位受到额外25%的伤害，且所有敌人拥有25%的伤害抗性。","Les unités Phoenix subissent 25 % de dégâts supplémentaires ET tous les ennemis bénéficient de 25 % de résistance aux dégâts.","Einheiten von Phoenix erleiden 25% mehr Schaden UND alle Feinde haben eine 25% höhere Schadensresistenz.","","","Юниты Феникса будут получать на 25% урона больше, а все враги получат +25% устойчивости к урону","",""
"KEY_EtermesVulnerabilityResistance","Text","","ELDRITCH VULNERABILITY AND RESISTANCE","远古弱点与抗性","VULNÉRABILITÉ ET RÉSISTANCE ELDRITCH","<color=#a020f0>ELDRITCH VERLETZLICHKEIT UND WIDERSTAND</color>","","","НАША УЯЗВИМОСТЬ, ИХ УСТОЙЧИВОСТЬ","",""
"KEY_HarderAmbush_DESCRIPTION","Text","","Ambushes will happen more often and will be harder. Regardless of this setting, all ambushes will have crates in them. Set to false on Rookie by default","伏击将更频繁且更难。无论此设置如何，所有伏击中都会有资源箱。默认新手难度关闭此选项。","Les embuscades se produiront plus souvent et seront plus difficiles.
Quelle que soit cette option, toutes les embuscades contiendront des caisses.
Par défaut, cette option est désactivée en mode «  Bleu ».","Hinterhalte werden häufiger und schwieriger. Unabhängig von dieser Einstellung enthalten alle Hinterhalte Kisten. Standardmäßig auf „Grünschnabel“ deaktiviert.","","","Засады будут случаться чаще и будут сложнее. Независимо от этой настройки, во всех таких миссиях будут ящики с ресурсами. По умолчанию выключено для сложности ""Новичок""","",""
"KEY_HarderAmbush","Text","","HARDER AMBUSHES","更难的伏击","EMBUSCADES PLUS DIFFICILES","<color=#a020f0>SCHWIERIGERE HINTERHALTE</color>","","","СЛОЖНЫЕ ЗАСАДЫ","",""
"KEY_StaminaDrain_DESCRIPTION","Text","","The stamina of any operative that sustains an injury in combat that results in a disabled body part will be set to zero after the mission. The stamina of any operative that undergoes a mutation or bionic augmentation will also be set to zero.","任何在战斗中受伤导致身体部位残废的干员，任务结束后耐力将被设为零。任何经历变异或义体增强的干员耐力也将被设为零。","L’endurance de tout agent subissant une blessure en combat entraînant la désactivation d'un membre tombera à zéro après la mission. De même en cas de mutation ou d'augmentation cybernétique.","Reduzierung der Ausdauer einer jeden Einheit nach dem Kampf auf 0, wenn ein Körperteil zuvor durch eine Verletzung geschädigt wurde. Dasselbe gilt für die Ausdauer, wenn eine Mutation oder eine bionische Augmentation erlitten wird.","","","Выносливость бойца, получившего в бою выбитую часть тела (0 хитов), после завершения миссии будет обнулена. При мутации или аугментации выносливость также упадет до 0","",""
"KEY_StaminaDrain","Text","","STAMINA DRAIN ON INJURY/AUGMENTATION","受伤/增强后耐力消耗","BLESSURE/MUT./AUGMENT. : CHUTE D’ENDURANCE","<color=#a020f0>AUSDAUERVERLUST BEI VERLETZ./AUGMENT.</color>","","","ПОТЕРЯ ВЫНОСЛИВОСТИ (РАНЕНИЯ\МОДИФ.)","",""
"KEY_DiploPenalties_DESCRIPTION","Text","","Diplomatic penalties from choices in events are doubled and revealing diplomatic missions for one faction gives a diplomatic penalty with the other factions. Set to false on Rookie by default","事件中的外交惩罚加倍，且揭露一个派系的外交任务会导致与其他派系的外交惩罚。默认新手难度关闭此选项。","Les pénalités diplomatiques liées aux choix dans les événements sont doublées, et révéler les missions diplomatiques d’une faction entraîne une pénalité diplomatique avec les autres factions.
Par défaut, cette option est désactivée en mode «  Bleu ».","Diplomatische Strafen aufgrund von Entscheidungen in Ereignissen werden verdoppelt und die Offenlegung diplomatischer Missionen einer Fraktion führt zu einer diplomatischen Strafe bei den anderen Fraktionen. Standardmäßig auf „Grünschnabel“ deaktiviert.","","","Дипломатические штрафы от выбора в событиях удваиваются, а получение дипломатических миссий одной фракции дает дипломатический штраф с другими фракциями. По умолчанию отключено для сложности «Новичок»","",""
"KEY_DiploPenalties","Text","","HIGHER DIPLOMATIC PENALTIES","更高的外交惩罚","PÉNALITÉS DIPLOMATIQUES ACCRUES","<color=#a020f0>HÖHERE DIPLOMATISCHE STRAFEN</color>","","","БОЛЬШИЕ ДИПЛОМАТИЧЕСКИЕ ШТРАФЫ","",""
"KEY_ImpossibleWeapons_DESCRIPTION","Text","","In TFTV, Ancient Weapons are replaced by the Impossible Weapons (IW) counterparts. They have different functionality (read: they are nerfed) and some of them require additional faction research. Check this option off to keep Impossible Weapons with the same stats and functionality as Ancient Weapons in Vanilla and without requiring additional faction research. Set to false by default on Rookie.","在《来自虚空的恐惧》中，远古武器被不可能武器（IW）替代。它们功能不同（即被削弱），且部分需要额外的派系研究。取消勾选此选项可保持不可能武器与原版远古武器相同的属性和功能，且无需额外派系研究。默认新手难度关闭此选项。","Dans TFTV, les Armes Anciennes sont remplacées par leurs homologues, les Armes Mystérieuses. Elles ont des fonctionnalités différentes (c’est-à-dire qu’elles sont nerfées) et certaines nécessitent des recherches supplémentaires par les factions. Cochez cette option pour conserver les Armes Impossibles avec les mêmes caractéristiques et fonctionnalités que les Armes Anciennes en vanilla, sans nécessiter de recherches supplémentaires par les factions. Par défaut, cette option est désactivée en mode «  Bleu ».","In TFTV ersetzen unmögliche Waffen (IW) die Uralten Waffen. Diese haben eine andere Funktionalität (sind abgeschwächt) und einige erfordern zusätzliche Fraktionsforschung. Diese Einstellung deaktivieren, um die unmöglichen Waffen mit denselben Werten und derselben Funktionalität wie die Uralten Waffen im Basisspiel zu behalten, ohne dass zusätzliche Fraktionsforschung erforderlich ist. Standardmäßig auf „Grünschnabel“ deaktiviert.","","","В TFTV оружие Древних заменено Супер-оружием (СО). Оно имеют другую функциональность (по сути: это нерф), а некоторые единицы Супер-оружия требуют дополнительного исследования фракции. Выключите эту настройку, чтобы Супер-оружие имело те же статы и функциональность, что и оружие Древних в ванильной игре, и не требовало дополнительного исследования фракций. По умолчанию выключено для сложности ""Новичок"" ","",""
"KEY_ImpossibleWeapons","Text","","ADJUST IMPOSSIBLE WEAPONS","调整不可能武器","AJUSTER LES MYSTÉRIEUSES ARMES","<color=#a020f0>ANPASSUNG UNMÖGLICHER WAFFEN</color>","","","СУПЕР-ОРУЖИЕ","",""
"KEY_ResourcesEvents_DESCRIPTION","Text","","TFTV adjusts the amount of resources gained in Missions and Events by difficulty level. Please be aware that, for Events, TFTV 100% refers to Vanilla Pre-Azazoth patch levels (so it's actually 80% of current Vanilla amount).","TFTV 根据难度等级调整任务和事件中获得的资源数量。请注意，对于事件，TFTV 100% 指的是原版 Azazoth 补丁前的资源量（所以实际上是当前原版资源量的 80%）。","TFTV ajuste la quantité de ressources obtenues lors des missions et événements selon le niveau de difficulté. Notez que pour les événements, TFTV 100 % correspond aux niveaux Vanilla avant le patch Azazoth (ce qui représente en réalité 80 % de la quantité Vanilla actuelle).","In TFTV wird die in Missionen und Events erhaltene Ressourcenmenge an den Schwierigkeitsgrad angepasst. In TFTV entspricht 100% der Menge vor dem Azazoth-Patch (also tatsächlich 80% der aktuellen Menge im Basisspiel).","","","TFTV регулирует количество ресурсов, получаемых в миссиях и событиях, в зависимости от уровня сложности. Пожалуйста, обратите внимание, что для событий TFTV на 100% соответствует ванильной игре до патча Azazoth (так что на самом деле это 80% от текущей Ванили)","",""
"KEY_ResourcesEvents","Text","","SCALE RESOURCE ACQUISITION","调整资源获取量","AJUSTER L’ACQUISITION DE RESSOURCES","<color=#a020f0>SKALIERBARE ROHSTOFFBESCHAFFUNG</color>","","","КОЛИЧЕСТВО РЕСУРСОВ","",""
"KEY_ExoticResources_DESCRIPTION","Text","","Choose the amount of Exotic Resources you want to have in your game per playthrough. Each unit provides enough resources to manufacture one set of Impossible Weapons. So, if you want to have two full sets, set this number to 2, and so on. By default, this is set by the difficulty level: 2.5 on Rookie, 2 on Veteran, 1.5 on Hero, 1 on Legend.","选择每次游戏中你希望拥有的异域资源数量。每单位资源足够制造一套不可能武器。因此，如果你想拥有两整套，请将此数值设为 2，依此类推。默认情况下，此数值由难度等级决定：新兵为 2.5，老兵为 2，英雄为 1.5，传奇为 1。","Choisissez la quantité de Ressources Exotiques que vous souhaitez avoir dans votre partie. Chaque unité fournit suffisamment de ressources pour fabriquer un ensemble complet d'Armes Mystérieuses. Ainsi, si vous voulez disposer de deux ensembles complets, définissez ce nombre sur 2, et ainsi de suite. Par défaut, cette valeur est définie par le niveau de difficulté : 2,5 en Bleu, 2 en Vétéran, 1,5 en Héros et 1 en Légende.","Wähle die Menge an exotischen Rohstoffen pro Spieldurchgang. Jede Einheit liefert genug Rohstoffe, um einen Satz unmöglicher Waffen herzustellen. Wenn du also zwei vollständige Sätze haben möchtest, stelle diesen Wert auf 2 usw. - Standardmäßig richtet sich dies nach dem Schwierigkeitsgrad: 2,5 auf Grünschnabel, 2 auf Veteran, 1,5 auf Held und 1 auf Legende.","","","Выберите количество экзотических ресурсов, которое вы хотите иметь в игре. 100% - ресурсы для производства одного комплекта Супер-оружия, 200% - 2 комплекта и так далее. По умолчанию это число зависит от уровня сложности: 250% на «Новичке», 200% на «Ветеране», 150% на «Герое», 100% на «Легенде»","",""
"KEY_ExoticResources","Text","","AMOUNT OF EXOTIC RESOURCES","异域资源数量","QUANTITÉ DE RESSOURCES EXOTIQUES","<color=#a020f0>MENGE EXOTISCHER ROHSTOFFE</color>","","","КОЛИЧЕСТВО ЭКЗОТИЧЕСКИХ РЕСУРСОВ","",""
"KEY_SkipMovies_DESCRIPTION","Text","","Choose whether to skip Logos on game launch, Intro and Landing cinematics. Adapted from Mad's Assorted Adjustments.","选择是否跳过游戏启动时的标志、开场和着陆过场动画。改编自 Mad 的杂项调整。","Choisissez si vous souhaitez passer les cinématiques Logos au lancement du jeu, ainsi que les cinématiques d’Intro et d’Atterrissage. Adapté de Mad’s Assorted Adjustments.","Logos, Intro und Zwischensequenzen beim Start überspringen. (Adaptiert von Mad's Assorted Adjustments).","","","Выберите, пропускать ли видео вставки при запуске игры, во вступлениях и роликах приземления самолета (адаптация Mad's Assorted Adjustments)","",""
"KEY_SkipMovies","Text","","SKIP MOVIES","跳过过场动画","PASSER LES CINÉMATIQUES","FILME ÜBERSPRINGEN","","","ПРОПУСК ВИДЕО","",""
"KEY_MoreMistVO_DESCRIPTION","Text","","If you are playing on a Low-end system and experience lag with this Void Omen, you can turn it off here. This will prevent it from rolling.","如果你使用低端系统游玩并且在此虚空预兆事件中遇到卡顿，可以在这里关闭它。这将阻止该事件触发。","Si vous jouez sur un système peu puissant et que vous constatez des ralentissements avec cette Influence du Néant, vous pouvez le désactiver ici. Cela empêchera son activation.","Deaktivieren, falls auf einem leistungsschwachen System gespielt wird und bei Omen der Leere Verzögerungen auftreten. Dadurch wird verhindert, dass es sich ausbreitet.","","","Если вы играете на слабом компьютере и испытываете лаги с Void Omen (Знамения Пустоты - механика случайных эффектов Тумана в моде TFTV) ""Больше Тумана"", вы можете отключить его","",""
"KEY_MoreMistVO","Text","","PLAY WITH MORE MIST VOID OMEN","启用更多迷雾虚空预兆","INFLUENCE DU NÉANT : PLUS DE BRUME","SPIELE MIT MEHR NEBEL „OMEN DER LEERE“","","","ЗНАМЕНИЕ ПУСТОТЫ ""БОЛЬШЕ ТУМАНА""","",""
"KEY_StrongerPandorans_DESCRIPTION","Text","","Applies the changes from Dtony BetterEnemies that make Pandorans more of a challenge.","应用 Dtony BetterEnemies 的改动，使潘多拉体更具挑战性。","Applique les modifications de Dtony BetterEnemies qui rendent les Pandoriens plus redoutables.","Wendet die Änderungen aus Dtony BetterEnemies an, die Pandoraner zu einer größeren Herausforderung machen.","","","Включается дополнительный мод ""Dtony BetterEnemies"", который делает Пандоранов более опасными","",""
"KEY_StrongerPandorans","Text","","STRONGER PANDORANS","更强的潘多拉体","PANDORIENS PLUS FORTS","<color=#a020f0>STÄRKERE PANDORANER</color>","","","ОПАСНЫЕ ПАНДОРАНЫ","",""
"KEY_Flinching_DESCRIPTION","Text","","The characters will continue to animate during shooting sequences and targets that are hit may flinch, causing subsequent shots in a burst to miss when shooting in freeaim mode.","角色在射击序列中将继续动画，命中的目标可能会畏缩，导致在自由瞄准模式下连射的后续射击失误。","Les personnages continueront à s’animer pendant les séquences de tir, et les cibles touchées peuvent sursauter, ce qui peut faire rater les tirs suivants d’une rafale en mode visée libre.","Getroffene Ziele können zurückzucken. Dies kann dazu führen, dass nachfolgende Schüsse einer Salve im freien Zielmodus ihr Ziel verfehlen.","","","Персонажи будут продолжать шевелиться при стрельбе, а пораженные цели могут дергаться, из-за чего последующие выстрелы в очереди могут промахиваться при стрельбе в режиме свободного прицеливания","",""
"KEY_Flinching","Text","","FLINCHING","畏缩","SURSAUT","ZURÜCKZUCKEN","","","ПОСТОЯННОЕ ДВИЖЕНИЕ","",""
"KEY_NoDropReinforcements_DESCRIPTION","Text","","Enemy reinforcements do not drop items on death; disallows farming for weapons on missions with infinite reinforcements.","敌方增援死亡时不会掉落物品；禁止在无限增援的任务中刷取武器。","Les renforts ennemis ne lâchent pas d’objets à leur mort ; cela empêche de farmer des armes lors des missions avec des renforts infinis.","Gegnerische Verstärkungen lassen keine Beute fallen. Dies verhindert das Farmen von Waffen in Missionen mit unendlichen Verstärkungswellen.","","","Вражеские подкрепления не роняют предметы после смерти. Это не позволит фармить оружие в миссиях с бесконечными подкреплениями","",""
"KEY_NoDropReinforcements","Text","","NO ITEM DROPS FROM REINFORCEMENTS","增援无物品掉落","AUCUN BUTIN DES RENFORTS","KEINE BEUTE VON VERSTÄRKUNGEN","","","ПОДКРЕПЛЕНИЯ БЕЗ ЛУТА","",""
"KEY_LimitedRaiding_DESCRIPTION","Text","","After a raid, all faction havens are immediately set to highest alert and may not be raided in the next 7 days.","突袭后，所有派系避难所立即进入最高警戒状态，且在接下来的7天内不可被突袭。","Après un raid, tous les refuges des factions passent immédiatement en alerte maximale et ne peuvent pas être attaqués pendant les 7 jours suivants.","Nach einem Überfall werden alle Fraktionszufluchten sofort auf höchste Alarmbereitschaft versetzt und dürfen in den nächsten 7 Tagen nicht angegriffen werden.","","","После рейда все убежища фракции немедленно переводятся в режим повышенной готовности и не могут подвергаться рейдам в течение следующих 7 дней","",""
"KEY_LimitedRaiding","Text","","LIMITED RAIDING","限制突袭","RAIDS LIMITÉS","BEGRENZTE ÜBERFÄLLE","","","ОГРАНИЧИТЬ РЕЙДЫ","",""
"KEY_Trading_DESCRIPTION","Text","","Trade is always 1 tech for 5 food or 5 materials, so no profit can be made from trading.","交易始终为1科技换5食物或5材料，因此无法通过交易获利。","Les échanges sont toujours de 1 technologie contre 5 nourriture ou 5 matériaux, ce qui empêche de réaliser un profit via le commerce.","Handel gewährt immer nur 1 Technologie gegen 5 Nahrung oder 5 Materialien. Daher kann durch Handel kein Gewinn erzielt werden.","","","Торговля - это всегда 1 технология за 5 еды или 5 материалов, поэтому прибыль от торговли невозможна","",""
"KEY_Trading","Text","","NO PROFIT FROM TRADING","交易无利润","AUCUN PROFIT DU COMMERCE","KEIN GEWINN DURCH HANDEL","","","НЕТ ПРИБЫЛИ ОТ ТОРГОВЛИ","",""
