Key,Type,Desc,English,Chinese (Simplified),French,German,Italian,Polish,Russian,Spanish,UI_Tester
PX_CRYSTALCROSSBOW_RESEARCHDEF_COMPLETE,Text,,"At a first glance it seemed to us that Kristian Luft came up with a design for a very high air powered bow; a long shot from the marvels of the other projects of the NG+ Vanadium division. This until we realized that Prof. Luft did away with the glaring deficiency of all crossbows: that they require bolts. The Crystal Crossbow does not shoot bolts at all, but rather air particles accelerated to incredible speeds!

Requires completing Living Crystal research.",,"À première vue, il nous a semblé que Kristian Luft avait conçu un arc pneumatique à très haute puissance. Bien loin des merveilles des autres projets de la division NG+ Vanadium. Jusqu’à ce que nous nous rendions compte que le Prof. Luft avait éliminé la déficience flagrante de toutes les arbalètes : elles ont besoin de carreaux. L’arbalète de cristal ne tire pas du tout des carreaux, mais plutôt des particules d’air accélérées à des vitesses incroyables !","Auf den ersten Blick schien es sich um nichts weiter als eine pneumatische Armbrust mit außergewöhnlich hoher Luftleistung zu handeln – weit entfernt von den sonstigen Wundern der NG+-Vanadium-Abteilung.
Erst bei genauerer Betrachtung wurde klar, dass Prof. Kristian Luft einen grundlegenden Nachteil aller herkömmlichen Armbrüste überwunden hatte: Den Bedarf an Bolzen.
Die Kristallarmbrust verschießt keine Projektile, sondern Luftpartikel, die auf unglaubliche Geschwindigkeiten beschleunigt werden.

Erfordert den Abschluss der Forschung „Lebender Kristall“.",,,"На первый взгляд может показаться, что Кристиан Люфт придумал дизайн очень мощного пневматического лука, далекого от чудес других проектов филиала «Оружейные Системы Нового Поколения» корпорации «Ванадий». И это до тех пор, пока мы не поняли, что профессор Люфт избавился от вопиющего недостатка всех арбалетов: они требуют болтов. Кристаллический Арбалет стреляет вовсе не болтами, а частицами воздуха, разогнанными до невероятных скоростей! 

Требуется завершить исследование «Живой Кристалл».
",,
PX_CRYSTALCROSSBOW_RESEARCHDEF_NAME,Text,,Crystal Crossbow,,Arbalète de cristal,Kristallarmbrust,,,"КРИСТАЛЛИЧЕСКИЙ АРБАЛЕТ
",,
PX_CRYSTALCROSSBOW_RESEARCHDEF_UNLOCK,Text,,"A design for what appears to be a high powered pneumatic crossbow by Kristian Luft, acclaimed particle physicist and medieval history buff.",,"Une conception pour ce qui semble être une arbalète pneumatique de haute puissance par Kristian Luft, physicien des particules acclamé et passionné d’histoire médiévale.","Ein Entwurf für eine scheinbar leistungsstarke pneumatische Armbrust von Prof. Kristian Luft, einem gefeierten Teilchenphysiker und Mittelalterhistoriker.",,,"Проект мощного пневматического арбалета, созданный Кристианом Люфтом, известным физиком элементарных частиц и любителем средневековой истории.
",,
PX_MATTOCKOFTHEANCIENTS_RESEARCHDEF_COMPLETE,Text,,"The Reaper appears to have been designed by Valygar Prazac to address in hand to hand combat a variety of diverse hypothetical adversaries such as Golems, Gargoyles and (interestingly enough) intelligent crustaceans from outer space.

Requires completing Protean Mutane research.",,"Le Hoyau semble avoir été conçu par Valygar Prazac pour affronter au corps à corps une variété d'adversaires hypothétiques tels que des Golems, des Gargouilles et (ce qui est intéressant) des crustacés intelligents venus de l'espace.","Der Schnitter scheint von Valygar Prazac für den Nahkampf gegen eine Vielzahl hypothetischer Gegner entwickelt worden zu sein - darunter Golems, Gargoyles und – aus bislang ungeklärten Gründen – intelligente Krustentiere aus dem Weltraum.

Erfordert den Abschluss der Forschung zum „proteischen Mutan“.",,,"Судя по всему, Жнец был разработан Валигаром Празаком для рукопашного боя с самыми разными гипотетическими противниками, такими как големы, гаргульи и, что забавно, разумные ракообразные из космоса. 

Требуется завершить исследование «Белковый Мутаген».
",,
PX_MATTOCKOFTHEANCIENTS_RESEARCHDEF_NAME,Text,,Reaper,,Le Hoyau des anciens,Schnitter,,,"ЖНЕЦ
",,
PX_MATTOCKOFTHEANCIENTS_RESEARCHDEF_UNLOCK,Text,,"An impossible melee weapon dreamt up by Valygar Prazac of the NG+ Weapon Systems at Vanadium Co., and former professor in the experimental physics department of the Taras Shevchenko University of Kyiv.",,"Une arme de mêlée improbable imaginée par Valygar Prazac des systèmes d’armes NG+ à Vanadium Co., et ancien professeur au département de physique expérimentale de l’Université Taras Shevchenko de Kiev.","Eine unmögliche Nahkampfwaffe, entworfen von Valygar Prazac (NG+-Waffensysteme), einem ehemaligen Professor für Experimentalphysik an der Taras-Schewtschenko-Universität in Kiew.",,,"Невероятное оружие ближнего боя, придуманное Валигаром Празаком из филиала «Оружейные Системы Нового Поколения» корпорации «Ванадий», бывшим профессором кафедры экспериментальной физики киевского университета имени Тараса Шевченко.
",,
PX_REBUKE_RESEARCHDEF_COMPLETE,Text,,"Mr. Stridrahen was an imminently practical man and this practicality paradoxically shows throughout the impracticable (before the Antediluvian materials) Rebuke. It is somewhat of a misnomer to describe this weapon as a grenade launcher, and what happens when it is activated as an explosion, but it will have to do until we are ready to update our physics models to account for the Antediluvian materials.

Requires completing Protean Mutane research.",,"M. Stridrahen était un homme d’une pratique imminente et cette pratique se manifeste paradoxalement tout au long de la réprimande de l'infaisabilité (avant les matériaux antédiluviens). Il est un peu erroné de décrire cette arme comme un lance-grenades, et ce qui se passe quand il est activé, comme une explosion. Mais cela devra le faire jusqu’à ce que nous sommes prêts à mettre à jour nos modèles de physique pour tenir compte des matériaux antédiluviens.","Herr Stridrahen war ein ausgesprochen pragmatischer Mann – und genau diese Pragmatik spiegelt sich paradoxerweise in der Waffe „Tadel“ wider.
Was vor der Einführung antediluvianischer Materialien als unpraktisch gegolten hätte, erweist sich nun als funktional, wenn auch schwer einzuordnen. Es ist irreführend, Tadel als Granatwerfer zu bezeichnen oder die Wirkung seiner Aktivierung als Explosion zu beschreiben, doch diese Vereinfachung muss genügen – zumindest solange unsere Physik der Realität hinterherhinkt.

Erfordert den Abschluss der Forschung zum „proteischen Mutan“.",,,"Мистер Стридрахен был невероятно практичным человеком, и эта практичность парадоксальным образом проявляется в создании невозможного, до обнаружения Антедилувианских Материалов, Дезинтегратора. Описывать это оружие как гранатомет и то, что происходит при его активации, как взрыв, несколько неправильно, но это придется сделать, пока мы не будем готовы обновить наши физические модели, чтобы учесть Антедилувийские Материалы. 

Требуется завершить исследование «Белковый Мутаген».
",,
PX_REBUKE_RESEARCHDEF_NAME,Text,,Rebuke,,Querelleur,Tadel,,,"ДЕЗИНТЕГРАТОР
",,
PX_REBUKE_RESEARCHDEF_UNLOCK,Text,,"Hristos Stridrahen, the mind behind the Rebuke, rose from Vanadium Mining and Rare Earths division to NG+ Weapon Systems through his passion for high explosives.",,"Hristos Stridrahen, l’esprit derrière le Querelleur, est passé de la division des mines et des terres rares de Vanadium à NG+ Weapons Systems grâce à sa passion pour les explosifs.","Hristos Stridrahen, der Kopf hinter Tadel, arbeitete sich durch seine Leidenschaft für Sprengstoffe von der Vanadium- und Seltene-Erden-Abteilung zu den NG+-Waffensystemen hoch.",,,"Христос Стридрахен, создатель Дезинтегратора, прошел путь от рабочего в подразделении по добыче редких ископаемых до директора филиала «Оружейные Системы Нового Поколения» корпорации «Ванадий» благодаря своей страсти к взрывчатым веществам.
",,
TFTV_PX_SCORPION_RESEARCHDEF_COMPLETE,Text,,"The ultimate purpose of the Scorpion is to make all forms of armor obsolete. Surprisingly, it seems like Mr. Antonasov’s work has provided a foundational basis for a lot of technologies with practical applications developed first by Vanadium and later New Jericho.

Requires completing Living Crystal and Protean Mutane researches.",,"L’objectif ultime du Scorpion est de rendre toutes les formes de blindage obsolètes. Étonnamment, il semble que les travaux de M. Antonasov aient fourni une base fondamentale à de nombreuses technologies aux applications pratiques, développées d’abord par Vanadium, puis plus tard par la Nouvelle-Jéricho.

Malheureusement, il nous manque encore le savoir‑faire nécessaire pour produire certains composants critiques indispensables à la construction d’un prototype du Scorpion. Nous supposons que la Nouvelle-Jéricho mène actuellement des recherches dans cette direction, dans le cadre du développement d’un nouveau véhicule terrestre.

De plus, nécessite l’achèvement des recherches Cristal Vivant et Mutane Protéen.","Das ultimative Ziel des Skorpions ist es, jede Form von Rüstung überflüssig zu machen. Erstaunlicherweise bildet die Arbeit von Herrn Antonasov die Grundlage für zahlreiche Technologien mit praktischen Anwendungen, die zunächst von Vanadium und später von Neu-Jericho weiterentwickelt wurden.

Ärgerlicherweise fehlt uns derzeit das technische Know-how zur Produktion einiger kritischer Komponenten für einen Skorpion-Prototyp. Unsere Einschätzung ist, dass Neu-Jericho in diese Richtung forscht, vermutlich mit dem Ziel, ein neues Landfahrzeug zu entwickeln.

Zusätzlich erfordert dieses Projekt den Abschluss der Forschungen „Lebender Kristall“ und „proteisches Mutan“.",,,"Конечная цель Скорпиона - сделать все виды брони устаревшими. Удивительно, но похоже, что работа мистера Антонасова послужила основой для множества технологий, имеющих практическое применение, разрабатываемых сначала корпорацией «Ванадий», а затем Новым Иерихоном. 

К сожалению, нам не хватает ноу-хау для производства некоторых критически важных компонентов, необходимых для создания прототипа Скорпиона. Возможно, Новый Иерихон проводит исследования в этом направлении для разработки новой машины.

В дополнение, требуется завершить исследования «Живой Кристалл» и «Белковый Мутаген».
",,
TFTV_NJ_VEHICLETECH_RESEARCHDEF_BENEFITS,Text,,The breakthrough we have been waiting for! We can now manufacture the Scorpion Impossible Weapon.,,La percée que nous attendions ! Nous pouvons désormais fabriquer la mystérieuse arme Scorpion.,"Der Durchbruch, auf den wir gewartet haben! Wir können jetzt den Skorpion, eine unmögliche Waffe, herstellen.",,,"Прорыв, которого мы так долго ждали! Теперь мы можем производить Скорпиона (Супер-оружие).
",,
PX_SCORPION_RESEARCHDEF_COMPLETE,Text,,"The ultimate purpose of the Scorpion is to make all forms of armor obsolete. Surprisingly, it seems like Mr. Antonasov’s work has provided a foundational basis for a lot of technologies with practical applications developed first by Vanadium and later New Jericho.

Requires completing Living Crystal and Protean Mutane researches.",,"Le but ultime du Scorpion est de rendre toutes les formes d’armure obsolètes. Étonnamment, il semble que le travail de M. Antonasov ait fourni une base fondamentale à de nombreuses technologies avec des applications pratiques développées d’abord par Vanadium et plus tard par la Nouvelle-Jéricho.","Das ultimative Ziel des Skorpions ist es, jegliche Rüstung überflüssig zu machen. Erstaunlicherweise scheint die Arbeit von Herrn Antonasov die Grundlage für viele Technologien mit praktischen Anwendungen gelegt zu haben, die zuerst von Vanadium und später von Neu-Jericho entwickelt wurden.

Erfordert den Abschluss der Forschungen „Lebender Kristall“ und „proteisches Mutan“.",,,"Конечная цель Скорпиона - сделать все виды брони устаревшими. Удивительно, но похоже, что работа мистера Антонасова послужила основой для множества технологий, имеющих практическое применение, разрабатываемых сначала корпорацией «Ванадий», а затем Новым Иерихоном. 

Требуется завершить исследования «Живой Кристалл» и «Белковый Мутаген».
",,
PX_SCORPION_RESEARCHDEF_NAME,Text,,Scorpion,,Scorpion,Skorpion,,,"СКОРПИОН
",,
PX_SCORPION_RESEARCHDEF_UNLOCK,Text,,This blueprint by renowned rocket engineer John Antonasov is for some sort of long rifle with incredible damage capacity.,,Ce plan du célèbre ingénieur en fusée John Antonasov est pour une sorte de long fusil avec une capacité de pénétration et de dégâts incroyable.,Dieser Entwurf des renommierten Raketeningenieurs John Antonasov ist für eine Art Langgewehr mit unglaublicher Zerstörungskraft.,,,"Этот чертеж, выполненный известным инженером-ракетчиком Джоном Антонасовым, предназначен для производства какой-то длиннющей винтовки с невероятно мощным уроном.
",,
TFTV_SYN_BIONICS3_RESEARCHDEF_BENEFITS,Text,,Cybernetics Lab facility and additional designs. The breakthrough we have been waiting for! We can now manufacture the Scyther Impossible Weapon.,,Installation de laboratoire cybernétique et plans supplémentaires. La percée que nous attendions ! Nous pouvons désormais fabriquer la mystérieuse arme Scyther.,"Einrichtung des Kybernetiklabors und weitere Konstruktionspläne.

Der Durchbruch, auf den wir gewartet haben! Wir können jetzt die Sense, eine unmögliche Waffe, herstellen.",,,"Лаборатория кибернетики и дополненной реальности. 

Прорыв, которого мы так долго ждали! Теперь мы можем производить Косилку (Супер-оружие).
",,
TFTV_PX_SCYTHER_RESEARCHDEF_COMPLETE,Text,,"According to the notes accompanying the recovered data, Jules Godfry designed the Scyther after his disappointing performance in some sort of corporate ludic e-competition called ""Chaos Reborn 2022 Annual Tournament”. In psychological terms it is the expression of unfathomable anger directed at all things, living and inanimate, though its practical military applications in the real world were doubtful until the appearance of the Pandoran monstrosities.

Requires completing Living Crystal and Protean Mutane researches.",,"D’après les notes accompagnant les données récupérées, Jules Godfry conçut le Scyther à la suite de ses performances décevantes dans une sorte de compétition ludique d’entreprise appelée Chaos Reborn – Tournoi Annuel 2022. Sur le plan psychologique, il s’agit de l’expression d’une colère insondable dirigée contre toute chose, vivante ou inanimée, bien que ses applications militaires concrètes dans le monde réel aient longtemps été jugées douteuses, jusqu’à l’apparition des monstruosités pandoriennes.

Malheureusement, des impératifs de sécurité liés aux interactions élémentaires nous empêchent de fabriquer le Scyther, une arme tranchante à effet de zone. Cette arme nécessite des capteurs extrêmement précis capables de rééquilibrer l’arme en plein mouvement afin d’éviter de blesser son porteur. Les temps de réaction exigés par ces capteurs dépassent les capacités de notre technologie actuelle, mais le Projet Pur de la Nouvelle-Jéricho progressait dans la bonne direction. Peut‑être que le développement ultérieur des technologies cybernétiques nous apportera la solution recherchée. D’ici là, le Scyther demeure un rêve.

De plus, nécessite l’achèvement des recherches Cristal Vivant et Mutane Protéen.","Beigefügten Notizen aus den wiederhergestellten Daten zufolge entwarf Jules Godfry die Sense nach einer enttäuschenden Leistung in einem spielerischen firmeninternen Wettbewerb namens „Chaos Reborn 2022 Annual Tournament“. Psychologisch betrachtet ist sie Ausdruck eines immensen Zorns auf alles Lebende und Unbelebte – wenngleich ihre praktischen militärischen Anwendungen in der realen Welt bis zum Auftauchen der pandoranischen Bedrohung fraglich blieben.

Grundlegende Sicherheitsbedenken verhindern derzeit die Fertigung der Sense, einer Klingenwaffe mit Flächenwirkung. Der Einsatz erfordert hochpräzise Sensoren, die die Waffe während des Schwungs aktiv ausbalancieren, um Verletzungen des Trägers zu vermeiden. Die hierfür notwendigen Reaktionszeiten übersteigen die Möglichkeiten unserer aktuellen Technologie. Das Projekt „Reinheit“ von Neu-Jericho zeigt jedoch Fortschritte in diese Richtung. Eine weiterentwickelte Bionik könnte letztlich die fehlende Lösung liefern. Bis dahin bleibt die Sense ein theoretisches Konzept.

Zusätzlich erfordert dieses Projekt den Abschluss der Forschungen „Lebender Kristall“ und „proteisches Mutan“.",,,"Согласно найденным записям, Джулс Годфри создал Косилку после неудачного выступления на каком-то корпоративном кибер-спортивном соревновании под названием «Ежегодный турнир Возрождение Хаоса 2022». Психологически, это выражение яростного гнева, направленного на все живое и неживое, хотя его практическое военное применение в реальном мире было сомнительным до появления Пандоранских чудовищ. 

К сожалению, соображения элементарной безопасности не позволяют нам изготовить Косилку - холодное оружие с большой площадью поражения. Для этого оружия требуются очень точные датчики, которые могут изменять балансировку оружия во время его использования, чтобы избежать нанесения вреда его владельцу. Время срабатывания, требуемое от этих датчиков, выходит за рамки того, что может обеспечить наша собственная технология, но Проект Чистых в Новом Иерихоне продвигался в нужном направлении. Возможно, дальнейшее развитие бионических технологий даст нам необходимое решение. До тех пор Косилка остается мечтой.

В дополнение, требуется завершить исследования «Живой Кристалл» и «Белковый Мутаген».
",,
PX_SCYTHER_RESEARCHDEF_COMPLETE,Text,,"According to the notes accompanying the recovered data, Jules Godfry designed the Scyther after his disappointing performance in some sort of corporate ludic e-competition called ""Chaos Reborn 2022 Annual Tournament"". In psychological terms it is the expression of unfathomable anger directed at all things, living and inanimate, though its practical military applications in the real world were doubtful until the appearance of the Pandoran monstrosities.

Requires completing Living Crystal and Protean Mutane researches.",,"Selon les notes accompagnant les données récupérées, Jules Godfry a conçu la Scyther après sa performance décevante dans une sorte de compétition électronique ludique d’entreprise appelée « Chaos Reborn 2022 Annual Tournament ». En termes psychologiques, c’est l’expression d’une colère insondable dirigée vers toutes choses, vivantes ou inanimées, bien que ses applications militaires pratiques dans le monde réel étaient douteuses jusqu’à l’apparition des monstruosités pandoriennes.","Den Aufzeichnungen aus den wiederhergestellten Daten zufolge entwarf Jules Godfry die „Sense“ nach seiner enttäuschenden Leistung in einem spielerischen Firmenwettbewerb namens „Chaos Reborn 2022 Annual Tournament“. Psychologisch betrachtet ist sie Ausdruck unermesslicher Wut, gerichtet gegen alles Lebendige und Unbelebte. Ihre praktischen militärischen Anwendungsmöglichkeiten in der realen Welt galten jedoch bis zum Auftauchen der pandoranischen Ungeheuer als zweifelhaft.

Erfordert den Abschluss der Forschungen „Lebender Kristall“ und „proteisches Mutan“.",,,"Согласно найденным записям, Джулс Годфри создал Косилку после неудачного выступления на каком-то корпоративном кибер-спортивном соревновании под названием «Ежегодный турнир Возрожденный Хаос 2022». Психологически, это выражение яростного гнева, направленного на все живое и неживое, хотя его практическое военное применение в реальном мире было сомнительным до появления Пандоранских чудовищ. 

Требуется завершить исследования «Живой Кристалл» и «Белковый Мутаген».
",,
PX_SCYTHER_RESEARCHDEF_NAME,Text,,Scyther,,Scyther,Sense,,,"КОСИЛКА
",,
PX_SCYTHER_RESEARCHDEF_UNLOCK,Text,,"A curious design by Jules Godfry, head of NG+ Weapon Systems at Vanadium, that looks like an electro blade powered by a miniaturized fusion reactor.",,"Une curieuse conception de Jules Godfry, directeur de NG+ Weapon Systems chez Vanadium, qui ressemble à une lame électro alimentée par un réacteur à fusion miniaturisé.","Ein kurioser Entwurf von Jules Godfry, Leiter der NG+-Waffensysteme bei Vanadium: Eine Elektroklinge, angetrieben von einem miniaturisierten Fusionsreaktor.",,,"Любопытная разработка Джулса Годфри, инженера филиала «Оружейные Системы Нового Поколения» корпорации «Ванадий», выглядит как электролезвие, питающееся от миниатюрного термоядерного реактора.
",,
TFTV_ANU_ADVANCEDINFECTIONTECH_RESEARCHDEF_BENEFITS,Text,,The breakthrough we have been waiting for! We can now manufacture the Shardgun Impossible Weapon.,,La percée que nous attendions ! Nous pouvons désormais fabriquer la mystérieuse arme Shardgun.,"Ein erneuter Durchbruch! Wir können jetzt die Splitter-Schrotflinte, eine unmögliche Waffe, herstellen.",,,"Прорыв, которого мы так долго ждали! Теперь мы можем производить Осколочное Орудие (Супер-оружие).
",,
