"Key","Type","Desc","English","Chinese (Simplified)","French","German","Italian","Polish","Russian","Spanish","UI_Tester"
"KEY_SkipFSTutorial_DESCRIPTION","Text","","No air combat tutorial after completing the Hatching (the Gift in Vanilla) (You will still get the armed Manticore)","完成孵化任务（原版中的赠礼）后跳过空战教程（你仍将获得武装螳螂）。","Pas de tutoriel de combat aérien après avoir terminé l’Éclosion (équivalent de “Le Don” en Vanilla). Vous recevrez toujours le Manticore armé.","Kein Luftkampf-Tutorial nach Abschluss der Quest „Brutstätte“ (in der Basisversion „Das Geschenk“). Du erhältst dennoch den bewaffneten Manticore.","","","Пропустить обучение воздушному бою после завершения миссии ""Вылупление"" (в ванили - миссия ""Подарок"") (вы все равно получите вооруженную Мантикору)","",""
"KEY_SkipFSTutorial","Text","","SKIP AIR COMBAT TUTORIAL","跳过空战教程","PASSER LE TUTORIEL DE COMBAT AÉRIEN","LUFTKAMPF-TUTORIAL ÜBERSPRINGEN","","","ПРОПУСТИТЬ ОБУЧЕНИЕ ВОЗДУШНОМУ БОЮ","",""
"KEY_OPTIONS_TACTICAL_SAVING_WARNING","Text","","Saving and loading on Tactical can result in odd behavior and bugs (Vanilla issues). It is recommended to save only on Geoscape (and use several saves, in case one of them gets corrupted). And, you know what... losing soldiers in TFTV is fun :)","在战术战斗中保存和加载可能导致奇怪的行为和漏洞（原版问题）。建议仅在世界地图上保存（并使用多个存档，以防其中一个损坏）。而且，你知道吗……在《来自虚空的恐惧》中失去士兵其实挺有趣的 :)","Sauvegarder et charger en mode Tactique peut provoquer des comportements étranges et des bugs (problèmes présents dans Vanilla). Il est recommandé de sauvegarder uniquement sur la Géoscape (et d’utiliser plusieurs sauvegardes au cas où l’une d’elles serait corrompue). Et, vous savez quoi... perdre des agents dans TFTV, c’est amusant :)","Das Speichern und Laden im taktischen Modus kann zu ungewöhnlichem Verhalten und Fehlern führen (Probleme des Basisspiels). Es wird empfohlen, nur im Geoscape-Modus zu speichern (und mehrere Spielstände anzulegen, falls einer beschädigt wird). Und weißt du was? Einheiten in TFTV zu verlieren macht Spaß! =)","","","Сохранение и загрузка в Тактическом режиме может привести к проблемам и ошибкам (ванильный баг). Рекомендуется сохраняться только в планетарном режиме (используйте несколько сохранений, на всякий пожарный). И, знаете что... терять солдат в TFTV весело :)","",""
"KEY_OPTIONS_CHANGED_SETTING_WARNING0","Text","","Previous setting for","之前的设置","Paramètre précédent pour","Vorherige Einstellung für","","","Предыдущая настройка","",""
"KEY_OPTIONS_CHANGED_SETTING_WARNING1","Text","","has already been implemented on starting or a loading a game! PLEASE QUIT TO DESKTOP BEFORE STARTING OR LOADING A GAME","已经在开始或加载游戏时生效！请在开始或加载游戏前退出到桌面","a déjà été appliqué au lancement ou au chargement d’une partie ! VEUILLEZ QUITTER LE JEU AVANT DE COMMENCER OU DE CHARGER UNE PARTIE.","wird bereits beim Starten oder Laden eines Spiels aktiviert! BITTE VOR DEM STARTEN ODER LADEN EINES SPIELES ZUM DESKTOP ZURÜCKKEHREN","","","уже реализована при старте новой или загрузке сохраненной игры! ПОЖАЛУЙСТА, ВЫХОДИТЕ НА РАБОЧИЙ СТОЛ ПЕРЕД СТАРТОМ ИЛИ ЗАГРУЗКОЙ ИГРЫ","",""
"KEY_NoSecondChances","Text","","NO SECOND CHANCES","没有第二次机会","AUCUNE SECONDE CHANCE","<color=#a020f0>KEINE ZWEITE CHANCE</color>","","","БЕЗ ШАНСОВ!","",""
"KEY_NoSecondChances_DESCRIPTION","Text","","If you fail a story mission, that is <i>it</i>; you may not retry it again. On by default on ELDRITCH.","如果你在剧情任务中失败，那就是<i>终结</i>；你不能再次重试。默认在ELDRITCH难度开启。","Si vous échouez une mission scénarisée, c’est <i>terminé</i> ; vous ne pourrez pas la recommencer. Activé par défaut en ELDRITCH.","Wenn du eine Story-Mission nicht schaffst, <i>war's das</i>. Du kannst sie nicht erneut versuchen. Standardmäßig auf ELDRITCH aktiviert.","","","Если вы провалили сюжетную миссию, это <i>конец</i>, вы не сможете повторить ее. Включено по умолчанию на сложности ""ПОЛНОЕ БЕЗУМИЕ""","",""
"KEY_LimitedDeploymentVO","Text","","PLAY WITH LIMITED DEPLOYMENT VOID OMEN","启用有限部署虚空预兆","INFLUENCE DU NÉANT : DÉPLOIEMENT LIMITÉ","EINSATZTEAMLIMIT BEI „OMEN DER LEERE“","","","ЗНАМЕНИЕ ПУСТОТЫ ""-2 БОЙЦА В ОТРЯДЕ""","",""
"KEY_LimitedDeploymentVO_DESCRIPTION","Text","","If you are finding the VOID OMEN reducing Maximum Deployment by 2 (and increasing soldier XP by 100%) unfun, you can turn it off here. This will prevent it from rolling and, if already rolled, will prevent it from having any effect.","如果你觉得虚空预兆减少最大部署人数2名（并使士兵经验值增加100%）不有趣，可以在这里关闭。关闭后将阻止其触发，如果已触发，也将阻止其生效。","Si vous trouvez que l'Influence du Néant', réduisant le Déploiement Maximum de 2 (et en augmentant l’XP des agents de 100%), n’est pas amusant, vous pouvez le désactiver ici. Cela empêchera son activation et, si l’effet a déjà été appliqué, il n’aura plus aucun impact.","Deaktiviert die Auswirkungen von „Omen der Leere“ (-2 Einsatzteamgröße, +100% EP). Verhindert das zukünftige Auftreten und deaktiviert den Effekt sofort, falls er bereits aktiv ist.","","","Если вы считаете, что Знамение Пустоты, уменьшающее размер отряда при высадке на 2 (и увеличивающее получаемый опыт солдата на 100%), это слишком жестко, вы можете отключить это здесь. Это предотвратит его появление, а если оно уже есть, то отключит его эффекты","",""
"KEY_DeactivateTacticalAutoStandby","Text","","Deactivate tactical auto standby","禁用战术自动待命","STANDBY AUTOMATIQUE EN TACTIQUE","Automatisches Zugende im Taktikmodus deaktivieren","","","Отключить автоматический режим ожидания юнита в Тактическом режиме","",""
"KEY_DeactivateTacticalAutoStandby_DESCRIPTION","Text","","Disables or enables the vanilla behavior of automatically putting an actor into standby mode and thus switching to the next actor when all AP are used. ATTENTION: This function is WIP, i.e. currently still experimental!","禁用或启用原版自动将角色置于待命状态并切换到下一个角色的行为（当所有行动力用尽时）。注意：此功能仍在开发中，目前仍属实验性质！","Active ou désactive le comportement vanilla qui met automatiquement un agent en mode veille et passe au prochain agent lorsque tous les PA sont utilisés. ATTENTION : Cette fonction est en cours de développement (WIP) et reste expérimentale !","Aktiviert oder deaktiviert das Verhalten des Basisspiels, eine Einheit automatisch in den Standby-Modus zu versetzen und zur nächsten Einheit zu wechseln, sobald alle AP verbraucht sind. ACHTUNG: Diese Funktion steckt noch in der Entwicklung und ist daher derzeit experimentell!","","","Отключает или включает ванильный перевод бойца в режим ожидания и, соответственно, переключение на следующего бойца, когда все ОД использованы. ВНИМАНИЕ: Эта функция пока еще экспериментальная (на свой страх и риск)!","",""
"KEY_Debug","Text","","Debug log & messages","调试日志与消息","Debug log & messages","Debug-Protokoll und Meldungen","","","Журнал отладки и сообщений","",""
"KEY_Debug_DESCRIPTION","Text","","Shows when any error ocurrs. Please, do not change unless you know what you are doing.","当发生任何错误时显示。请勿更改，除非你知道自己在做什么。","Affiche les erreurs. Ne modifiez que si vous savez ce que vous faites.","Zeigt an, wenn ein Fehler auftritt. Bitte nichts ändern, es sei denn, die Auswirkungen sind glasklar.","","","Индикатор ошибки. Пожалуйста, не меняйте его, если вы не понимаете, зачем","",""
"KEY_NoBarks","Text","","DISABLE PHOENIX OPERATIVES BARKS","禁用凤凰干员语音","RÉPLIQUES DES AGENTS PHOENIX","EINHEITENKOMMENTARE UNTERDRÜCKEN","","","ОТКЛЮЧИТЬ РАЗГОВОРЫ БОЙЦОВ ФЕНИКСА","",""
"KEY_NoBarks_DESCRIPTION","Text","","Your operatives will silently execute your commands and stoically bear with their consequences.","你的干员将默默执行你的命令，并坚忍地承受其后果。","Vos agents exécuteront vos ordres en silence et supporteront stoïquement leurs conséquences.","Deine Einheiten werden deine Befehle stillschweigend ausführen und die Konsequenzen stoisch ertragen.","","","Ваши бойцы будут молча выполнять ваши приказы и стоически переносить их последствия","",""
"KEY_Warning_Disable_Mod0","Text","","PLEASE DISABLE","请禁用","VEUILLEZ DÉSACTIVER","BITTE DEAKTIVIEREN","","","ПОЖАЛУЙСТА ОТКЛЮЧИТЕ,","",""
"KEY_Warning_Disable_Mod1","Text","",", AS THIS MOD HAS ALREADY BEEN FULLY INTEGRATED IN TERROR FROM THE VOID. PLEASE QUIT TO DESKTOP AND LAUNCH THE GAME AGAIN TO AVOID POSSIBLE ISSUES.","，因为此 Mod 已完全整合进《来自虚空的恐惧》。请退出到桌面并重新启动游戏以避免可能的问题。",", CAR CE MOD A DÉJÀ ÉTÉ INTÉGRÉ COMPLÈTEMENT DANS TERROR FROM THE VOID.
VEUILLEZ QUITTER LE JEU ET LE RELANCER POUR ÉVITER D’ÉVENTUELS PROBLÈMES.",", da diese Modifikation bereits vollständig in „Terror from the Void“ integriert wurde. BITTE SPIEL BEENDEN UND NEU STARTEN, UM PROBLEME ZU VERMEIDEN!","","",", ТАК КАК ЭТОТ МОД УЖЕ ПОЛНОСТЬЮ ИНТЕГРИРОВАН В TFTV (TERROR FROM THE VOID). ПОЖАЛУЙСТА, ВЫЙДИТЕ НА РАБОЧИЙ СТОЛ И ЗАПУСТИТЕ ИГРУ СНОВА, ЧТОБЫ ИЗБЕЖАТЬ ВОЗМОЖНЫХ ПРОБЛЕМ","",""
"KEY_Difficulty","Text","","TFTV_HIDDEN_DIFFICULTY","TFTV_隐藏难度","TFTV_HIDDEN_DIFFICULTY","TFTV – VERSTECKTER SCHWIERIGKEITSGRAD","","","TFTV_СКРЫТАЯ_СЛОЖНОСТЬ","",""
"KEY_Difficulty_DESCRIPTION","Text","","","","","","","","","",""
"KEY_MISSING_DLC_TFTV","Text","","TERROR FROM THE VOID REQUIRES ALL PHOENIX POINT DLC TO BE INSTALLED. YOU ARE MISSING THE FOLLOWING DLC: {0}","《来自虚空的恐惧》需要安装所有凤凰点 DLC。你缺少以下 DLC：{0}","TERROR FROM THE VOID REQUIERT TOUS LES DLC DE PHOENIX POINT. VOUS NE POSSÉDEZ PAS LE DLC SUIVANT : {0}","Für „Terror aus der Leere“ müssen ALLE Phoenix Point-DLCs installiert sein. Folgende DLCs fehlen: {0}","","","TFTV ТРЕБУЕТ УСТАНОВКИ ВСЕХ ДОПОЛНЕНИЙ К ИГРЕ PHOENIX POINT. ВАМ НЕ ХВАТАЕТ СЛЕДУЮЩИХ DLC: {0}","",""
"KEY_CustomPortraits","Text","","CUSTOM PORTRAITS IN TACTICAL","战术模式自定义头像","PORTRAITS PERSONNALISÉS EN TACTIQUE","INDIVIDUELLE PORTRÄTS IM TAKTIKMODUS","","","УНИКАЛЬНЫЕ ПОРТРЕТЫ БОЙЦОВ В МИССИЯХ","",""
"KEY_CustomPortraits_DESCRIPTION","Text","","Your operatives in Tactical will have custom portraits instead of the in-game renders. You can add your own custom portraits by placing jpg files in the Assets\Textures\Portraits folder of the mod. Check the readme in that folder for instructions.","你的干员在战术模式中将显示自定义头像，而非游戏内渲染图。你可以通过将 jpg 文件放入 Mod 的 Assets\Textures\Portraits 文件夹来添加自定义头像。请查看该文件夹中的自述文件获取说明。","Vos agents en mode Tactique utiliseront des portraits personnalisés à la place des modèles du jeu. Vous pouvez ajouter vos propres portraits en plaçant des fichiers JPG dans le dossier Assets\Textures\Portraits du mod. Consultez le fichier readme de ce dossier pour les instructions.","Im taktischen Modus können deine Einheiten individuelle Porträts anstelle der Spielgrafiken erhalten. Eigene Porträts werden hinzugefügt, indem die jeweiligen JPG-Dateien in den Ordner „Assets\Textures\Portraits“ der Mod eingefügt werden. Eine Anleitung dazu findest du in der Readme-Datei in diesem Ordner.","","","У ваших бойцов в Тактическом режиме будут пользовательские портреты, а не стандартные картинки. Вы можете добавить свои собственные портреты, поместив файлы .jpg в папку Assets\Textures\Portraits мода. Инструкции можно найти в файле readme в этой же папке.","",""
"KEY_HandGrenadeScatter","Text","","HAND GRENADES SCATTER","手榴弹散布","DISPERSION DES GRENADES À MAIN","HANDGRANATEN STREUEN","","","РАЗБРОС РУЧНЫХ ГРАНАТ","",""
"KEY_HandGrenadeScatter_DESCRIPTION","Text","","Hand thrown grenades will not be pinpoint accurate anymore and will have a small scatter.","手投掷手榴弹将不再精准命中，且会有小范围散布。","Les grenades lancées à la main ne seront plus parfaitement précises et auront une légère dispersion.","Handgranaten werden nicht mehr punktgenau sein und eine geringe Streuung aufweisen.","","","При включении опции ручные гранаты больше не получится бросать точно в цель. Будет присутствовать небольшой разброс","",""
"KEY_EquipBeforeAmbush","Text","","ALLOW EQUIPPING BEFORE AMBUSHES","允许伏击前装备","EMBUSCADES : AUTORISER L’ÉQUIPEMENT AVANT","AUSRÜSTUNG VOR HINTERHALTEN ERLAUBEN","","","ДОСТУП К ЭКИПИРОВКЕ ПЕРЕД ЗАСАДОЙ","",""
"KEY_EquipBeforeAmbush_DESCRIPTION","Text","","Allows Player to equip operatives before an ambush mission.","允许玩家在伏击任务前为干员装备物品。","Permet au joueur d’équiper ses agents avant une mission d’embuscade.","Ermöglicht es dem Spieler, seine Einheiten vor einer Hinterhaltmission auszurüsten.","","","Позволяет игроку экипировать бойцов перед миссией с засадой","",""
"KEY_DeadDropAllLoot","Text","","DROP ALL ITEMS ON DEATH","死亡时丢弃所有物品","LÂCHER TOUS LES OBJETS À LA MORT","<color=#c41f23>ALLE GEGENSTÄNDE BEIM TOD FALLEN LASSEN</color>","","","РОНЯТЬ ВСЕ ПРЕДМЕТЫ ПРИ ГИБЕЛИ","",""
"KEY_DeadDropAllLoot_DESCRIPTION","Text","","Friendlies and enemies drop all the equipment and inventory items they are carrying when they die. ","友军和敌人在死亡时会丢弃他们携带的所有装备和库存物品。","Les alliés et ennemis lâchent tout leur équipement et tous les objets de leur inventaire à leur mort.","<color=#c41f23>Verbündete und Feinde lassen beim Tod ihre gesamte Ausrüstung und alle Inventargegenstände fallen, die sie bei sich tragen.</color>","","","И свои, и враги при гибели роняют все снаряжение и предметы инвентаря, которые у них были.","",""
"KEY_UnLimitedDeployment","Text","","UNLIMITED DEPLOYMENT","无限部署","DÉPLOIEMENT ILLIMITÉ","<color=#c41f23>UNBEGRENZTE EINSATZKRÄFTE</color>","","","НЕОГРАНИЧЕННЫЕ ОТРЯДЫ","",""
"KEY_UnLimitedDeployment_DESCRIPTION","Text","","No limit to how many operatives you can deploy on a mission.","任务中部署的干员数量无限制。","Aucune limite au nombre d’agents que vous pouvez déployer lors d’une mission.","<color=#c41f23>Es gibt keine Begrenzung hinsichtlich der Anzahl der Einheiten, die du auf eine Mission entsenden kannst.</color>","","","Нет ограничения по количеству бойцов в миссиях.","",""
"KEY_DeliriumCappedAt4","Text","","DELIRIUM CAPPED AT 4","谵妄值上限为4","DELIRIUM LIMITÉ À 4","<color=#c41f23>DELIRIUM AUF 4 BEGRENZT</color>","","","МАКС. УРОВЕНЬ СОННОГО БЕЗУМИЯ: 4","",""
"KEY_DeliriumCappedAt4_DESCRIPTION","Text","","Delirium can never go above 4, therefore fully rested operatives will not suffer a penalty to Willpower. Path to Experimental Treatment research triggered when first operative reaches 4 Delirium, instead of 5.","谵妄值永远不会超过4，因此完全休息的干员不会受到意志力惩罚。首次干员达到4点谵妄时触发实验性治疗研究，而非5点。","Le Delirium ne peut jamais dépasser 4, donc les agents complètement reposés ne subiront pas de pénalité à la Volonté. La recherche « Traitement Expérimental » est déclenchée lorsque le premier agent atteint 4 de Delirium, au lieu de 5.","<color=#c41f23>Delirium kann nie über 4 steigen, daher erleiden ausgeruhte Einheiten keinen Willenskraftverlust. Die Forschung „Pfad zur experimentellen Behandlung“ wird ausgelöst, sobald der erste Agent Delirium 4 erreicht, anstatt 5.</color>","","","Уровень Сонного Безумия не может быть выше 4-х, поэтому полностью отдохнувшие бойцы не получают штраф к Силе Воли. Исследование «Экспериментальное лечение» появляется, когда первый боец достигает 4-ого уровня Сонного Безумия, вместо 5-ого.","",""
"KEY_AllowFullAugmentations","Text","","NO LIMIT TO AUGMENTATIONS","义体改造无限制","AUCUNE LIMITE AUX AUGMENTATIONS","<color=#c41f23>KEIN LIMIT AN AUGMENTIERUNGEN</color>","","","НЕТ ОГРАНИЧЕНИЙ В АУГМЕНТАЦИЯХ","",""
"KEY_AllowFullAugmentations_DESCRIPTION","Text","","Operatives can receive up to 3 bionics or mutations.","干员最多可装备3个义体或变异。","Les agents peuvent recevoir jusqu’à 3 augmentations cybernétiques ou mutations.","<color=#c41f23>Einheiten können bis zu 3 Bioniken oder Mutationen erhalten.</color>","","","Бойцы могут аугментироваться или мутировать 3 раза","",""
"KEY_MercsCanBeAugmented","Text","","MERCENARIES CAN BE AUGMENTED","雇佣兵可被改造","LES MERCENAIRES PEUVENT ÊTRE AUGMENTÉS","<color=#c41f23>SÖLDNER KÖNNEN AUGMENTIERT WERDEN</color>","","","НАЕМНИКОВ МОЖНО АУГМЕНТИРОВАТЬ","",""
"KEY_MercsCanBeAugmented_DESCRIPTION","Text","","Allows augmenting mercenaries.","允许对雇佣兵进行改造。","Permet d’augmenter les mercenaires.","<color=#c41f23>Ermöglicht die Augmentierung von Söldnern.</color>","","","Разблокируется возможность аугментировать наемников.","",""
"KEY_VehicleAndMutogSize1","Text","","VEHICLES AND MUTOGS TAKE 1 SPACE","飞行器和螳螂占用1个空间","VÉHICULES & MUTOGS OCCUPENT 1 PLACE","<color=#c41f23>FAHRZEUGE UND MUTOGS NUR 1 PLATZ</color>","","","МАШИНЫ И МУТОГИ ЗАНИМАЮТ 1 МЕСТО","",""
"KEY_VehicleAndMutogSize1_DESCRIPTION","Text","","Vehicles and Mutogs only occupy one space in aircraft and during deployment on missions.","飞行器和螳螂在飞行器内及任务部署时仅占用一个空间。","Les véhicules et les Mutogs n’occupent qu’un seul emplacement dans les appareils et lors du déploiement en mission.","<color=#c41f23>Fahrzeuge und Mutogs belegen in Fluggeräten und während des Einsatzes nur einen Platz.</color>","","","Машины и Мутоги занимают 1 грузовое место в самолетах и при старте миссий.","",""
"KEY_MultipleVehiclesInAircraftAllowed","Text","","MULTIPLE VEHICLES ALLOWED","允许携带多辆飞行器","PLUSIEURS VÉHICULES AUTORISÉS","<color=#c41f23>MEHRERE FAHRZEUGE ERLAUBT</color>","","","ЛЮБОЕ КОЛИЧЕСТВО МАШИН","",""
"KEY_MultipleVehiclesInAircraftAllowed_DESCRIPTION","Text","","Aircraft can carry multiple vehicles and can deploy multiple vehicles on all missions.","飞行器可携带多辆车辆，并可在所有任务中部署多辆车辆。","Les appareils peuvent transporter et déployer plusieurs véhicules lors des missions.","<color=#c41f23>Fluggeräte können mehrere Fahrzeuge transportieren und bei allen Missionen mehrere Fahrzeuge einsetzen.</color>","","","Самолет может переносить любое количество машин и выгружать их при старте миссий.","",""
"KEY_EasyAirCombat","Text","","EASY AIR COMBAT","简易空战","COMBAT AÉRIEN FACILE","<color=#c41f23>EINFACHER LUFTKAMPF</color>","","","ОБЛЕГЧЕННЫЙ ВОЗДУШНЫЙ БОЙ","",""
"KEY_EasyAirCombat_DESCRIPTION","Text","","Pandoran flyers don't evolve, keeping the basic loadouts throughout the whole game. ","潘多拉飞行体不会进化，整个游戏中保持基本装备。","Les pandoriens volants n’évoluent pas et conservent leurs équipements de base tout au long de la partie.","<color=#c41f23>Pandoranische Flieger entwickeln sich nicht weiter und behalten ihre Grundausrüstung das gesamte Spiel.</color>","","","Пандоранские летуны не эволюционируют, сохраняя стартовую конфигурацию до конца игры.","",""
"KEY_BehemothSubmergesForever","Text","","SLEEPY BEHEMOTH","沉睡的巨兽","BÉHÉMOTH ENDORMI","<color=#c41f23>SCHLAFENDER BEHEMOTH</color>","","","ВЯЛЫЙ БЕГЕМОТ","",""
"KEY_BehemothSubmergesForever_DESCRIPTION","Text","","After first emerging, the Behemoth goes into the deep, and stays there. Completely removes air combat with Pandoran flyers and Behemoth roamings.","巨兽首次出现后潜入深海，并一直停留在那里。完全移除潘多拉飞行单位的空中战斗和巨兽的游荡。","Après sa première apparition, le Béhemoth retourne dans les profondeurs et y reste.
Supprime complètement le combat aérien avec les pandoriens volants et les déplacements du Béhemoth.","<color=#c41f23>Nach seinem ersten Auftauchen taucht der Behemoth in die Tiefe ab und verharrt dort. Dadurch entfallen Luftkämpfe mit pandoranischen Fliegern und umherstreifenden Behemoths vollständig.</color>","","","После первого появления Бегемот уходит в глубину и остается там. Полностью отключаются воздушные бои с Пандоранскими летунами и всплытия Бегемота.","",""
"TFTV_CHEAT_OPTIONS_TITLE","Text","","CHEAT OPTIONS","作弊选项","CHEAT OPTIONS","<color=#c41f23>EINSTELLUNGEN ZUM CHEATEN</color>","","","ЧИТЫ","",""
"TFTV_CHEAT_OPTIONS_DESCRIPTION","Text","","WARNING! Each of these options disrupts game balance in some way. The mod is NOT intended to be played with any of them. Enabling these options will generally result in a worse experience for the player.","警告！这些选项中的每一个都会以某种方式破坏游戏平衡。该 Mod 并不打算与这些选项一起使用。启用这些选项通常会导致玩家体验变差。","ATTENTION ! Chacune de ces options déséquilibre le jeu. Le mod n’est PAS conçu pour être utilisé avec ces options. Les activer entraînera généralement une expérience de jeu moins satisfaisante.","<color=#c41f23>WARNUNG! Jede dieser Einstellungen stört die Spielbalance. Die Mod ist NICHT für die Verwendung mit diesen Einstellungen gedacht. Die Aktivierung dieser Einstellungen führt im Allgemeinen zu einem schlechteren Spielerlebnis.</color>","","","ВНИМАНИЕ! Каждая из этих опций так или иначе нарушает игровой баланс. Данный мод не рассчитан на игру с такими опциями. Использование этих опций ухудшит ваше впечатление от игры.","",""
