"Key","Type","Desc","English","Chinese (Simplified)","French","German","Italian","Polish","Russian","Spanish","UI_Tester"
"FIRST_HAVEN_ATTACK_TEXT","Text","","<i>""It was hard to tell the Kaiju apart from the winged creatures that surrounded it… Together they were one, and the horror they wrought was complete. A machine fueled by life. It devoured without mercy or pleasure.""</i>

Akari Ito, excerpt from ""Interviews with survivors of Incident #ZGB12/68""

<i>""It's a fragging gargantuan biomass harvester, what's so hard to understand about it?! How should I know why it destroyed only half of the frigging haven!""</i>

Dr. Philemon Stavropoulos, Non-Executive Chairman of the Extraordinary Advisory Committee on Suspected Pandoravirus Related Aerial Phenomena Commonly Known as Festering Skies
","<i>“很难将怪兽与环绕它的有翼生物区分开……它们合为一体，带来的恐怖是彻底的。一台以生命为燃料的机器。它无情且无乐趣地吞噬着。”</i>

伊藤明，摘自《事件#ZGB12/68幸存者访谈》

<i>“它就是个巨型生物质收割机，这有什么难理解的？！我怎么知道它为什么只毁了半个该死的避难所！”</i>

菲利蒙·斯塔夫罗普洛斯博士，非执行主席，潘多拉病毒相关空中现象特别咨询委员会（俗称腐烂天空）","<i>""Il était difficile de distinguer le Kaiju des créatures ailées qui l’entouraient... Ensemble, ils étaient un, et l’horreur qu’ils produisaient était complète. Une machine alimentée par la vie. Elle dévore sans pitié ni plaisir.""</i>

Akari Ito, extrait de ""Entretiens avec les survivants de l’incident #ZGB12/68""

<i>""C’est une moissonneuse de biomasse gargantuesque, qu’est-ce qui est si difficile à comprendre ? Comment saurais-je pourquoi il n’a détruit que la moitié de ce putain de refuge !""</i>

Philemon Stavropoulos, Ph. D., président non exécutif du Comité consultatif extraordinaire sur les phénomènes aériens présumé liés au pandoravirus, communément appelé l'essaim","<i>„Es war schwer, das Kaiju von den geflügelten Kreaturen zu unterscheiden, die es umschwärmten... Zusammen waren sie eins, und der Schrecken, den sie entfesselten, war vollkommen.
Eine Maschine, angetrieben von Leben. Sie fraß – ohne Gnade und ohne Genuss.“</i>

Akari Ito, Auszug aus „Interviews mit Überlebenden des Vorfalls #ZGB12/68“

<i>„Es ist ein verdammter, gigantischer Biomasse-Ernter – was gibt es daran nicht zu verstehen?! Woher soll ich wissen, warum er nur die Hälfte der verflixten Zuflucht zerstört hat!“</i>

Dr. Philemon Stavropoulos, nichtgeschäftsführender Vorsitzender des außerordentlichen Beratungsausschusses für mutmaßliche pandoravirusbedingte Luftphänomene, die gemeinhin als „Faulender Himmel“ bekannt sind.","","","<i>""Было трудно отыскать Кайдзю среди крылатых существ, которые его окружали. Вместе они были единым целым, и ужас, который они творили, был неописуем. Машина, наполненная жизнью. Она пожирала без жалости и удовольствия.""</i>

Акари Ито, выдержка из ""Интервью с выжившими после инцидента #ZGB12/68""

<i>""Это гигантский комбайн для сбора биомассы, что в нем такого сложного для понимания?! Откуда мне знать, почему он уничтожил только половину этого чертова убежища!""</i>

Доктор Филимон Ставропулос, председатель Чрезвычайного консультативного комитета по расследованию воздушных проявлений Пандоравируса, широко известных как ""Гнойное Небо""","",""
"PROG_FS20_TEXT_GENERAL_0","Text","","Why did the Behemoth destroy that haven? I believe our Adversary is trying to send us a message, “behave, or else…”","巨兽为何摧毁那个避难所？我相信我们的对手正试图传达一个信息，“规矩点，否则……”","Pourquoi le Béhémoth a-t-il détruit ce refuge ? Je crois que notre Adversaire essaie de nous envoyer un message, ""comporte-toi bien, sinon...""","Warum hat der Behemoth diese Zuflucht zerstört?
Ich glaube, unser Gegner versucht, uns eine Botschaft zu senden: „Benehmt euch – oder else...“","","","Почему Бегемот уничтожил это убежище? Я полагаю, что наш Противник пытается дать нам понять: ""Ведите себя прилично, а не то...""","",""
"PROG_FS20_TITLE","Text","","An Education into the Consequences of Resistance","抵抗的代价教育","Un enseignement sur les conséquences de la résistance","Eine Lektion über die Konsequenzen des Widerstands","","","Разъяснение последствий сопротивления","",""
"OLENA_ON_FIRST_FLYER_TITLE","Text","","Bogey!","目标！","Bogey !","Bogey!","","","Летун!","",""
"OLENA_ON_FIRST_FLYER_TEXT","Text","","One of the flyers is detaching itself from the swarm! If it reaches a haven it will wreak havoc on the civilians. We should attempt to triangulate its destination and set an armed aircraft on course to intercept.","一只飞行生物正从群体中脱离！如果它抵达避难所，将对平民造成严重破坏。我们应尝试三角定位其目的地，并派遣武装飞行器拦截。","L'une des créatures volantes se détache de l’essaim ! S’il atteint un refuge, il fera des ravages parmi les civils. Nous devrions tenter de trianguler sa destination et mettre un appareil armé en route pour l’intercepter.","Eines der Flugwesen löst sich aus dem Schwarm!
Erreicht es eine Zuflucht, wird es unter der Zivilbevölkerung verheerenden Schaden anrichten. Trianguliere sein Ziel und schicke ein bewaffnetes Flugzeug zum Abfangen.","","","Один из летунов отделяется от стаи! Если он достигнет убежища, это вызовет панику среди гражданского населения. Мы должны попытаться определить место его назначения и направить вооруженный самолет на перехват.","",""
"OLENA_ON_FIRST_HAVEN_TARGET_TITLE","Text","","Moving!","移动中！","En mouvement !","In Bewegung!","","","Оно движется!","",""
"OLENA_ON_FIRST_HAVEN_TARGET_TEXT","Text","","The Behemoth is on the move! It's targeting a haven previously visited by one of the stray flyers that returned to the Festering Skies.","巨兽正在移动！它的目标是一个之前被返回腐烂天空的流浪飞行器访问过的避难所。","Le Béhémoth est en mouvement ! Il vise un refuge visité par l’une des créatures errantes retourné dans l'essaim.","Der Behemoth ist unterwegs!
Er nimmt eine Zuflucht ins Visier, die zuvor von einem der zurückgekehrten Flugwesen besucht wurde, welches zu den Fauligen Himmeln zurückkehrte.","","","Чудовище движется! Оно нацелилось на убежище, которое ранее посетил один из отделившихся летунов, вернувшийся в «Гнойное Небо».","",""
"FIRST_HAVEN_ATTACK_OUTCOME","Text","","We have to think of the Behemoth as a highly resilient colony of pathogens, or a self-propelled ecosystem of extremophiles, rather than as a <i>Kaiju</i>.

If we want to destroy it we need the right antibodies... or more like the right biological WMD... and a method of delivering it. We will come up with something, as we always do. But in the meantime you must keep shooting down the… airborne cephalopods? If they reach a haven and return to the Behemoth, that haven will be targeted for “harvesting”.
","我们必须把巨兽看作是一个高度耐受的病原体群落，或者是一个自我驱动的极端环境生物生态系统，而不是一个<i>怪兽</i>。

如果我们想摧毁它，我们需要合适的抗体……更准确地说，是合适的生物武器……以及投放它的方法。我们会想出办法，就像我们一直做的那样。但在此期间，你必须继续击落那些……空中的头足类生物？如果它们抵达避难所并返回巨兽，那个避难所将被标记为“收割”目标。
","Nous devons considérer le Béhémoth comme une colonie d'agents pathogènes très résistante, ou un écosystème d'extrêmophiles autopropulsé, plutôt que comme un <i>Kaiju</i>.

Si nous voulons le détruire, nous avons besoin des bons anticorps... ou plutôt de la bonne arme biologique de destruction massive... et d'une méthode pour la délivrer. Nous trouverons quelque chose, comme toujours. Mais en attendant, vous devez continuer à abattre les... céphalopodes aériens ? S'ils atteignent un refuge et retournent au Behemoth, ce refuge sera ciblé pour la ""récolte"".
","„Wir müssen den Behemoth eher als eine extrem widerstandsfähige Kolonie von Krankheitserregern begreifen – oder als ein sich selbst antreibendes Ökosystem aus Extremophilen – nicht als einen <i>Kaiju</i>.

Wenn wir ihn vernichten wollen, brauchen wir die richtigen Antikörper... oder eher die passende biologische Massenvernichtungswaffe... und eine Methode, sie zuzustellen. Uns wird etwas einfallen, wie immer. Aber bis dahin musst du weiter die... fliegenden Kopffüßer abschießen? Wenn sie eine Zuflucht erreichen und zum Behemoth zurückkehren, wird diese Zuflucht zum Ziel für „Ernte“.","","","Мы должны думать о Бегемоте как о колонии патогенов с высокой устойчивостью или самодвижущейся экосистеме экстремофилов, а не как о ""Кайдзю"".

Если мы хотим уничтожить его, нам нужны правильные антитела... или, скорее, подходящее биологическое оружие массового уничтожения... и способ его доставки. Мы, как всегда, что-нибудь придумаем. Но тем временем вы должны продолжать отстреливать... летающих головоногих моллюсков? Если они доберутся до убежища и вернутся к Бегемоту, это убежище станет мишенью для ""сбора урожая"".","",""
"AFTER_YE_SIGNAL_TITLE","Text","","Messages from the Void","来自虚空的讯息","Messages du Néant","Botschaften aus der Leere","","","Послания из пустоты","",""
"AFTER_YE_SIGNAL_TEXT","Text","","Director, the Oneiric Delirium is a signal, a signal that has to cross at least 90 billion kilometers to reach us. That would take days traveling at the speed of light. The energy cost of delivering this signal to every infected human on the planet is… It's impossible.","指挥官，梦魇谵妄是一种信号，这个信号必须跨越至少900亿公里才能到达我们。以光速传播也需要数天时间。将这个信号传递给地球上每一个被感染的人类所需的能量……这是不可能的。","Directeur, le Delirium est un signal, un signal qui doit traverser au moins 90 milliards de kilomètres pour nous atteindre. Cela prendrait des jours à voyager à la vitesse de la lumière. Le coût énergétique de la transmission de ce signal à chaque humain infecté sur la planète est... C’est impossible.","„Direktor, das Oneirische Delirium ist ein Signal – ein Signal, das mindestens 90 Milliarden Kilometer überwinden muss, um uns zu erreichen. Selbst mit Lichtgeschwindigkeit dauert das Tage. Der Energieaufwand, dieses Signal an jeden infizierten Menschen auf dem Planeten zu senden ist... das ist unmöglich.“","","","Директор, Сонное Безумие - это сигнал, который должен был преодолеть, по меньшей мере, 90 миллиардов километров, чтобы достичь нас. На это ушли бы дни, если бы он распространялся со скоростью света. Затраты энергии на доставку этого сигнала каждому инфицированному человеку на планете составляют... немыслимо...","",""
"AFTER_YE_SIGNAL_OUTCOME","Text","","There must be infrastructure here, on Earth. Something to receive the signal, transform it, augment it… A network of relays that is powered locally, using our planet's resources.","地球上一定有基础设施。某种接收信号、转换信号、增强信号的装置……一个由本地能源驱动的中继网络，利用我们星球的资源。","Il doit y avoir une infrastructure ici, sur Terre. Quelque chose pour recevoir le signal, le transformer, l’augmenter... Un réseau de relais alimentés localement en utilisant les ressources de notre planète.","Es muss hier auf der Erde eine Infrastruktur geben. Etwas, das das Signal empfängt, es umwandelt, es verstärkt... Ein Netzwerk von Relaisstationen, das lokal mit Energie versorgt wird und die Ressourcen unseres Planeten nutzt.","","","Здесь, на Земле, должна быть инфраструктура. Что-то, что могло бы принимать сигнал, преобразовывать его, усиливать его. Сеть узлов-ретрансляторов, подключенная к местным источникам питания на основе ресурсов нашей планеты.","",""
"AFTER_YE_SIGNAL_CHOICE","Text","","How do you explain it then?","那你怎么解释呢？","Comment l’expliquez-vous alors ?","Wie erklärt man es dann?","","","Как же тогда вы это объясните?","",""
"BEHEMOTH_PATTERN_TITLE","Text","","A Method to the Carnage","屠杀中的规律","Une méthode pour le carnage","Eine Methode für das Gemetzel","","","Способ, ведущий к кровавой бойне","",""
"BEHEMOTH_PATTERN_TEXT","Text","","There is a pattern... I didn’t see it at first, but then it occurred to me to check the old marine surveys from the times of the First Mist. The Behemoth <i>always</i> submerges and emerges near a <i>different</i> cluster of the undersea colonies, the first recorded manifestations of the Pandoravirus over 20 years ago. It’s delivering the harvested biomass to them. 

And we know what they need it for: to amplify the Oneiric Delirium signal from Yuggoth. 

If we take out the Behemoth, we will weaken its grip on us, maybe even neutralize it completely. 
","这里有个规律……起初我没注意到，但后来我想起去查看第一次迷雾时期的旧海洋调查记录。巨兽<i>总是</i>在不同的海底殖民地群附近潜入和浮出水面，那些殖民地是20多年前潘多拉病毒首次被记录的表现。它正在向它们输送收割的生物质。

我们知道它们需要这些生物质来增强来自尤格索斯的梦魇谵妄信号。

如果我们消灭巨兽，就能削弱它对我们的控制，甚至可能完全中和它。
","Il y a une tendance.. Je ne l’ai pas vue au début, mais ensuite il m’est venu à l’esprit de vérifier les anciens relevés maritimes de l’époque de la Première Brume. Le Béhémoth plonge dans l'océan et émerge <i>toujours</i> près d’un groupe <i>différent</i> de colonies sous-marines, les premières manifestations enregistrées du pandoravirus il y a plus de 20 ans. Il leur livre la biomasse récoltée.

Et nous savons pourquoi ils en ont besoin : pour amplifier le signal du Delirium de Yuggoth.

Si nous éliminons le Béhémoth, nous affaiblirons son emprise sur nous, peut-être même la neutraliserons-nous complètement.","Da ist ein Muster... Ich habe es zuerst nicht erkannt, aber dann kam mir der Gedanke, die alten Meeresvermessungen aus der Zeit des Ersten Nebels zu überprüfen. Der Behemoth taucht <i>immer</i> in der Nähe einer <i>anderen</i> Ansammlung der Unterwasserkolonien auf, jener ersten dokumentierten Manifestationen des Pandoravirus vor über 20 Jahren. Dorthin liefert er die geerntete Biomasse.

Und wir wissen, wofür sie diese brauchen: um das Signal des Oneirischen Deliriums von Yuggoth zu verstärken.

Wenn wir den Behemoth ausschalten, schwächen wir seinen Einfluss auf uns, vielleicht sogar vollständig.","","","Есть определенная закономерность... Сначала я этого не заметил, но потом мне пришло в голову просмотреть старые морские обзоры времен Первого Тумана. Бегемот всегда погружается и всплывает вблизи различных подводных колоний, где более 20 лет назад были зафиксированы первые проявления Пандоравируса. Он доставляет им собранную биомассу.

И мы знаем, для чего им это нужно: для усиления сигнала Сонного Безумия от Юггота.

Если мы уничтожим Бегемота, мы ослабим этот сигнал, возможно, даже полностью нейтрализуем его.","",""
"PROG_FS2_WIN_CHOICE_0_TEXT","Text","","We deserve a good night sleep...","我们应当好好睡一觉……","Nous méritons une bonne nuit de sommeil...","Wir hätten eine Nacht mit richtig gutem Schlaf verdient...","","","Мы заслуживаем спокойного ночного сна","",""
"PROG_FS2_WIN_TEXT_GENERAL_0","Text","","Today we were finally able to deal a serious blow to our enemy. If only for a while, our dreams and nightmares are once again our own.  

This victory has galvanized the factions into setting aside their differences until the survival of humanity can be ensured and has cemented Phoenix Project as the only actor capable of dealing with the threat of the Yuggothian Entity. 

<i>All Void Omens removed and all non-mutated operatives clear of Delirium.</i>","今天我们终于能够对敌人造成沉重打击。即使只是暂时，我们的梦境和噩梦再次属于我们自己。

这场胜利促使各派系搁置分歧，直到确保人类生存，并巩固了凤凰计划作为唯一能够应对尤格索斯实体威胁的力量。

<i>所有虚空预兆已被消除，所有非变异干员的谵妄值已清零。</i>","Aujourd’hui, nous avons finalement pu porter un sérieux coup à notre ennemi. Le Delirium a disparu. Nos rêves et nos cauchemars nous appartiennent à nouveau. L’humanité peut encore périr, mais elle ne sera pas asservie.","Heute konnten wir unserem Feind endlich einen schweren Schlag versetzen. Zumindest für eine Weile gehören unsere Träume und Albträume wieder uns.

Dieser Sieg hat die Fraktionen dazu bewegt, ihre Differenzen beiseitezulegen, bis das Überleben der Menschheit gesichert ist - und das Phoenix-Projekt als einzigen Akteur etabliert, der fähig ist, der Bedrohung durch die yuggothische Entität zu begegnen.

<i>Alle Omen der Leere wurden entfernt und alle nicht mutierten Einheiten sind frei von Delirium.</i>","","","Сегодня мы, наконец, смогли нанести серьезный удар по нашему врагу. Пусть ненадолго, но наши сны и кошмары снова принадлежат нам.

Эта победа побудила фракции отложить в сторону свои разногласия до тех пор, пока не будет обеспечено выживание человечества, и закрепила за Проектом Феникс статус единственного участника, способного справиться с угрозой, исходящей от Югготианской сущности.

<i>Все Знамения Пустоты уничтожены, все бойцы, не подвергшиеся мутациям, излечены от Сонного Безумия.</i>","",""
"PROG_FS2_WIN_TITLE","Text","","Will Not Go Gentle Into That Night","不向那夜温顺屈服","N’entre pas doucement dans cette nuit","Wird nicht sanft in jene Nacht gehen","","","Не буду нежен в эту ночь...","",""
"PROG_FS3_CHOICE_0_TEXT","Text","","OK.","确定。","OK.","OK.","","","Ок","",""
"PROG_FS3_FAIL_CHOICE_0_TEXT","Text","","OK.","确定。","OK.","OK.","","","Ок","",""
"PROG_FS3_FAIL_TEXT_GENERAL_0","Text","","We did not have the strength to combat this threat. But we must return.","我们没有足够的力量来对抗这一威胁。但我们必须返回。","Nous n’avions pas la force pour affronter cette menace... mais nous devons revenir.","Wir hatten nicht die Kraft, dieser Bedrohung standzuhalten. Aber wir müssen zurückkehren.","","","У нас не хватило сил противостоять этой угрозе. Но мы должны вернуться!","",""
"PROG_FS3_FAIL_TITLE","Text","","Corruption of the Body","身体的腐化","Corruption du corps","Verderbnis des Körpers","","","Живые трупы","",""
"PROG_FS3_MISS_CHOICE_0_TEXT","Text","","START MISSION","开始任务","LANCER LA MISSION","MISSION STARTEN","","","НАЧАТЬ МИССИЮ","",""
"PROG_FS3_MISS_CHOICE_1_TEXT","Text","","CANCEL","取消","ANNULER","ABBRECHEN","","","ОТМЕНА МИССИИ","",""
"PROG_FS3_MISS_TEXT_GENERAL_0","Text","","Locate and destroy the Pandoran mutation that has taken hold of the minds of the Anu splinter group command.","定位并摧毁已控制阿努分裂派指挥部心智的潘多拉变异体。","Localisez et détruisez la mutation pandorienne qui a pris le contrôle de l’esprit du commandent du groupe dissident Anu.","Lokalisiert und vernichtet die pandoranische Mutation, die die Köpfe des Kommandos der Anu-Splittergruppe in Besitz genommen hat.","","","Найдите и уничтожьте Пандоранскую мутацию, которая захватила умы лидеров отколовшейся группы Ану.","",""
"PROG_FS3_MISS_TITLE","Text","","Corruption of the Mind","心智的腐化","Corruption de l’esprit","Verderbnis des Geistes","","","Безумие наступает","",""
"PROG_FS3_TEXT_GENERAL_0","Text","","Something strange is happening in a haven deep in the Mist. We are receiving reports suggesting a masspsychoneurological affliction of some sort. I bet it is a Delirium-related incident. We have to investigate it as soon as possible; it might open new avenues of research that can help us deal with the Pandoran menace.","迷雾深处的一个避难所发生了奇怪的事情。我们收到报告，显示某种大规模精神神经疾病。我敢打赌这是一起与谵妄相关的事件。我们必须尽快调查；这可能开启新的研究方向，帮助我们应对潘多拉威胁。","Il se passe quelque chose d’étrange dans un refuge perdu au cœur de la Brume. Nous recevons des rapports suggérant une sorte d’affliction psycho-neurologique de masse. Je parie qu’il s’agit d’un incident lié au Delirium. Nous devons l’investiguer dès que possible ; cela pourrait ouvrir de nouvelles pistes de recherche pour nous aider à lutter contre la menace pandorienne.","In einer Zuflucht tief im Nebel geschehen seltsame Dinge. Wir erhalten Berichte über eine Art massenpsychoneurologische Erkrankung. Ich wette, es handelt sich um einen Vorfall im Zusammenhang mit Delirium. Wir müssen dem so schnell wie möglich nachgehen; es könnte neue Forschungsansätze eröffnen, die uns helfen, die pandoranische Bedrohung zu bekämpfen.","","","Что-то странное происходит в одном из убежищ далеко в Тумане. Мы получаем сообщения о каком-то массовом психоневрологическом расстройстве. Готова поспорить, что это связано с Сонным Безумием. Мы должны расследовать это как можно скорее - это может открыть новые направления исследований, которые помогут нам справиться с Пандоранской угрозой.","",""
"PROG_FS3_TITLE","Text","","The Science of Madness","疯狂的科学","La Folie Scientifique","Die Wissenschaft des Wahnsinns","","","Наука о Безумии","",""
"PROG_FS3_WIN_CHOICE_0_TEXT","Text","","OK.","好的。","OK.","OK.","","","Ок","",""
"PROG_FS3_WIN_TEXT_GENERAL_0","Text","","The horrifying creature will no longer terrorize the Anu cultists. Let's hope they rebuild in a sensible way.","可怕的生物将不再恐吓阿努门徒。希望他们能以理智的方式重建。","La créature horrifiante ne terrorisera plus les disciples d’Anu. Espérons qu’ils reconstruisent de manière sensée.","Diese grauenhafte Kreatur wird die Anu-Kultisten nicht länger terrorisieren. Hoffen wir, dass sie ihren Kult auf vernünftige Weise wiederaufbauen.","","","Ужасное существо больше не будет терроризировать культистов Ану. Будем надеяться, что они восстановят свой разум.","",""
"PROG_FS3_WIN_TITLE","Text","","Cleansed","净化完成","Purifié","Gereinigt","","","Очищение","",""
