Key,Type,Desc,English,Chinese (Simplified),French,German,Italian,Polish,Russian,Spanish,UI_Tester
PX_BLASTRESISTANCEVEST_RESEARCHDEF_UNLOCK,Text,,The natural resistance to Pandoran acid possessed by this creature has promising applications for our own research into a device that would reduce the damage caused by the acid to our operarives.,,La résistance naturelle à l’acide pandorien possédée par cette créature offre des applications prometteuses pour nos recherches sur un dispositif capable de réduire les dégâts causés par l’acide à nos agents.,"Die natürliche Resistenz dieses Lebewesens gegenüber pandoranischer Säure bietet vielversprechende Anwendungsmöglichkeiten für unsere eigene Forschung an einem Gerät, das die durch die Säure verursachten Schäden an unseren Operateuren verringern könnte.",,,"Природная устойчивость к Пандоранской кислоте, которой обладает это существо, имеет многообещающее применение в наших собственных исследованиях покрытия, которое уменьшило бы ущерб, наносимый кислотой нашим бойцам.",,
PX_BLASTRESISTANCEVEST_RESEARCHDEF_COMPLETE,Text,,"The new acid resistance vest can be fitted under all torso armor sections. It reduces the damage to body parts from Acid by roughly half, providing valuable protection against this new Pandoran threat.",,"Le nouveau gilet de résistance à l’acide peut être porté sous toutes les sections d’armure du torse. Il réduit d’environ moitié les dégâts infligés par l’acide aux différentes parties du corps, offrant une protection précieuse contre cette nouvelle menace pandorienne.",Die neue Säureschutzweste kann unter allen Torso-Panzerungsteilen getragen werden. Sie reduziert die Säureschäden an Körperteilen um etwa die Hälfte und bietet so wertvollen Schutz vor dieser neuen Bedrohung aus Pandora.,,,"Новый костюм химзащиты можно одевать на все слоты брони на теле. Он уменьшает повреждения частей тела от кислоты примерно наполовину, обеспечивая хорошую защиту от этой новой угрозы со стороны Пандоранов.",,
PX_BLASTRESISTANCEVEST_RESEARCHDEF_BENEFITS,Text,,Acid-Res Vest is available for production,,Le gilet de résistance à l’acide est désormais disponible à la production.,Die säurebeständige Weste ist ab sofort erhältlich.,,,"Доступен для производства ""Костюм химзащиты"".",,
PX_ALIEN_ACIDWORM_RESEARCHDEF_BENEFITS,Text,,Can now research acid resistance technology!,,La technologie de résistance à l’acide peut désormais être recherchée !,Jetzt kann ich die Säureresistenztechnologie erforschen!,,,Теперь вы можете исследовать технологию кислотостойкости!,,
NJ_FIRERESISTANCETECH_RESEARCHDEF_COMPLETE,Text,,"New heat and blast resistant undersuits have been developed for use on the battlefield. The module is light to wear and can be incorporated into virtually any armor, increasing tolerance to flame and heat by 62%, and reducing the impact of explosive munitions by roughly half.",,"De nouvelles combinaisons résistantes à la chaleur et aux explosions ont été développées pour le champ de bataille. Le module est léger à porter et peut être intégré à presque toutes les armures, augmentant la résistance au feu et à la chaleur de 62 % et réduisant l’impact des munitions explosives d’environ moitié.","Für den Einsatz auf dem Schlachtfeld wurden neue, hitze- und explosionsbeständige Unteranzüge entwickelt. Das Modul ist leicht zu tragen und lässt sich in nahezu jede Schutzweste integrieren. Es erhöht die Feuer- und Hitzebeständigkeit um 62% und reduziert die Wirkung von Sprengmunition um etwa die Hälfte.",,,"Для использования в бою были разработаны новые термо- и взрывозащищенные пластины. Модули легкие, могут быть встроены практически в любую броню, повышая устойчивость к огню и перегреву на 62% и снижая воздействие взрывов примерно наполовину.",,
NJ_FIRERESISTANCETECH_RESEARCHDEF_NAME,Text,,Blast and Fire Resistant Technology,,Résistance Feu et Explosion,Explosions- und feuerbeständige Technologie,,,Технология защиты от взрывов и огня,,
NJ_FIRERESISTANCETECH_RESEARCHDEF_UNLOCK,Text,,"With the emergence of creatures such as the Fireworms, it is becoming increasingly necessary to invest in better blast and fire resistance technology.",,"Avec l’apparition de créatures comme les Vers de Feu, il devient de plus en plus nécessaire d’investir dans une technologie offrant une meilleure résistance aux explosions et au feu.","Angesichts des Auftretens von Kreaturen wie den Feuerwürmern wird es immer notwendiger, in bessere Technologien zur Explosions- und Feuerbeständigkeit zu investieren.",,,"С появлением таких созданий, как Огненные Черви, необходимо срочно разработать более совершенные технологии взрывозащиты и огнестойкости.",,
NJ_PURIFICATIONTECH_RESEARCHDEF_COMPLETE,Text,,"A new type of bio-fuel has been created to use with modern flame throwers, and compact incendiary grenades have been developed from solid fuel technology. The new weapons will assist with clearance, especially inside alien structures.",,"Un nouveau type de biocarburant a été créé pour être utilisé avec les lance‑flammes modernes, et des grenades incendiaires compactes ont été développées à partir de la technologie des carburants solides. Ces nouvelles armes faciliteront le déblaiement, notamment à l’intérieur des structures extraterrestres.

De plus, de nouvelles combinaisons résistantes à la chaleur et aux explosions ont été développées pour le champ de bataille. Le module est léger à porter et peut être intégré à presque toutes les armures, augmentant la résistance au feu et à la chaleur de 62 % et réduisant l’impact des munitions explosives d’environ moitié.","Für moderne Flammenwerfer wurde ein neuartiger Biokraftstoff entwickelt, und auf Basis von Festbrennstofftechnologie wurden kompakte Brandgranaten konstruiert. Die neuen Waffen erleichtern die Räumung, insbesondere in außerirdischen Strukturen.

Darüber hinaus wurden neue hitze- und explosionsbeständige Unteranzüge für den Einsatz auf dem Schlachtfeld entwickelt. Das Modul ist leicht zu tragen und in nahezu jede Rüstung integrierbar. Es erhöht die Feuer- und Hitzebeständigkeit um 62% und reduziert die Wirkung von Sprengmunition um etwa die Hälfte.",,,"Был разработан новый тип биотоплива для использования в современных огнеметах, а на основе технологии твердого топлива были разработаны компактные зажигательные гранаты. Новое оружие поможет при зачистке, особенно внутри инопланетных тоннелей.  Кроме того, для использования в бою были разработаны новые огне- и взрывоустойчивые пластины. Модули легкие, могут быть встроены практически в любую броню, повышая устойчивость к пламени и перегреву на 62% и снижая воздействие взрывов примерно вдвое.",,
PX_LIGHTSNIPERRIFLE_RESEARCHDEF_UNLOCK,Text,,The appearance of Myrmidons has inspired our designers to consider developing a more agile sniper rifle that can deal quickly with small targets at range.,,"L’apparition des Myrmidons a incité nos concepteurs à envisager le développement d’un fusil de précision plus agile, capable de neutraliser rapidement de petites cibles à longue distance.","Das Erscheinen der Myrmidonen hat unsere Designer dazu inspiriert, die Entwicklung eines wendigeren Scharfschützengewehrs in Erwägung zu ziehen, das kleine Ziele auf Distanz schnell ausschalten kann.",,,"Появление Мирмидонов вдохновило наших конструкторов на разработку легкой снайперской винтовки, способной быстро расправляться с небольшими целями на расстоянии.",,
PX_CAPTURETECH_RESEARCHDEF_COMPLETE_TFTV,Text,,"Specialized Pandoran Containment facilities have been designed and successfully tested, allowing us to safely keep Pandorans in a state of constant paralysis. 

In addition, we have equipped all our aircraft with the Skyhook Retrieval and Transportation System (SRTS), which allows us to retrieve fully paralyzed Pandorans from the battlefield after a successful mission.

The SRTS uses micro drones to attach tethers to the immobilized Pandoran organism. Total volume of transportable matter is determined by aircraft carrying capacity. For reference, we estimate that our Manticores should be able to carry up to 3 Arthrons or Tritons.

This represents a step forward in our struggle to understand their biology.",,"Des installations spécialisées de confinement pandorien ont été conçues et testées avec succès, nous permettant de maintenir les Pandoriens dans un état de paralysie constante en toute sécurité.

De plus, nous avons équipé tous nos appareils du Système de Récupération et de Transport Skyhook (SRTS), qui nous permet de récupérer les Pandoriens entièrement paralysés après une mission réussie.

Le SRTS utilise des micro‑drones pour fixer des cordages à l’organisme pandorien immobilisé. Le volume total transportable dépend de la capacité de charge de l’appareil. À titre indicatif, nous estimons que nos Manticores devraient pouvoir transporter jusqu’à 3 Arthrons ou Tritons.

Cela représente un progrès important dans notre lutte pour comprendre leur biologie.","Spezielle Einrichtungen zur Eindämmung von Pandoranern wurden entwickelt und erfolgreich getestet. Sie ermöglichen es uns, Pandoraner sicher in einem Zustand dauerhafter Lähmung zu halten.

Zusätzlich haben wir alle unsere Fluggeräte mit dem Skyhook-Bergungs- und Transportsystem (SRTS) ausgestattet. Dieses System erlaubt es uns, vollständig benommene Pandoraner nach einer erfolgreichen Mission vom Schlachtfeld zu bergen.

Das SRTS verwendet Mikrodrohnen, um die immobilisierten Pandoraner mit Seilen zu fixieren. Das Gesamtvolumen des transportierbaren Materials hängt von der Tragfähigkeit des Fluggerätes ab. Wir schätzen, dass unser Manticore bis zu drei Arthrons oder Tritons transportieren kann.

Dies stellt einen Fortschritt in unserem Bestreben dar, ihre Biologie zu verstehen.",,,"Были разработаны и успешно испытаны специализированные установки для удержания Пандоранов, позволяющие безопасно держать их в состоянии постоянного паралича. 

Кроме того, мы оснастили все наши самолеты грузоподъемной системой «Небесный Крюк», которая позволяет нам загружать полностью парализованных Пандоранов с поля боя в самолет после успешной миссии. Система использует микродроны, чтобы прикрепить тросы к обездвиженному Пандорану. Общий объем транспортируемой биомассы определяется грузоподъемностью самолета. Для сравнения, по нашим расчетам, наши Мантикоры смогут перевозить до 3-х Артронов или Тритонов. Это шаг вперед в нашей борьбе за понимание их биологии.",,
NJ_EXPLOSIVETECH_RESEARCHDEF_COMPLETE,Text,,"A breakthrough in explosives technology has led to the development of a new rocket launcher design. Unlike conventional rockets, this weapon fires armor-piercing projectiles that deal massive damage to a single target. It is ideal for quickly crippling the biggest and toughest Pandoran creatures, as each rocket can inflict three times the normal damage to the limb it hits. The rockets are expensive to produce, but will be worth it if used strategically.
",,"Une percée dans le domaine des technologies explosives a conduit au développement d’un nouveau lance‑roquettes. Contrairement aux roquettes conventionnelles, cette arme tire des projectiles perforants capables d’infliger des dégâts massifs à une cible unique. Elle est idéale pour neutraliser rapidement les créatures pandoriennes les plus grandes et les plus résistantes, chaque roquette pouvant infliger trois fois les dégâts normaux au membre touché. Les roquettes sont coûteuses à produire, mais leur utilisation stratégique en vaut largement la peine.","Ein Durchbruch in der Sprengstofftechnologie hat zur Entwicklung eines neuen Raketenwerfers geführt. Anders als herkömmliche Raketen verschießt diese Waffe panzerbrechende Geschosse, die einem einzelnen Ziel massiven Schaden zufügen. Sie eignet sich ideal, um die größten und widerstandsfähigsten Kreaturen Pandoras schnell zu schwächen, da jede Rakete dem getroffenen Körperteil den dreifachen normalen Schaden zufügt. Die Raketen sind zwar teuer in der Produktion, aber bei strategischem Einsatz lohnt sich die Investition.",,,"Прорыв в технологии взрывчатых веществ привел к созданию новой конструкции ракетной установки. В отличие от обычных ракет, это оружие стреляет бронебойными снарядами, наносящими огромный урон одной цели. Оно идеально подходит для быстрого поражения самых крупных и выносливых Пандоранов, ведь каждая ракета может нанести конечности, в которую попала, в три раза больше обычного урона. Ракеты дороги в производстве, но при стратегическом использовании они себя оправдывают.",,
SYN_NANOTECH_RESEARCHDEF_BENEFITS,Text,,Allows manufacturing Nanotech Fieldkit,,Débloque la fabrication du Kit de terrain et du gilet nanotechnologiques.,Ermöglicht die Produktion von Nanotechnik-Einsatzkit und -Schutzweste.,,,Позволяет производить Ремонтного Нанодроида и Нано-Бронежилет,,
KEY_FS_ALN_MEDIUM_FLYER_RESEARCHDEF_COMPLETE,Text,,"Species classification PF-M
This new mutation spawned from the Festering Skies is aggressive and tenacious. Its well-coordinated flight patterns indicate a sinister sense of purpose. Field reports and collected footage shows that Berith strikes are carefully planned in advance and executed with alarming haste and precision. Threat level: very high.",,"Classification de l’espèce : PF‑M
Cette nouvelle mutation issue des Cieux Purulents est agressive et tenace. Ses schémas de vol bien coordonnés témoignent d’un sens du but inquiétant. Les rapports de terrain et les enregistrements collectés montrent que les attaques du Berith sont soigneusement planifiées à l’avance et exécutées avec une rapidité et une précision alarmantes. Niveau de menace : très élevé.","Speziesklassifizierung PF-M
Diese neue Mutation, hervorgegangen aus den Verseuchten Himmeln, ist aggressiv und zäh. Ihre präzisen Flugmuster deuten auf finstere Absichten hin. Feldberichte und gesammeltes Videomaterial belegen, dass Berith-Angriffe sorgfältig geplant und mit alarmierender Schnelligkeit und Präzision ausgeführt werden. Bedrohungsstufe: sehr hoch.",,,"Видовая классификация: Верит (Средний). 
Мы подтвердили появление новой мутации в экосистеме Бегемота. Как и в случае с его предшественником Харуном, головоногое происхождение этого существа очевидно невооруженным глазом. Ожидайте повышенной живучести и превосходного вооружения.",,
KEY_FS_ALN_LARGE_FLYER_RESEARCHDEF_COMPLETE,Text,,"Species classification PF-Alpha
The largest species of winged Pandoran discovered to date shows superior strength and intelligence. Its complex and unpredictable behavioral patterns make it the greatest airborne threat to humanity. The study of its movements is of utmost importance given its cunning and destructive potential. Threat level: critical.",,"Classification de l’espèce : PF‑Alpha
La plus grande espèce de Pandorien ailé découverte à ce jour présente une force et une intelligence supérieures. Ses schémas comportementaux complexes et imprévisibles en font la plus grande menace aérienne pour l’humanité. L’étude de ses mouvements est d’une importance capitale, compte tenu de sa ruse et de son potentiel destructeur. Niveau de menace : critique.","Speziesklassifizierung PF-Alpha
Die größte bisher entdeckte geflügelte Pandoraner-Spezies zeichnet sich durch überragende Stärke und Intelligenz aus. Ihr komplexes und unberechenbares Verhalten macht sie zur größten Bedrohung für die Menschheit aus der Luft. Angesichts ihrer List und ihres zerstörerischen Potenzials ist die Erforschung ihrer Bewegungen von höchster Wichtigkeit. Bedrohungsstufe: kritisch.",,,"Видовая классификация: Абаддон (Альфа). 
Последняя мутация, появившаяся в ""Гнойном Небе"", огромна. Головоногое происхождение этого существа все еще можно определить визуально, но как оно может оставаться в воздухе, учитывая его массу и отсутствие очевидных средств передвижения, остается загадкой. Чтобы уничтожить это чудовище, нашим самолетам, скорее всего, потребуется мощное оружие или несколько вылетов.",,
ANU_ANUFUNGUSFOOD_RESEARCHDEF_BENEFITS,Text,,Output of Food Production facilities increased by around 50%,,La production des installations alimentaires a été augmentée d’environ 50 %.,Der Ertrag der Nahrungsproduktion steigt um rund 50%.,,,Производительность пищевых комбинатов увеличилась примерно на 50%,,
KEY_CH_ALN_ACHERON_ACHLYS_CHAMPION_RESEARCHDEF_COMPLETE,Text,,"Species classification AC-Beta-2
Possibly the most lethal specimen of Acheron. In addition to projecting corrosive goo and transforming corpses into Pandorans, and possessing the capability of evolved Acherons that enables other Pandorans on the battlefield to spread Delirium, reports indicate that the death of this specimen is invariably accompanied by excess Umbra sightings.",,"Classification de l'espèce AC-Beta-2
Considéré comme le spécimen le plus mortel de l'Achéron, cette créature est capable de libérer des substances biochimiques qui rendent les humains fous, temporairement aveugles ou même immobilisés au sol. Le spécimen peut muter et transformer les cadavres en Pandoriens, et aussi libérer des substances corrosives dans une large zone affectant tout ce qui s'y trouve. A tuer à distance.","Speziesklassifizierung AC-Beta-2
Möglicherweise das tödlichste Exemplar von Acheron. Zusätzlich zum Ausstoßen ätzender Flüssigkeit und der Verwandlung von Leichen in Pandoraner sowie der Fähigkeit weiterentwickelter Acherons, andere Pandoraner auf dem Schlachtfeld mit Delirium anzustecken, deuten Berichte darauf hin, dass der Tod dieses Exemplars stets mit vermehrten Umbra-Sichtungen einhergeht.",,,"Видовая классификация: АХ-Бета-2. 
Возможно, самая смертоносная особь Ахерона. Помимо плевков едкой слизью и превращения трупов людей в Пандоранов, а также способности, позволяющей другим Пандоранам на поле боя распространять Сонное Безумие, по сообщениям, смерть этой особи неизменно сопровождается появлением Фиолетовых Тварей.",,
KEY_CH_ALN_ACHERON_ACHLYS_CHAMPION_RESEARCHDEF_NAME,Text,,ACHERON ACHLYS CHAMPION,,ACHERON ACHLYS CHAMPION,ACHERON ACHLYS CHAMPION,,,АХЕРОН-АХЛИС (ЧЕМПИОН),,
KEY_CH_ALN_ACHERON_ACHLYS_RESEARCHDEF_COMPLETE,Text,,"Species classification AC-Beta-1 “Achlys”
An enhanced species of Acheron that has evolved to release chemicals capable of partially paralyzing humans by temporarily reducing their speed, or trapping them or vehicles in corrosive goo. Field observations have found that the creature is also capable of granting Pandorans the ability to spread the Third Mist strain of the Pandoraviurs on people, driving them to delirium, and also can mutate dead corpses, transforming them into Arthrons and Tritons.
",,"Classification de l'espèce AC-Beta-1
Une espèce améliorée d'Achéron qui a évolué pour libérer des produits chimiques capables de paralyser partiellement les humains en réduisant temporairement leur vitesse ou en désactivant un membre. Des observations sur le terrain ont révélé que la créature est également capable de donner aux Pandoriens la capacité de propager la souche de la Troisieme Brume du Pandoravirus sur les gens, les poussant au délire, et peut également faire muter les cadavres, les transformant en Arthrons et en Tritons. À traiter avec prudence.","Speziesklassifizierung AC-Beta-1 „Achlys“
Eine verbesserte Acheron-Spezies, die sich so entwickelt hat, dass sie Chemikalien freisetzt, die Menschen teilweise lähmen können, indem sie deren Geschwindigkeit vorübergehend verringern oder sie bzw. Fahrzeuge in ätzendem Schleim einschließen. Feldbeobachtungen haben ergeben, dass die Kreatur Pandoranern außerdem die Fähigkeit verleihen kann, die Pandoravirus-Variante des Dritten Nebels auf Menschen zu übertragen und sie so in den Wahnsinn zu treiben. Darüber hinaus kann sie Leichen mutieren lassen und sie in Arthrons und Tritons verwandeln.",,,"Видовая классификация: AХ-Бета-1 «Ахлис». 
Усовершенствованный вид Ахерона, который научился выделять химические вещества, способные частично парализовать людей, временно снижая их скорость, или задерживать их или транспортные средства в коррозийной слизи. Наблюдения показали, что это существо также способно наделять Пандоранов способностью распространять на людей штамм Пандоравируса Третьего Тумана, заражая их Сонным Безумием, а также реанимировать трупы, превращая их в Артронов и Тритонов.",,
KEY_CH_ALN_ACHERON_ACHLYS_RESEARCHDEF_NAME,Text,,ACHERON ACHLYS,,ACHERON ACHLYS,ACHERON ACHLYS,,,AХЕРОН-АХЛИС,,
