"Key","Type","Desc","English","Chinese (Simplified)","French","German","Italian","Polish","Russian","Spanish","UI_Tester"
"KEY_EXPENDABLE_ARCHETYPE_SECTARIAN_DESCRIPTION","Text","","This savage fighter belongs to a group of secular sceptics that tore away from the religious teachings of the Anu cult at an early stage in its development, disgusted by its dogmatism. They went on to found their own secretive warrior societies, and make heavy use of hallucinogenic drugs to induce terrifying frenzies on the battlefield. Their numbers have grown since, and they are well known and respected in the bandit settlements, where their heavy axes are symbols of ferocity and suicidal bravery. When you approach them in the bar they grin, and lazily point you to their rates.","这名野蛮战士属于一群世俗怀疑论者，他们在阿努教派发展初期就脱离了其宗教教义，对其教条主义感到厌恶。他们随后成立了自己的秘密战士社团，并大量使用致幻药物，在战场上引发恐怖的狂暴状态。他们的人数不断增长，在土匪聚居地中广为人知且备受尊敬，他们沉重的战斧象征着凶猛和自杀式的勇敢。当你在酒吧接近他们时，他们会咧嘴一笑，懒洋洋地告诉你他们的收费标准。","Ce combattant sauvage appartient à un groupe de sceptiques laïcs qui se sont détachés des enseignements religieux du culte d’Anu à un stade précoce de son développement, dégoûtés par son dogmatisme. Ils ont ensuite fondé leurs propres sociétés guerrières secrètes et utilisent abondamment des drogues hallucinogènes pour provoquer des frénésies terrifiantes sur le champ de bataille. Leur nombre a depuis augmenté, et ils sont bien connus et respectés dans les camps de bandits, où leurs lourdes haches sont des symboles de férocité et de bravoure suicidaire. Lorsque vous les approchez au bar, ils vous sourient et vous indiquent nonchalamment leurs tarifs.","Dieser wilde Kämpfer gehört einer Gruppe säkularer Skeptiker an, die sich frühzeitig von den religiösen Lehren des Anu-Kults abwandten, angewidert von dessen Dogmatismus. Sie gründeten ihre eigenen geheimen Kriegergesellschaften und griffen exzessiv zu halluzinogenen Drogen, um auf dem Schlachtfeld furchterregende Raserei auszulösen. Ihre Zahl ist seitdem gewachsen, und sie sind in den Banditenlagern bekannt und geachtet, wo ihre schweren Äxte Symbole für Wildheit und selbstmörderischen Mut sind. Spricht man sie in der Taverne an, grinsen sie und deuten lässig auf ihre Preise.","","","Этот свирепый боец принадлежит к группе изгоев, которые отказались от религиозных учений культа Ану на ранней стадии его развития, испытывая отвращение к его догматизму. Они основали свои собственные тайные воинские общества и активно используют галлюциногенные препараты, чтобы вызывать яростное Иссупление в бою. С тех пор их численность возросла, и они хорошо известны и уважаемы в вольных поселениях, где их тяжелые топоры являются символами свирепости и самоубийственной храбрости. Когда вы подходите к нему в баре, он ухмыляется и лениво достает дощечку с вырезанными цифрами и большой корявой надписью ""МОЙ ЦЕНА"".","",""
"KEY_EXPENDABLE_ARCHETYPE_SECTARIAN_QUOTE","Text","","<i>“Life is very precious, you know? You can’t just sacrifice what’s in your soul for people who don’t care whether you live or die. There’s no place in this world for cowards.” </i>","<i>“生命非常宝贵，你知道吗？你不能为了那些不在乎你生死的人牺牲你的灵魂。这个世界没有懦夫的容身之地。”</i>","<I>« La vie est très précieuse, tu sais ? On ne peut pas sacrifier ce qui est dans son âme pour des gens qui se fichent de savoir si tu vis ou meurs. Il n’y a pas de place pour les lâches dans ce monde. »</i>","<i>„Das Leben ist kostbar, wissen Sie? Man kann nicht einfach seine Seele für Menschen opfern, denen es egal ist, ob man lebt oder stirbt. Feiglinge haben in dieser Welt keinen Platz.“</i>","","","<i>«Жизнь очень ценная штука, понимаешь? Ты не можешь просто пожертвовать тем, что у тебя на душе, ради людей, которым все равно, живой ты или мертвый. В этом мире нет места трусам.» </i>","",""
"KEY_EXPENDABLE_ARCHETYPE_GHOST_NAME","Text","","Ghost (Priest)","幽灵（牧师）","Spectre (Prêtre)","Geist (Priester)","","","Призрак (Жрец)","",""
"KEY_EXPENDABLE_ARCHETYPE_GHOST_DESCRIPTION","Text","","You hear about them before you see one, and everyone has heard the stories. It was supposed to be a clandestine Synedrion programme, experimenting with shared lucid dreaming, controlled exposure to mist, and other para-physical phenomena, but you have never heard any firm agreement around what these experiments were hoping to achieve. Some say they were trying to develop truly unmediated human closeness and empathy; all that is known for sure is that they managed to escape together, that they live as refugees in the bandit towns, and that they are uniformly unstable. You don’t see this one blink once during the negotiations.","你在见到他们之前就听说过他们，人人都听过这些故事。据说这是平衡议会的一个秘密项目，实验共享清醒梦、受控迷雾暴露及其他超自然现象，但你从未听说过这些实验具体想要达到什么目标。有人说他们试图发展真正无中介的人类亲密与共情；唯一确定的是他们成功逃脱，一起作为难民生活在土匪城镇，并且普遍精神不稳定。在谈判过程中，你甚至没见这位幽灵眨过一次眼。","On entend parler d’eux avant d’en voir un, et tout le monde connaît ces histoires. Un programme clandestin du Synédrion, expérimentant le rêve lucide partagé, l’exposition contrôlée à la brume et d’autres phénomènes para-physiques, mais vous n’avez jamais entendu de consensus clair sur les objectifs réels de ces expériences. Certains disent qu’ils cherchaient à développer une proximité et une empathie humaines sans artifice ; tout ce que l’on sait avec certitude, c’est qu’ils ont réussi à s’échapper ensemble, qu’ils vivent comme réfugiés dans les villes de bandits et qu’ils sont tous profondément instables. Celui-ci ne cligne pas une seule fois des yeux pendant les négociations.","Man hört von ihnen, bevor man einen sieht, und jeder kennt die Geschichten. Es sollte ein geheimes Synedrion-Programm sein, das mit gemeinsamem Klarträumen, kontrollierter Nebelexposition und anderen paraphysischen Phänomenen experimentierte, aber man hat nie etwas Konkretes darüber gehört, was diese Experimente eigentlich bezwecken sollten. Manche sagen, sie hätten versucht, wahrhaft unmittelbare menschliche Nähe und Empathie zu entwickeln; sicher ist nur, dass sie gemeinsam fliehen konnten, dass sie als Flüchtlinge in den Banditenstädten leben und dass sie alle labil sind. Man sieht diesen einen während der Verhandlungen nicht einmal mit der Wimper zucken.","","","Вы услышали о них еще до того, как увидели своими глазами, да... все слышали эти истории. Предполагалось, что это будет тайная программа Синедриона, экспериментирующая с групповыми сновидениями наяву, контролируемым воздействием Тумана и другими парафизическими явлениями, но никто точно не знает, чего надеялись достичь в ходе этих экспериментов. Некоторые говорят, что им пытались привить по-настоящему человеческую эмпатию и сопереживание. Все, что известно наверняка - это то, что им удалось сбежать, что они живут как беженцы в вольных поселениях, и что они абсолютно не похожи на живых людей. Вы даже не заметили, чтобы этот человек хоть раз моргнул во время разговора.","",""
"KEY_EXPENDABLE_ARCHETYPE_GHOST_QUOTE","Text","","<i>“Eventually, anyone who associates too closely with real power will also be exposed to it, vulnerable to its movements and its monstrous demands.”</i>","<i>“最终，任何与真正权力过于亲近的人也会暴露于其影响之下，易受其动作和怪异要求的支配。”</i>","<i>« Tôt ou tard, quiconque s’associe de trop près au véritable pouvoir y sera également exposé, vulnérable à ses mouvements et à ses exigences monstrueuses. »</i>","<i>„Letztendlich wird jeder, der sich zu eng mit der wahren Macht einlässt, ihr ebenfalls ausgesetzt sein und ihren Machenschaften und ihren monströsen Forderungen ausgeliefert sein.“</i>","","","<i>«В конечном счете, любой, кто слишком тесно связан с реальной властью, также будет подвержен ее влиянию, обременен ее коррупцией и вынужден нести чудовищное бремя»</i>","",""
"KEY_EXPENDABLE_ARCHETYPE_SLUG_NAME","Text","","Slug (Technician)","蛞蝓（技师）","Mutant (Technicien)","Slug (Techniker)","","","Полу-киборг (Техник)","",""
"KEY_EXPENDABLE_ARCHETYPE_SLUG_DESCRIPTION","Text","","These mutants are the result of invasive and unsafe treatments against mist exposure. With a mixture of controlled mutation and mechanical restraining armatures, they have managed to keep their personalities intact, but many of them live in pain and most are dissociative at best. They often hire themselves out as haven guards and technical specialists, in order to raise funds that they use to ‘save’ more victims of the mist. They are generally seen in the mutant ghettoes, but this particular soldier has approached you directly and asked about being hired on.","这些变异体是对抗迷雾暴露时采用侵入性且不安全治疗的产物。通过控制变异和机械约束装置的结合，他们设法保持了个性，但许多人生活在痛苦中，大多数顶多是解离状态。他们经常作为避难所守卫和技术专家出租自己，以筹集资金“拯救”更多迷雾受害者。他们通常出现在变异者贫民区，但这名士兵直接找到你，询问是否可以被雇佣。","Ces mutants sont le résultat de traitements invasifs et dangereux contre l’exposition au brouillard. Grâce à un mélange de mutation contrôlée et d’armatures mécaniques de contention, ils ont réussi à préserver leur personnalité, mais beaucoup vivent dans la douleur et la plupart restent au mieux dissociés. Ils se font souvent engager comme gardes de refuge ou spécialistes techniques afin de récolter des fonds qu’ils utilisent pour « sauver » d’autres victimes du brouillard. On les rencontre généralement dans les ghettos mutants, mais cet agent en particulier est venu vous voir directement pour se renseigner sur un éventuel engagement.","Diese Mutanten sind das Ergebnis invasiver und gefährlicher Behandlungen gegen die Einwirkung des Nebels. Durch eine Kombination aus kontrollierter Mutation und mechanischen Fixierungsvorrichtungen konnten sie ihre Persönlichkeit bewahren, doch viele von ihnen leiden unter Schmerzen und die meisten sind bestenfalls dissoziativ. Oftmals verdingen sie sich als Wachen in Zufluchten und technische Spezialisten, um Geld zu verdienen, mit dem sie weitere Opfer des Nebels „retten“. Man sieht sie üblicherweise in den Mutantenghettos, doch dieser spezielle Mutant hat dich direkt angesprochen und gefragt, ob er sich anheuern lassen kann.","","","Эти мутанты являются результатом инвазивного и небезопасного лечения от воздействия Тумана. С помощью комбинации контролируемых мутаций и механических имплантов им удалось сохранить свое сознание, но многие из них живут в муках, и большинство из них в лучшем случае асоциальны. Они часто нанимаются в качестве охранников убежищ или техников, чтобы собрать средства, которые они используют, что бы «спасти» больше жертв Тумана. Обычно их можно увидеть в гетто мутантов, но этот конкретный боец обратился непосредственно к вам и попросил о найме.","",""
"KEY_EXPENDABLE_ARCHETYPE_SLUG_QUOTE","Text","","<i>“When I look at this world you know sometimes I see nothing worth liking. But it doesn’t matter. There are still people to fight for, people who don’t deserve to suffer like they do.”</i>","<i>“当我看这个世界时，有时我觉得没有什么值得喜欢的。但这无所谓。还有人值得我去战斗，那些不该像他们这样受苦的人。”</i>","<i>« Quand je regarde ce monde, tu sais, parfois je n’y vois rien qui mérite d’être aimé. Mais ça n’a pas d’importance. Il y a encore des gens pour qui se battre, des gens qui ne méritent pas de souffrir comme ils le font. »</i>","<i>„Wenn ich mir diese Welt ansehe, sehe ich manchmal nichts, was mir gefällt. Aber das spielt keine Rolle. Es gibt immer noch Menschen, für die es sich zu kämpfen lohnt, Menschen, die es nicht verdient haben, so zu leiden.“</i>","","","<i>«Знаете, когда я смотрю на этот мир, иногда я не вижу ничего, что стоило бы любить. Но это не имеет значения. Все еще есть люди, за которых нужно бороться, люди, которые не заслуживают тех страданий, которые им причиняют»</i>","",""
"KEY_EXPENDABLE_ARCHETYPE_SPYMASTER_NAME","Text","","Spymaster (Infiltrator)","间谍大师（潜入者）","Espion (Infiltré)","Meisterspion (Infiltrator)","","","Ниндзя (Разведчик)","",""
"KEY_EXPENDABLE_ARCHETYPE_SPYMASTER_DESCRIPTION","Text","","This is one of the infiltrators that work for the rulers of the bandit encampments. These are the men and women who actually undertake the high-risk sabotage and infiltration missions against the factions, and who stock the bazaar with its more exotic wares. They are also capable and ruthless enforcers and assassins, and their skills make them excellent mercenaries, hired out when their masters are in need of cash. However, the spymaster before you is obviously green; the practiced self-assured manner fools nobody.","这是为土匪营地统治者效力的潜入者之一。这些男女实际上执行针对各派系的高风险破坏和潜入任务，并为市集提供更为稀有的货物。他们也是能干且无情的执法者和刺客，技能使他们成为优秀的雇佣兵，当他们的主人需要现金时会被雇佣。然而，眼前的这位间谍大师显然是个新手；那种自信满满的做作态度骗不了任何人。","Il s’agit de l’un des infiltrés qui travaillent pour les chefs des camps de bandits. Ce sont les hommes et les femmes qui réalisent réellement les missions de sabotage et d’infiltration les plus risquées contre les factions, et qui approvisionnent le bazar avec ses marchandises les plus exotiques. Ce sont également des exécutants et assassins capables et impitoyables, et leurs compétences en font d’excellents mercenaires, engagés lorsque leurs maîtres ont besoin d’argent. Cependant, l'espion devant vous est visiblement inexpérimenté ; son air assuré et maîtrisé ne trompe personne.","Dies ist einer der Infiltratoren, die für die Anführer der Banditenlager arbeiten. Diese Männer und Frauen führen die riskanten Sabotage- und Infiltrationsmissionen gegen die verschiedenen Fraktionen durch und bestücken den Basar mit exotischen Waren. Sie sind außerdem fähige und skrupellose Vollstrecker und Attentäter, und ihre Fähigkeiten machen sie zu exzellenten Söldnern, die angeheuert werden, wenn ihre Herren Geld benötigen. Der Spionagechef vor Ihnen ist jedoch offensichtlich unerfahren; sein geübtes, selbstsicheres Auftreten täuscht niemanden.","","","Это один из разведчиков, что обычно работают на правителей вольных селений. Мужчины и женщины, они часто выполняют рискованные диверсионные операции на территории различных фракций, а потом... на Рынке вдруг появляются редкие товары. Они также способные и безжалостные бойцы и убийцы, а их навыки делают их отличными наемниками, из тех, которых нанимают, что бы заработать еще больше денег. Однако перед вами явно новичок, его наигранная уверенность вряд ли кого-то обманет.","",""
"KEY_EXPENDABLE_ARCHETYPE_SPYMASTER_QUOTE","Text","","<i>“The encampments have been in chaos for years, and it was hard work putting them back together. Lots of people died, lots of people had to be killed. But nothing worth doing is easy, and things are finally improving.”</i>","<i>“营地多年来一直混乱不堪，重建它们是艰苦的工作。许多人死了，许多人被杀。但凡值得做的事都不容易，现在情况终于有所好转。”</i>","<i>« Les camps sont en chaos depuis des années, et ça a été un travail difficile de les remettre en ordre. Beaucoup de gens sont morts, beaucoup ont dû être tués. Mais rien de ce qui vaut la peine n’est facile, et les choses s’améliorent enfin. »</i>","<i>„Die Lager waren jahrelang im Chaos, und es war harte Arbeit, sie wieder aufzubauen. Viele Menschen starben, viele mussten getötet werden. Aber nichts, was sich lohnt, ist einfach, und die Lage bessert sich endlich.“</i>","","","<i>«В течение многих лет в вольных поселениях царил хаос, было тяжело с этим бороться. Многие погибли, многих пришлось убить. Ничто из того, что должно быть сделано, не бывает легким. Конечно, пока не научишься...»</i>","",""
"KEY_EXPENDABLE_ARCHETYPE_DOOM_NAME","Text","","Old Hound (Heavy)","老猎犬（重装）","Limier (Mastodonte)","Alter Haudegen (Brecher)","","","Старый Пес (Тяжелый штурмовик)","",""
"KEY_EXPENDABLE_ARCHETYPE_DOOM_DESCRIPTION","Text","","This soldier is one of the few surviving members of a loose collection of powerful military outfits who sometimes fought alongside New Jericho in the years before the collapse. Their gear is ancient and in bad need of repair, and their outdated and poorly-maintained military implants cause them constant pain, which often makes them aggressive and confused, evidenced in trophy-taking and other unethical behaviour. Built for battle, but often untested in real combat; a scarecrow for the human carrion of the Pandoran wastes.","这名士兵是少数幸存者之一，来自一支松散的强大军事组织，曾在崩溃前几年偶尔与新耶利哥并肩作战。他们的装备古老且急需维修，过时且维护不良的军事义体让他们持续疼痛，常使他们变得易怒和迷惑，表现为战利品收集和其他不道德行为。为战斗而生，但常缺乏实战经验；是潘多拉荒地中人类腐肉的稻草人。","Ce soldat fait partie des rares membres survivants d’un groupe militaires ayant parfois combattu aux côtés de la Nouvelle-Jéricho dans les années précédant l’effondrement. Son équipement est ancien et en mauvais état, et ses implants militaires obsolètes et mal entretenus lui causent des douleurs constantes, le rendant souvent agressif et confus, comme en témoignent la prise de trophées et d’autres comportements contraires à l’éthique. Conçu pour le combat, mais jamais testé en situation réelle ; un épouvantail pour la charogne humaine des terres pandoriennes.","Einer der wenigen Überlebenden eines losen Zusammenschlusses mächtiger Militäreinheiten, die in den Jahren vor dem Zusammenbruch zeitweise an der Seite von Neu-Jericho kämpften. Ihre Ausrüstung ist uralt und dringend reparaturbedürftig, und ihre veralteten und schlecht gewarteten Militärimplantate verursachen ihnen ständige Schmerzen, was sie oft aggressiv und verwirrt macht und sich in Trophäenjagd und anderem unethischen Verhalten äußert. Geschaffen für den Kampf, aber im realen Gefecht oft unerprobt; eine Art Schreckgespenst für die menschlichen Überreste der pandoranischen Ödnis.","","","Этот старый солдат - один из немногих выживших бойцов спецназа, которые сражались бок о бок с Новым Иерихоном в годы, предшествовавшие краху. Их древнее снаряжение давно уж нуждается в ремонте, а устаревшие и плохо обслуженные боевые имплантаты причиняют постоянную боль. Это часто делает их агрессивными и бестолковыми, что проявляется в захвате трофеев и других неэтичных действиях прямо в бою. Создан для битвы, но часто не испытан в реальном бою, этакая страшилка для бродяг с Пандоранских пустошей.","",""
"KEY_EXPENDABLE_ARCHETYPE_DOOM_QUOTE","Text","","<i>”Usually they just run away when they see me. Usually.”</i>","<i>“通常他们一看到我就跑了。通常如此。”</i>","<i>« D’habitude, ils s’enfuient quand ils me voient. D’habitude. »</i>","<i>„Normalerweise rennen sie einfach weg, wenn sie mich sehen. Normalerweise.“</i>","","","<i>«Обычно они просто убегают, завидев меня. Обычно...»</i>","",""
"KEY_EXPENDABLE_ARCHETYPE_EXILE_NAME","Text","","Exile (Assault)","流亡者（突击）","Exilé (Unité d'assaut)","Exilant (Sturm)","","","Изгнанник (Штурмовик)","",""
