Key,Type,Desc,English,Chinese (Simplified),French,German,Italian,Polish,Russian,Spanish,UI_Tester
TFTV_CAPTURE_DRONES_MODULE_NAME,Text,,Salvage Drones,,Drones de récupération,Bergungsdrohnen,,,Грузовые Дроны,,
TFTV_CAPTURE_DRONES_MODULE_DESCRIPTION,Text,,"A pack of autonomous retrieval drones that scour the battlefield, securing all items even when the area remains contested. All items left on the ground are collected on mission end.",,"Un groupe de drones de récupération autonomes qui parcourent le champ de bataille, récupérant tous les objets même si la zone reste contestée. Tous les objets laissés au sol sont collectés à la fin de la mission.","Ein Schwarm autonomer Bergungsdrohnen, der das Schlachtfeld absucht und alle Gegenstände sichert – auch in umkämpften Gebieten.
<b>Alle am Boden verbliebenen Gegenstände werden am Missionsende eingesammelt.</b>",,,"Несколько дронов с захватами для сбора трофеев с боля боя, даже с незачищенной территории. В конце миссии все, что лежит на земле, будет подобрано!",,
TFTV_VEHICLE_HARNESS_MODULE_NAME,Text,,Ezekiel's Dream,,Le Rêve d’Ézéchiel,Ezechiels Traum,,,Модуль «Мечта Иезекииля»,,
TFTV_VEHICLE_HARNESS_MODULE_DESCRIPTION,Text,,A reinforced hard-point harness that lets any aircraft carry a ground vehicle as external cargo. Aircraft can carry a vehicle for 1 space less (Thunderbird can carry 2 vehicles for 1 space each).,,Un harnais renforcé à point d’ancrage rigide permettant à n’importe quel apareil de transporter un véhicule terrestre en tant que cargaison externe. Les apareils peuvent transporter un véhicule pour 1 case de moins (le Thunderbird peut transporter 2 véhicules pour 1 case chacun).,"Verstärkte Außenlast-Aufhängung, die es Fluggeräten erlaubt, Bodenfahrzeuge extern zu transportieren.
<b>Fahrzeuge benötigen 1 Platz weniger</b> (Thunderbird kann <b>2 Fahrzeuge zu je 1 Platz</b> transportieren).",,,"Усиленный грузовой захват для машин. Позволяет самолету нести машину снаружи корпуса. Машина занимает на 1 пассажиро-место меньше. (Гром-птица может нести 2 машины, по 1-му месту на каждую).",,
TFTV_SCANNER_MODULE_NAME,Text,,Signal Harvester,,Collecteur de signaux,Signalsammler,,,Звукоулавливатель,,
TFTV_SCANNER_MODULE_DESCRIPTION,Text,,"A jumble of antenna arrays to listen in on other people's conversations. Provides SCAN ABILITY: spend 12 hours and 5 tech and 30 mat to detect Points of Interest on the Geoscape within 2000 KM (50% success rate).
Aircraft cannot move during scan.",,"Un amas d'antennes permettant d'intercepter les communications adverses. Confère la capacité SCANNER : dépensez 12 heures, 5 de technologie et 30 de matériaux pour détecter des points d'intérêt sur le Géoscape dans un rayon de 2000 km (taux de réussite de 50 %).
L'appareil ne peut pas se déplacer pendant le scan.","Ein Antennenwirrwarr, welches das verzweifelte Rauschen der Welt auffängt. Erhöht die Chance, noch nicht ganz verlorene Orte zu finden.
<b>Fähigkeit „Scannen“ mit 50% Chance, einen POI zu entdecken.</b>

<color=#E0E0E0>[BENNU]: Der Scan-Vorgang erfordert eine 12-stündige stationäre Positionierung des Fluggerätes. Dieses Verfahren ermöglicht die Aufklärung entlegener Gebiete ohne die vorherige Aktivierung lokaler Stützpunkte.</color>",,,Блок из нескольких направленных микрофонов. Дает способность Сканировать с 50% шансом обнаружить неизвестную локацию.,,
TFTV_PASSENGER_MODULE_NAME,Text,,Barracuda Berths,,Lits Barracuda,Barracuda-Kojen,,,Подвесная гондола «Барракуда»,,
TFTV_PASSENGER_MODULE_DESCRIPTION,Text,,"Reconfigures the Manticore’s hold into two extra passenger pods, at the cost of some speed. Adds 2 passenger seats, –200 Speed",,"Reconfigure la soute du Manticore en deux modules passagers supplémentaires, au prix d’une certaine vitesse. Ajoute 2 places passagers, –200 en Vitesse","Rüstet den Laderaum des Manticore mit zwei zusätzlichen Truppmodulen um – auf Kosten der Geschwindigkeit.
<b>+2 Truppplätze, -200 Geschwindigkeit</b>",,,"Добавляет Мантикоре +2 пассажиро-места, но отнимает -200 скорости",,
TFTV_CLINIC_MODULE_NAME,Text,,Neurorest Hammocks,,Hamacs Neurorepos,Neurorest,,,Модуль «Нейро-гамаки»,,
TFTV_CLINIC_MODULE_DESCRIPTION,Text,,"A set of mesh slings with IV drips and brain-wave modulators, because we all deserve a natural rest. Operatives on board recover a small amount of Stamina.",,"n ensemble de hamacs en filet équipés de perfusions et de modulateurs d’ondes cérébrales, parce que nous méritons tous un repos naturel. Les unités à bord récupèrent une petite quantité d’Endurance.","Netzhängematten mit Infusionen und Hirnwellenmodulatoren – denn natürliche Erholung steht allen zu.
<b>Einheiten an Bord regenerieren langsam Ausdauer.</b>",,,"Гамаки, оборудованные капельницами и нейро-модуляторами мозговых волн, идеально для спокойного отдыха! Бойцы на борту медленно восстанавливают Выносливость.",,
TFTV_THUNDERBIRD_GROUNDATTACK_MODULE_NAME,Text,,Lightning Strike Precision Ordnance,,Munitions de Précision Frappe Éclair,Präzisionsbewaffnung „Blitzschlag“,,,Ракета класса воздух-земля «Удар молнии»,,
TFTV_THUNDERBIRD_GROUNDATTACK_MODULE_DESCRIPTION,Text,,Precision-guided munitions system that allows to call down targeted explosive strikes in open air locations.,,Système de munitions à guidage de précision permettant d'ordonner des frappes explosives ciblées dans des zones à ciel ouvert.,"Präzisionsgelenktes Munitionssystem, das gezielte Sprengangriffe im offenen Gelände ermöglicht.",,,"Система высокоточного оружия, позволяющая наносить управляемые фугасные удары по открытой местности.",,
TFTV_THUNDERBIRD_SCANNER_MODULE_NAME,Text,,Argus Array,,Réseau Argus,Argus-Array,,,Модуль «Глаза Аргуса»,,
TFTV_THUNDERBIRD_SCANNER_MODULE_DESCRIPTION,Text,,Military-grade sensor suite that enhances point-of-interest detection on the Geoscape and heightens operative perception in combat.,,Suite de capteurs de qualité militaire qui améliore la détection des points d'intérêt sur le Géoscape et accroît la perception des unités au combat.,Militärtaugliches Sensorsystem zur verbesserten Erkennung interessanter Orte auf der Geosphäre und zur Steigerung der Wahrnehmung unserer Einheiten im Gefecht.,,,"Набор военных датчиков, который улучшает обнаружение локаций на карте Земли и повышает Восприятие бойцов в сражениях.",,
TFTV_THUNDERBIRD_WORKSHOP_MODULE_NAME,Text,,Hephaestus Workshop,,Atelier d'Héphaïstos,Hephaistos-Werkstatt,,,Модуль «Кузница Гефеста»,,
TFTV_THUNDERBIRD_WORKSHOP_MODULE_DESCRIPTION,Text,,An engineering bay that repairs bionics and vehicle systems and enhances their resilience by integrating the latest technological breakthroughs.,,"Une baie d'ingénierie qui répare les systèmes cybernétiques et les véhicules, tout en améliorant leur résistance grâce à l'intégration des dernières avancées technologiques.","Ingenieurbereich zur Reparatur von Bionik- und Fahrzeugsystemen.
<b>Erhöht die Widerstandsfähigkeit durch Integration modernster Technologiedurchbrüche.</b>",,,"Инженерный отсек для ремонта аугментаций и машин, а также внедрения последних технических новинок.",,
TFTV_THUNDERBIRD_RANGE_MODULE_NAME,Text,,Daedalus Overdrive Suite,,Module de suralimentation Daedalus,Daedalus-Overdrive-System,,,Модуль «Ускоритель Дедала»,,
TFTV_THUNDERBIRD_RANGE_MODULE_DESCRIPTION,Text,,"An automation-driven overdrive package that installs redundant subsystems and precision diagnostics, leveraging advanced automation to maximize range, speed, and airframe resilience.",,"Un ensemble de suralimentation piloté par automatisation qui installe des sous-systèmes redondants et des diagnostics de précision, exploitant l'automatisation avancée pour maximiser la portée, la vitesse et la résilience de la cellule de l'appareil.","Automatisiertes Überlastungspaket mit redundanten Subsystemen und Präzisionsdiagnostik.
<b>Maximiert Reichweite, Geschwindigkeit und Strukturstabilität des Fluggeräts.</b>",,,"Комплекс автоматизированных резервных и диагностических систем для максимального увеличения дальности, скорости и прочности самолета.",,
TFTV_HELIOS_MISTREPELLER_MODULE_NAME,Text,,Boreas Purger,,Purificateur Boreas,Boreas-Reiniger,,,Модуль «Дыхание Борея»,,
TFTV_HELIOS_MISTREPELLER_MODULE_DESCRIPTION,Text,,"A variant of the Mist Repeller designed to be aircraft mounted. During tactical missions, every turn 50% of Mist on the map dissipates and no automatic +1 Delirium for starting mission in a Delirium Area.",,Une variante du Répulseur de brume conçue pour être montée sur apareil.,Eine für Fluggeräte angepasste Variante des Nebelabweisers.,,,Авиационный анти-Туманный модуль,,
TFTV_HELIOS_STEALTH_MODULE_NAME,Text,,Proteus Matrix,,Matrice Proteus,Proteus-Matrix,,,Модуль «Матрица Протея»,,
TFTV_HELIOS_STEALTH_MODULE_DESCRIPTION,Text,,"An AI that forecasts optimal concealment tactics and likely threat vectors to guide operatives. Its predictive accuracy naturally degrades over time, capping its benefits to the mission’s opening phase.",,"Une IA qui prévoit les tactiques de camouflage optimales et les vecteurs de menace probables pour guider les agents. Sa précision prédictive se dégrade naturellement avec le temps, limitant ses avantages à la phase initiale de la mission.","KI zur Prognose von Tarnmanövern und feindlichen Bewegungen.
Die Präzision nimmt stetig ab und der Nutzen ist auf die Anfangsphase begrenzt.",,,"ИИ, который обеспечивает маскировку и прогнозирует вероятные направления угроз, помогая бойцам на начальном этапе миссии. В дальнейшем точность его прогнозов естественным образом снижается.",,
TFTV_HELIOS_HEALING_MODULE_NAME,Text,,Panacea Nexus,,Panacea Nexus,Panacea-Regenerationsmodul,,,Модуль «Объятия Панацеи»,,
TFTV_HELIOS_HEALING_MODULE_DESCRIPTION,Text,,A bio-nanite infusion chamber that bathes operatives in regenerative swarms and primes them for battle.,,Une chambre d'infusion de bio-nanites qui baigne les agents dans des essaims régénérateurs et les prépare au combat.,"Bio-Naniten-Infusionsmodul, das Einheiten in regenerative Schwärmen hüllt und sie auf den Kampf vorbereitet.",,,Камера-ванная с регенеративными био-нанитами для подготовки бойцов к сражению.,,
TFTV_HELIOS_SPEED_MODULE_RESEARCH_BENEFIT_0,Text,,Helios Engine upgrade: Overclocked Fusion Catalyst +100 Speed,,Amélioration de moteur Helios : Catalyseur de fusion surcadencé +100 Vitesse,Helios-Triebwerksupgrade: Übertakteter Fusionskatalysator +100 Geschwindigkeit,,,Апгрейд для двигателя Гелиоса (Разгоночный Катализатор Синтеза): +100 к скорости,,
TFTV_HELIOS_SPEED_MODULE_RESEARCH_BENEFIT_1,Text,,Helios Engine upgrade: Magnetic Plasma Vortex Nozzles +100 Speed,,Amélioration de moteur Helios : Tuyères à vortex de plasma magnétique +100 Vitesse,Helios-Triebwerksupgrade: Magnetische Plasmawirbel-Düsen +100 Geschwindigkeit,,,Апгрейд для двигателя Гелиоса (Вихревые Магнитоплазменные Сопла): +100 к скорости,,
TFTV_HELIOS_SPEED_MODULE_RESEARCH_BENEFIT_2,Text,,Helios Engine upgrade: Icarus Net +100 Speed,,Amélioration de moteur Helios : Filet d'Icare +100 Vitesse,Helios-Triebwerksupgrade: Ikarus-Netz +100 Geschwindigkeit,,,Апгрейд для двигателя Гелиоса (Сеть Икара): +100 к скорости,,
TFTV_HELIOS_SPEED_MODULE_RESEARCH_BENEFIT_3,Text,,Helios Engine upgrade: Gravitic Resonance Assist +100 Speed,,Amélioration de moteur Helios : Assistance par résonance gravitique +100 Vitesse,Helios-Triebwerksupgrade: Gravitische Resonanzunterstützung +100 Geschwindigkeit,,,Апгрейд для двигателя Гелиоса (Гравитационный Резонансный Ускоритель): +100 к скорости,,
TFTV_BLIMP_WP_MODULE_NAME,Text,,Sanctum of the Veil,,Sanctuaire du Voile,Heiligtum des Schleiers,,,Модуль «Святилище Вуали»,,
TFTV_BLIMP_WP_MODULE_DESCRIPTION,Text,,Aetheric chamber that prepares the Anointed for symbiosis with the Mist.,,Une chambre éthérique qui prépare les élus à la symbiose avec le Brouillard.,Ätherische Kammer zur Vorbereitung der Gesalbten auf die Symbiose mit dem Nebel.,,,Эфирная камера для подготовки Последователей к симбиозу с Туманом.,,
TFTV_BLIMP_MUTOG_PEN_MODULE_NAME,Text,,Mutog Menagerie,,Centre de confinement pour Mutogs,Menagerie der Mutogs,,,Клетка для Мутога,,
TFTV_BLIMP_MUTOG_PEN_MODULE_DESCRIPTION,Text,,A space-saving organic containment module. Aircraft may carry and deploy up to 2 Mutogs for 1 space each.,,"Un module de confinement organique conçu pour optimiser l'espace. Les apareils peuvent transporter et déployer jusqu'à 2 Mutogs, chacun occupant 1 emplacement.","Platzsparendes organisches Eindämungsmodul.
<b>Fluggeräte können bis zu 2 Mutogs transportieren und einsetzen (je 1 Platz).</b>",,,"Компактный органический изолятор. Самолет может перевозить и размещать до двух Мутогов, по 1-му месту на каждого.",,
TFTV_BLIMP_MUTATIONLAB_MODULE_NAME,Text,,Conservatory of Transmutation,,Conservatoire de Transmutation,Hort der Transmutation,,,Модуль «Обитель Трансмутации»,,
TFTV_BLIMP_MUTATIONLAB_MODULE_DESCRIPTION,Text,,"Biotic conservatory that nurtures the Anointed, healing wounds and restoring vigor.",,"Conservatoire biotique qui soigne les élus, pansant leurs blessures et restaurant leur vigueur.","Ein biotischer Hort, der die Gesalbten nährt, Wunden heilt und die Lebenskraft erneuert.",,,"Биотическая оранжерея, которая питает Последователей, залечивая раны и восстанавливая силы.",,
TFTV_BLIMP_SPEED_MODULE_NAME,Text,,Bioflux Assimilator,,Assimilateur de Bioflux,Bioflux-Assimilator,,,Модуль «Ассимилятор Биопотока»,,
TFTV_BLIMP_SPEED_MODULE_DESCRIPTION,Text,,"A living engine graft that scavenges and metabolizes microscopic biomatter from the Mist, digesting Mist-borne organics into raw thrust.",,"Une greffe de moteur vivant qui récupère et métabolise la biomatière microscopique du Brouillard, digérant les organismes en suspension pour les convertir en poussée brute.","Organisches Triebwerk, das mikroskopische Biomasse aus dem Nebel verwertet.
<b>Wandelt organische Materie aus dem Nebel in Schub um.</b>",,,"Живой трансплантат двигателя, который собирает и перерабатывает микроскопическую биоматерию из Тумана, превращая органику Тумана в чистую тягу.",,
TFTV_CLINIC_BONUS,Text,,Slowly recovers Stamina of characters on board,,Récupère lentement l'endurance des personnages à bord.,Stellt langsam die Ausdauer der Einsatzkräfte an Bord wieder her.,,,Медленно восстанавливает Выносливость пассажиров на борту,,
KEY_FS_NJ_CRUISE_CONTROL_MODULE_NAME,Text,,Junker Jet Engine,,Moteur à réaction de bric-et-broc,Junker-Strahltriebwerk,,,Реактивный тракторный движок,,
KEY_FS_NJ_CRUISE_CONTROL_MODULE_DESCRIPTION,Text,,They can go on planes too! Adds +150 Speed,,Ils s'adaptent aussi sur les appareils ! Ajoute +150 Vitesse,"Kann auch an Fluggeräte montiert werden!
<b>+150 Geschwindigkeit</b>",,,Они годятся и для самолетов! Дает +150 к скорости,,
KEY_FS_NJ_FUEL_TANK_MODULE_NAME,Text,,Omni Tank,,Omni-réservoir,Universaltank,,,Универсальный Реактор,,
KEY_FS_NJ_FUEL_TANK_MODULE_DESCRIPTION,Text,,"Fill it up with anything you need to power your aircraft: gas, biomass, fissionable materials, pixie dust. Adds +1000 Range",,"Remplissez-le avec tout ce dont vous avez besoin pour alimenter votre apareil : essence, biomasse, matières fissiles ou même de la poussière de fée. Ajoute +1000 Portée.","Befüllbar mit allem, was ein Fluggerät antreibt: Treibstoff, Biomasse, spaltbare Materialien, Feenstaub.
<b>+1000 Reichweite</b>",,,"Заполните его чем угодно для питания вашего самолета: газом, биомассой, радиоактивными материалами, волшебной пыльцой. Дает +1000 к расстоянию перелета",,
TFTV_THUNDERBIRD_GAW_ABILITY_NAME,Text,,Call Fire Support,,Soutien tactique,Feuerunterstützung anfordern,,,Вызвать огневую поддержку,,
TFTV_THUNDERBIRD_GAW_ABILITY_DESCRIPTION,Text,,Launches guided munitions towards target area.,,Lance des munitions guidées vers la zone cible.,Startet gelenkte Munition auf das Zielgebiet.,,,Запускает управляемые ракеты в целевой район.,,
TFTV_BLIMP_SPEED_RESEARCH_BENEFIT,Text,,"Aircraft speed through Mist +150, aircraft maintenance loss reduced by 25%",,"Vitesse de l'apareil dans le Brouillard +150, perte de maintenance de l'apareil réduite de 25 %.","Fluggeschwindigkeit im Nebel <b>+150 Geschwindigkeit, Wartungsverlust −25%</b>",,,"Скорость самолета в Тумане +150, стоимость обслуживания меньше на 25%",,
TFTV_BLIMP_MUTOG_PEN_MODULE_RESEARCH_NAME,Text,,Mutog Menagerie,,Centre de confinement pour Mutogs,Menagerie der Mutogs,,,Подвесная клетка для Мутогов,,
TFTV_BLIMP_MUTOG_PEN_MODULE_RESEARCH_REVEAL,Text,,A space-saving organic containment module. Aircraft may carry and deploy up to 2 Mutogs for 1 space each.,,"Un module de confinement organique conçu pour optimiser l'espace. Les apareils peuvent transporter et déployer jusqu'à 2 Mutogs, chacun n'occupant qu'1 emplacement.","Platzsparendes organisches Eindämungsmodul.
<b>Fluggeräte können bis zu 2 Mutogs transportieren und einsetzen (je 1 Platz).</b>",,,"Наружный модуль-клетка. Самолет может перевозить и десантировать до двух Мутогов, каждый из которых занимает по одному пассажирскому месту.",,
TFTV_BLIMP_MUTOG_PEN_MODULE_RESEARCH_UNLOCK,Text,,A space-saving organic containment module. Aircraft may carry and deploy up to 2 Mutogs for 1 space each.,,"Un module de confinement organique conçu pour optimiser l'espace. Les apareils peuvent transporter et déployer jusqu'à 2 Mutogs, chacun n'occupant qu'1 emplacement.","Platzsparendes organisches Eindämungsmodul.
<b>Fluggeräte können bis zu 2 Mutogs transportieren und einsetzen (je 1 Platz).</b>",,,"Наружный модуль-клетка. Самолет может перевозить и десантировать до двух Мутогов, каждый из которых занимает по одному пассажирскому месту.",,
TFTV_BLIMP_MUTOG_PEN_MODULE_RESEARCH_COMPLETE,Text,,Mutog Menagerie complete.,,Recherche « Centre de confinement pour Mutogs » terminée.,Menagerie der Mutogs abgeschlossen.,,,Подвесная клетка для Мутогов разработана.,,
TFTV_BLIMP_MUTOG_PEN_MODULE_RESEARCH_BENEFITS,Text,,Allows manufacturing a module that allows carrying 2 Mutogs for 1 space on the Anu Blimp.,,Permet de fabriquer un module capable de transporter 2 Mutogs pour seulement 1 emplacement à bord du Dirigeable d'Anu.,"Ermöglicht die Herstellung eines Moduls, das den Transport von <b>2 Mutogs für 1 Platz</b> im <b>Anu-Luftschiff</b> erlaubt.",,,"Можно построить модуль, позволяющий перевозить до двух Мутогов на Тиамате Последователей Ану.",,
TFTV_VEHICLE_HARNESS_MODULE_RESEARCH_NAME,Text,,Ezekiel's Dream,,Le Rêve d’Ézéchiel,Ezechiels Traum,,,Модуль «Мечта Иезекииля»,,
TFTV_VEHICLE_HARNESS_MODULE_RESEARCH_REVEAL,Text,,A reinforced hard-point harness that lets any aircraft carry a ground vehicle as external cargo. Aircraft can carry a vehicle for 1 space less (Thunderbird can carry 2 vehicles for 1 space each).,,Un harnais à points d'ancrage renforcés qui permet à n'importe quel apareil de transporter un véhicule terrestre en tant que cargaison externe. Les apareils peuvent transporter un véhicule pour 1 emplacement de moins (le Thunderbird peut ainsi transporter 2 véhicules occupant 1 emplacement chacun).,"Verstärkte Außenlast-Aufhängung, die es Fluggeräten erlaubt, Bodenfahrzeuge extern zu transportieren.
<b>Fahrzeuge benötigen 1 Platz weniger</b> (Thunderbird kann <b>2 Fahrzeuge zu je 1 Platz</b> transportieren).",,,"Усиленный грузовой захват для машин. Позволяет самолету нести машину снаружи корпуса. Машина занимает на 1 пассажиро-место меньше. (Гром-птица может нести 2 машины, по 1-му месту на каждую).",,
TFTV_VEHICLE_HARNESS_MODULE_RESEARCH_UNLOCK,Text,,A reinforced hard-point harness that lets any aircraft carry a ground vehicle as external cargo. Aircraft can carry a vehicle for 1 space less (Thunderbird can carry 2 vehicles for 1 space each).,,Un harnais à points d'ancrage renforcés qui permet à n'importe quel apareil de transporter un véhicule terrestre en tant que cargaison externe. Les apareils peuvent transporter un véhicule pour 1 emplacement de moins (le Thunderbird peut ainsi transporter 2 véhicules occupant 1 emplacement chacun).,"Verstärkte Außenlast-Aufhängung, die es Fluggeräten erlaubt, Bodenfahrzeuge extern zu transportieren.
<b>Fahrzeuge benötigen 1 Platz weniger</b> (Thunderbird kann <b>2 Fahrzeuge zu je 1 Platz</b> transportieren).",,,"Усиленный грузовой захват для машин. Позволяет самолету нести машину снаружи корпуса. Машина занимает на 1 пассажиро-место меньше. (Гром-птица может нести 2 машины, по 1-му месту на каждую).",,
TFTV_VEHICLE_HARNESS_MODULE_RESEARCH_COMPLETE,Text,,Ezekiel's Dream research complete.,,Recherche « Le Rêve d'Ézéchiel » terminée.,Ezekiels Traum – Forschung abgeschlossen.,,,Модуль «Мечта Иезекииля» исследован.,,
TFTV_VEHICLE_HARNESS_MODULE_RESEARCH_BENEFITS,Text,,Allows manufacturing a module that reduces space used by vehicles on aircraft,,Permet de fabriquer un module qui réduit l'espace occupé par les véhicules à bord des apareils.,"Ermöglicht die Herstellung eines Moduls, das den Platzbedarf von Fahrzeugen in Fluggeräten reduziert.",,,"Можно построить модуль, который уменьшает место, занимаемое машинами на борту самолета.",,
Geoscape/KEY_AIRCRAFT_STATS_DURABILITY,Text,,OPS HOURS,,HEURES D'OPÉRATIONS,FLUGDIENST,,,ЧАСЫ РАБОТЫ,,
DLC 3 - Behemoth/KEY_DLC3_HULL_POINTS,Text,,CONDITION,,ÉTAT,ZUSTAND,,,СОСТОЯНИЕ,,
TFTV_KEY_TIER,Text,,Tier,,Rang,Stufe,,,Уровень,,
KEY_GEO_SCANNER_UNAVAILABLE,Text,,Area Scan already in progress.,,Scan de zone déjà en cours.,Gebietsscan bereits im Gange.,,,Сканирование области уже идет.,,
TFTV_BLIMP_SPEED_MODULE_BENEFIT_1_SINGLE,Text,,"• Aircraft speed through Mist increased by 150, aircraft maintenance loss reduced by 25% (TIER 1).",,"• Vitesse des appareils dans la Brume augmentée de 150, coûts d'entretien réduits de 25% (NIVEAU 1).","• Fluggerätgeschwindigkeit im Nebel um 150 erhöht, Wartungsverlust um 25% reduziert (STUFE 1).",,,"• Скорость самолета сквозь Туман увеличена на 150, стоимость обслуживания самолета снижена на 25% (УРОВЕНЬ 1).",,
