Key,Type,Desc,English
TFTV_INCIDENT_26_OUTCOME_1_SUCCESS,Text,Reward: +4 NJ +8 Haven Leader + 400 Research,"After extensive filtering, portions of the transmission become unexpectedly clear.

The signal resolves into a structured language, governed by syntax and repetition.

Its meaning remains inaccessible, but one pattern appears again and again—regular, urgent, unmistakable. Like a warning, a call for help, or perhaps an emergency broadcast."
TFTV_INCIDENT_26_OUTCOME_0_FAIL,Text,,"The triangulation attempt produces contradictory results.

Each recalculation places the signal somewhere else, sometimes hundreds of kilometers apart.

The uplink behaves inconsistently, as though the source itself cannot be fixed in space.

New Jericho files the anomaly under “unresolved interference.”"
TFTV_INCIDENT_26_OUTCOME_1_FAIL,Text,,"Every attempt to stabilize the signal introduces further distortion.

Filters collapse into static, and decoding routines begin to loop endlessly.

At one point, the system briefly locks up, forcing a manual reset of the uplink.

The data remains unreadable, leaving only fragments and an uneasy sense that something was missed."
TFTV_INCIDENT_27_TITLE_NJ,Text,Req: haven survived Pandoran attack,Broken Chain
TFTV_INCIDENT_27_DESC,Text,,"The inhabitants of the New Jericho haven of [HavenName] are still reeling after a recent Pandoran assault.

The attack was repelled, but at a heavy cost. Many are dead or wounded, and key defensive installations were damaged.

In the aftermath, it becomes apparent that the haven’s garrison commander is missing."
TFTV_INCIDENT_27_CHOICE_0_C_M,Text,,"Review security footage and after-action reports.
(Machinery / Compute approach)"
TFTV_INCIDENT_27_CHOICE_1_B_E,Text,,"Conduct a forensic investigation of the headquarters.
(Exploration / Biotech approach)"
TFTV_INCIDENT_27_CHOICE_2,Text,,Surely they can find the body themselves. [END]
TFTV_INCIDENT_27_OUTCOME_0_SUCCESS,Text,Reward: +4 NJ +8 Haven Leader + 400 Mats,"The garrison commander vanished shortly before the attack began.

He was not alone. At least two junior officers with direct responsibility for perimeter defenses are also unaccounted for.

Their last recorded movements suggest no struggle, no alarm—only absence."
TFTV_INCIDENT_27_OUTCOME_1_SUCCESS,Text,Reward: +4 NJ +8 Haven Leader + 400 Mats,"A careful forensic sweep of headquarters uncovers a single anomaly.

A ventilation duct cover in a restroom near the command offices is missing.

Inside the duct, Phoenix operatives identify traces of dried organic residue.

The material is consistent with secretions commonly associated with Triton activity."
TFTV_INCIDENT_27_OUTCOME_0_FAIL,Text,,"The data is incomplete.

Several cameras were disabled during the attack, while others appear to have looped corrupted footage.

After-action reports contradict one another, filed hastily and under extreme stress.

No clear sequence of events can be reconstructed.

What happened before the attack remains lost in the confusion."
TFTV_INCIDENT_27_OUTCOME_1_FAIL,Text,,"The investigation is hampered by extensive contamination.

Emergency responders, medical teams, and repair crews moved freely through the headquarters before the site could be secured.

Biological traces are degraded beyond usefulness, and structural damage obscures potential points of entry.

The trail goes cold before it can even begin."
TFTV_INCIDENT_28_TITLE_NJ,Text,Req: nearby liberated infested New Jericho haven,Clearance
TFTV_INCIDENT_28_DESC,Text,,"Following the arrival of several refugee groups, medical screening at [HavenName] has identified multiple individuals testing positive for the Pandoravirus.

All refugees have been placed under immediate quarantine."
TFTV_INCIDENT_28_CHOICE_0_B,Text,,"Conduct a detailed examination of the quarantined refugees.
(Biotech)"
TFTV_INCIDENT_28_CHOICE_1_C_M,Text,,"Review and assess New Jericho’s infection detection procedures.
(Compute / Machinery)"
TFTV_INCIDENT_28_CHOICE_2,Text,,No matter what we do they are never leaving quarantine. [END]
TFTV_INCIDENT_28_OUTCOME_0_SUCCESS,Text,Reward: Research +300,"Nearly all refugees - not just those that tested positive - exhibit one or more markers that could be associated with Pandoravirus exposure, but a reaction to the virus does not imply infection. It is also not possible to establish whether exposure ocurred during the infestation of [RequirementHavenName], or long before it. "
TFTV_INCIDENT_28_OUTCOME_1_SUCCESS,Text,Reward: Research +300,"Though seemingly complex and thorough, New Jericho’s screening protocols are narrowly defined; detection focuses on specific biomarkers known to correlate with mutations or late-stage Pandoran adaptation, but which can also sometimes appear after an immune reaction. "
TFTV_INCIDENT_28_OUTCOME_0_FAIL,Text,,"Several refugees refuse further examination, fearing the results will be used to justify permanent isolation.

Stress responses interfere with testing, and cooperation deteriorates rapidly.

The data remains inconclusive, and suspicion deepens on both sides of the quarantine barrier."
TFTV_INCIDENT_28_OUTCOME_1_FAIL,Text,,"The procedures are classified, fragmented across multiple departments, and inconsistently applied.

Responsibility is diffused. No one can fully explain why one individual is isolated while another is cleared.

What was meant to reassure instead reinforces the impression that certainty is being improvised."
TFTV_INCIDENT_29_TITLE_NJ,Text,Req: nearby haven with both research and advanced training facility,Transferred
TFTV_INCIDENT_29_DESC,Text,,"An instructor at a New Jericho school in [HavenName] contacts the Phoenix Project with a concern.

Many of her students are orphans under the care of New Jericho. Over the past weeks, several have stopped attending classes.

When questioned, the facility’s warden responds laconically that the children have been transferred to another haven."
TFTV_INCIDENT_29_CHOICE_0_C,Text,,"Hack into the warden’s personal files and correspondence.
(Compute)"
TFTV_INCIDENT_29_CHOICE_1_E_P,Text,,"Speak with the remaining wards and orphanage personnel.
(Psycho-Sociology / Exploration approach)"
TFTV_INCIDENT_29_CHOICE_2,Text,,We have more important things to do. [END]
TFTV_INCIDENT_29_OUTCOME_0_SUCCESS,Text,Reward: Extra personnel,"For the warden the transfers appear to be a bureaucratic obligation—tedious, poorly explained, and outside her core responsibilities.

Cross-referencing medical and administrative logs reveals a pattern: all transferred wards underwent medical examinations within weeks of departure.

Every transfer destination is the same: [RequirementHavenName], a New Jericho haven that houses a research complex and an advanced training facility."
TFTV_INCIDENT_29_OUTCOME_1_SUCCESS,Text,Reward: Extra personnel,"Conversations with staff yield little; most repeat the official explanation without comment.

The children, however, speak more freely.

Some talk in hushed, excited tones about a place they call the Royal Stables at [RequirementHavenName].

They describe better food, cleaner quarters, and a special training program.

Their tone is reverent, almost awed."
TFTV_INCIDENT_29_OUTCOME_0_FAIL,Text,,"The files are sparse and poorly organized.

Large portions of the warden’s correspondence appear to have been archived automatically, beyond Phoenix’s reach.

What remains suggests routine compliance rather than initiative.

If there is intent behind the transfers, it is being generated elsewhere."
TFTV_INCIDENT_29_OUTCOME_1_FAIL,Text,,"Staff grow defensive as questions continue.

They insist that Phoenix has no jurisdiction over internal child welfare decisions.

The wards fall silent, watching carefully to see who is listening.

Whatever rumors exist retreat further out of reach."