Key,Type,Desc,English,Chinese (Simplified),French,German,Italian,Polish,Russian,Spanish,UI_Tester
TFTV_LORE_BENNU_DESCRIPTION,Text,,"The Phoenix Project relies on a number of Limited Artificial Intelligences: task oriented, non replicating software with limited growth potential devoid of internal personality modulators, aggregated under the namespace Bennu. 

Bennu runs the life support on Phoenix bases, assists with research and manufacturing processes, and provides the Director Interface and other critical information, among many other crucial background tasks. They allow the Director maximum control in both strategic and tactical decisions. 

As a data processing unit, Bennu works to present all relevant information in the most succinct, understandable and engaging manner. Like this text here! Hope you enjoyed it!",,"Le Projet Phénix s’appuie sur un certain nombre d’Intelligences Artificielles Limitées : des logiciels orientés tâches, non réplicables, au potentiel de croissance limité et dépourvus de modules de personnalité internes, regroupés sous le nom de Bennu.

Bennu gère le support vital des bases Phénix, assiste dans les processus de recherche et de fabrication, et fournit l’Interface du Directeur ainsi que d’autres informations critiques, parmi de nombreuses autres tâches essentielles en arrière-plan. Elles permettent au Directeur de garder un contrôle maximal sur les décisions stratégiques et tactiques.

En tant qu’unité de traitement de données, Bennu s’efforce de présenter toutes les informations pertinentes de la manière la plus concise, compréhensible et engageante possible. Comme ce texte ici ! Nous espérons que cela vous a plu !","Das Phoenix-Projekt stützt sich auf Bennu: ein Kollektiv aus aufgabenorientierten, limitierten KIs – Software ohne Replikationsdrang, Wachstumspotenzial oder Persönlichkeitskerne.

Bennu überwacht die Lebenserhaltung, steuert Produktionsprozesse und dient als die einzige Schnittstelle, die den Verstand des Direktors mit der brutalen Realität der Datenflut verbindet. Es ist das Rückgrat, das die totale Kontrolle über Leben und Tod auf dem Schlachtfeld ermöglicht.

Als rein analytische Einheit filtert Bennu die Wahrheit in verdauliche Fragmente. Wie dieses hier. Konsumiere die Information, solange dein Bewusstsein noch zur Verarbeitung fähig ist!",,"Projekt Phoenix opiera się na szeregu Ograniczonych Sztucznych Inteligencji: zorientowanego zadaniowo, niereplikującego się oprogramowania o ograniczonym potencjale rozwoju, pozbawionego wewnętrznych modulatorów osobowości, zebranych pod wspólną nazwą Bennu.

Bennu obsługuje podtrzymywanie życia w bazach Phoenix, wspomaga badania i produkcję, zapewnia Interfejs Dyrektora oraz wiele innych krytycznych informacji, a poza tym wykonuje mnóstwo kluczowych zadań w tle. Dzięki temu Dyrektor ma maksymalną kontrolę zarówno nad decyzjami strategicznymi, jak i taktycznymi.

Jako jednostka przetwarzania danych Bennu stara się przedstawiać wszystkie istotne informacje w sposób możliwie najbardziej zwięzły, zrozumiały i angażujący. Tak jak ten tekst tutaj! Mamy nadzieję, że ci się podobał.","Проект Феникс опирается на набор слабых искусственных интеллектов - специализированных, не способных к воспроизводству, программ с ограниченным потенциалом самообучения, лишенных какой-либо личности, объединенных вместе в систему под названием Бенну. 

Бенну обеспечивают жизнедеятельность баз Феникса, помогает в исследованиях и производственных процессах, реализует панель управления Директора и доступ к базе данных Проекта Феникс, а также выполняет множество других важнейших фоновых задач. Он позволяет Директору полностью контролировать принятие стратегических и тактических решений. 

Будучи по сути улучшенной версией ChatGPT, Бенну представляет всю необходимую информацию в наиболее краткой, понятной и увлекательной форме, как, например, данный текст! Надеюсь, вам понравилось?!","El Proyecto Phoenix depende de un número de Inteligencias Artificiales Inteligentes: tareas básicas, programas no autorreplicables con un crecimiento potencial carente de módulos de personalidad, bajo la supervisión de Bennu.

Bennu mantiene el soporte vital en las bases Phoenix, ayuda con la investigación y procesos de montaje, y le da al Director información crítica, entre otras muchas cosas. Le permiten al Director máximo control tanto en decisiones tácticas y estratégicas.

Como unidad de procesamiento de datos, Bennu se esfuerza por presentar toda la información relevante de la manera más concisa, comprensible y atractiva. ¡Dale ""Me gusta"" a este texto! ¡Espero que lo hayas disfrutado!",
TFTV_TIP_GEOSCAPE_1,Text,,Accepting a Diplomacy mission from one faction will normally give you a large penalty with the other factions.,,Accepter une mission diplomatique d’une faction entraîne normalement une pénalité importante auprès des autres factions.,"Wenn du eine Diplomatie-Mission für eine Fraktion annimmst, bekommst du meist einen großen Malus bei den anderen Fraktionen.",,Przyjęcie misji dyplomatycznej od jednej frakcji zwykle daje dużą karę u pozostałych frakcji.,"Приняв дипломатическое задание от одной фракции, вы обычно получаете большой штраф в отношениях с другими фракциями.",Aceptar una Misión Diplomática de una de las facciones normalmente te dará una gran penalización hacia las otras.,
TFTV_TIP_GEOSCAPE_2,Text,,"If you choose to postpone a Diplomacy mission, you will suffer a penalty with the offering faction, and be offered the mission again once you reach the required Diplomacy rating.",,"Si vous choisissez de reporter une mission diplomatique, vous subirez une pénalité auprès de la faction qui l’a proposée, et la mission vous sera reproposée lorsque vous atteindrez à nouveau le palier requis.","Wenn du eine Diplomatie-Mission aufschiebst, erleidest du einen Malus bei der anbietenden Fraktion und bekommst sie erneut angeboten, sobald du die erforderliche Diplomatie-Bewertung erreichst.",,"Jeśli odłożysz misję dyplomatyczną na później, otrzymasz karę u frakcji, która ją oferuje, a sama misja zostanie zaproponowana ponownie po osiągnięciu wymaganego poziomu dyplomacji.","Если вы решите отложить дипломатическую миссию, вы будите оштрафованы фракцией, предложившей миссию. И вам предложат ее снова не раньше, чем когда вы достигнете требуемого рейтинга дипломатии.","Si decides posponer una misión de Diplomacia, sufrirás una penalización con la facción solicitante y se ofrecerá la misión nuevamente una vez que alcances la calificación de Diplomacia requerida.",
TFTV_TIP_GEOSCAPE_3,Text,,Void Omens can be removed by destroying Pandoran Lairs or Citadels (or Nests if you are playing on Rookie).,,Les « Influences du Néant » peuvent être supprimés en détruisant des Colonies ou des Citadelles Pandoriennes (ou des Nids si vous jouez en mode Bleu).,"Omen der Leere lassen sich entfernen, indem du pandoranische Baue oder Zitadellen zerstörst – auf der Schwierigkeit Grünschnabel auch Nester.",,"Znaki Pustki można usuwać, niszcząc pandorańskie Legowiska lub Cytadele (albo Gniazda, jeśli grasz na Rekrucie).","Знамения Пустоты можно отменить, уничтожая Пандоранские Логова или Цитадели (или Гнезда, если вы играете на уровне сложности Новичок).","Los Augurios del Vacío pueden eliminarse destruyendo las madrigueras, guaridas o ciudadelas (o Nidos si estás jugando en Novato).",
TFTV_TIP_GEOSCAPE_4,Text,,Pandoran Colonies and Infested Havens speed up Pandoran Evolution.,,Les colonies pandoriennes et les refuges infestés accélèrent l’évolution pandorienne.,Pandoranische Kolonien und befallene Zufluchten beschleunigen die Evolution.,,Kolonie Pandora i zainfestowane przystanie przyspieszają ewolucję Pandoran.,Колонии Пандоранов и зараженные убежища ускоряют эволюцию Пандоранов.,Las colonias Pandora y refugios infestados aceleran la evolución Pandora.,
TFTV_TIP_GEOSCAPE_5,Text,,Beware of ambushes when exploring!,,Méfiez‑vous des embuscades lors de vos explorations !,"Die Stille im Nebel ist ein Raubtier. Hinterhalte sind keine Möglichkeit, sondern eine Gewissheit für die Unvorsichtigen!",,Uważaj na zasadzki podczas eksploracji!,Остерегайтесь засад при разведке неизвестных локаций!,¡Cuidado con las emboscadas al explorar!,
TFTV_TIP_GEOSCAPE_6,Text,,You can buy Faction Technologies in the Marketplace.,,Vous pouvez acheter des Technologies de faction dans le Marché.,Im Basar kannst du Fraktionstechnologien erwerben.,,Technologie frakcyjne można kupować na Targowisku.,Вы можете купить технологии фракций на Рынке.,Puede comprar Tecnologías de Facción en el Mercado.,
TFTV_TIP_GEOSCAPE_7,Text,,Reverse Engineering an item will allow the player to research the underlying Faction Technology.,,Le rétro‑ingénierie d’un objet permet au joueur d’étudier la Technologie de faction sous-jacente.,Durch Rückwärtsanalyse eines Gegenstands kannst du die zugrunde liegende Fraktionstechnologie erforschen.,,Inżynieria wsteczna przedmiotu pozwala zbadać stojącą za nim technologię frakcyjną.,"Реверс-инжиниринг предмета позволит игроку изучить технологию фракции, лежащую в его основе.",Hazle Ingeniería Inversa a un objeto permitirá al jugador investigar la Tegnología de Facción subyacente.,
TFTV_TIP_GEOSCAPE_8,Text,,You don't have to follow the Symes questline to win; activate a couple old Phoenix bases to see if there is anything interesting in their archives...,,Vous n’êtes pas obligé de suivre la quête de Symes pour gagner. Activez quelques anciennes bases Phénix pour voir s’il y a quelque chose d’intéressant dans leurs archives...,Symes’ Pfad ist nur einer von vielen in den Abgrund. Durchsuche die verstaubten Archive alter Basen – vielleicht liegt die Wahrheit in den Trümmern vergraben.,,"Nie musisz podążać ścieżką fabularną Symesa, żeby wygrać; aktywuj kilka starych baz Phoenix i sprawdź, czy w ich archiwach nie ma czegoś interesującego...","Чтобы победить, необязательно идти по следам Саймса: активируйте пару старых баз Феникса, чтобы узнать, нет ли в их архивах чего-нибудь интересного...",No tienes que sequir la serie de misiones de Symes para ganar; activa un par de antiguas bases Phoenix para ver si hay algo interesante en sus archivos…,
TFTV_TIP_GEOSCAPE_9,Text,,The FAR-M module that comes equipped on your starting Manticore adds 4 seats and stamina regeneration to everyone on board.,,Le module FAR-M équipé sur votre Manticore de départ ajoute 4 sièges et régénère l’endurance de tous les occupants.,Das FAR-Modul der Start-Manticore bietet 4 Zusatzplätze und regeneriert Ausdauer.,,"Moduł FAR-M, w który wyposażona jest twoja początkowa Manticore, dodaje 4 miejsca i regenerację wytrzymałości wszystkim na pokładzie.","Модуль РШМ, которым оснащается стартовая Мантикора, добавляет 4 места для бойцов и постепенное восстановление выносливости всех, кто находится на борту.",El módulo FAR-M que viene equipado en tu Mantícora inicial añade 4 asientos y recuperación de Aguante a todos los de abordo.,
TFTV_TIP_GEOSCAPE_10,Text,,"There are 4 different Passenger Modules for your aircraft, each granting a different bonus in addition to the extra seats. You will unlock them as you acquire Faction Technologies.",,"Il existe 4 modules passagers différents pour votre appareil, chacun offrant un bonus distinct en plus des sièges supplémentaires. Vous les débloquerez au fur et à mesure que vous acquerrez des Technologies de faction.","Es gibt 4 verschiedene Transportmodule für dein Fluggerät. Jedes gewährt neben zusätzlichen Sitzen einen eigenen Bonus. Du schaltest sie frei, sobald du Fraktionstechnologien erwirbst.",,"Istnieją 4 różne moduły pasażerskie do statków powietrznych, a każdy z nich daje inny bonus oprócz dodatkowych miejsc. Odblokujesz je wraz z pozyskiwaniem technologii frakcyjnych.","Для вашего самолета существует 4 различных пассажирских модуля, каждый из которых дает различные бонусы и дополнительные места для бойцов. Вы откроете их по мере получения технологий фракций.","Hay 4 tipos de Módulos de Pasajeros para tus aeronaves, cada uno dando diferentes ventajas además de más asientos. Los desbloquearás a medida que consigas las Tecnologías de Facción.",
TFTV_TIP_GEOSCAPE_11,Text,,"A Haven under attack will send out an S.O.S., revealing its position.",,"Un refuge attaqué émettra un S.O.S., révélant sa position.",Die Todesschreie einer fallenden Zuflucht hallen durch die Geoscape. Ein SOS ist nur der verzweifelte Countdown bis zur endgültigen Stille.,,"Atakowana przystań wyśle sygnał S.O.S., ujawniając swoją pozycję.","Убежище, подвергшееся нападению, посылает сигнал SOS, сообщая о своих координатах.","Un refugio bajo ataque enviará una señal S.O.S., revelando su posición.",
TFTV_TIP_GEOSCAPE_12,Text,,Build or repair satellite uplinks at your bases to discover Points of Interest and increase the chance of detecting a Pandoran Colony after successfully defending a haven.,,Construisez ou réparez des liaisons satellites dans vos bases pour découvrir des Points d’Intérêt et augmenter la probabilité de détecter une colonie pandorienne après avoir défendu avec succès un refuge.,"Baue oder repariere Satellitenanbindungen in deinen Basen, um interessante Orte zu entdecken und die Chance zu erhöhen, nach einer erfolgreichen Zufluchtsverteidigung eine pandoranische Kolonie aufzuspüren.",,"Buduj lub naprawiaj łącza satelitarne w bazach, aby odkrywać Punkty Zainteresowania i zwiększyć szansę wykrycia kolonii Pandora po skutecznej obronie przystani.","Постройте или отремонтируйте «Спутниковые Комплексы» на своих базах, чтобы находить новые локации на карте Земли и повысить вероятность обнаружения Пандоранских Колоний при успешной защите убежищ.",Construye o repara un enlace de satélite en tus bases para descubrir Puntos de Interés y aumentar la posibilidad de detectar Colonias Pandora tras defender exitosamente un refugio.,
TFTV_TIP_GEOSCAPE_13,Text,,"As long as haven leaders are not hostile to the Phoenix Project, they will continue to offer recruits, though at a higher price if they dislike you.",,"Tant que les dirigeants des refuges ne sont pas hostiles au Projet Phénix, ils continueront à proposer des recrues, bien qu’à un prix plus élevé s’ils vous apprécient peu.","Solange Zufluchtsanführer dem Phoenix-Projekt nicht feindlich gesinnt sind, bieten sie weiterhin Rekruten an – nur teurer, wenn sie dich nicht mögen.",,"Dopóki przywódcy przystani nie są wrogo nastawieni do Projektu Phoenix, nadal będą oferować rekrutów, choć po wyższej cenie, jeśli cię nie lubią.","Пока лидеры убежищ не враждебны Проекту Феникс, они будут продолжать предлагать новобранцев, хотя и по более высокой цене, если вы им не нравитесь.","Siempre y cuando los líderes de refugios no sean hostiles al Proyecto Phoenix, continuarán ofreciendo reclutas, pero más caros si te desprecian.",
TFTV_TIP_GEOSCAPE_14,Text,,"As the Oneiric Delirium advances, more negative effects will come in play, including Void Omens.",,"À mesure que le Delirium progresse, davantage d’effets négatifs entreront en jeu, y compris les « Influences du Néant ».","Während das Oneirische Delirium voranschreitet, treten weitere negative Effekte in Kraft – einschließlich Omen der Leere.",,"Wraz z postępem Onirycznego Delirium pojawi się więcej negatywnych efektów, w tym Znaki Pustki.","По мере распространения Сонного Безумия в игру будет вступать все больше негативных эффектов, включая Знамения Пустоты (Void Omens).","A medida que el Delirio Onírico avanza, más efectos negativos harán acto de presencia, includyendo los Augurios del Vacío.",
TFTV_TIP_GEOSCAPE_15,Text,,Havens destroyed inside the Mist can become Infested.,,Les refuges détruits à l’intérieur de la Brume peuvent devenir infestés.,"Was der Nebel beansprucht, gibt er nicht wieder her. Zerstörte Zufluchten bleiben nicht tot; sie können zu Brutstätten des Albtraums werden.",,Przystanie zniszczone we Mgle mogą zostać zainfestowane.,"Убежища, разрушенные внутри Тумана, могут стать зараженными.",Los refugios destruidos dentro de la Niebla podrán ser infestados.,
TFTV_TIP_GEOSCAPE_16,Text,,"Infested Havens cannot be saved, but unique rewards can be salvaged and some population recovered.",,"Les refuges infestés ne peuvent être récupérés, seulement une partie de la population peut être sauvée. Cependant, vous y trouverez peut être des récompenses uniques.","Befallene Zufluchten lassen sich nicht retten, aber du kannst einzigartige Belohnungen bergen und einen Teil der Bevölkerung evakuieren.",,"Zainfestowanych przystani nie da się uratować, ale można odzyskać z nich unikalne nagrody i część populacji.","Зараженные убежища нельзя спасти, но при их зачистке можно получить уникальные награды и восстановить часть населения.","Los refugios infestados no pueden salvarse, pero ofrecen recompensas únicas y pueden recuperar a parte de la población restante.",
TFTV_TIP_GEOSCAPE_17,Text,,"If you are looking for a challenge, check the Make Pandorans Stronger option at the start of the game. If you are still finding everything too easy, try the ELDRITCH difficulty. Report if you survive, would you kindly. ",,"Si vous cherchez un défi, activez l’option « Rendre les Pandoriens plus forts » au début du jeu. Si vous trouvez encore tout trop facile, essayez la difficulté ELDRITCH. Faites un rapport si vous survivez, s’il vous plaît.","Wenn du eine Herausforderung suchst, aktiviere zu Spielbeginn die Einstellung „stärkere Pandoraner“. Wenn dir dann immer noch alles zu leicht ist, probier den Schwierigkeitsgrad ETERMES. Gib uns bitte Bescheid, falls du überlebst.",,"Jeśli szukasz wyzwania, włącz na początku gry opcję Wzmocnij Pandoran. Jeśli nadal wszystko wydaje się zbyt łatwe, spróbuj poziomu trudności ELDRITCH. Jeśli przeżyjesz, koniecznie zamelduj.","Если вы хотите больше сложностей, включите опцию ОПАСНЫЕ ПАНДОРАНЫ в начале игры. Если вам все еще кажется, что играть слишком легко, попробуйте сложность ПОЛНОЕ БЕЗУМИЕ. Сообщите, если вы выжили, пожалуйста :)","Si buscas un desafío, echa un vistazo a la opción para hacer a los Pandoras más fuertes al principio de la partida. Si aún te parece fácil, prueba la dificultad ETERMES. Avisa si sobrevives, ¿quieres?",
TFTV_TIP_GEOSCAPE_18,Text,,"If you are finding the game too hard, try playing on Story Mode or Rookie. You can also choose a different difficulty setting for the Tactical portion of the game. You can do so either on starting a new game or in the mod config.",,"Si vous trouvez le jeu trop difficile, essayez de jouer en « Mode Histoire » ou en « Bleu ». Vous pouvez également choisir un niveau de difficulté différent pour la partie « Tactique » du jeu, soit en commençant une nouvelle partie, soit dans la configuration du mod.","Wenn dir das Spiel zu schwer ist, versuch „Erzählung“ oder „Grünschnabel“. Du kannst außerdem einen anderen Schwierigkeitsgrad für den taktischen Teil des Spiels wählen – entweder beim Start eines neuen Spiels oder in der Mod-Konfiguration.",,"Jeśli gra wydaje ci się zbyt trudna, spróbuj trybu Fabuła albo Rekrut. Możesz też wybrać inny poziom trudności dla części taktycznej gry, zarówno przy rozpoczynaniu nowej kampanii, jak i w konfiguracji moda.","Если игра кажется вам слишком тяжелой, попробуйте сыграть на сложности КАК КНИЖКУ ПРОЧИТАТЬ или НОВИЧОК. Вы также можете выбрать отдельно настройку сложности для Тактического (боевого) режима игры. Это можно сделать либо при начале новой игры, либо в конфигурации мода - кликом на название нашего мода в списке модов.","Si te parece demasiado defícil, prueba el Modo Historia o Novato. También puedes elegir otra dificultad en la parte Táctica del juego. Puedes hacerlo al empezar una partida o en la pestaña mod config.",
TFTV_TIP_GEOSCAPE_19,Text,,"If you run into any Error Messages or other bugs, please report them in our #bug-reporting channel at the Terror from the Void Discord server.",,"Si vous rencontrez des messages d’erreur ou d’autres bugs, merci de les signaler dans notre canal #bug-reporting sur le serveur Discord « Terror from the Void ».","Wenn du auf Fehlermeldungen oder andere Bugs stößt, melde diese bitte in unserem Channel #bug-reporting auf dem „Terror from the Void“-Discord-Server.",,"Jeśli natkniesz się na komunikaty o błędach lub inne bugi, zgłoś je na kanale #bug-reporting na serwerze Discord Terror from the Void.","Если вы столкнулись с какими-либо сообщениями об ошибках или другими багами, пожалуйста, сообщите о них в нашем канале #bug-reporting на сервере «Terror from the Void» в Discord.","Si te topas con algún Mensaje de Error u otros fallos, por favor, háznoslo saber en nuestro canal #bug-reporting del servidor de Discord de Terror from the Void.",
TFTV_TIP_TACTICAL_1,Text,,The total amount of Delirium of all your operatives present on the mission determines the chance that an Arthron or a Triton will be Touched by the Void.,,La quantité totale de Delirium de touts vos unités présentes lors de la mission détermine la probabilité qu’un Arthron ou un Triton soit « Imprégné du Néant ».,"Die Gesamtmenge des Deliriums deiner Einheiten in der Mission bestimmt die Wahrscheinlichkeit, dass ein Arthron oder Triton von der Leere berührt wird.",,"Łączna ilość Delirium wszystkich twoich operatorów obecnych na misji określa szansę, że Arthron lub Triton zostaną Dotknięci Pustką.","Степень поражения Сонным Безумием ваших бойцов, участвующих в миссии, определяет вероятность того, что Артрон или Тритон получит Благословление Пустоты.",La cantidad total de Delirio de todos tus operativos presentes en la misión determina la posibilidad de que un Arthron o un Tritón sean Tocados por el Vacío.,
TFTV_TIP_TACTICAL_2,Text,,"Umbras can only attack characters that have at least one Delirium point, or are inside the Mist.",,"Les Umbra ne peuvent attaquer que les personnages ayant au moins un point de Delirium, ou se trouvant dans la Brume.","Umbras können nur Charaktere angreifen, die mindestens einen Delirium-Punkt haben oder sich im Nebel befinden.",,Umbry mogą atakować tylko postacie mające co najmniej 1 punkt Delirium albo znajdujące się we Mgle.,"Фиолетовая Тварь может атаковать только тех бойцов, которые заражены Сонном Безумием или которые находятся внутри Тумана.",Los Umbras solo pueden atacar personajes que tengan al menos un punto de Delirio o estén dentro de la Niebla.,
