Key,Type,Desc,English,Chinese (Simplified),French,German,Italian,Polish,Russian,Spanish,UI_Tester
TFTV_TIP_TACTICAL_3,Text,,The impact of Delirium on Willpower is weakened if your operative is well rested. Every 10 Stamina will reduce the effect of Delirium on Willpower by 1.,,L’impact du Delirium sur la Volonté est réduit si votre unité est bien reposée. Chaque tranche de 10 points d’Endurance diminue l’effet du Delirium sur la Volonté de 1.,"Der Einfluss von Delirium auf die Willenskraft ist schwächer, wenn deine Einheit ausgeruht ist. Jede 10 Ausdauer verringert den Effekt von Delirium auf die Willenskraft um 1.",,"Wpływ Delirium na Siłę Woli jest słabszy, jeśli operator jest wypoczęty. Każde 10 punktów wytrzymałości zmniejsza wpływ Delirium na Siłę Woli o 1.","Влияние Сонного Безумия на Силу Воли ослабевает, если ваш боец хорошо отдохнул. Каждые 10 единиц Выносливости уменьшают на 1 влияние Сонного Безумия на Силу Воли.",El Impacto del Delirio en la Fuerza de Voluntado se debilita si tu operativo está bien descansado. Cada 10 de Aguante reduce el efecto del Delirio en en la Fuerza de Voluntad en 1.,
TFTV_TIP_TACTICAL_4,Text,,"If a body part is disabled in battle, the operative's Stamina will drop to 0 after the mission.",,"Si un membre est rendu inutilisable en combat, l’Endurance de l’unité tombera à 0 après la mission.","Wird im Kampf ein Körperteil außer Gefecht gesetzt, sinkt die Ausdauer der Einheit nach der Mission auf 0.",,"Jeśli część ciała zostanie wyłączona z użycia w walce, wytrzymałość operatora spadnie do 0 po misji.",Если в бою часть тела окажется выбитой (хиты части тела равны 0) то после выполнения миссии Выносливость бойца упадет до 0.,"Si una parte del cuerpo es inhabilitada en batalla, el Aguante de los operativos caerá a 0 tras la misión.",
TFTV_TIP_TACTICAL_5,Text,,"The bigger Pandorans will ignore smaller critters, drones and turrets, and walk over them, or squash them.",,"Les Pandoriens plus gros ignoreront les petites créatures, drones et tourelles, et les écraseront ou marcheront dessus.","Größere Pandoraner ignorieren kleinere Kreaturen, Drohnen und Geschütztürme und trampeln über sie hinweg – oder zerquetschen sie.",,"Więksi Pandoranie ignorują mniejsze stwory, drony i wieżyczki, przechodząc po nich albo je miażdżąc.","Более крупные Пандораны будут игнорировать мелкую живность, дронов и турели, проходя над ними или давя их.","Los Pandoras más grandes ignorarán a los bichos pequeños, drones y torretas,y caminarán sobre ellos, o los aplastarán.",
TFTV_TIP_TACTICAL_6,Text,,Decoys and imaginary (or are they?) monsters don't stop bullets.,,Les leurres et les monstres imaginaires (le sont-ils vraiment ?) ne stoppent pas les balles.,Attrappen und eingebildete (oder doch nicht?) Monster halten keine Kugeln auf.,,Wabiki i wyimaginowane (a może jednak nie?) potwory nie zatrzymują kul.,"Приманки и воображаемые (если они воображаемые, конечно) монстры не останавливают пули.",Los Señuelos y monstruos ¿imaginarios? No paran balas.,
TFTV_TIP_TACTICAL_7,Text,,"If you are looking for a challenge, check the Make Pandorans Stronger option at the start of the game. If you are still finding everything too easy, try the ELDRITCH difficulty. Report if you survive, would you kindly. ",,"Si vous cherchez un défi, activez l’option « Rendre les Pandoriens plus forts » au début du jeu. Si vous trouvez encore tout trop facile, essayez la difficulté ELDRITCH. Faites un rapport si vous survivez, s’il vous plaît.","Wenn du eine Herausforderung suchst, aktiviere zu Spielbeginn die Einstellung „stärkere Pandoraner“. Wenn dir dann immer noch alles zu leicht ist, probier den Schwierigkeitsgrad ETERMES. Gib uns bitte Bescheid, falls du überlebst.",,"Jeśli szukasz wyzwania, włącz na początku gry opcję Wzmocnij Pandoran. Jeśli nadal wszystko wydaje się zbyt łatwe, spróbuj poziomu trudności ELDRITCH. Jeśli przeżyjesz, koniecznie zamelduj.","Если вы хотите больше сложностей, включите опцию ОПАСНЫЕ ПАНДОРАНЫ в начале игры. Если вам все еще кажется, что играть слишком легко, попробуйте сложность ПОЛНОЕ БЕЗУМИЕ. Сообщите нам, если вы выжили, пожалуйста :)","Si buscas un desafío, echa un vistazo a la opción para hacer a los Pandoras más fuertes al principio de la partida. Si aún te parece fácil, prueba la dificultad ETERMES. Avisa si sobrevives, ¿quieres?",
TFTV_TIP_TACTICAL_8,Text,,"If you are finding the game too hard, try playing on Story Mode or Rookie. You can also choose a different difficulty setting for the Tactical portion of the game. You can do so either on starting a new game or in the mod config.",,"Si vous trouvez le jeu trop difficile, essayez de jouer en Mode Histoire ou en Bleu. Vous pouvez également choisir un niveau de difficulté différent pour la partie Tactique du jeu, soit en commençant une nouvelle partie, soit dans la configuration du mod.","Wenn dir das Spiel zu schwer ist, versuch „Erzählung“ oder „Grünschnabel“. Du kannst außerdem einen anderen Schwierigkeitsgrad für den taktischen Teil des Spiels wählen – entweder beim Start eines neuen Spiels oder in der Mod-Konfiguration.",,"Jeśli gra wydaje ci się zbyt trudna, spróbuj trybu Fabuła albo Rekrut. Możesz też wybrać inny poziom trudności dla części taktycznej gry, zarówno przy rozpoczynaniu nowej kampanii, jak i w konfiguracji moda.","Если игра кажется вам слишком тяжелой, попробуйте сыграть на сложности КАК КНИЖКУ ПРОЧИТАТЬ или НОВИЧОК. Вы также можете выбрать другую настройку сложности для Тактического (боевого) режима игры. Это можно сделать либо при начале новой игры, либо в конфигурации мода - кликом на название нашего мода в списке модов.","Si te parece demasiado difícil, prueba el Modo Historia o Novato. También puedes elegir otra dificultad en la parte Táctica del juego. Puedes hacerlo al empezar una partida o en la pestaña mod config.",
TFTV_TIP_TACTICAL_9,Text,,"If you run into any Error Messages or other bugs, please report them in our #bug-reporting channel at the Terror from the Void Discord server.",,"Si vous rencontrez des messages d’erreur ou d’autres bugs, merci de les signaler dans notre canal #bug-reporting sur le serveur Discord Terror from the Void.","Wenn du auf Fehlermeldungen oder andere Bugs stößt, melde diese bitte in unserem Channel #bug-reporting auf dem „Terror from the Void“-Discord-Server.",,"Jeśli natkniesz się na komunikaty o błędach lub inne bugi, zgłoś je na kanale #bug-reporting na serwerze Discord Terror from the Void.","Если вы столкнулись с какими-либо сообщениями об ошибках или другими багами, пожалуйста, сообщите о них в нашем канале #bug-reporting на сервере «Terror from the Void» в Discord.","Si te topas con algún Mensaje de Error u otros fallos, por favor, háznoslo saber en nuestro canal #bug-reporting del servidor de Discord de Terror from the Void.",
TFTV_TIP_TACTICAL_10,Text,,Smart adversaries will realize fast that they are attacking a decoy.,,Les adversaires intelligents se rendront rapidement compte qu’ils attaquent un leurre.,"Clevere Gegner merken schnell, dass sie eine Attrappe angreifen.",,"Sprytni przeciwnicy szybko zorientują się, że atakują wabik.","Умные противники быстро поймут, что атакуют приманку.",Los adversarios inteligentes se darán cuenta rápido de que están atacando a un señuelo.,
TFTV_TIP_GEOSCAPE_20,Text,,The volume of Pandorans that a craft is able to extract is equal to its carrying capacity when equipped with a passenger module.,,Le volume de Pandoriens qu’un appareil peut extraire est égal à sa capacité de transport lorsqu’il est équipé d’un module passager.,"Die Anzahl der Pandoraner, die ein Fluggerät zur Gefangennahme bergen kann, entspricht seiner Transportkapazität, wenn es mit einem Transportmodul ausgestattet ist.",,"Liczba Pandoran, które statek może ewakuować, jest równa jego pojemności transportowej po wyposażeniu modułu pasażerskiego.","Объем Пандоранов, который может вместить самолет, равен его грузоподъемности, при условии оснащения пассажирским модулем.",El volumen de Pandoras que una aeronave es capaz de extraer es igual a su capacidad de carga cuando se le equipa un Módulo de Pasajeros.,
TFTV_TIP_GEOSCAPE_21,Text,,Only one aircraft can be used for extracting paralyzed Pandorans for capture. The game will automatically pick the one with the largest capture capacity.,,Un seul appareil peut être utilisé pour extraire des Pandoriens paralysés en vue de les capturer. Le jeu sélectionnera automatiquement celui ayant la plus grande capacité de capture.,Nur ein einziges Fluggerät kann zur Bergung gelähmter Pandoraner zur Gefangennahme eingesetzt werden. Das Spiel wählt automatisch das Fluggerät mit der größten Eindämmungskapazität aus.,,Tylko jeden statek powietrzny może zostać użyty do ewakuacji sparaliżowanych Pandoran do pojmania. Gra automatycznie wybierze ten z największą pojemnością przechwytywania.,Только один самолет может быть использован для перевозки захваченных парализованных Пандоранов. Игра автоматически выберет самолет с наибольшей вместимостью.,Solo se puede usar una aeronave para extraer a los Pandoras paralizados para la captura. El juego automáticamente elegirá la que tenga una capacidad de captura superior.,
TFTV_TIP_GEOSCAPE_22,Text,,If you have built a Containment Facility the game will automatically try to extract the most valuable of the paralyzed Pandorans at the end of a successful mission.,,"Si vous avez construit un « Centre de confinement », le jeu tentera automatiquement d’extraire les Pandoriens paralysés les plus précieux à la fin d’une mission réussie.","Wenn du eine Eindämmungsanlage errichtet hast, versucht das Spiel am Ende einer erfolgreichen Mission automatisch, die wertvollsten der gelähmten Pandoraner zu bergen.",,"Jeśli zbudowałeś Ośrodek Przetrzymywania, gra automatycznie spróbuje ewakuować najcenniejszego ze sparaliżowanych Pandoran po zakończeniu udanej misji.","Если вы построили Изолятор, то в конце успешной миссии игра автоматически попытается загрузить в самолет самого ценного из парализованных Пандоранов.","Si has contruido una Instalación de Contención, el juego automáticamente intentará extraer a los Pandoras paralizados más valiosos al final de una misión exitosa.",
TFTV_TIP_GEOSCAPE_23,Text,,"If you want to ensure that a lower value Pandoran gets captured, click on the fully paralyzed Pandoran and choose that option in the dropdown menu. Do the same to remove the mark.",,"Si vous voulez vous assurer qu’un Pandorien de moindre valeur soit capturé, cliquez sur le Pandorien entièrement paralysé et choisissez cette option dans le menu déroulant. Faites de même pour retirer la sélection.","Um die Gefangennahme eines weniger wertvollen Pandoraners zu garantieren, klicke auf das vollständig gelähmte Ziel und wähle die Option im Dropdown-Menü. Gehe genauso vor, um die Markierung wieder zu entfernen.",,"Jeśli chcesz mieć pewność, że schwytany zostanie Pandoranin o niższej wartości, kliknij w pełni sparaliżowanego przeciwnika i wybierz tę opcję z rozwijanego menu. W ten sam sposób usuwa się oznaczenie.","Если вы хотите, чтобы в плен попал менее ценный Пандоран, щелкните по полностью парализованному Пандорану левой кнопкой мыши и выберите его в появившемся меню. Сделайте то же самое, чтобы снять метку погрузки.","Si quieres asegurarte de que un Pandora de poco valor sea capturado, pincha sobre él y elige la opción en el menú desplegable. Haz lo mismo para revertirlo.",
TFTV_TIP_GEOSCAPE_24,Text,,Scyllas are big! You will need a special module to capture them.,,Les Scyllas sont énormes ! Vous aurez besoin d’un module spécial pour les capturer.,"Scyllas sind riesig! Du brauchst ein spezielles Modul, um sie gefangen zu nehmen.",,Scylle są wielkie! Do ich pojmania potrzebujesz specjalnego modułu.,Сциллы очень большие! Для их перевозки вам понадобится специальный модуль.,¡Las scyllas son grandees! Necesitarás un módulo especial para capturarlas.,
TFTV_TIP_GEOSCAPE_25,Text,,"If you have a Mutation Lab, captured Pandorans will generate Mutagens every hour. Each Mutation Lab can generate up to 50 Mutagens per day.",,"Si vous possédez un Laboratoire de Mutations, les Pandoriens capturés produiront des Mutagènes toutes les heures. Chaque Laboratoire de Mutations peut générer jusqu’à 50 Mutagènes par jour.","Besitzt du ein Mutationslabor, produzieren gefangene Pandoraner stündlich Mutagene. Jedes Mutationslabor kann bis zu 50 Mutagene pro Tag erzeugen.",,"Jeśli masz Laboratorium Mutacji, schwytani Pandoranie będą generować mutageny co godzinę. Każde laboratorium może wytworzyć do 50 mutagenów dziennie.","Если у вас построена «Лаборатория Мутаций», из захваченных Пандоранов будут добываться мутагены каждый час. Каждая «Лаборатория Мутаций» может добыть до 50 мутагенов в день.","Si tienes un Laboratorio de Mutaciones, los Pandoras capturados generarán Mutágenos cada hora. Cada Laboratorio de Mutaciones pueden generar has 50 mutágenos cada día.",
TFTV_TIP_GEOSCAPE_26,Text,,"If you have a Food Production facility you can process captured Pandorans, turning them into food. Each of these facilities can process 50 units of Pandoran meat per day.",,"Si vous possédez une installation de Production Alimentaire, vous pouvez transformer les Pandoriens capturés en nourriture. Chacune de ces installations peut traiter 50 unités de viande pandorienne par jour.","Ist eine Nahrungsproduktion vorhanden, können gefangene Pandoraner zu Nahrung verarbeitet werden. Jede dieser Anlagen verarbeitet täglich 50 Einheiten Pandoranerfleisch.",,"Jeśli masz obiekt Produkcji Żywności, możesz przetwarzać schwytanych Pandoran na żywność. Każdy taki obiekt może przerobić 50 jednostek pandorańskiego mięsa dziennie.","Если у вас построен «Пищевой Комбинат», вы можете перерабатывать захваченных Пандоранов, превращая их в еду. Каждый из этих комбинатов может перерабатывать до 50 единиц Пандоранского мяса в день.","Si tienes una Instalción de Producción Comida puedes procesar Pandoras capturados, convirtiéndolos en comida. Cada una de estas instalaciones puede procesar 50 unidadees de carne Pandora cada día.",
TFTV_TIP_GEOSCAPE_27,Text,,Do you recall the legend of Fort Bacon?,,Te souviens‑tu de la légende du Fort Bacon ?,Erinnerst du dich an die Legende von Fort Bacon?,,Pamiętasz legendę Fortu Bacon?,"Помните ли вы легенду о Форте «Бекон»? Это небылица, миф о пост-апокалипсисе, распространенный среди наших солдат. В ней рассказывается об убежище, где люди нашли способ безопасно есть Пандоранов... которые, если верить сообщениям, и в самом деле имеют вкус бекона.",¿Recuerdas la leyenda de Fort Bacon?,
TFTV_TIP_GEOSCAPE_28,Text,,Containment facilities housing captured Pandoran life forms are perfectly secure. You have absolutely nothing to worry about.,,Les installations de contention abritant des formes de vie pandoriennes capturées sont parfaitement sécurisées. Vous n’avez absolument rien à craindre.,"Eindämmungsanlagen, die gefangene pandoranische Lebensformen beherbergen, sind vollkommen sicher. Du hast absolut nichts zu befürchten.",,Ośrodki przetrzymywania przechowujące schwytane pandorańskie formy życia są całkowicie bezpieczne. Nie masz absolutnie czym się martwić.,"Изоляторы, в которых содержатся захваченные Пандоранские формы жизни, абсолютно надежны. Вам совершенно не о чем беспокоиться!",Las Instalaciones de Contención que tengan Pandoras capturados son perfectamente seguras. No tienes nada de lo que preocuparte.,
TFTV_TIP_GEOSCAPE_29,Text,,Project Cornucopia is made of fishpeople! It’s made of fishpeople!,,Le Projet Cornucopia est peuplé d'Homme‑poissons ! Il est peuplé d'Homme‑poissons !,Projekt Cornucopia besteht aus Fischmenschen! Es besteht aus Fischmenschen!,,Project Cornucopia jest zrobiony z ryboludzi! Jest zrobiony z ryboludzi!,Проект «Рог изобилия» сделан из рыболюдей! Из рыбо-людей!,¡El Proyecto Cornucopia está hecho de hombres pez! ¡Está hecho de personas pescados!,
TFTV_TIP_GEOSCAPE_30,Text,,There are no known health risks associated with consuming nutrients derived from our autonomous Food Production facilities.,,Aucun risque sanitaire n’a été identifié concernant la consommation de nutriments provenant de nos installations autonomes de Production Alimentaire.,Der Verzehr von Nährstoffen aus unserer autonomen Nahrungsproduktion ist mit keinerlei bekannten Gesundheitsrisiken verbunden.,,Nie są znane żadne zagrożenia zdrowotne związane ze spożywaniem składników odżywczych pochodzących z naszych autonomicznych obiektów Produkcji Żywności.,"Не существует никаких известных рисков для здоровья, связанных с потреблением питательных веществ, полученных на наших автономных «Пищевых Комбинатах».",No se conocen riesgos para la salud asociados con el consumo de nutrientes derivados de nuestras instalaciones autónomas de producción de alimentos.,
TFTV_TIP_GEOSCAPE_31,Text,,"If your system, or you, are struggling with the Mist from the More Mist Void Omen, you can turn it off in the Mod settings.",,"Si votre système, ou vous-même, êtes gêné par la Brume liée à l'Influence du Néant « Plus de Brume », vous pouvez la désactiver dans les paramètres du mod.","Sollte der zusätzliche Nebel die Systemleistung beeinträchtigen oder dich stören, kannst du SPIELE MIT MEHR NEBEL „OMEN DER LEERE“ in den Mod-Einstellungen deaktivieren.",,"Jeśli twój sprzęt, albo ty, źle znosicie Mgłę z Znaku Pustki Więcej Mgły, możesz wyłączyć ją w ustawieniach moda.","Если ваш компьютер или вы сами испытываете трудности с Туманом от Знамения Пустоты «БОЛЬШЕ ТУМАНА», вы можете отключить его в настройках мода.","Si tu sistema, o tú, tienen problemas con la Niebla por el “More Mist Void Omen”, puedes desactivarlo en el Mod settings.",
TFTV_TIP_GEOSCAPE_32,Text,,"If the Limited Deployment Void Omen is too much for you, you can turn it off on new game start or in Mod settings.",,"Si l'Influence du Néant « Déploiement Limité » est trop contraignant, vous pouvez le désactiver au début d’une nouvelle partie ou dans les paramètres du mod.","Wenn dich das EINSATZTEAMLIMIT BEI „OMEN DER LEERE“ zu stark einschränkt, deaktiviere es einfach beim Spielstart oder in den Einstellungen.",,"Jeśli Znak Pustki Ograniczone Rozmieszczenie jest dla ciebie zbyt uciążliwy, możesz wyłączyć go przy starcie nowej gry albo w ustawieniach moda.","Если уменьшение отряда на 2 в тактических миссиях при Знамении Пустоты «-2 БОЙЦА В ОТРЯДЕ» вам не очень нравится, вы можете отключить его при новом прохождении игры или в настройках мода.","Si el Despliegue limitado de Augurios del Vacío es demasiado para ti, puedes desactivarlos al empezar una partida o en Mod settings.",
TFTV_TIP_GEOSCAPE_33,Text,,You don't need an aircraft at the Bazaar to buy things! We deliver!,,Vous n’avez pas besoin d’un appareil au Bazar pour acheter des objets ! Nous livrons !,Zum Einkaufen auf dem Basar brauchst du kein eigenes Fluggerät. Wir liefern!,,"Nie potrzebujesz statku w Bazarze, żeby coś kupić! Dostarczamy!","Чтобы купить что-то на Рынке, вам не нужен самолет! Используйте доставку!",¡No necesitas una aeronave en el Bazar para comprar cosas! ¡Hacemos envíos!,
TFTV_TIP_GEOSCAPE_34,Text,,Mercenaries refuse to be augmented or mutated.,,Les mercenaires refusent toute augmentation ou mutation.,"Söldner weigern sich, augmentiert oder mutiert zu werden.",,Najemnicy odmawiają augmentacji i mutacji.,Наемники будут отказываться от аугментаций и мутаций.,Los Mercenarios se niegan a los aumentos y mutaciones.,
KEY_TACTICAL_LOADING_TIP_4_TFTV,Text,,The Berserker's Dash ability allows a soldier to move up to half its movement range for 1 Action Point.,,La capacité Charge du Berserker permet à une unité de se déplacer jusqu’à la moitié de sa portée de mouvement pour 1 point d’action.,"Die Fähigkeit „Sprint“ erlaubt es einer Einheit, sich für 1 Aktionspunkt bis zur Hälfte ihrer Bewegungsreichweite zu bewegen.",,Umiejętność Szarża Berserkera pozwala żołnierzowi przemieścić się na odległość do połowy zasięgu ruchu za 1 Punkt Akcji.,Способность Берсерка «Рывок» позволяет бойцу переместиться на половину своей дальности передвижения за 1 Очко Действий.,La habilidad Carrera del Berserker permite a un soldado moverse hasta la mitad de su rango de movimiento por 1 Punto de Acción.,
