Key,Type,Desc,English,Chinese (Simplified),French,German,Italian,Polish,Russian,Spanish,UI_Tester
TFTV_LORE_ALISTAIR_TITLE,Text,,Alistair Ashby,,Alistair Ashby,Alistair Ashby,,Alistair Ashby,Алистер Эшби,Alistair Ashby,
TFTV_LORE_ALISTAIR_DESCRIPTION,Text,,"Sometimes Alistair thought that the transformative effect of the Pandoravirus on him could not have been greater had he actually been infected with it.

Alistair went from a youthful college-dropout influencer to a bona fide expert, all by taking the first Mist stories seriously, while the rest of the media still considered them fake news. He grasped the significance of what was happening earlier and better than anyone else. He anticipated the Third World War and its consequences, including the rise of the highly polarized and ideologically charged factions, and the demise of race, wealth, nationality and family prestige as relevant sociological factors.

“We are mistaken about the coming Apocalypse. It’s not about extinction or survival. It’s about our place in the new food chain.”

The Pandoravirus also brought Alistair into contact with the child prodigy Olena Kim. They ran into each other more than two decades ago and have been inseparable ever since, to the extent that Alistair now considers himself her oppa (older brother).

The connection - if any - between Alistair and Phoenix Project remains a mystery, but it seems like he knew Randolph Symes III personally.",,"Parfois, Alistair pensait que l'effet du Pandoravirus sur lui ne pouvait être pire, en supposant qu'il était réellement infecté.

Alistair est passé du statut de jeune influenceur ayant abandonné ses études à celui de véritable expert, simplement en prenant au sérieux les premiers récits sur la Brume, alors que le reste des médias les considérait encore comme des fake news. Il a saisi l'importance de ce qui se passait plus tôt et mieux que quiconque. Il a anticipé la Troisième Guerre mondiale et ses conséquences, notamment l'émergence de factions très différentes et chargées d'idéologies, ainsi que la fin de la race, de la richesse, de la nationalité et du prestige familial en tant que facteurs sociologiques pertinents.

« Nous nous trompons sur l'Apocalypse à venir. Il ne s'agit pas d'extinction ou de survie. Il s'agit de notre place dans la nouvelle chaîne alimentaire. »

Le Pandoravirus a également mis Alistair en contact avec l'enfant prodige Olena Kim. Ils se sont rencontrés il y a plus de deux décennies et sont inséparables depuis, à tel point qu'Alistair se considère désormais comme son oppa (grand frère).

Le lien — s'il existe — entre Alistair et le Projet Phénix reste un mystère, mais il semble qu'il ait connu Randolph Symes III personnellement.","Manchmal dachte Alistair, die verändernde Wirkung des Pandoravirus auf ihn hätte kaum größer sein können – selbst wenn er tatsächlich damit infiziert worden wäre.

Alistair wandelte sich vom jungen College-Abbrecher-Influencer zu einem echten Experten – nur weil er die ersten Geschichten vom Nebel ernst nahm, während der Rest der Medien sie noch als Fake News abtat. Er begriff die Tragweite der Ereignisse früher und besser als alle anderen. Er sagte den Dritten Weltkrieg und seine Folgen voraus, darunter den Aufstieg der stark polarisierten und ideologisch aufgeladenen Fraktionen und den Bedeutungsverlust von Rasse, Reichtum, Nationalität und Familienprestige als soziologische Faktoren.

<i>„Wir irren uns, was die kommende Apokalypse angeht. Es geht nicht um Aussterben oder Überleben. Es geht um unseren Platz in der neuen Nahrungskette.“</i>

Das Pandoravirus brachte Alistair auch mit dem Wunderkind Olena Kim in Kontakt. Sie begegneten sich vor über zwei Jahrzehnten und sind seitdem unzertrennlich, so sehr, dass Alistair sich mittlerweile als ihren Oppa (großen Bruder) betrachtet.

Welche Verbindung – wenn überhaupt – zwischen Alistair und dem Phoenix-Projekt besteht, bleibt ein Rätsel, aber es wirkt, als hätte er Randolph Symes III. persönlich gekannt.",,"Czasami Alistair myślał, że wpływ Pandorawirusa na jego przemianę nie mógłby być większy nawet wtedy, gdyby sam został nim zakażony.

Alistair przeszedł drogę od młodego influencera, który porzucił studia, do prawdziwego eksperta, wyłącznie dlatego, że potraktował pierwsze historie o Mgle poważnie, podczas gdy reszta mediów wciąż uważała je za fake newsy. Zrozumiał wagę tego, co się dzieje, wcześniej i trafniej niż ktokolwiek inny. Przewidział trzecią wojnę światową i jej konsekwencje, w tym wzrost skrajnie spolaryzowanych i ideologicznie naładowanych frakcji oraz upadek rasy, bogactwa, narodowości i prestiżu rodzinnego jako istotnych czynników socjologicznych.

„Mylimy się co do nadchodzącej Apokalipsy. Nie chodzi o wymarcie ani przetrwanie. Chodzi o nasze miejsce w nowym łańcuchu pokarmowym.”

Pandorawirus doprowadził też Alistaira do spotkania z cudownym dzieckiem, Oleną Kim. Wpadli na siebie ponad dwie dekady temu i od tamtej pory są nierozłączni, do tego stopnia, że Alistair uważa się dziś za jej oppę (starszego brata).

Związek - jeśli w ogóle istnieje - między Alistairem a Projektem Phoenix pozostaje tajemnicą, ale wygląda na to, że znał osobiście Randolpha Symesa III.","Иногда Алистеру кажется, что влияние Пандоравируса на него не стало бы сильнее, даже если бы он им заразился.

Алистер прошел путь от молодого дуралея, бросившего колледж, до настоящего гуру, и все потому, что серьезно отнесся к первым сообщениям о Тумане, пока все СМИ все еще считали их фэйками. Он понял значение происходящего раньше и лучше, чем кто-либо другой. Он предвидел Третью мировую войну и ее последствия, включая появление ультра поляризованных и идеологически чуждых друг другу фракций, а также исчезновение рас, богатств, национальностей и семейных ценностей как значимых социологических факторов.

«Мы заблуждаемся относительно грядущего Апокалипсиса. Речь идет не о вымирании или выживании. Речь идет о нашем месте в новой пищевой цепи».

Также из-за Пандоравируса Алистер сошелся с ребенком-вундеркиндом Аленой Ким. Они встретились более двадцати лет назад и с тех пор неразлучны до такой степени, что Алистер считает себя ее старшим братом.

Связь между Алистером и Проектом Феникс остается загадкой, но, похоже, он был лично знаком с Рэндольфом Саймсом 3-м.","A veces, Alistair pensaba que el efecto transformador del Pandoravirus en él no podría haber sido mayor si realmente se hubiera infectado.

Alistair pasó de ser un joven influencer que abandonó la universidad a un experto de verdad, todo por tomarse en serio las primeras historias de la Niebla, mientras que el resto de los medios aún las consideraban paparruchas. Comprendió la importancia de lo que estaba sucediendo antes y mejor que nadie. Anticipó la Tercera Guerra Mundial y sus consecuencias, incluyendo el auge de las facciones altamente polarizadas e ideológicamente cargadas, y la desaparición de la raza, la riqueza, la nacionalidad y el prestigio familiar como factores sociológicos relevantes.

“Nos equivocamos sobre el Apocalipsis que se avecina. No se trata de extinción ni de supervivencia. Se trata de nuestro lugar en la nueva cadena alimentaria”.

El Pandoravirus también puso a Alistair en contacto con la niña prodigio Olena Kim. Se conocieron hace más de dos décadas y han sido inseparables desde entonces, hasta el punto de que Alistair ahora se considera su oppa (hermano mayor).

La conexión, si la hay, entre Alistair y el Proyecto Fénix sigue siendo un misterio, pero parece que conocía personalmente a Randolph Symes III.",
TFTV_LORE_OLENA_TITLE,Text,,Olena Kim,,Olena Kim,Olena Kim,,Olena Kim,Алена Ким,Olena Kim,
TFTV_LORE_OLENA_DESCRIPTION,Text,,"Olena was born in Odesa to a Korean father and a Ukrainian mother, both renowned scholars in archaeology and anthropology. They traveled around the world with their daughter, exposing her to different cultures and languages. A prodigy, Olena bears the imprint of a program for the gifted: an alien within her own species.

She lost her parents during the First Mist. When Alistair Ashby and his band of refugees found her, she was another shell shocked child. In time, he became her friend and confidant, one of the few people who understood her.

Olena never talks about her past unless asked directly. She prefers to focus on the present and future challenges. She is loyal to Alistair and respects his judgment, particularly as to people. She is curious about the various factions but wary of their intentions or agendas.",,"Olena est née à Odesa d’un père coréen et d’une mère ukrainienne, tous deux éminents chercheurs en archéologie et en anthropologie. Ils ont voyagé autour du monde avec leur fille, la confrontant à différentes cultures et langues. Prodige, Olena porte l’empreinte d’un programme pour enfants surdoués : une étrangère au sein de sa propre espèce.

Elle perdit ses parents lors de la Première Brume. Lorsque Alistair Ashby et sa bande de réfugiés la trouvèrent, elle n’était qu’un enfant traumatisé. Avec le temps, il devint son ami et confident, l’une des rares personnes à vraiment la comprendre.

Olena ne parle jamais de son passé à moins d’être interrogée directement. Elle préfère se concentrer sur les défis du présent et de l’avenir. Elle est loyale envers Alistair et respecte son jugement, notamment en ce qui concerne les gens. Elle s’intéresse aux différentes factions, mais reste méfiante quant à leurs intentions ou leurs agendas.","Olena wurde in Odessa als Tochter eines koreanischen Vaters und einer ukrainischen Mutter geboren, beides angesehene Archäologen und Anthropologen. Sie bereisten mit ihrer Tochter die Welt und ließen sie verschiedene Kulturen und Sprachen kennenlernen. Als Wunderkind trug Olena die Spuren eines Förderprogramms für Hochbegabte: eine Außenseiterin innerhalb ihrer eigenen Spezies.

Sie verlor ihre Eltern während des Ersten Nebels. Als Alistair Ashby und seine Gruppe von Flüchtlingen sie fanden, war sie ein weiteres traumatisiertes Kind. Mit der Zeit wurde er ihr Freund und Vertrauter, einer der wenigen Menschen, die sie verstanden.

Olena spricht nie über ihre Vergangenheit, es sei denn, sie wird direkt danach gefragt. Sie konzentriert sich lieber auf die Gegenwart und die Herausforderungen der Zukunft. Sie ist Alistair treu ergeben und respektiert sein Urteilsvermögen, insbesondere in Bezug auf Menschen. Sie ist neugierig auf die verschiedenen Fraktionen, aber misstraut deren Absichten und Zielen.",,"Olena urodziła się w Odessie. Jej ojciec był Koreańczykiem, a matka Ukrainką; oboje byli cenionymi badaczami archeologii i antropologii. Podróżowali po całym świecie razem z córką, wystawiając ją na wpływ różnych kultur i języków. Cudowne dziecko, Olena nosi na sobie piętno programów dla wybitnie uzdolnionych: obcego we własnym gatunku.

Straciła rodziców podczas Pierwszej Mgły. Gdy Alistair Ashby i jego grupa uchodźców ją odnaleźli, była kolejnym dzieckiem w stanie szoku pourazowego. Z czasem został jej przyjacielem i powiernikiem, jednym z niewielu ludzi, którzy naprawdę ją rozumieli.

Olena nigdy nie mówi o swojej przeszłości, jeśli nie zostanie o nią zapytana wprost. Woli skupiać się na teraźniejszych i przyszłych wyzwaniach. Jest lojalna wobec Alistaira i ufa jego osądowi, zwłaszcza w sprawach dotyczących ludzi. Ciekawią ją różne frakcje, ale podchodzi z rezerwą do ich intencji i planów.","Алена родилась в Одессе в семье отца-корейца и матери-украинки, известных ученых в области археологии и антропологии. Они путешествовали с дочерью по всему миру, приобщая ее к разным культурам и языкам. Будучи вундеркиндом, Алена несет на себе отпечаток своего дара: чуждая своему собственному виду.

Она потеряла родителей во время Первого Тумана. Когда Алистер Эшби и его группа беженцев нашли ее, она была еще одним потрясенным ребенком. Со временем он стал ее другом и доверенным лицом, одним из немногих, кто ее понимал.

Алена никогда не говорит о своем прошлом, если ее не спрашивают напрямую. Она предпочитает сосредоточиться на настоящем и будущих проблемах. Она верна Алистеру и уважает его суждения, особенно в отношении людей. Она интересуется различными фракциями, но с опаской относится к их намерениям и планам.","Olena nació en Odesa con padre coreano y madre ucraniana, ambos prestigiosos en el campo de la arqueología y antropología. Viajaron por el mundo con su hija, exponiéndola a culturas y lenguas foráneas. Una prodigia, Olena lleva la imprenta de un programa para superdotados: un alienígena dentro de su propia especie.

Perdió a sus padres durante la Primera Niebla. Cuando Alistair Ashby y su banda de refugiados la encontraron, era otra niña asustada. Con el tiempo, él se convirtió en amigo y confidente, uno de los pocos que la entendía.

Olena nunca habla sobre su pasado a menos que se le pregunte directamente. Prefiere centrarse en el presente y los desafíos del futuro. Es leal a Alistair y respeta su juicio, particularmente hacia la gente. Es curiosa sobre las facciones pero le preocupan sus intenciones.",
TFTV_LORE_HELENA_TITLE,Text,,Helena Lewandowski,,Helena Lewandowski,Dr. Helena Lewandowski,,Helena Lewandowski,Хелена Левандовски,Helena Lewandowski,
TFTV_LORE_HELAN_DESCRIPTION,Text,,"Helena Lewandowski was born in Warsaw, Poland, in 1993. She had a passion for history and archaeology since she was a child, and pursued her studies at the University of Warsaw. She became one of the world’s leading experts on prehistoric cultures and civilizations, especially those that existed before the last ice age. 

In 2019, she joined Project Glory, a secretive attempt to study the nature of enigmatic ruins that predated Homo Sapiens. Project Glory was funded by the Phoenix Project and Vanadium Inc., and was led by Dr. Randolph Symes III, the director of the Phoenix Project at that time.

However, Dr. Symes did not share her enthusiasm or vision. Helena left Project Glory and joined Vanadium Inc., where she continued her research under the supervision of Tobias West, the CEO of Vanadium Inc. In 2022, when the Pandora virus began to spread across the globe, Helena uncovered evidence of an ancient civilization that had advanced technology and knowledge beyond anything known to modern humans. She contacted West and told him about her breakthrough.

However, West suddenly shut down Project Glory and ordered Helena to return to New Jericho’s headquarters. She was later transferred to a prison facility, where she remained until rescued by the Phoenix Project. ",,"Helena Lewandowski est née à Varsovie, en Pologne, en 1993. Passionnée d’histoire et d’archéologie depuis l’enfance, elle a poursuivi ses études à l’Université de Varsovie. Elle est devenue l’une des principales expertes mondiales des cultures et civilisations préhistoriques, en particulier celles ayant existé avant la dernière période glaciaire.

En 2019, elle a rejoint le Projet Gloire, une initiative secrète visant à étudier la nature de ruines énigmatiques datant d’avant l’Homo Sapiens. Le Projet Gloire était financé par le Projet Phénix et Vanadium Inc., et dirigé par le Dr Randolph Symes III, alors directeur du Projet Phénix.

Cependant, le Dr Symes ne partageait ni son enthousiasme ni sa vision. Helena quitta le Projet Gloire et rejoignit Vanadium Inc., où elle poursuivit ses recherches sous la supervision de Tobias West, PDG de Vanadium Inc. En 2022, lorsque le virus Pandora commença à se répandre dans le monde, Helena découvrit des preuves d’une civilisation ancienne possédant une technologie et des connaissances dépassant tout ce que l’humanité moderne connaissait. Elle contacta West pour lui annoncer sa percée.

Cependant, West ferma soudainement le Projet Gloire et ordonna à Helena de retourner au quartier général de la Nouvelle-Jéricho. Elle fut ensuite transférée dans un établissement pénitentiaire, où elle resta jusqu’à ce qu’elle soit secourue par le Projet Phénix.","Dr. Helena Lewandowski wurde 1993 in Warschau, Polen, geboren. Schon als Kind begeisterte sie sich für Geschichte und Archäologie und studierte an der Universität Warschau. Sie zählt zu den weltweit führenden Expertinnen für prähistorische Kulturen und Zivilisationen, insbesondere jener, die vor der letzten Eiszeit existierten.

2019 schloss sie sich dem Projekt Herrlichkeit an, einem geheimnisvollen Vorhaben zur Erforschung rätselhafter Ruinen aus der Zeit vor dem Homo sapiens. Das Projekt Herrlichkeit wurde vom Phoenix-Projekt und Vanadium Inc. finanziert und von Dr. Randolph Symes III., dem damaligen Direktor des Phoenix-Projekts, geleitet.

Dr. Symes teilte jedoch weder ihre Begeisterung noch ihre Vision. Helena verließ Projekt Herrlichkeit und schloss sich Vanadium Inc. an, wo sie ihre Forschung unter der Aufsicht von Tobias West, dem CEO von Vanadium Inc., fortsetzte. Als sich 2022 das Pandoravirus weltweit auszubreiten begann, stieß Helena auf Beweise für eine uralte Zivilisation, deren Technologie und Wissen alles übertrafen, was der modernen Menschheit bekannt war. Sie kontaktierte West und informierte ihn über ihren Durchbruch.

Doch plötzlich stellte West Projekt Herrlichkeit ein und befahl Helena, zum Hauptquartier von Neu-Jericho zurückzukehren. Später wurde sie in eine Haftanstalt verlegt, wo sie bis zu ihrer Befreiung durch das Phoenix-Projekt inhaftiert blieb.",,"Helena Lewandowski urodziła się w Warszawie w Polsce w 1993 roku. Od dziecka pasjonowała się historią i archeologią, a później podjęła studia na Uniwersytecie Warszawskim. Stała się jedną z czołowych światowych ekspertek od kultur i cywilizacji prehistorycznych, szczególnie tych, które istniały przed ostatnią epoką lodowcową.

W 2019 roku dołączyła do Projektu Glory, tajnego przedsięwzięcia badającego naturę zagadkowych ruin starszych niż Homo sapiens. Projekt Glory był finansowany przez Projekt Phoenix i Vanadium Inc., a kierował nim dr Randolph Symes III, ówczesny dyrektor Projektu Phoenix.

Dr Symes nie podzielał jednak jej entuzjazmu ani wizji. Helena opuściła Projekt Glory i dołączyła do Vanadium Inc., gdzie kontynuowała badania pod nadzorem Tobiasa Westa, prezesa Vanadium Inc. W 2022 roku, gdy Pandorawirus zaczął rozprzestrzeniać się po całym świecie, Helena odkryła dowody istnienia starożytnej cywilizacji posiadającej technologię i wiedzę przewyższające wszystko, co było znane współczesnym ludziom. Skontaktowała się z Westem i opowiedziała mu o swoim przełomie.

West nagle jednak zamknął Projekt Glory i nakazał Helenie powrót do kwatery głównej Nowego Jerycha. Później została przeniesiona do zakładu więziennego, gdzie przebywała aż do chwili, gdy uratował ją Projekt Phoenix.","Хелена Левандовски родилась в Варшаве, Польша, в 1993 году. Она с детства увлекалась историей и археологией и продолжила обучение в Варшавском университете. Она стала одним из ведущих мировых экспертов по доисторическим культурам и цивилизациям, особенно тем, которые существовали до последнего ледникового периода. 

В 2019 году она присоединилась к проекту «Слава» - тайной попытке изучить природу загадочных руин, существовавших еще до появления человечества. Проект «Слава» под руководством Рэндольфа Саймса 3-его, директора Проекта Феникс на тот момент, финансировался Проектом Феникс и корпорацией Ванадий.

Однако доктор Саймс не разделял ее энтузиазм и идеи. Хелена покинула проект «Слава» и присоединилась к корпорации Ванадий, где продолжила свои исследования под руководством Тобиаса Уэста, генерального директора. В 2022 году, когда Пандоравирус начал распространяться по всему миру, Хелена обнаружила свидетельства существования древней цивилизации, которая обладала технологиями и знаниями, превосходящими все, что известно современным людям. Она связалась с Уэстом и рассказала ему о своем открытии.

Однако Уэст внезапно закрыл проект «Слава» и приказал Хелене вернуться в штаб-квартиру Нового Иерихона. Позже ее перевели в тюрьму, где она оставалась до тех пор, пока ее не спасла команда Проекта Феникс.","Helena Lewandowski nació en Varsovia, Polonia, en 1993. Era apasionada de la historia y arquología desde pequeña, y siguió sus etudios en la universidad de Varsovia. Se convirtió en experta en culturas y civilizaciones prehistóricas , especialmente las anteriores a la última edad de hielo.

En 2019, se unió al Proyecto Gloria, un intento de estudiar las enigmáticas ruinas anteriores al Homo Sapiens. El Proyecto Gloria fue fundado por Phoenix Project y Vanadio Inc., y fue liderado por el Dr. Randolph Symes III, el director del Proyecto Phoenix Project de aquel momento.

Sin embargo, el dr. Symes no compartía su entusiasmo o visión. Helena dejó el Proyecto Gloria y se unió a Vanadio Inc., donde continuó su investigación bajo la supervisión de Tobias West, el CEO de Vanadio Inc. En 2022, cuando el Pandoravirus empezó a extenderse por el mundo, Helena descubrió pruebas de una civilización antigua que poseía tecnología avanzada y conocimiento más allá de nuestro entendimiento. Ella contactó a West y compartió con él su descubrimiento.

Sin motivo aparente, West tumbó el Proyecto Gloria y ordenó a Helena volver a Nuevo Jericó. Luego fue encarcelada y estuvo presa hasta que fue rescatada por el Proyecto Phoenix. ",
TFTV_LORE_BENNU_TITLE,Text,,Bennu,,Bennu,Bennu,,Bennu,Бенну,Bennu,
