Key,Type,Desc,English,Chinese (Simplified),French,German,Italian,Polish,Russian,Spanish,UI_Tester
VOID_OMEN_DESCRIPTION_TEXT_02,Text,,"<i>""We are losing our moral compass, if we ever had one.""</i> ",,,,,,,,
VOID_OMEN_DESCRIPTION_TEXT_03,Text,,"<i>""It's a waking nightmare. Can you get used to nightmares?""</i> ",,,,,,,,
VOID_OMEN_DESCRIPTION_TEXT_04,Text,,"<i>""Have you seen the latest psych-evals? 'Trust issues' is putting it mildly: they can start shooting each other any minute. If you want my advice, keep the combat units small, at least for a while.""</i>",,,,,,,,
VOID_OMEN_DESCRIPTION_TEXT_05,Text,,"<i>""They went Paranoid cuckoo! They think we are not there to defend them, but to take their stuff. Honestly, I think we should, just to teach them a lesson.""</i>",,,,,,,,
VOID_OMEN_DESCRIPTION_TEXT_06,Text,,"<i> ""What did you expect? They too are capable of learning from their mistakes.""</i>",,,,,,,,
VOID_OMEN_DESCRIPTION_TEXT_07,Text,,"<i> ""It has nothing to do with meteorology. We know nothing about the Mist: why it moves, where to, why there is so much more of it all of a sudden. Yes, as a ""Mist Expert"" I admit I'm a fraud."" </i>",,,,,,,,
VOID_OMEN_DESCRIPTION_TEXT_08,Text,,"<i> ""Them and us, we can't help but see the world that way. Odd how sometimes that peaks and we forget that we are all part of the same species. A species that is currently facing extinction.""</i>",,,,,,,,
VOID_OMEN_DESCRIPTION_TEXT_09,Text,,"<i> ""I would say they are off the leash now, but, if so, who was holding it?""</i>",,,,,,,,
VOID_OMEN_DESCRIPTION_TEXT_10,Text,,<i>I can't wake up I can't wake up I can't wake up <b> I CAN'T WAKE UP</b></i>,,,,,,,,
VOID_OMEN_DESCRIPTION_TEXT_11,Text,,<i>It just won't quit</i>,,,,,,,,
VOID_OMEN_DESCRIPTION_TEXT_12,Text,,<i>They are throwing everything they have at us</i>,,,,,,,,
VOID_OMEN_DESCRIPTION_TEXT_13,Text,,"<i>""Look, the Pandron Colonies don't just happen… They follow some pattern; I can't tell you what it is because we don't understand it… yet. But I can tell you that something has changed. </i>",,,,,,,,
VOID_OMEN_DESCRIPTION_TEXT_14,Text,,"<i>Have you noticed how things look less substantial these days? Like they were covered in fog, or made of cotton candy. Maybe it's just me.</i>",,,,,,,,
VOID_OMEN_DESCRIPTION_TEXT_15,Text,,"<i>""Our people are seeing <b>more</b> oil monsters in the field. I look forward to the strict adherents of the scientific method explaining this away as our operatives going <b>more</b> crazy.""</i>",,,,,,,,
VOID_OMEN_DESCRIPTION_TEXT_16,Text,,<i>It just isn't fair! Demons are supposed to follow rules too!</i>,,,,,,,,
VOID_OMEN_DESCRIPTION_TEXT_17,Text,,<i>What if this is their end game? To turn us all into the puppets of an alien intelligence?</i>,,,,,,,,
VOID_OMEN_INTRO,Text,,"We believe we are observing the first effects of the Oneiric Delirium on a collective scale. The phenomenon is akin to mass hysteria. 

Synedrion psycho-sociologists are rationalizing the documented instances of widespread psychosis as the result of stresses to which our communities are subjected when our species is facing the possibility of extinction. 

However, the global scale and eerie thematic homogeneity of these events suggests a different causal relationship. 

Given what we know about the Oneiric Delirium and its connection to the Mist, there is little room for doubt: our collective psyche has become another battleground in our struggle with the Pandoravirus.",,,,,,,,
VOID_OMEN_INTRO_TITLE,Text,,Omens of the Void,,,,,,,,
ALN_CRABMANUMBRA_RESEARCHDEF_COMPLETE,Text,,"""What are they? You ask me, but I do not know; there is nothing in them to sequence. Perhaps you should talk to Martika the Priest... These 'purple shadows' our warriors speak of sound like her field of expertise.""

- Kalus, a Disciple gene-smith

""Our soldiers are under immense stress, not to mention the drug cocktail and direct cortical stimulation administered to them on a constant basis. If one or two of them start seeing 'oil monsters', I say it's a tolerable side effect"". 

- Dr. Abongameli Smith, New Jericho",,,,,,,,
ALN_CRABMANUMBRA_RESEARCHDEF_NAME,Text,,ARTHRON UMBRA,,,,,,,,
ALN_FISHMANUMBRA_RESEARCHDEF_COMPLETE,Text,,"""It grew from the fishman’s pool of blood in the ground... Like water from a spigot... flowing in reverse. I shot it! We all shot it, we emptied our mags into the fragging thing!... Then it just melted... There was nothing left... I don't know what got the rest of the squad, maybe there was more of... those things, maybe it was the regular crabbies. I lost it, I ran away, never looking back.""

- Citizen Brackman, sole survivor of recon team Echo, Synedrion 

""Oh, but the Umbra are quite real, I assure you. Why wouldn't they be, when we live in the age of horrors?"" 

- Alistair Ashby, Phoenix Project",,,,,,,,
ALN_FISHMANUMBRA_RESEARCHDEF_NAME,Text,,TRITON UMBRA,,,,,,,,
BG_INTRO_0_TITLE,Text,,A Cold Reboot,,,,,,,,
BG_INTRO_0_DESCRIPTION,Text,,"After all these years, you finally got the call. It meant that Symes and his deputies were dead or unreachable. Phoenix Project had gone dark. 

The trek to Phoenix Point was long and dangerous, but when you reached it, somebody was already home...",,,,,,,,
BG_INTRO_1_TITLE,Text,,Homecoming,,,,,,,,
BG_INTRO_1_DESCRIPTION,Text,,"I'm Alistair Ashby. Yes, the ""Mist Expert"". Thanks for watching me back in the day, I guess... 

A few of us managed to get to this bunker and activate the emergency beacon before we were overrun by the creatures that followed us here. 

We got this place mostly up and running... Thanks to Olena, she is quite the wunderkind.",,,,,,,,
BG_INTRO_2_TITLE,Text,,Olena Kim,,,,,,,,
BG_INTRO_2_DESCRIPTION,Text,,"<i>Oppa</i> Alistair is good with people. I'm good with machines and software. This facility runs on a limited AI called Bennu. Once Bennu verifies your credentials as duly appointed Director, all functionality should be restored and you should be able to interface with the system. ",,,,,,,,
BG_INTRO_2_CHOICE_0,Text,,Identify yourself and present your credentials ,,,,,,,,
KEY_MISSION_HAVEN_INFESTED_VICTORY_NAME,Text,,MISSION COMPLETE,,,,,,,,
KEY_MISSION_HAVEN_INFESTED_VICTORY_DESCRIPTION,Text,,NODE DESTROYED,,,,,,,,
KEY_MISSION_HAVEN_INFESTED_DEFEAT_NAME,Text,,DEFEAT,,,,,,,,
KEY_MISSION_HAVEN_INFESTED_DEFEAT_DESCRIPTION,Text,,Infestation remains.,,,,,,,,
KEY_GEOSCAPE_HAVEN_INFESTED,Text,,"A haven in the Mist, has succumbed to Pandoran infestation!",,,,,,,,
KEY_MISSION_HAVEN_INFESTED_NAME,Text,,INFESTED HAVEN,,,,,,,,
KEY_MISSION_HAVEN_INFESTED_DESCRIPTION,Text,,Cleanse the infestation,,,,,,,,
UMBRA_SIGHTED_TITLE,Text,,Umbra!,,,,,,,,
UMBRA_SIGHTED_TEXT,Text,,It's so scary!,,,,,,,,
VO_HINT_TITLE,Text,,Void Omens!,,,,,,,,
VO_HINT_TEXT,Text,,Terror!,,,,,,,,
KEY_INDEPENDENCE_DAY_NAME,Text,,To Kill a Behemoth,,,,,,,,
KEY_INDEPENDENCE_DAY_REVEAL,Text,,"The Virophage should be able to kill the Behemoth, but we still need a delivery system that would allow us to deploy it safely in sufficient quantities. Perhaps we can repurpose the injector designed by the Barnabas AI.",,,,,,,,
KEY_INDEPENDENCE_DAY_UNLOCK,Text,,,,,,,,,,
KEY_INDEPENDENCE_DAY_COMPLETE,Text,,"Repurposing the injector turned out to be the easy part. The rest of it is more... extravagant. Olena will explain. 

/AA",,,,,,,,
PROG_FS2_TITLE,Text,,That 1996 Extravaganza,,,,,,,,
PROG_FS2_TEXT_GENERAL_0,Text,,"So... This foolproof plan comes from Oppa Alistair re-watching a 50 year old piece of pre-Collapse entertainment where the good guys defeat an alien invasion by flying a stolen alien craft into the alien mothership and uploading a computer virus into it. 

The Behemoth is the Mothership, the virus is the Virophage and the alien craft is a modified Manticore covered in Mutagen-rich biomass, the ""Masked Manticore"". ",,,,,,,,
PROG_FS2_CHOICE_0_TEXT,Text,,And you told me Alistair has no imagination. So we build this Masked Manticore. What's next?,,,,,,,,
PROG_FS2_CHOICE_0_TEXT_OUTCOME,Text,,"I just told you: Oppa Alistair didn't come up with this idea, he stole it from a movie. 

We will deploy a strike team on the surface of the Behemoth to locally inject the Virophage at pre-identified vital points. Hopefully it will kill it and we will be able to evacuate our team.",,,,,,,,
KEY_ALISTAIRONSYMES_1_DESCRIPTION,Text,,"Symes... Symes fought for redemption... He sought to redeem the Phoenix Project, his family name and himself. A tragic figure writ large. But his story is not our story, we do not have to follow him and his trail of breadcrumbs.",,,,,,,,
KEY_ALISTAIRONSYMES_2_DESCRIPTION,Text,,"So Randolph was right after all. Yes, Olena and I were with him when he started on his crazy trip. The how and the why of it is a long story... I suppose he was more interested in Olena's abilities and worth to the Project than in yours truly. It doesn't take a genius to see that the kid is special.",,,,,,,,
KEY_ALISTAIRONWEST_DESCRIPTION,Text,,"I will give West that he built New Jericho, not just took it over as some two-bit military dictator of yore. But ultimately the only human will he cares about is his own. A lot depends on his retirement plans; bear in mind he might take the crazy cyborg route to defend his legacy. But then we have already dealt - DEALT - with one of those before...",,,,,,,,
KEY_ALISTAIRONWEST_CHOICE,Text,,What do you make of New Jericho?,,,,,,,,
KEY_ALISTAIRONSYNEDRION_DESCRIPTION,Text,,"Synedrion, they are not the naive fools everyone thinks that they are - and that they pretend to be. They have mastered the art of ruling while appearing not to rule: pulled a colegial Octavian, so to speak. It's the compact with the AIs that allows them to do that, relying on them for all bureaucratic functions and maintaining a soft censorship via adroit public feed algorithm manipulation... Anyway, remember those Pre-Collapse cautionary tales about AIs enslaving humanity? Yeah, me too.",,,,,,,,
KEY_ALISTAIRONSYNEDRION_CHOICE,Text,,What about Synedrion?,,,,,,,,
KEY_ALISTAIRONANU_DESCRIPTION,Text,,"The Disciples of Anu... They are the wild card. They have disguised as religious dogma human ascendancy through an alien rDNA virus. Well, not exactly alien, since apparently we are partly its product. Still, do we really want to take that road? Might there not be plans within plans within plans to lure us into an ascendancy that turns out to be the slavery we fought so hard to avoid?",,,,,,,,
KEY_ALISTAIRONANU_CHOICE,Text,,What do you think of the Exalted?,,,,,,,,
KEY_ALISTAIRONHELENA_DESCRIPTION,Text,,"Dr. Helena has spent her life working towards reviving the Ancients as our heritage, and what better way to honor our ancestors than using their WMDs. But what was that saying about doing the same thing over and over again expecting a different result? A lot of us will survive, I'm sure: those of us who remain now are good at surviving. But what if the Ancients were extinguished by the post-war political chaos, rather than by the biological weapon itself? What if reducing the number of casualties will not make a difference? Is the Phoenix Project up to the task of rebuilding a human civilization with the factions gone?",,,,,,,,
KEY_ALISTAIRONHELENA_CHOICE,Text,,Do you trust that Dr. Helena's plan will work?,,,,,,,,
KEY_ALISTAIRONVIROPHAGE_DESCRIPTION,Text,,The second worst outcome beats the hell out of the worst outcome. ,,,,,,,,
KEY_ALISTAIRONVIROPHAGE_CHOICE,Text,,Should we build the Virophage Injector?,,,,,,,,
KEY_ALISTAIR_ROADS_DESCRIPTION,Text,,"The history of our species is one of mistakes and accidents, some more fortunate than others. Now we come to yet another crossroads, where, to continue onwards, we need to choose a new mistake to make. ",,,,,,,,
KEY_ALISTAIR_ROADS_TITLE,Text,,Roads,,,,,,,,
KEY_ALISTAIR_ROADS_ALLDONE,Text,,"That will be all. Thank you, Alistair",,,,,,,,
KEY_ALISTAIR_ROADS_DESCRIPTION_2,Text,,"Will that be all, Director?",,,,,,,,
KEY_OLENA_HELENA_DESCRIPTION,Text,,"This... Can't be... Olena? You are alive. Your parents... We used to work together... We were friends. You probably don't remember me, you were so little... ",,,,,,,,
KEY_OLENAONWEST_DESCRIPTION,Text,,"You know, that Vanadium neural link West has, it doesn't really make him any smarter. It gives him some limited augmented reality functionality and  easy access to external data, but that's about it. Interesting… if anything, at New Jericho they have the tech for much deeper neurological enhancement. I wouldn't be surprised if they could merge West's brain with a slaved AI. ",,,,,,,,
KEY_OLENAONSYNOD_DESCRIPTION,Text,,Why would anyone create the Synod? And how did its... constituent parts feel about it? Perhaps the Exalted wanted to show everyone that the Disciples are concerned neither by ethics nor aesthetics when it comes to human gene manipulation.,,,,,,,,
KEY_OLENAONANCIENTS_DESCRIPTION,Text,,"I always knew about the ""Ancients"". As a child, I have these memories of my parents talking about them... They weren't just real, they were more real to them than everything else.",,,,,,,,
KEY_OLENAONANCIENTS_TITLE,Text,,Parents and Forefathers,,,,,,,,
KEY_OLENAONBEHEMOTH_DESCRIPTION,Text,,I don't think it came from an egg. It was created by the Pandoravirus. We are likely seeing the result of super-charged genetic amalgamation of the flora and fauna inhabiting the Hammerfall impact zone. Oppa Alistair is on a marathon of pre-Collapse Kaiju entertainment... Expect his threat assessment memo shortly... ,,,,,,,,
KEY_OLENAONALISTAIR_DESCRIPTION,Text,,"Oppa Alistair... He knows he's not very imaginative. And as he knows he can't be imagining things, he trusts what he sees. That's the best way I can put it, I guess.",,,,,,,,
KEY_OLENAONSYMES_DESCRIPTION,Text,,"Symes wanted me out of the expedition. He hoped to return to Phoenix Point with a blueprint for a cure and he wanted me to help him make it. When it was you who arrived and without a shimmering blue vial, I admit I was disappointed. Not so Oppa Alistair, he didn't put much stake in what Symes was doing.",,,,,,,,
KEY_OLENAONENDING_DESCRIPTION,Text,,"The choice you have to make... It's important, probably the most important a human being has ever had to make. Ending a war is easy: all you have to do is give up. We have to end this war the right way. I... I don't know what the right way is, but I hope you do. Otherwise it will all have been for nothing.",,,,,,,,
PROG_AN2_CHOICE_1_TEXT,Text,,Maybe later.,,,,,,,,
PROG_AN2_CHOICE_1_OUTCOME_GENERAL,Text,,"That's... disappointing. Very well, I hope you will change your mind.",,,,,,,,
PROG_LE3_WARN_TEXT_GENERAL_0,Text,,"Make no mistake: for the ancients, our ancestors were little more than curious animals. Perhaps they had laws to ensure our protection along with that of the other primates. Maybe they came from somewhere else and brought their own primordial soup with them… 

These are gods we are talking about, only they cleaned their roadside picnic pretty well when they left. Fortunately for us, we were able to grow without the burden of familiarity with our precursors' magic. 

Can you imagine how long it would have taken us to invent the lever had we been cursed with the power of ""protean mutane"" in our infancy?",,,,,,,,
PROG_LE3_WARN_TITLE,Text,,Children of gods,,,,,,,,
PROG_LE2_WARN_TEXT_GENERAL_0,Text,,"Their technology… It's so advanced as to be indistinguishable from magic. Take the Orichalcum: it shows an ability to manipulate matter and energy that is orders of magnitude higher than anything imaginable on such a small scale. Where did they come from and what could have happened to them? 

These things they have left behind: the automata, the exotic materials… I suspect that is only part of their legacy. I believe they also passed on to us a terrifying fear of the unknown and the means of defeating it. It's all there: we only need to find it. ",,,,,,,,
PROG_LE2_WARN_TITLE,Text,,A legacy of hope and fear,,,,,,,,
PROG_LE1_WARN_TEXT_GENERAL_0,Text,,"I have always known about the ""Ancients"". I have these memories of my parents talking about them when I was a child... They weren't just real, they were more real to them than everything else. 

And I have seen the ""Living Crystal"" before. My dad kept a small notebook with brown leather covers. Every page was crammed with Hangul writing and sketches. Sometimes I would sit on his lap and he would show me the drawings and explain what they were. The crystal stuck with me because dad joked that it would make my toys come alive. ",,,,,,,,
PROG_LE1_WARN_TITLE,Text,,Parents and Forefathers,,,,,,,,
PROG_SY_POSTPONE_CHOICE,Text,,Maybe later.,,,,,,,,
PROG_SY_POSTPONE_TEXT,Text,,"That's... disappointing. Very well, I hope you will change your mind.",,,,,,,,
PROG_NJ_POSTPONE_CHOICE,Text,,Maybe later.,,,,,,,,
PROG_NJ_POSTPONE_TEXT,Text,,"That's... disappointing. Very well, I hope you will change your mind.",,,,,,,,
KEY_INFESTATION_REWARD_TITLE,Text,,Rewards!,,,,,,,,
KEY_INFESTATION_REWARD_DESCRIPTION,Text,,Nice things!,,,,,,,,